,title,comments_author_lst,comments_score_lst,author,guilded,num_comments,score,pinned,subreddit,created_utc,r_id
0,"Official Weekly Free-For-All Thread (Week 38 -- September 24, 2018)","['Danny365', 'Adamb1403', 'nicolasZA', 'Vini_Dalvino', 'HopeFiend22']","[6, 6, 5, 5, 5]",AutoModerator,0,114,38,False,Drugs,1537795065.0,9ihu2t
1,You can stil register to vote in many US states. If you haven't yet then please do so. More resources in this post and earn custom r/Drugs flair!,['devilsdancing'],[2],cyrilio,0,5,5,False,Drugs,1538674397.0,9le141
2,"UK Home secretary announces crackdown on ""middle class"" drug users and claims ""You are not innocent - no one is innocent if they are taking illegal drugs.""","['danthedealer', 'losingit19']","[821, 494]",tommysplanet,0,245,876,False,Drugs,1538645461.0,9lacgg
3,One of the best things to happen in my drug using career,"['JoinMyGuild', 'moon_forge']","[448, 171]",lazerberriez,0,94,439,False,Drugs,1538615903.0,9l7d3h
4,8 ball in a store,"['Loganjohn11', 'BCD195', 'cat_fondu']","[1034, 529, 287]",hamstic,0,277,1911,False,Drugs,1538579510.0,9l214o
5,LSD: 2 years after,"['utsles', 'Airborne82D', 'Alpha_Moose1']","[46, 22, 12]",Alesij,0,37,97,False,Drugs,1538632073.0,9l977k
6,RANT: It’s so stupid how kids think Xanax is ”special”,"['DeadbeatPieceOfShit6', 'killnik420']","[140, 46]",EMR021,0,158,223,False,Drugs,1538609585.0,9l6kds
7,"Please tell me you're joking Ohio. ""Participants reported that the most common route of administration for kratom is intravenous injection (aka “shooting”).""","['ARobotJew', 'justhrowinawaymylife', 'razorsharpgears']","[243, 215, 131]",flamingjoints,0,116,560,False,Drugs,1538590867.0,9l3sll
8,You NEVER see people on Cops getting caught with LSD,"['bagofm3th', 'dolphinpalms', 'DonnieTisfat']","[28, 18, 11]",Trastice123,0,17,12,False,Drugs,1538662500.0,9lc9oy
9,Drugs in the Caribbean??,['Ryjami'],[5],blindleopard,0,8,7,False,Drugs,1538670940.0,9ldihr
10,Anybody else have a shitty situation and just try to find the little things to appreciate?,"['UpsetHobo', 'radiationandme']","[23, 7]",Tylerb0713,0,10,36,False,Drugs,1538636664.0,9l9m8r
11,This subreddit is surprisingly so good for harm reduction,"['Needyouradvice93', 'TNSKING420', 'lmao_turkey']","[73, 44, 24]",dontread12334,0,32,156,False,Drugs,1538606172.0,9l644j
12,Forever afterglow,['MaltiuGhajjien'],[5],drugaddictedfuck,0,5,8,False,Drugs,1538666514.0,9lcubz
13,K seems so much more globally popular than it is to me locally.,['throwaway129873487'],[2],123ihateme123,0,5,4,False,Drugs,1538674367.0,9le0yp
14,Fucked a crazy chick high on meth,"['whymimosa', 'martinmartin538', 'foreveracunt', 'Fiendiana_Jones']","[108, 106, 75, 63]",metham-sket-amine,0,64,157,False,Drugs,1538602333.0,9l5l24
15,Testing cocaine ??,['alexanderdotmp3'],[8],EpiiCideas,0,5,7,False,Drugs,1538659660.0,9lbvry
16,Took many coke lines and ecstasy/ alcohol together,"['SusanPreat', 'Sterrxgamr', 'ExquisiteLumberjack', 'Veryoriqinal']","[48, 18, 15, 14]",MDmaisgoodbad,0,19,18,False,Drugs,1538642265.0,9la2we
17,Is melting the tip of a pencil related to drugs?,"['ieatnarcotics', 'PM_BoobsnButts_pls', 'Airborne82D']","[54, 27, 16]",updootmachine,0,32,26,False,Drugs,1538634523.0,9l9fg2
18,In love with GHB,"['psyki', 'El_Spunko']","[6, 4]",project_nl,0,44,16,False,Drugs,1538643765.0,9la7dd
19,The guy I did acid with for the first time as a teenager od'd on Sunday.,"['elecfever', 'IceColdSeltzer', 'yaboynatan']","[374, 224, 196]",nicolix9,0,203,1137,False,Drugs,1538558217.0,9kzjj1
20,Xanax is shit,"['mikewirkijowski', 'FUWS']","[4, 2]",forthunt,0,7,3,False,Drugs,1538672028.0,9ldoca
21,This is why you should NEVER drive on psychedelics (audio/visual replication),"['5_meo_mipt', 'RoboTripped']","[8, 4]",StingrayZ,0,20,7,False,Drugs,1538655052.0,9lbb7z
22,Mushrooms and K.,[],[],Lsdinsomnia,0,3,3,False,Drugs,1538671416.0,9ldl0p
23,Benzo Afterglow,[],[],caughtyoulookinn,0,5,4,False,Drugs,1538665517.0,9lcp2v
24,I tried heroin for the first time yesterday. Can somebody help me understand what’s happening right now?,"['richiescratchy', 'Wiseguy2013']","[23, 5]",period_questionmark,0,41,23,False,Drugs,1538629364.0,9l8x71
25,Any Psychedelics which have a SHORT duration,"['assman218', 'aenild', 'DreamingMeme', 'musicismath_']","[10, 6, 6, 5]",OpiumSmoke,0,29,4,False,Drugs,1538662528.0,9lc9uw
26,Drugs that are entertaining and can be done often?,['FreeManBeat'],[3],fenixflexin,0,33,3,False,Drugs,1538667901.0,9ld1qp
27,"What makes LSD safe, but 25I-NBome so dangerous?","['aenild', 'kdseiler', 'doommuffin']","[6, 2, 2]",OpiumSmoke,0,15,5,False,Drugs,1538661750.0,9lc5se
28,OCD and DXM,[],[],Xodeine,0,8,3,False,Drugs,1538667209.0,9lcxxn
29,If this sub has taught me anything. It’s that it takes a lot more drugs to kill yourself than I was lead to believe.,"['bothunter', 'mrfuzzyasshole']","[375, 109]",ThisEffingGuyC,0,52,232,False,Drugs,1538581925.0,9l2e0u
30,Favourite party combo instead of mdma? Mine is 2cb + amphetamine (both moderate doses),[],[],Throwaway65632921,0,1,4,False,Drugs,1538661290.0,9lc3lb
31,I did my first DMT extraction using Q21Q21's Vinegar/Lime A/B Tek And 50% of my product seems to be jungle spice. Is that normal?,[],[],materialmind,0,1,2,False,Drugs,1538674595.0,9le26s
32,why do I seemingly have a substantial natural tolerance to most drugs?,[],[],kikThrowaway9490,0,4,2,False,Drugs,1538674359.0,9le0xd
33,"Mdma, cocaine, and heroin",[],[],phatbatty13,0,3,2,False,Drugs,1538674289.0,9le0l9
34,In Portugal and bought some sketchy drugs. Help.,"['emmy9622', 'slob_omb']","[9, 5]",slob_omb,0,9,3,False,Drugs,1538665724.0,9lcq6p
35,Be incredibly care with who you trip with (LSD catastrophe report),"['Trump_is_the_Cuckold', 'ThisIsMyFifthAcc', 'sqqlut']","[161, 69, 56]",psychosets,0,81,235,False,Drugs,1538579338.0,9l2082
36,y'all niggas slipping on semen in the bathroom and I'm walking on clean tile.,"['newrcthrowaway', 'need-info-plz']","[57, 18]",somethingsmatter,0,21,79,False,Drugs,1538600198.0,9l59td
37,"Does anyone have experience with the bamboo orchid, dendrobium nobile?",[],[],Ganjanthegr33n,0,6,5,False,Drugs,1538649552.0,9lapwf
38,"Fav tune to listen too on sid? Tipper is my go too guy for acid sessions, just wondering what everyone else likes too listen whilst peaking. Go on guys see if ya can top thay",['mass_revolution_'],[6],bigbadburgess120,0,17,6,False,Drugs,1538648707.0,9lan03
39,First lsd trip,['SullyCCA'],[14],allnightinternets,0,2,28,False,Drugs,1538615761.0,9l7cio
40,Funny while high,,,nyc420clouds,0,0,2,False,Drugs,1538667671.0,9ld0fs
41,Your opinion :),['Sterrxgamr'],[2],Keith_H23,0,3,2,False,Drugs,1538666164.0,9lcsj8
42,Has anyone noticed a decrease in cognitive functioning ever since using cannabis long term?,"['bwm8142', 'tomzak14', 'drewc0213', 'evidencebasedDC']","[30, 29, 17, 14]",qwerty0521,0,48,55,False,Drugs,1538600106.0,9l59cp
43,"Random and intensive cravings for Xanax, months after use?",['Ayehase'],[2],MrAlderson59,0,2,2,False,Drugs,1538664283.0,9lcim8
44,What do you do when you're in a country where drugs are hard to get or strictly prohibited for an extended period of time?,"['Ezo31202', 'StaplesMcGee', 'Intercontinentalmove']","[3, 2, 2]",gsdickpills,0,12,2,False,Drugs,1538664125.0,9lchtf
45,"Kratom, stimulant tolerance cycle. Question.",,,zanzabar209,0,0,1,False,Drugs,1538676596.0,9lecrs
46,My clumsiness saved me from getting expelled,"['druggies101', 'potatogmm46', 'AntPoizon']","[12, 11, 9]",potatogmm46,0,16,24,False,Drugs,1538615156.0,9l79oh
47,Anyone feel a little “boy who cried wolf”y over the INSANE amount of people who claim they suffer from depression and like diseases?,[],[],davidpastaroni,0,5,1,False,Drugs,1538675802.0,9le8hs
48,Religion and Psychedelics,[],[],themodernape368,0,1,1,False,Drugs,1538675681.0,9le7uu
49,Dihydrocodiene + Kanna combo safe ?,,,yomofogo1234,0,0,1,False,Drugs,1538675453.0,9le6mu
50,idfk if I need rehab...,[],[],straightforshady,0,3,1,False,Drugs,1538674833.0,9le3eg
51,Will Amphetamine take effect on LSD that I take after?,['noleague'],[3],MutantTurtle59,0,11,2,False,Drugs,1538661255.0,9lc3eu
52,"Watching planet earth II while tripping is the best, emotional and mind bending experience ever.","['leeham93', 'leagueredditor', 'UntitledDude']","[105, 34, 29]",lucykid,0,75,359,False,Drugs,1538559371.0,9kzmzw
53,Taking Xans Without Blacking Out,['WilfordBrimleyOnAcid'],[4],Mifergas578,0,5,1,False,Drugs,1538673881.0,9ldyfm
54,Blotter in water,[],[],asssss_,0,1,1,False,Drugs,1538673633.0,9ldx17
55,"DPH + DMT/LSD? Retarded, but how retarded?",[],[],ReallyBadAtChemistry,0,2,1,False,Drugs,1538672915.0,9ldt5y
56,Took 30mg Adderal RX I don't feel it :( ?,['greggdogg'],[3],COB98,0,6,2,False,Drugs,1538659187.0,9lbtm1
57,"Hot plated too hot, what now?",['The-Evil-Thing'],[1],The-Evil-Thing,0,4,1,False,Drugs,1538672307.0,9ldpti
58,"My shower thoughts about Molly, weed, and my life",['mikewirkijowski'],[2],erkapi,0,2,1,False,Drugs,1538671961.0,9ldo01
59,Vyvanse for studying,['greggdogg'],[2],Liesergyc,0,12,2,False,Drugs,1538658259.0,9lbp9o
60,drugs don't affect me the way they affect my friends,,,pale_tail,0,0,1,False,Drugs,1538671667.0,9ldmfd
61,How many days after tramadol should I wait to drop MDMA?,[],[],MustBeMoreOriginal,0,2,1,False,Drugs,1538671362.0,9ldkq4
62,What do you think about ALD-52?,[],[],whymimosa,0,1,3,False,Drugs,1538649295.0,9lap0t
63,Need a little help,['oh_wooow'],[3],KefyrDaPsycho,0,3,2,False,Drugs,1538657148.0,9lbk9r
64,Do you notice a difference in different strains/types of weed?,['shetrips-shesmokes'],[8],tbomb6660420,0,20,7,False,Drugs,1538632171.0,9l97ke
65,LSD Permanent Changes,"['hotdanish91', 'MedicineMan202']","[176, 94]",Tidus9631,0,100,109,False,Drugs,1538578005.0,9l1tcf
66,Me and my best friend are doing shrooms for the first time,['drewc0213'],[2],believeitornut,0,7,1,False,Drugs,1538669555.0,9ldaxm
67,drugs and family!,['WakandaLive'],[7],mattum01,0,9,10,False,Drugs,1538623433.0,9l8a82
68,Drug to get deep thoughts,"['drewc0213', 'grey59babe']","[3, 2]",vicsk8,0,26,2,False,Drugs,1538654634.0,9lb9gl
69,Legal highs besides phenibut and kratom that people enjoy and don’t completely fuck you up,['yepez1011'],[3],jewafrica,0,15,0,False,Drugs,1538667245.0,9lcy43
70,I think the reason I love MDMA is it allows me to touch other people. I'm so touch-deprived in my regular life.,"['Zanmatox123', 'Bensonion', 'DJFlipside', 'PrivateLabelAcolyte']","[23, 13, 11, 9]",Firsttimerolling,0,23,79,False,Drugs,1538581590.0,9l2cay
71,Adderall Vasoconstriction,[],[],greggdogg,0,3,1,False,Drugs,1538667217.0,9lcxz4
72,Is Conor McGregor a coke user? Cause he surely acts like one.,['vostok33'],[9],deerparking,0,6,1,False,Drugs,1538666915.0,9lcwf1
73,"Ex herion addict, been clean for 3 years but still think about it everyday. Will it ever go away or will I be cursed with this forever?","['danthedealer', 'danthedealer']","[6, 2]",bigbadburgess120,0,19,2,False,Drugs,1538653352.0,9lb4cn
74,Court date tommorrow,"['cemiller0', 'greenmachiner']","[2, 2]",RoosterInMahRari,0,13,12,False,Drugs,1538618237.0,9l7nff
75,LSD + MDMA + DXM + Weed + Speed,"['HappyNug220', 'FreeManBeat', 'lolzme24']","[4, 3, 2]",janchistu,0,9,1,False,Drugs,1538666759.0,9lcvla
76,Is it safe to take Adderall thats 12 years old?,"['Diarrheadevil', 'richiescratchy']","[38, 12]",Dinn2win,0,11,12,False,Drugs,1538614879.0,9l78gh
77,I wanna do a psychedelic but I’m on SNRIs,['Clee1k'],[2],jewafrica,0,2,1,False,Drugs,1538666204.0,9lcsqv
78,Warning do not microdose any amphetamine.,"['FreeManBeat', 'wizzaarrd']","[18, 10]",somethingsmatter,0,12,0,False,Drugs,1538664963.0,9lcm64
79,Uncontrollable nervous the day laughter after stimulant use?,,,AlexEquilibrium,0,0,1,False,Drugs,1538663776.0,9lcg3k
80,I've never heard something so amazing!,[],[],Seeig,0,1,1,False,Drugs,1538662738.0,9lcaxk
81,Philippine Illegal Drugs Prices,[],[],UsualTheoRhyst,0,4,2,False,Drugs,1538647384.0,9laii1
82,"20mg day meth user, 10 months daily no break, now im cold turkey 2nd day, got some q's","['Down_for_all', 'cfcck']","[5, 4]",NecroSyphilis,0,4,5,False,Drugs,1538631371.0,9l94v2
83,First time Seroquel,[],[],peanutbutterandtacos,0,4,1,False,Drugs,1538657920.0,9lbnnt
84,Being sober,"['thatguyakira123', 'killer2themx']","[11, 5]",metallicusovwinter,0,22,65,False,Drugs,1538576272.0,9l1kan
85,MDMA usage question,['Pflauhau'],[5],purplelegs,0,17,2,False,Drugs,1538643989.0,9la81r
86,"LSD trip report, great experience",[],[],jannshi,0,2,15,False,Drugs,1538604277.0,9l5ute
87,Will alcohol stunt my growth as a teenager?,['Airborne82D'],[14],sadcelthrowaway,0,11,4,False,Drugs,1538625423.0,9l8i9f
88,Why is Ketamine so unpopular still?,"['Oz_a_day', 'Fleeto95']","[107, 34]",shortdickedman,0,39,30,False,Drugs,1538589551.0,9l3ks9
89,4-HO-MET or 4-AcO-DMT ?,"['noleague', 'hammerstones']","[5, 4]",Taway142857,0,11,1,False,Drugs,1538656423.0,9lbh4t
90,Should i use psychedelics,"['psycho9365', 'noleague', 'puuuurfection']","[5, 5, 4]",John_the_fishermen,0,6,1,False,Drugs,1538655515.0,9lbd87
91,Mdma pink bear pill?,['mikewirkijowski'],[2],veggotripper,0,11,0,False,Drugs,1538654513.0,9lb8yz
92,Anybody have any experience with combining shrooms and LSD?,"['Djvacuumseal', 'PotatoKing0613', 'applestruddel']","[10, 7, 5]",surreal_squirrel,0,9,17,False,Drugs,1538599132.0,9l548a
93,"I'm pretty stoked that my ""slight HPPD"" went away.",['sirredsalot'],[16],lsdthrowaway1234567,0,23,31,False,Drugs,1538586821.0,9l35b3
94,First time in years I don't have access to Ritalin... FREAKING out,['thepsychoshaman'],[19],wow85294,0,12,4,False,Drugs,1538626141.0,9l8l5t
95,The Mushroom Queen,,,denverdatasci,0,0,3,False,Drugs,1538631688.0,9l95xz
96,OCD worsening after amphetamine,['T_R_I_P'],[3],speedolini,0,5,3,False,Drugs,1538631383.0,9l94wg
97,"Drugs & congenital heart disease - what I've learned, and some questions I still have",[],[],spongue,0,9,3,False,Drugs,1538630849.0,9l92yb
98,Xanax with Coke vs Phenibut with Coke,[],[],AlteredThoughts,0,3,1,False,Drugs,1538651945.0,9layqj
99,My DXM vision dream about the rise of Kardashian empire and her hunt for me,['hulkhoganblue'],[5],Fork_On_The_Left_,0,3,8,False,Drugs,1538608891.0,9l6h4v
100,At what point did you consider yourself an addict and can you reverse it?,['Airborne82D'],[5],engineerprogramatuw,0,8,2,False,Drugs,1538637758.0,9l9ppn
101,What gives you the worst comedown?,"['DjenxCR', 'stardust-redux', 'mikewirkijowski', 'ireizumi']","[7, 3, 3, 3]",tacticalbutthole86,0,10,1,False,Drugs,1538651155.0,9lavsz
102,Datura + Hard liquor + K-pins,['pierceddvl'],[5],Wuzi203,0,5,4,False,Drugs,1538624026.0,9l8cly
103,"My first adderall ""binge""? Can I keep going? (34hrs in)","['Lord_Of_Filth', 'Airborne82D']","[5, 3]",fueganese_,0,19,4,False,Drugs,1538623601.0,9l8ax7
104,Trip Report: LSD & DXM,['TNSKING420'],[2],M0V3xTAD,0,8,2,False,Drugs,1538637053.0,9l9njt
105,dark side of letting loose,['censqred'],[1],v_m_2000,0,11,7,False,Drugs,1538611746.0,9l6u6z
106,help idk if im dying,"['Airborne82D', 'VeryDramatic']","[5, 5]",reallyradriver,0,8,5,False,Drugs,1538622187.0,9l84y4
107,I appreciate arts,[],[],HamTam,0,6,18,False,Drugs,1538593817.0,9l4ae2
108,"If everyone had drugs that made them, and subsequently, the world, a better place, why does it sound so wrong?",[],[],apcay565,0,6,1,False,Drugs,1538649023.0,9lao1k
109,The time I almost got caught with weed as a teen.,['ShitNRun18'],[3],yoyoyo13234,0,7,7,False,Drugs,1538610872.0,9l6qbu
110,How to develop self-control?,['Oakester'],[26],pelpeh,0,24,22,False,Drugs,1538586372.0,9l31r5
111,Long term effects of daily vyvance use?,"['PisnotequaltoNP', 'TotesMessenger']","[2, 1]",MedicalMagic420,0,9,2,False,Drugs,1538634427.0,9l9f51
112,is there big difference between crack and pure coke?,"['Sterrxgamr', 'ireizumi']","[3, 2]",neverbeanotherone,0,4,1,False,Drugs,1538647537.0,9laiyk
113,I haven't slept in 4 days thanks to Mydayis,"['Killed0', 'FartinSpartin', 'yes_i_wood']","[10, 5, 5]",dogwhisperer3242,0,15,18,False,Drugs,1538591131.0,9l3uee
114,Help me out,"['scutchie', 'eternal_n0mad']","[6, 3]",uragays,0,9,1,False,Drugs,1538646124.0,9laeg9
115,Dexies and Vyvanse,[],[],HalfKing1,0,2,2,False,Drugs,1538632499.0,9l98o8
116,Feeling high for almost a week now. Will it go away?,"['coldanddarkinside', 'moneykillinq', 'shhkskakkkk']","[20, 19, 12]",fedra_,0,36,15,False,Drugs,1538592741.0,9l445c
117,Sedating weed combinations?,"['AHHHHHIDKWHATIMDOING', 'T_R_I_P', 'SanPedroLover_']","[3, 2, 2]",beaubeausummons,0,21,2,False,Drugs,1538631907.0,9l96nf
118,does being ‘lightweight’ mean theres less damage caused on my liver when drinking,['Airborne82D'],[6],soulo__ho,0,3,3,False,Drugs,1538623828.0,9l8bse
119,"Hella on rn (alone), want to read some interesting stories. What is your craziest binge episode? What drug, antics, consequences, etc..., let's hear it!!",['ativantaliban'],[2],thatguywhoexist,0,3,2,False,Drugs,1538631565.0,9l95iu
120,Anti depressants and me.,[],[],Lanko-TWB,0,5,2,False,Drugs,1538630161.0,9l9087
121,Horny after drugs,"['grey59babe', 'burgbrain']","[4, 3]",PMikeee,0,16,6,False,Drugs,1538608502.0,9l6f7w
122,What is risks when I use street salts instead Adderal for ADHD treatment?,"['AutoModerator', 'Sterrxgamr', 'ireizumi']","[1, 1, 1]",mattuzauza,0,10,1,False,Drugs,1538642179.0,9la2nt
123,Cool Idea for a super power,"['stepaside22', 'jeffbobingson']","[18, 8]",Serielhexilon,0,6,23,False,Drugs,1538581484.0,9l2bqe
124,Still dizzy 3 days later?,"['kermit212', 'wizardswrath00', 'NonProductiveApe']","[3, 2, 2]",hlp964,0,4,1,False,Drugs,1538641682.0,9la16z
125,Me and my two mates did ket and became the characters in big lez,['Jasurius'],[9],howmanygramsinapound,0,5,13,False,Drugs,1538590706.0,9l3r91
126,Took 170 MG of Vyvanse today. 23-year old male.,"['Skionz', 'Gaidenego', 'Opiates_and_Some']","[4, 3, 3]",Throwawayimdumb12345,0,8,3,False,Drugs,1538612120.0,9l6w2l
127,A fun story about smokin in Disney,"['uncomfortablerhino', 'dlxnj', 'hahakon11']","[52, 21, 21]",Salty_Shiba_,0,23,58,False,Drugs,1538559698.0,9kznze
128,Promethazine without Codeine,"['nathanroot28', 'richiescratchy']","[3, 3]",otissplunk,0,6,4,False,Drugs,1538611893.0,9l6uzl
129,Ketamine,['LysergaMycologist'],[6],salesman_jordan,0,12,4,False,Drugs,1538605524.0,9l613s
130,Another generic “tripping saved my life” post,,,skimask7,0,0,1,False,Drugs,1538636275.0,9l9ky6
131,Possible overdose from meth?,"['Airborne82D', 'DeputyDong69', 'ireizumi']","[3, 2, 2]",sienikala,0,11,2,False,Drugs,1538622718.0,9l878t
132,Almost got checked by cops,"['beanster', 'fancypants_']","[113, 39]",vsdoom,0,30,98,False,Drugs,1538546216.0,9kyibm
133,About to get set up (again),"['BaltimoreDopeRunner', 'Intercontinentalmove', 'Djvacuumseal']","[27, 13, 7]",NewBallista,0,18,15,False,Drugs,1538584630.0,9l2svh
134,"2cb, redosing and lasting longer!",[],[],imadumbdruggyithink,0,2,2,False,Drugs,1538622233.0,9l854s
135,DXM + LSD+ Weed,[],[],Phreaky312,0,8,4,False,Drugs,1538608602.0,9l6fol
136,Serious LSD Discussion,"['thatstonerguy32', 'TheRickestMorty10']","[4, 4]",Dirazi,0,8,5,False,Drugs,1538603563.0,9l5r9a
137,Alcohol + Xanax + Ambien?,['ShitNRun18'],[5],SwampyAss247,0,5,3,False,Drugs,1538610889.0,9l6qer
138,Anyone seen improvements after quitting??,[],[],wow85294,0,1,1,False,Drugs,1538632074.0,9l977o
139,Ways to conceal packages?,[],[],preppingforblastoff,0,3,1,False,Drugs,1538632057.0,9l975l
140,Need answers and advice,[],[],sexylucymolly,0,7,3,False,Drugs,1538609181.0,9l6igx
141,What drug should I take for getting into a book?,"['trippy_toaster', 'Ovrcast67']","[38, 14]",anaonmise,0,47,11,False,Drugs,1538581840.0,9l2dmi
142,Do alcoholics enjoy drinking alcohol?,"['billy_the_kid16', 'kennedysleftnut']","[12, 8]",Percle,0,16,4,False,Drugs,1538598815.0,9l52k3
143,Do you get high off the drip?,['runningoutoftim3'],[4],Init__,0,3,1,False,Drugs,1538629761.0,9l8ypb
144,how long til ghb withdrawals set in?,['JewishHottub'],[2],Heroic-Dose,0,6,1,False,Drugs,1538628748.0,9l8uzu
145,Constant dreaming after K.,[],[],BullionGodspeed,0,2,4,False,Drugs,1538601577.0,9l5h5c
146,How to snort Concerta?,['BakedTillChrispy'],[5],aussievapenewb,0,13,1,False,Drugs,1538628372.0,9l8tmv
147,Fuck the people who always want you to share but never offer once,"['TheRickestMorty10', 'ProktosRS', 'psychedfish']","[623, 353, 222]",flyfreeNhigh,0,290,1639,False,Drugs,1538482948.0,9kq4ey
148,Doing other drugs during withdrawals,"['braapbraap69', 'AutoModerator', 'Drunkenpumpkin420']","[6, 4, 4]",robloxdruglord,0,13,1,False,Drugs,1538626208.0,9l8lgl
149,"I suspect my long-distance friend of using meth, what do?","['Airborne82D', 'gunpartys']","[10, 3]",ChunkOmega,0,12,0,False,Drugs,1538625763.0,9l8joi
150,Bringing Weed Astroworld Festival,['Fractals4Evet'],[4],TacticalTacoGG,0,10,1,False,Drugs,1538625347.0,9l8hz5
151,Just wasted an edible...,['Airborne82D'],[5],sadnpoor,0,2,1,False,Drugs,1538624875.0,9l8g27
152,What is “Ketamine r type”?,"['StonedGiraffes', 'c0mp1ex88', 'Airborne82D', 'bagofm3th']","[3, 3, 2, 2]",effervescent_fox,0,14,2,False,Drugs,1538609858.0,9l6loy
153,Phenylpiracetam + 2c-b?,[],[],digydongopongo,0,1,6,False,Drugs,1538588188.0,9l3d23
154,Meth + zoloft + Wellbutrin,[],[],sebyhood,0,2,1,False,Drugs,1538622957.0,9l8896
155,Hawaiian Babby Wood Rose Seeds,,,ANewName1,0,0,2,False,Drugs,1538608751.0,9l6gee
156,Weird HPPD,[],[],indyson,0,6,1,False,Drugs,1538622287.0,9l85ce
157,How long do the after effects of xanax last?,[],[],BigFig32,0,9,1,False,Drugs,1538622045.0,9l849w
158,Addy Dosage Guide,[],[],crossfadedrunner,0,2,1,False,Drugs,1538621880.0,9l83ll
159,Shrooms,[],[],captainballburst,0,3,2,False,Drugs,1538607465.0,9l6a8n
160,Peter Theil launches psychedelic research firm,,,Astronautswag,0,0,5,False,Drugs,1538588966.0,9l3hke
161,"Honestly though, these are my brain cells when I give them a break and be sober for a day...",['InfiniteBuddy'],[16],sprakx,0,6,37,False,Drugs,1538549570.0,9kyter
162,How fucked will my friend be if she takes 8 bars?,"['Kadebladekehd', 'Ismokeshatter92']","[183, 182]",LevelVS,0,111,61,False,Drugs,1538538561.0,9kxq0b
163,What's your favorite psych and why? And how are you doing? <3,"['SacredGeometry25', 'weedtripper']","[10, 6]",AyahuascaAdvocate,0,31,8,False,Drugs,1538577937.0,9l1syb
164,Took this what would happen,['richiescratchy'],[1],Kodak_blacc,0,5,1,False,Drugs,1538618328.0,9l7nth
165,Is suboxone good recreationally?,"['richiescratchy', 'Airborne82D']","[2, 0]",drunkenwizardry,0,9,1,False,Drugs,1538618327.0,9l7ntc
166,Comedowns,"['VapeMcdrippington', 'iammyowndoctor']","[11, 5]",tasteofink85,0,8,7,False,Drugs,1538580009.0,9l23kq
167,Xanax vyvanse and edible?,['BlackGoldKnight'],[5],swaggedoutvegetable,0,7,1,False,Drugs,1538618000.0,9l7mdj
168,New federal opioids bill,[],[],boris-farage,0,1,1,False,Drugs,1538617409.0,9l7jnz
169,I hate taking stimulants everyday but I need them.,"['Airborne82D', 'horacetheclown', 'Randy_lahey3']","[27, 14, 11]",teefbango,0,50,52,False,Drugs,1538541109.0,9kxzzm
170,Mushrooms for a concert?,['sokodank'],[8],corajade17,0,5,3,False,Drugs,1538595522.0,9l4k2b
171,question on 5mg vicodin,"['Airborne82D', 'richiescratchy', 'unknownshoe']","[2, 2, 2]",stargrazerrq,0,5,1,False,Drugs,1538616702.0,9l7gkx
172,codeine and alcohol,[],[],farstaste,0,7,2,False,Drugs,1538616144.0,9l7e4f
173,my best friend saved my l,['shittingbiscuits'],[15],stopdropandwop,0,8,17,False,Drugs,1538558459.0,9kzk91
174,5/325 Percocet and Weed?,['Kylerdub'],[2],Vick_Vinigar,0,15,1,False,Drugs,1538615543.0,9l7bjm
175,"Could Gotu Kola, L theanine, or passion flower make depression worse long term?",[],[],jellybeanzx,0,3,2,False,Drugs,1538601732.0,9l5hwa
176,What it takes to be a dealer.,"['Tylerb0713', 'BlankSimon']","[11, 10]",verypooryoungman,0,12,0,False,Drugs,1538641717.0,9la1b3
177,Strange Attractor,[],[],vicvector0000,0,1,0,False,Drugs,1538614249.0,9l75ll
178,Medical marijuana for minors,"['crews007', 'WilfordBrimleyOnAcid']","[8, 7]",robloxdruglord,0,12,3,False,Drugs,1538591464.0,9l3wi2
179,Safe to mix this much of xanax and codeine,[],[],2amguy,0,4,1,False,Drugs,1538612388.0,9l6xb6
180,Why am I having acid like visuals? That of a micro dose- 1/2 tab,[],[],NEVERUSEmeGYM,0,12,1,False,Drugs,1538611851.0,9l6uqn
181,thanks guys,['Rohirrim47'],[2],holesinmybrain,0,7,0,False,Drugs,1538611773.0,9l6ucn
182,How to sleep when taking Adderall.,['FreeManBeat'],[5],newbinha,0,8,2,False,Drugs,1538597921.0,9l4xr6
183,Vyvanse 280mg does nothing?!,[],[],401_pound_hacker,0,5,1,False,Drugs,1538611402.0,9l6sp2
184,Do you think more drugs should be legal?,"['The_MuffinPrince', 'Stickey794']","[14, 7]",Rohit49plus2,0,24,9,False,Drugs,1538570689.0,9l0th7
185,Meth smell/taste,['JustThinkAboutThings'],[23],DirtyHandsMcgee,0,10,15,False,Drugs,1538558047.0,9kziz0
186,Drug Suggestions UK,[],[],luketrimmz,0,3,1,False,Drugs,1538609894.0,9l6luy
187,first blotter,['TastyWavesSpicoli'],[4],v_m_2000,0,4,1,False,Drugs,1538609725.0,9l6l3e
188,4th Ketamine infusion.,"['HyImHylo', 'Molokai420']","[23, 15]",Airborne82D,0,37,91,False,Drugs,1538520883.0,9kvj7t
189,Is mixing 1P-LSD with an SSRI deadly?,"['nathansosick', 'anusbainussheamus']","[2, 2]",ddbot12,0,6,1,False,Drugs,1538608902.0,9l6h6k
190,Trippy music video. What song should I use?,"['Billith', 'Abeyfen', 'kunstkamera']","[2, 2, 2]",erinlewisfudge,0,9,5,False,Drugs,1538577438.0,9l1qe4
191,Power-outs and weed,['stepaside22'],[12],RapidTrash,0,10,22,False,Drugs,1538548277.0,9kyp92
192,"What all drugs are ""legal"" and easily obtainable?","['ShitNRun18', 'allovertheplaces']","[22, 15]",TitanicMan,0,44,6,False,Drugs,1538577128.0,9l1oq3
193,Mephedrone quality/legitimacy,,,Crayonlover123,0,0,1,False,Drugs,1538608541.0,9l6fer
194,"Excerpt from my drug journal, on ALD-52",[],[],1-P-Leo-Sydd-Darrel-,0,2,4,False,Drugs,1538581262.0,9l2ak6
195,Senate passes multi-pronged legislation to battle nation's opioid crisis,[],[],ampfin,0,1,1,False,Drugs,1538607805.0,9l6buv
