,title,comments_author_lst,comments_score_lst,author,guilded,num_comments,score,pinned,subreddit,created_utc,r_id
1776,"After a bad trip, I have trapped my mind into a living hell of paranoia and hopelessness","['MarkSpenecer', 'Kaddy03']","[42, 15]",321231j,0,40,31,False,Drugs,1538472745.0,9kp6eu
1777,Probation questions,[],[],RoosterInMahRari,0,9,1,False,Drugs,1538540973.0,9kxzg4
1778,Me and my SO took DXM and she's still feeling weird after four days.,,,jojoDUB,0,0,2,False,Drugs,1538527006.0,9kwbex
1779,Unexperienced drug use,['tweaker_withfeelings'],[4],suicidalcrybaby,0,8,3,False,Drugs,1538518157.0,9kv6al
1780,I boofed the marijuanas,"['schlonghornbbq8', 'oswoodruhs', 'sebseb420', 'lilmeepkin']","[57, 25, 24, 19]",Hautla,0,34,142,False,Drugs,1538442493.0,9km9s9
1781,Let me tell you a story about the war on drugs,['mikewirkijowski'],[2],AnatomyOfTrees,0,6,9,False,Drugs,1538496170.0,9krwdj
1782,Questions before first xanax experience,"['Airborne82D', 'kellik123', 'lizardnamedoxy', 'InfiniteBuddy', 'blood_clot_drip']","[2, 1, 1, 1, 1]",Not_A_Creative_Color,0,13,1,False,Drugs,1538539023.0,9kxrrb
1783,"Had a very small bit of gin, is it okay to take DXM?",[],[],dontgetupsetman,0,1,2,False,Drugs,1538525464.0,9kw4g8
1784,Coke is not garbage,"['braapbraap69', 'Remember_the_BBQ', 'Insanity_Pills', 'killnik420']","[80, 27, 25, 24]",XannyBarChrist,0,73,111,False,Drugs,1538447068.0,9kmu2s
1785,Acid Humor,"['LovableKyle24', 'haannaah1']","[2, 2]",therealpussyslayer,0,10,8,False,Drugs,1538497884.0,9ks5pv
1786,Nitrous urgent safety question,['Aoibhneas-Dabs'],[3],rainystan,0,6,1,False,Drugs,1538538098.0,9kxo51
1787,macromerine?,,,sackofchemicals,0,0,2,False,Drugs,1538524435.0,9kvzta
1788,Will doctor prescribe adderall w/ substance abuse/depression?,['Spoderr'],[2],wow85294,0,19,0,False,Drugs,1538551204.0,9kyyqw
1789,Different lsd trips?,[],[],RoosterInMahRari,0,3,1,False,Drugs,1538536830.0,9kxiyp
1790,Amphetamine parachuting question,[],[],HellishTought,0,6,3,False,Drugs,1538515125.0,9kur2g
1791,Ambien and alcohol,[],[],veggietrooper,0,6,1,False,Drugs,1538536590.0,9kxhy0
1792,When to take Xanax before presentation,"['21_TwentyOne_21', 'jesceyc']","[3, 3]",uhohdiddly,0,6,6,False,Drugs,1538501432.0,9ksp2v
1793,"Addicted to Caffeine, can anyone help me?",['memeshroud'],[5],mcafc,0,8,3,False,Drugs,1538514736.0,9kuoyg
1794,How to turn 2 ounces of MDMA into presses.,[],[],columbusaveprospect,0,10,2,False,Drugs,1538522591.0,9kvraa
1795,Treating myself,[],[],Xavier11223,0,6,1,False,Drugs,1538535982.0,9kxf7h
1796,"Just used my GF's pee for a drug test, I have some questions","['iswallowedafrog', 'FlyByWeekendMan']","[24, 10]",BHojnacki,0,30,13,False,Drugs,1538485848.0,9kqgw9
1797,How fast is ketamine gonna fuck my bladder?,[],[],acidbasehead,0,2,2,False,Drugs,1538522390.0,9kvqbb
1798,First time meth comedown,"['zman1672', 'DrinkSmokeJerk']","[6, 3]",bananaorange94,0,20,11,False,Drugs,1538488261.0,9kqs3u
1799,Do ADHD meds just affect me different or do I just need a higher dose?,['Airborne82D'],[2],uhgglw,0,9,1,False,Drugs,1538535041.0,9kxb4s
1800,Drug Test Quandery,[],[],JKFishTrip,0,1,0,False,Drugs,1538534393.0,9kx89k
1801,Is it just me who thinks that alcohol is incredibly overrated?,"['sayeret13', 'WokeStoner420']","[1138, 1071]",eons4ages,0,670,1783,False,Drugs,1538389034.0,9kf3p4
1802,I need to do some soul searching,['is00c'],[5],fort_bev100,0,11,5,False,Drugs,1538502507.0,9ksuyr
1803,Will I have a tolerance to Valium if I have a tolerance to Xanax?,['Super_Superior'],[4],HazeBoyDaily,0,4,5,False,Drugs,1538506861.0,9ktiok
1804,Coke or Speed?,"['yayoiscrazy', 'eternal_n0mad', 'shrugs19']","[5, 5, 4]",awikiguy,0,12,1,False,Drugs,1538532256.0,9kwylq
1805,I think I really fucked myself over this time.,"['yayoiscrazy', 'liltape', 'Airborne82D']","[89, 25, 23]",Bbthebest,0,30,67,False,Drugs,1538450177.0,9kn7nc
1806,Tylenol 3 With Codine...Advice?,"['seangriffin63', 'chungus11111']","[6, 3]",probablyhornykitty,0,23,7,False,Drugs,1538493974.0,9krky5
1807,"Glass vial of brown stuff, help","['pangy12', 'WilfordBrimleyOnAcid', 'mycmush33', 'Airborne82D']","[4, 3, 3, 3]",lizardnamedoxy,0,17,1,False,Drugs,1538531811.0,9kwwmu
1808,How should I prepare,"['Deadly_Kittens_', 'sivaddavid']","[4, 3]",xxxilovechildren6969,0,11,3,False,Drugs,1538510270.0,9ku12r
1809,Why the fuck do ppl do synthetic weed?,"['blindreality', 'Airborne82D', 'tidepodpeople']","[38, 32, 25]",SlicedRice,0,42,48,False,Drugs,1538455967.0,9kntgb
1810,PUBG and the drug that makes you God at PUBG,"['spacecadet-au', 'FriendlyDuck__', 'Super_Superior']","[20, 10, 7]",cinnamoncum,0,24,6,False,Drugs,1538495478.0,9krsrr
1811,Drugs like nicotine,"['greenlight227', 'shsjcvs', 'tarbender710', 'Pinkamenarchy']","[31, 9, 8, 8]",kazikant,0,43,29,False,Drugs,1538464658.0,9kokem
1812,First time potentiating Opiates,[],[],-skinny-fiend-,0,11,3,False,Drugs,1538508734.0,9ktstu
1813,What happened to mephedrone in the UK?,"['Dieselite', 'FreeManBeat', 'gintonicisntwater']","[5, 3, 2]",polebambi,0,21,6,False,Drugs,1538491955.0,9krabp
1814,My toads are doing well,['sp00nme'],[7],Neurogod1,0,5,7,False,Drugs,1538494770.0,9krp3z
1815,Valium or Klonopin before Ecstasy?,"['is00c', 'quantumbill']","[5, 3]",kittheyy,0,9,4,False,Drugs,1538502563.0,9ksva5
1816,Need help enjoying weed again,"['is00c', 'quantumbill', 'memeshroud', 'zombi-11']","[3, 3, 3, 3]",Im_High_AF,0,20,5,False,Drugs,1538502328.0,9kstyk
1817,I haven't seen a post from the guy who was getting clean off heroin recently. Anyone know how he's doing?,['ChefRobH'],[3],breezefortrees,0,2,6,False,Drugs,1538491286.0,9kr6zy
1818,Weed Nausea,['radiationandme'],[5],RepDaddy05,0,14,3,False,Drugs,1538507615.0,9ktmvf
1819,What Boardgames are Great to Play During an Acid Trip?,['Scribox'],[5],Octavarion,0,6,2,False,Drugs,1538515386.0,9kusfs
1820,What's your sick day drug(s) of choice?,['ChefRobH'],[11],Tkldsphincter,0,8,3,False,Drugs,1538501746.0,9ksquk
1821,Am I the only one who likes the Xanax afterglow better than the actual Xanax?,"['KingLuke420', 'AndreWigggins']","[2, 1]",nathanroot28,0,10,2,False,Drugs,1538515202.0,9kurhh
1822,MDA + MDMA dosage?,[],[],Drpppr67,0,2,2,False,Drugs,1538515146.0,9kur69
1823,How to understand reasons of your drug abuse?,"['bananfluer505', 'AnonKey23', 'Themokephene', 'Penumbrium']","[9, 7, 3, 3]",Random_boiii,0,14,10,False,Drugs,1538484652.0,9kqbg7
1824,Smoked so much weed I became sober,"['anaurism', 'Ayehase']","[5, 3]",LilWokhardt,0,5,1,False,Drugs,1538527123.0,9kwbxf
1825,I need advice,[],[],fuckieverything,0,4,1,False,Drugs,1538527066.0,9kwbow
1826,"First time shrooms user, how much for a good time?",['devilsdancing'],[4],ILikeSubaru,0,32,2,False,Drugs,1538512566.0,9kudd9
1827,Marijuana Charges in 2018 POSS/MFG.,['devilsdancing'],[8],Joshuaace1,0,11,2,False,Drugs,1538512000.0,9kuads
1828,Benzo that causes the least damage to cognitive function?,['quantumbill'],[27],spilldahill,0,8,4,False,Drugs,1538498010.0,9ks6f6
1829,Turbo Heartrate- Methylone,[],[],rb9046,0,4,3,False,Drugs,1538503582.0,9kt0rb
1830,codeine and drink,[],[],lil_wizzard-,0,2,3,False,Drugs,1538503060.0,9ksxxi
1831,My Dealer Just Posted Picture Of Bricks,"['falecf4', 'ilovechems', 'Docowart', 'goosetavio']","[41, 28, 17, 15]",goodtheguy,0,39,41,False,Drugs,1538450967.0,9knaqu
1832,Bless up y'all bc the Drug Gods just saved my ass,"['Pooty_Tang1594', 'Mickermoo', '0sepulcher0']","[93, 22, 17]",Afrochiken,0,28,108,False,Drugs,1538431198.0,9kktf3
1833,Smoking in the school bathroom,"['AstroBearGaming', 'Xsyther']","[13, 11]",XXkeif_KingXx,0,17,2,False,Drugs,1538509536.0,9ktx6t
1834,Smoked weed for the first time,['WilfordBrimleyOnAcid'],[9],throwaway54642254,0,3,2,False,Drugs,1538509244.0,9ktvks
1835,How to search for state and federal drug laws,[],[],GullibleSwimming,0,6,4,False,Drugs,1538495532.0,9krt0v
1836,Phenibut and GBL,[],[],d8662,0,1,2,False,Drugs,1538508710.0,9ktspa
1837,Stimulant/Vyvanse alternative for ADHD?,[],[],StarShot77,0,4,1,False,Drugs,1538521934.0,9kvo6o
1838,Tripping on a work day,['MercuryMorrison1971'],[5],toastshop,0,3,5,False,Drugs,1538494565.0,9kro0h
1839,Making a new drug,['iswallowedafrog'],[5],danthedealer,0,8,0,False,Drugs,1538521251.0,9kvkvw
1840,How to make wet weed dry,[],[],HarryTibbs,0,4,1,False,Drugs,1538520832.0,9kviyh
1841,Understanding song meanings with drugs,['26LT'],[8],seangriffin63,0,7,4,False,Drugs,1538493402.0,9krhvj
1842,Is it safe to do a little coke like 7 hours after taking 10mg of Oxy?,[],[],cinnamoncum,0,2,1,False,Drugs,1538519530.0,9kvcuh
1843,Worst day of my life,['Captainbuttram'],[3],Stonerhendrix4200,0,16,0,False,Drugs,1538519412.0,9kvc9y
1844,I died smoking DMT,"['Anthonyybayn', 'NewOrMom']","[442, 211]",Doit4DaL0Lz,0,90,568,False,Drugs,1538395107.0,9kfokw
1845,Does gabapentin or Lyrica make anyone else aggressive?,[],[],quantumbill,0,21,2,False,Drugs,1538505458.0,9ktazt
1846,I think I’m dumb from drugs,['mivanqua'],[11],templed_mind_,0,13,6,False,Drugs,1538487406.0,9kqo22
1847,Trying Acid,"['1bvr2lmr', 'noonecortex']","[6, 2]",HarveyG23,0,10,5,False,Drugs,1538490957.0,9kr5cj
1848,Basically First Time with Alprazolam,[],[],Solidifieddd,0,4,2,False,Drugs,1538504204.0,9kt47w
1849,Strange MDMA consequences,['DeductiveBest'],[3],Balliard,0,4,3,False,Drugs,1538496070.0,9krvsj
1850,I want to share my first time experience doing Ket. (Bad trip),['i_love_ket'],[6],IOllieLewisI,0,11,4,False,Drugs,1538490363.0,9kr2d0
1851,Boof Train,"['Bottleslip', 'th3m4g3']","[19, 5]",SojournerBoof,0,11,27,False,Drugs,1538452155.0,9knfg9
1852,Dimenhydrinate and LSD,[],[],ChodeChoppy,0,2,1,False,Drugs,1538517275.0,9kv1yn
1853,What would I be feeling if I had glutamate excitoxicity?,['sjemka'],[3],Fighterman27,0,9,3,False,Drugs,1538495254.0,9krrml
1854,Tips,['beenyolk'],[3],Yeeeeeah_Boyee,0,3,3,False,Drugs,1538495171.0,9krr7n
1855,Wost Comedown Of My Life,"['Molokai420', 'ChefRobH', 'KingKhezu', 'SpongebobForever']","[8, 3, 3, 3]",topbanana6969,0,29,3,False,Drugs,1538495089.0,9krqsn
1856,Long term effects of vyvanse or ritalin for ADHD?,['quantumbill'],[3],tomc31,0,8,1,False,Drugs,1538516507.0,9kuy2x
1857,Acid piss,"['killnik420', 'wizardswrath00', 'Nezborn02', 'BIGPoppa020', 'intodanihilizm']","[6, 4, 3, 3, 3]",BIGPoppa020,0,26,19,False,Drugs,1538459629.0,9ko5cl
1858,"Have you ever done drugs with your parents, fancy sharing the story?",['boicheeze'],[3],OctopusPoo,0,7,1,False,Drugs,1538515893.0,9kuuzx
1859,The government is stupid.,['JailsucksLEtoo'],[19],jeffbobingson,0,6,17,False,Drugs,1538460252.0,9ko798
1860,Alcohol withdrawals stopped after 24hours?,"['quantumbill', 'bagofm3th']","[2, 2]",aquakali,0,4,1,False,Drugs,1538515334.0,9kus5s
1861,"Acid, MDMA, Cannabis and Nitrous! All at the same time?",[],[],notsoeasy11,0,1,4,False,Drugs,1538488191.0,9kqrrz
1862,I had a bad trip on dxm 😫😫😫,"['O_God_The_Aftermath', 'hoonigan_4wd']","[6, 3]",kessahw,0,16,3,False,Drugs,1538487909.0,9kqqcf
1863,All the drugs I’ve done and their effects on me wanting to kill myself,"['ICantDoseProperly', 'Airborne82D']","[18, 9]",dontgetupsetman,0,14,43,False,Drugs,1538440521.0,9km0wl
1864,What are your reflections on your drug usage/experemineation - would you make the same decision again if given the chance?,[],[],Edslittlerusher,0,4,1,False,Drugs,1538513504.0,9kuic1
1865,Drugs Made Me Into a Scientist,['FanaticPhenAddict'],[44],Symm3try13,0,37,161,False,Drugs,1538413831.0,9ki8bz
1866,Weed prices in Kos (Greece),[],[],Tom246611,0,10,1,False,Drugs,1538513193.0,9kugoi
1867,Candyflip first time,['asiansune'],[5],XzeZT,0,5,3,False,Drugs,1538490480.0,9kr2xb
1868,Anyone began using again after years of sobriety willing to talk?,"['rafsimons213', 'Airborne82D']","[11, 8]",Questionsaplenty1,0,15,12,False,Drugs,1538463384.0,9kogl6
1869,First time smoking crack cocaine advice needed,"['psychedfish', 'murt311']","[71, 19]",Spankbang91,0,14,9,False,Drugs,1538472873.0,9kp6ry
1870,Convince parents to let me smoke,"['Shroomz603', 'Ismokeshatter92']","[31, 10]",lamest_private,0,23,11,False,Drugs,1538461496.0,9kob3u
1871,Just busted a nut on a whippet,"['Heil--Hydra', 'willm1123', 'LovableKyle24']","[193, 190, 59]",Xsyther,0,75,482,False,Drugs,1538387659.0,9kez7q
1872,ODing on speed ?,"['SpecificValue', 'Random_boiii']","[7, 5]",qu_me,0,5,3,False,Drugs,1538486640.0,9kqkhp
1873,First Times with Weed,['yesnessage'],[3],SushiSalamander,0,4,3,False,Drugs,1538486285.0,9kqiw8
1874,Anyone else love working out when they’re drunk as fuck?,['wizardswrath00'],[6],ohappalled,0,11,8,False,Drugs,1538466589.0,9kopnb
1875,Trapped in basement by German Shepard,['psychedfish'],[3],murt311,0,12,5,False,Drugs,1538475338.0,9kpe58
1876,Pill report: Have I taken PMA?,[],[],okcomput3r,0,3,5,False,Drugs,1538468869.0,9kovmv
1877,Can you guys review my plan - any issues?,['LysergicSNDR'],[6],MrNogi,0,4,1,False,Drugs,1538503727.0,9kt1jm
1878,Crack saved my friend from an overdose?,['vitaminB50000'],[45],metham-sket-amine,0,14,39,False,Drugs,1538430822.0,9kkrka
1879,Need advice,"['murt311', '_ShadowBee_']","[4, 3]",bennis-da-menace,0,7,5,False,Drugs,1538474963.0,9kpd05
1880,Renting a house,[],[],Stonerhendrix4200,0,17,1,False,Drugs,1538502003.0,9kss65
1881,Anybody else adore Cocaine but don't bother with it cause of the price ?,"['downlow1234', 'ingoodspirit']","[19, 18]",COB98,0,30,36,False,Drugs,1538433091.0,9kl2ol
1882,This cats bumping at lunch,[],[],CaliRider748,0,2,1,False,Drugs,1538500102.0,9kshng
1883,Don't play mushroom roulette!,"['Perforationss', 'Airborne82D']","[31, 8]",DirtyHandsMcgee,0,21,6,False,Drugs,1538463864.0,9koi08
1884,Anyone else have such a weak stomach they can't partake in many drugs?,[],[],ElCocaLoco,0,6,4,False,Drugs,1538471269.0,9kp247
1885,What was your most horrific DMT experience?,"['danthedealer', 'JailsucksLEtoo', 'EpiiCideas']","[3, 1, 1]",Lsdbanana,0,6,8,False,Drugs,1538462367.0,9kodld
1886,I love proving people wrong about drugs,"['cr1ptych', 'Captainbuttram']","[14, 9]",-AtomHeartMother-,0,22,18,False,Drugs,1538441853.0,9km6ua
1887,Doing drugs in dreams,"['FatAssMeme', 'deepcool77', 'toelicka', 'holeintheceiling']","[63, 28, 21, 17]",skimask7,0,55,75,False,Drugs,1538412200.0,9khzfg
1888,Finding a drug stash,"['Chazza354', 'whip-appeal']","[27, 11]",BigTadz,0,13,17,False,Drugs,1538439544.0,9klwfm
1889,"Very legal, but underrated drug combo.",[],[],AppoX7,0,3,2,False,Drugs,1538478901.0,9kpphl
1890,What's the most profound visual that you have ever seen on a psychedelic?,"['Buklao123', 'O_God_The_Aftermath', 'FromundaBrees']","[28, 9, 8]",Gorillapoopass,0,31,20,False,Drugs,1538432570.0,9kl0aj
1891,"If i was to only try one more drug, what would you recommend?","['EatDaCrayon', 'mykneegrows_', 'scheevsche']","[6, 6, 5]",tasweigan89,0,15,2,False,Drugs,1538478049.0,9kpmil
1892,Anyone else LOVE Caffeine pills?,"['pikachuyoloswag', 'RuffleBoy3']","[19, 5]",AndreWigggins,0,11,24,False,Drugs,1538430250.0,9kkoq0
1893,LDS Missionaries Try LSD for the First Time. Sorry if already been posted. thought it belonged here.,['lildopeboy589'],[7],Nadiagrace1,0,6,0,False,Drugs,1538512646.0,9kudrd
1894,"Guys, I may do shrooms tomorrow impulsively and need your advice",['tcald251'],[8],greendray1,0,7,4,False,Drugs,1538459459.0,9ko4v1
1895,"If you have a reliable hookup, be thankful","['throwawayforlewdstuf', 'gintonicisntwater']","[70, 36]",cokedoutratjazz,0,54,103,False,Drugs,1538400083.0,9kg9kq
1896,"What is your biggest ""I learned it the hard way"" advice about drugs","['Wavycapmurphy', 'mykneegrows_']","[58, 36]",Kaddy03,0,128,33,False,Drugs,1538423097.0,9kjn24
1897,Only little differences between cocaine and methyl/ethylphenidate,['isxtxpe'],[5],mdmeray,0,6,3,False,Drugs,1538468555.0,9kousn
1898,Is it safe to take psychedelics if you're on medication ?,"['PsychedAmbien', 'petespeyote', 'thepsychedelicsound']","[9, 5, 5]",ezugg,0,6,3,False,Drugs,1538468447.0,9kouia
1899,whats your mdma dose?,['spacecadet-au'],[2],Zyklopi,0,26,2,False,Drugs,1538489100.0,9kqw1y
1900,Favorite Thing To Do on Opiates?,"['trucknjoe', 'wizardswrath00', 'execob']","[7, 3, 3]",tyawesomejohnson,0,16,4,False,Drugs,1538461904.0,9koc9s
1901,Anyone else doing sober October?,['FitChickFourTwennie'],[12],_37_Pieces_of_Flair_,0,30,2,False,Drugs,1538488720.0,9kqu6i
1902,What's good for getting rid of inhibitions and anxiety?,"['fayoK', 'evan2686']","[3, 2]",kibberty,0,13,2,False,Drugs,1538488351.0,9kqsii
1903,Worst. Yayo. Ever.,['heroin_papi_'],[3],OG_Martian,0,25,2,False,Drugs,1538474712.0,9kpc5z
1904,800ug of MDMA over an extended amount of time?,"['gintonicisntwater', 'Finley403', 'spacecadet-au']","[6, 6, 3]",Zyklopi,0,25,2,False,Drugs,1538488049.0,9kqr1w
1905,Trazedone 300mg withdrawal.,['TheRoomsRbugged'],[3],mellowmushroom94,0,9,3,False,Drugs,1538465811.0,9konn2
1906,What are some specific things to do on specific drugs that feels particularly amazing? (Bonus if it’s a lesser known activity),"['EatDaCrayon', 'Ouija-Luigi', 'WildDerpAppears']","[13, 9, 7]",acidbasehead,0,20,8,False,Drugs,1538448709.0,9kn1i0
1907,Whats up with cocaine?,"['killnik420', 'SanPedroLover_', 'RoughJaw']","[16, 7, 5]",Madam_Pigeon,0,22,7,False,Drugs,1538448271.0,9kmzmy
1908,Drugs in prison,['crayonp'],[3],bucksinsix_,0,4,8,False,Drugs,1538444911.0,9kmknn
1909,Weed+Xanax+Ketamine,[],[],youngthugfan64,0,1,11,False,Drugs,1538438510.0,9klrmy
1910,Weed slaping after quiting for 7 months,['wizardswrath00'],[3],undercoveraver,0,3,5,False,Drugs,1538458134.0,9ko0rx
1911,Occasional Adderall use?,['nathansosick'],[5],mdmaziing,0,10,5,False,Drugs,1538453289.0,9knjt2
1912,"Bad DXM+weed interaction, increased anxiety, weird heart symptoms?",['O_God_The_Aftermath'],[1],AvailableHovercraft,0,4,1,False,Drugs,1538484536.0,9kqayt
1913,Just wondering about Xanax,[],[],danthedealer,0,3,2,False,Drugs,1538462393.0,9kodoi
1914,Walgreens prescription question,"['analshaman69', 'O_God_The_Aftermath']","[1, 1]",nitsuan,0,4,0,False,Drugs,1538483182.0,9kq5bs
1915,"Planning on taking some triple c’s, any advice?","['greenkween320', 'dankscammer', 'shetrips-shesmokes']","[6, 3, 3]",iawesome217,0,8,0,False,Drugs,1538504618.0,9kt6ev
1916,Xans(GG249) making me sad all of a sudden?,['Chipklaatu'],[17],Anonymous19981998,0,4,2,False,Drugs,1538482823.0,9kq3uu
1917,How long do Concerta side effects last?,,,maurid,0,0,5,False,Drugs,1538454796.0,9knpc0
1918,Drug Pick-up Lines?,"['p0a1u3l9', 'Litalian', '5_meo_mipt']","[133, 40, 29]",trumpsabastard,0,24,21,False,Drugs,1538422448.0,9kjjhg
1919,I need drugs?,[],[],BiggerBadgers,0,2,4,False,Drugs,1538453104.0,9knj3e
1920,A thought about blood donations,['TheInfinityDuck'],[5],TheInfinityDuck,0,5,1,False,Drugs,1538480157.0,9kptvv
1921,150ug or 200ug for 2nd time tripping?,[],[],Dashed12,0,1,1,False,Drugs,1538480107.0,9kptp0
1922,Kapanol (Morphine Sulfate),[],[],captainaustismo,0,10,1,False,Drugs,1538479680.0,9kps8g
1923,Addy,['Spoderr'],[19],smokmajana,0,20,6,False,Drugs,1538447524.0,9kmw67
1924,Any Movie Suggestions for When Taking MDMA,"['Purpleanonymous', 'blindreality']","[18, 9]",worsthumanalive,0,14,3,False,Drugs,1538457101.0,9knxf8
1925,What's the most euphoric psychedelic?,"['Captainbuttram', 'VD531', 'bagofm3th']","[7, 4, 4]",outlinked17,0,26,8,False,Drugs,1538443483.0,9kme8u
1926,Codeine and doxylamine,['wizardswrath00'],[1],Suwoo187,0,2,2,False,Drugs,1538464633.0,9kokc1
1927,Should I get prescribed Ritalin,['jagains167'],[2],danthedealer,0,9,1,False,Drugs,1538477858.0,9kplwk
1928,"Politico: ""Why the FBI Should Investigate 'Boofing'""",['Stickey794'],[13],SomaAlchemist,0,4,7,False,Drugs,1538442726.0,9kmaud
1929,Lyrica and klonopin,[],[],PineForest555,0,2,2,False,Drugs,1538464117.0,9kois3
1930,Hey guys I have serious question.,['blindreality'],[2],Sipping_codeine,0,15,3,False,Drugs,1538456185.0,9knu8a
1931,What’s your scariest drug trip?,"['SkeezySkeeter', 'GattFortOppidetsiste', 'Squezme', 'Killed0']","[6, 5, 5, 5]",Lilspoona,0,35,5,False,Drugs,1538442538.0,9km9zu
1932,Friday evening trip,[],[],TheAsinineBassist,0,2,7,False,Drugs,1538442332.0,9km938
1933,"Did DXM a couple years back, just curious...",['robomoboto'],[3],PrimmSlimShady,0,2,4,False,Drugs,1538455291.0,9knr4c
1934,Music on Morphine,['ScheduleIV'],[7],treesand1,0,3,4,False,Drugs,1538448856.0,9kn244
1935,Theory: Dissociatives are the building blocks of Psychedelics which are the building blocks of meditation,,,DisMyDrugAccount,0,0,7,False,Drugs,1538437528.0,9kln8k
1936,Cocaine Instant lightheadedness/dizziness/nausea,[],[],Finequasar3,0,2,3,False,Drugs,1538453845.0,9knm0t
1937,7 days of psychedelics.,"['sqqlut', 'Kaddy03', 'eternal_n0mad']","[6, 4, 3]",GewdMewd,0,10,1,False,Drugs,1538475227.0,9kpdsi
1938,Shroom thoughts,['skate-rat18'],[2],floppyflop123,0,2,11,False,Drugs,1538429973.0,9kkn9a
1939,Smoking Chamomile/Tobacco,['hrefchef'],[6],secret_god,0,7,7,False,Drugs,1538436620.0,9klj2v
1940,Xanax ER vs. Klonopin?,[],[],Questionable_Incel,0,1,4,False,Drugs,1538447337.0,9kmvb1
1941,A suggestion for making/maintaining relationships while getting high with people,"['bori_2791', 'newlightpsych']","[17, 14]",BagelStorm,0,6,63,False,Drugs,1538393286.0,9kfhys
1942,I fucked up by starting an amphetamine binge.. got college and work tomorrow,"['Bbthebest', 'Duggie1330']","[2, 2]",PharmacologyIsCool,0,17,4,False,Drugs,1538447020.0,9kmtvi
1943,Has Anyone Else Experienced This On Weed?,"['oliver413', 'TenaciousC99', 'maamayhem118']","[16, 9, 5]",ikea-shark-wen,0,22,10,False,Drugs,1538428849.0,9kkhlh
1944,Have drugs gotten cheaper or did I just stop getting custied as I've gotten older?,"['killnik420', 'tokeymonmon']","[4, 3]",JoshTheWebDev,0,12,5,False,Drugs,1538446633.0,9kms4y
1945,I love/hate molly,"['yayoiscrazy', 'Airborne82D']","[8, 4]",eetsahmee,0,19,3,False,Drugs,1538452251.0,9knfsx
1946,"Really sick of SSRIs, I feel they've barely helped. I want a new drug","['dr909o', 'sunface7', 'drewsus64', 'hegels_hair', 'savagebongmaster']","[5, 1, 1, 1, 1]",swaggyt123xyz,0,13,5,False,Drugs,1538441084.0,9km3dq
1947,Phenibut Overdose and Horrible Experience,[],[],scintillatingrabbit,0,3,1,False,Drugs,1538472328.0,9kp57f
1948,Suck in a terrible place (please help),['Ayehase'],[2],namazuthedrugdude,0,11,1,False,Drugs,1538472058.0,9kp4f7
1949,"I really need help, please.",['irollwithmoo'],[3],babyycakes69,0,10,7,False,Drugs,1538433761.0,9kl5tw
1950,What’s your Ketamine experience?,"['blueboy710', 'Xsyther']","[4, 2]",inaudible_music,0,9,3,False,Drugs,1538449973.0,9kn6s1
1951,How can I tell if my LSD sugar cubes are legit?,"['rg3Po2', 'fudpuck3r']","[2, 2]",hanktank27,0,20,3,False,Drugs,1538449951.0,9kn6oc
1952,Eating after using opiods,['eskimobeanr'],[3],Lostgirl712,0,5,3,False,Drugs,1538449254.0,9kn3s7
1953,What should I do with this coke?,['Stickey794'],[11],1305nsfw,0,13,7,False,Drugs,1538435520.0,9kldya
1954,"Currently tripping acid, any song recommendations?","['c0mp1ex88', 'spankabajanka', 'godickygodickygo', 'LITSWD189', 'woodtipwine']","[3, 3, 2, 2, 2]",hyucktownfunk,0,29,2,False,Drugs,1538455620.0,9kns8w
1955,Can soma (carispridol) be used to prevent alcohol withdrawal?,,,jh102499,0,0,5,False,Drugs,1538441863.0,9km6vt
1956,Have stimulants ruined my brain?,"['oliver413', 'Crixus991']","[6, 4]",lookintomyeyesss,0,43,11,False,Drugs,1538423272.0,9kjo0c
1957,Trippin,['ysladdict'],[38],AnnieQApples,0,16,124,False,Drugs,1538373038.0,9kdqvk
1958,"We should put kief in salt shakers to ""salt"" our bowls or blunts.","['Oz_a_day', 'rebbitryan']","[1825, 421]",ProktosRS,0,262,2477,False,Drugs,1538315822.0,9k6itf
1959,dropped my brother off at a homeless shelter,['c0nfigs'],[16],M46Initiative,0,6,0,False,Drugs,1538498689.0,9ks9yp
1960,Benadryl,"['flyingtacomoose', 'Aculeatus', 'bdelrey', 'SkeezySkeeter']","[9, 6, 4, 4]",trippyrick2,0,14,6,False,Drugs,1538430917.0,9kks27
1961,what's most awkward sex story you got yaself under the infuelnce of drugs?,"['la-de-de', 'YeezyTakeTheWheel', 'mandudebrodog']","[47, 30, 21]",neverbeanotherone,0,33,19,False,Drugs,1538407057.0,9kh80s
1962,Vyvanse? Lack of Sleep? Something else?,[],[],offbrandfignewtons,0,13,2,False,Drugs,1538451986.0,9knet4
1963,MDMA effects,['yayoiscrazy'],[2],kiddotj,0,6,2,False,Drugs,1538451947.0,9knenx
1964,"I’m looking for those who have used DMT for a video project I’m doing, would anyone be interested in talking about their trip?","['Tunixe', 'SufferingSober']","[8, 5]",blookysbox,0,10,23,False,Drugs,1538402854.0,9kgmmz
1965,Worth the mixture?,"['ieatnarcotics', 'wizardswrath00']","[3, 3]",dertyerwin,0,6,1,False,Drugs,1538462721.0,9koen2
1966,Crack Chemistry question,['NotCharmander'],[3],Saucey2Flossy,0,5,3,False,Drugs,1538441124.0,9km3k6
1967,The most renaissance moment in my life,[],[],norwegianopaq,0,3,3,False,Drugs,1538435159.0,9klcdb
1968,I always see posts about MDMA losing its magic. I feel like I know why you feel like that.,"['FloopMan', 'Djvacuumseal']","[41, 40]",GlockGod,0,104,62,False,Drugs,1538382332.0,9kejei
1969,How bad do you think I have damaged my brain/body?,"['whip-appeal', 'bodaciousbozo420']","[16, 10]",throwaway817128,0,20,6,False,Drugs,1538422289.0,9kjikf
1970,"Despite all the recent researches and great things psychedelics are achieving, people are still extremely misinformed thus progress is limited….",[],[],GrimReaperzZ,0,1,3,False,Drugs,1538433018.0,9kl2at
1971,"Who started doing ""hard"" drugs at a young age and still never lost control?","['DMlad', 'TheRickestMorty10']","[57, 22]",nonameplayer13,0,201,45,False,Drugs,1538386146.0,9keugt
1972,Seeking advice - Dangerous Dad addicted to Meth/heroin,"['vibrantax', 'rowan65', 'rowan65']","[33, 12, 9]",aidenphengsy,0,24,45,False,Drugs,1538384718.0,9keq4a
1973,"I haven't seen this mix talked about here, so here's my two cents- Xanax and Phenibut",['JuventusX'],[7],ElevatorDoor22,0,4,12,False,Drugs,1538410422.0,9khpy6
