,title,comments_author_lst,comments_score_lst,author,guilded,num_comments,score,pinned,subreddit,created_utc,r_id
5305,Which Myers Briggs personality are you depending on the drug you're on?,[],[],Throwaway619760858,0,3,1,False,Drugs,1538552558.0,9kz2vv
5306,Will doctor prescribe adderall w/ substance abuse/depression?,['Spoderr'],[2],wow85294,0,17,0,False,Drugs,1538551204.0,9kyyqw
5307,Family,[],[],CosmicCatDaddy,0,3,6,False,Drugs,1538518992.0,9kvab6
5308,Question Regarding Damage From Psychedelics,[],[],killer2themx,0,4,1,False,Drugs,1538549806.0,9kyu61
5309,Should I let my step dad lick me for some Xanax?,"['tomzak14', 'xanxandranq', 'peter_xan']","[55, 47, 24]",cinnamoncum,0,28,14,False,Drugs,1538499506.0,9kseam
5310,Hope I make it through death.,"['birdbro685', 'SickRanchez_cybin710']","[132, 51]",Veils93,0,66,188,False,Drugs,1538447166.0,9kmuio
5311,Fun things to do on lsd,['dk42O'],[8],0Adiemus0,0,8,5,False,Drugs,1538521684.0,9kvmzm
5312,Psychiatrist making me feel uncomfortable?,['rubym00n'],[4],patientlydenied,0,5,5,False,Drugs,1538513576.0,9kuips
5313,first time tripping,[],[],BlueFootPanda,0,6,5,False,Drugs,1538521439.0,9kvltp
5314,What should I take for my first psychedelic experience?,['ray198898765'],[5],onarolllikecottonell,0,5,4,False,Drugs,1538521186.0,9kvklj
5315,I have some tramadol and codeine. I was wondering how much of this will get me high?,['ingoodspirit'],[3],Films88888888,0,6,3,False,Drugs,1538525981.0,9kw6xn
5316,I never meet anyone that wants to help me access drugs.,"['StaySick666-', 'EatDaCrayon']","[15, 7]",mintspie,0,17,4,False,Drugs,1538520281.0,9kvgcq
5317,"""Breaking 4th Dimension"" on 300ug acid and getting caught by cops",['asiansune'],[12],Baby_MakingMusic,0,9,19,False,Drugs,1538490672.0,9kr3vx
5318,To those of you who experienced Ego Death,"['rhynoacid', 'yamanamawa', 'mikewirkijowski', 'anonidiotaccount']","[5, 2, 2, 2]",i-haveno-name,0,16,1,False,Drugs,1538546413.0,9kyiyg
5319,Is there anywhere I can read about the effects of taking PEA one a day everyday?,[],[],Sedai09,0,4,1,False,Drugs,1538545995.0,9kyhlh
5320,Going to the movies with a girl that is on xtc... Help needed,"['FreeManBeat', 'techhorrors', 'Tylerb0713']","[32, 27, 24]",Kaddy03,0,29,17,False,Drugs,1538490191.0,9kr1h5
5321,"Strong tabs, 0 acid tolerance ( last trip one year ago)",[],[],undercoveraver,0,2,1,False,Drugs,1538545367.0,9kyfex
5322,What is the best way to ingest Calea zacatechichi?,"['pangy12', 'mycmush33']","[2, 2]",Ajk973,0,3,2,False,Drugs,1538531284.0,9kwuct
5323,"Meth Question, I'm so goddamn tired","['MissLadyPerson', 'anonidiotaccount']","[5, 3]",grey59babe,0,27,2,False,Drugs,1538530760.0,9kwry9
5324,L-theanine after rolling?,[],[],PegaSwoop,0,2,1,False,Drugs,1538543456.0,9ky8od
5325,I never take xanax again,['ErLeo'],[9],perfectmolly,0,8,10,False,Drugs,1538498366.0,9ks8bc
5326,First time IM Ketamine questions,['gintonicisntwater'],[6],newlightpsych,0,5,5,False,Drugs,1538511580.0,9ku86j
5327,Is GHB worth it? If not whats worth a go ?,"['DaddysAsianToy', 'youngforever1998', 'RoboTripped']","[8, 5, 5]",Jk1292,0,23,4,False,Drugs,1538511208.0,9ku66r
5328,How is acid supposed to effect you?,"['mikewirkijowski', 'Montog7711']","[10, 4]",FamousCx,0,28,8,False,Drugs,1538500878.0,9kslzo
5329,Positive long term effects of responsible cocaine usage?,['gangsterdam020'],[7],daddanm,0,6,4,False,Drugs,1538514348.0,9kumu7
5330,"After a bad trip, I have trapped my mind into a living hell of paranoia and hopelessness","['MarkSpenecer', 'Kaddy03']","[45, 15]",321231j,0,39,30,False,Drugs,1538472745.0,9kp6eu
5331,Probation questions,[],[],RoosterInMahRari,0,8,1,False,Drugs,1538540973.0,9kxzg4
5332,Me and my SO took DXM and she's still feeling weird after four days.,,,jojoDUB,0,0,2,False,Drugs,1538527006.0,9kwbex
5333,Unexperienced drug use,['tweaker_withfeelings'],[5],suicidalcrybaby,0,6,3,False,Drugs,1538518157.0,9kv6al
5334,I boofed the marijuanas,"['schlonghornbbq8', 'oswoodruhs', 'sebseb420', 'lilmeepkin']","[54, 26, 24, 17]",Hautla,0,34,144,False,Drugs,1538442493.0,9km9s9
5335,Let me tell you a story about the war on drugs,['mikewirkijowski'],[2],AnatomyOfTrees,0,6,8,False,Drugs,1538496170.0,9krwdj
5336,Questions before first xanax experience,"['InfiniteBuddy', 'blood_clot_drip', 'Airborne82D']","[1, 1, 1]",Not_A_Creative_Color,0,8,1,False,Drugs,1538539023.0,9kxrrb
5337,"Had a very small bit of gin, is it okay to take DXM?",[],[],dontgetupsetman,0,1,2,False,Drugs,1538525464.0,9kw4g8
5338,Coke is not garbage,"['braapbraap69', 'Remember_the_BBQ', 'Insanity_Pills', 'killnik420']","[78, 27, 26, 23]",XannyBarChrist,0,73,111,False,Drugs,1538447068.0,9kmu2s
5339,Acid Humor,"['LovableKyle24', 'haannaah1']","[2, 2]",therealpussyslayer,0,10,7,False,Drugs,1538497884.0,9ks5pv
5340,Nitrous urgent safety question,[],[],rainystan,0,2,1,False,Drugs,1538538098.0,9kxo51
5341,macromerine?,,,sackofchemicals,0,0,2,False,Drugs,1538524435.0,9kvzta
5342,Question: Percs after Kratom,,,futurefiction2,0,0,3,False,Drugs,1538516313.0,9kux2o
5343,Different lsd trips?,[],[],RoosterInMahRari,0,3,1,False,Drugs,1538536830.0,9kxiyp
5344,Amphetamine parachuting question,[],[],HellishTought,0,6,3,False,Drugs,1538515125.0,9kur2g
5345,Ambien and alcohol,[],[],veggietrooper,0,6,1,False,Drugs,1538536590.0,9kxhy0
5346,When to take Xanax before presentation,"['21_TwentyOne_21', 'jesceyc']","[3, 3]",uhohdiddly,0,6,6,False,Drugs,1538501432.0,9ksp2v
5347,"Addicted to Caffeine, can anyone help me?",['memeshroud'],[4],mcafc,0,8,3,False,Drugs,1538514736.0,9kuoyg
5348,How to turn 2 ounces of MDMA into presses.,['spacejesusguy'],[6],columbusaveprospect,0,10,2,False,Drugs,1538522591.0,9kvraa
5349,Treating myself,[],[],Xavier11223,0,6,1,False,Drugs,1538535982.0,9kxf7h
5350,"Just used my GF's pee for a drug test, I have some questions","['iswallowedafrog', 'FlyByWeekendMan']","[24, 10]",BHojnacki,0,30,13,False,Drugs,1538485848.0,9kqgw9
5351,How fast is ketamine gonna fuck my bladder?,[],[],acidbasehead,0,2,2,False,Drugs,1538522390.0,9kvqbb
5352,First time meth comedown,['zman1672'],[7],bananaorange94,0,16,11,False,Drugs,1538488261.0,9kqs3u
5353,Do ADHD meds just affect me different or do I just need a higher dose?,['Airborne82D'],[2],uhgglw,0,8,1,False,Drugs,1538535041.0,9kxb4s
5354,Drug Test Quandery,[],[],JKFishTrip,0,1,0,False,Drugs,1538534393.0,9kx89k
5355,Is it just me who thinks that alcohol is incredibly overrated?,"['sayeret13', 'WokeStoner420']","[1139, 1070]",eons4ages,0,670,1777,False,Drugs,1538389034.0,9kf3p4
5356,I need to do some soul searching,"['is00c', 'tcald251', 'LittleSelfDiscovery']","[4, 2, 2]",fort_bev100,0,11,4,False,Drugs,1538502507.0,9ksuyr
5357,Will I have a tolerance to Valium if I have a tolerance to Xanax?,['Super_Superior'],[4],HazeBoyDaily,0,4,4,False,Drugs,1538506861.0,9ktiok
5358,Coke or Speed?,"['yayoiscrazy', 'eternal_n0mad', 'shrugs19', 'Airborne82D']","[5, 5, 5, 5]",awikiguy,0,10,1,False,Drugs,1538532256.0,9kwylq
5359,I think I really fucked myself over this time.,"['yayoiscrazy', 'liltape', 'Airborne82D']","[92, 26, 23]",Bbthebest,0,30,68,False,Drugs,1538450177.0,9kn7nc
5360,Tylenol 3 With Codine...Advice?,"['seangriffin63', 'chungus11111']","[6, 3]",probablyhornykitty,0,23,7,False,Drugs,1538493974.0,9krky5
5361,"Glass vial of brown stuff, help","['pangy12', 'WilfordBrimleyOnAcid', 'mycmush33', 'Airborne82D']","[4, 3, 3, 3]",lizardnamedoxy,0,16,1,False,Drugs,1538531811.0,9kwwmu
5362,How should I prepare,"['Deadly_Kittens_', 'sivaddavid']","[3, 3]",xxxilovechildren6969,0,11,3,False,Drugs,1538510270.0,9ku12r
5363,Why the fuck do ppl do synthetic weed?,"['blindreality', 'Airborne82D', 'tidepodpeople']","[41, 29, 23]",SlicedRice,0,41,48,False,Drugs,1538455967.0,9kntgb
5364,PUBG and the drug that makes you God at PUBG,"['spacecadet-au', 'FriendlyDuck__', 'Super_Superior']","[21, 10, 7]",cinnamoncum,0,24,6,False,Drugs,1538495478.0,9krsrr
5365,Drugs like nicotine,"['greenlight227', 'tarbender710', 'shsjcvs', 'Pinkamenarchy']","[31, 8, 8, 8]",kazikant,0,43,29,False,Drugs,1538464658.0,9kokem
5366,First time potentiating Opiates,[],[],-skinny-fiend-,0,11,3,False,Drugs,1538508734.0,9ktstu
5367,What happened to mephedrone in the UK?,"['Dieselite', 'FreeManBeat', 'gintonicisntwater']","[5, 3, 2]",polebambi,0,21,7,False,Drugs,1538491955.0,9krabp
5368,My toads are doing well,['sp00nme'],[7],Neurogod1,0,5,7,False,Drugs,1538494770.0,9krp3z
5369,Valium or Klonopin before Ecstasy?,"['is00c', 'quantumbill']","[7, 3]",kittheyy,0,9,4,False,Drugs,1538502563.0,9ksva5
5370,Need help enjoying weed again,"['is00c', 'quantumbill', 'memeshroud', 'zombi-11']","[3, 3, 3, 3]",Im_High_AF,0,20,4,False,Drugs,1538502328.0,9kstyk
5371,I haven't seen a post from the guy who was getting clean off heroin recently. Anyone know how he's doing?,['ChefRobH'],[3],breezefortrees,0,2,7,False,Drugs,1538491286.0,9kr6zy
5372,Weed Nausea,"['radiationandme', 'grufftheoutcast']","[4, 2]",RepDaddy05,0,14,3,False,Drugs,1538507615.0,9ktmvf
5373,What Boardgames are Great to Play During an Acid Trip?,['Scribox'],[6],Octavarion,0,6,2,False,Drugs,1538515386.0,9kusfs
5374,What's your sick day drug(s) of choice?,"['ChefRobH', 'FlyByWeekendMan']","[8, 3]",Tkldsphincter,0,8,5,False,Drugs,1538501746.0,9ksquk
5375,To all of you that take around a half gram of molly in a night.,"['gangsterdam020', 'Dragoonbaby']","[25, 5]",NOfuckstogive11,0,15,3,False,Drugs,1538507362.0,9ktlhy
5376,Am I the only one who likes the Xanax afterglow better than the actual Xanax?,['KingLuke420'],[2],nathanroot28,0,9,2,False,Drugs,1538515202.0,9kurhh
5377,MDA + MDMA dosage?,[],[],Drpppr67,0,2,2,False,Drugs,1538515146.0,9kur69
5378,How to understand reasons of your drug abuse?,"['bananfluer505', 'AnonKey23', 'Themokephene', 'Penumbrium']","[8, 6, 3, 3]",Random_boiii,0,14,10,False,Drugs,1538484652.0,9kqbg7
5379,Smoked so much weed I became sober,"['anaurism', 'Ayehase']","[4, 3]",LilWokhardt,0,5,1,False,Drugs,1538527123.0,9kwbxf
5380,I need advice,[],[],fuckieverything,0,3,1,False,Drugs,1538527066.0,9kwbow
5381,"First time shrooms user, how much for a good time?",['devilsdancing'],[4],ILikeSubaru,0,32,2,False,Drugs,1538512566.0,9kudd9
5382,Marijuana Charges in 2018 POSS/MFG.,['devilsdancing'],[7],Joshuaace1,0,11,2,False,Drugs,1538512000.0,9kuads
5383,Benzo that causes the least damage to cognitive function?,['quantumbill'],[27],spilldahill,0,8,4,False,Drugs,1538498010.0,9ks6f6
5384,Turbo Heartrate- Methylone,[],[],rb9046,0,4,3,False,Drugs,1538503582.0,9kt0rb
5385,codeine and drink,[],[],lil_wizzard-,0,2,3,False,Drugs,1538503060.0,9ksxxi
5386,My Dealer Just Posted Picture Of Bricks,"['falecf4', 'ilovechems', 'goosetavio', 'Docowart']","[41, 26, 16, 15]",goodtheguy,0,39,38,False,Drugs,1538450967.0,9knaqu
5387,Bless up y'all bc the Drug Gods just saved my ass,"['Pooty_Tang1594', 'Mickermoo', '0sepulcher0']","[94, 23, 19]",Afrochiken,0,28,110,False,Drugs,1538431198.0,9kktf3
5388,Smoking in the school bathroom,"['AstroBearGaming', 'Xsyther']","[13, 10]",XXkeif_KingXx,0,17,3,False,Drugs,1538509536.0,9ktx6t
5389,Smoked weed for the first time,['WilfordBrimleyOnAcid'],[8],throwaway54642254,0,3,3,False,Drugs,1538509244.0,9ktvks
5390,How to search for state and federal drug laws,[],[],GullibleSwimming,0,6,4,False,Drugs,1538495532.0,9krt0v
5391,Phenibut and GBL,[],[],d8662,0,1,2,False,Drugs,1538508710.0,9ktspa
5392,Stimulant/Vyvanse alternative for ADHD?,[],[],StarShot77,0,4,1,False,Drugs,1538521934.0,9kvo6o
5393,Tripping on a work day,['MercuryMorrison1971'],[5],toastshop,0,3,4,False,Drugs,1538494565.0,9kro0h
5394,Making a new drug,['iswallowedafrog'],[6],danthedealer,0,8,0,False,Drugs,1538521251.0,9kvkvw
5395,How to make wet weed dry,[],[],HarryTibbs,0,4,1,False,Drugs,1538520832.0,9kviyh
5396,Understanding song meanings with drugs,['26LT'],[8],seangriffin63,0,7,4,False,Drugs,1538493402.0,9krhvj
5397,Is it safe to do a little coke like 7 hours after taking 10mg of Oxy?,[],[],cinnamoncum,0,2,1,False,Drugs,1538519530.0,9kvcuh
5398,Worst day of my life,['Captainbuttram'],[3],Stonerhendrix4200,0,16,0,False,Drugs,1538519412.0,9kvc9y
5399,I died smoking DMT,"['Anthonyybayn', 'NewOrMom']","[450, 209]",Doit4DaL0Lz,0,90,564,False,Drugs,1538395107.0,9kfokw
5400,Does gabapentin or Lyrica make anyone else aggressive?,[],[],quantumbill,0,21,2,False,Drugs,1538505458.0,9ktazt
5401,I think I’m dumb from drugs,['mivanqua'],[13],templed_mind_,0,13,7,False,Drugs,1538487406.0,9kqo22
5402,Trying Acid,"['1bvr2lmr', 'noonecortex']","[5, 2]",HarveyG23,0,10,4,False,Drugs,1538490957.0,9kr5cj
5403,Basically First Time with Alprazolam,[],[],Solidifieddd,0,2,2,False,Drugs,1538504204.0,9kt47w
5404,Strange MDMA consequences,['DeductiveBest'],[3],Balliard,0,4,3,False,Drugs,1538496070.0,9krvsj
5405,I want to share my first time experience doing Ket. (Bad trip),['i_love_ket'],[5],IOllieLewisI,0,11,3,False,Drugs,1538490363.0,9kr2d0
5406,Boof Train,"['Bottleslip', 'th3m4g3']","[18, 6]",SojournerBoof,0,11,27,False,Drugs,1538452155.0,9knfg9
5407,Dimenhydrinate and LSD,[],[],ChodeChoppy,0,2,1,False,Drugs,1538517275.0,9kv1yn
5408,What would I be feeling if I had glutamate excitoxicity?,['sjemka'],[3],Fighterman27,0,7,3,False,Drugs,1538495254.0,9krrml
5409,Tips,['beenyolk'],[3],Yeeeeeah_Boyee,0,3,3,False,Drugs,1538495171.0,9krr7n
5410,Wost Comedown Of My Life,"['Molokai420', 'ChefRobH', 'KingKhezu', 'SpongebobForever']","[5, 3, 3, 3]",topbanana6969,0,29,3,False,Drugs,1538495089.0,9krqsn
5411,Long term effects of vyvanse or ritalin for ADHD?,['quantumbill'],[3],tomc31,0,8,1,False,Drugs,1538516507.0,9kuy2x
5412,Acid piss,"['killnik420', 'Nezborn02', 'BIGPoppa020', 'intodanihilizm', 'wizardswrath00']","[5, 3, 3, 3, 3]",BIGPoppa020,0,26,20,False,Drugs,1538459629.0,9ko5cl
5413,"Have you ever done drugs with your parents, fancy sharing the story?",['boicheeze'],[3],OctopusPoo,0,6,1,False,Drugs,1538515893.0,9kuuzx
5414,The government is stupid.,['JailsucksLEtoo'],[22],jeffbobingson,0,6,17,False,Drugs,1538460252.0,9ko798
5415,Alcohol withdrawals stopped after 24hours?,"['quantumbill', 'bagofm3th']","[2, 2]",aquakali,0,4,1,False,Drugs,1538515334.0,9kus5s
5416,"Acid, MDMA, Cannabis and Nitrous! All at the same time?",[],[],notsoeasy11,0,1,4,False,Drugs,1538488191.0,9kqrrz
5417,I had a bad trip on dxm 😫😫😫,"['O_God_The_Aftermath', 'hoonigan_4wd']","[5, 3]",kessahw,0,16,5,False,Drugs,1538487909.0,9kqqcf
5418,All the drugs I’ve done and their effects on me wanting to kill myself,"['ICantDoseProperly', 'Airborne82D', 'wizardswrath00']","[19, 8, 5]",dontgetupsetman,0,14,41,False,Drugs,1538440521.0,9km0wl
5419,What are your reflections on your drug usage/experemineation - would you make the same decision again if given the chance?,[],[],Edslittlerusher,0,4,1,False,Drugs,1538513504.0,9kuic1
5420,Drugs Made Me Into a Scientist,['FanaticPhenAddict'],[44],Symm3try13,0,37,164,False,Drugs,1538413831.0,9ki8bz
5421,Weed prices in Kos (Greece),[],[],Tom246611,0,7,1,False,Drugs,1538513193.0,9kugoi
5422,Candyflip first time,['asiansune'],[5],XzeZT,0,5,3,False,Drugs,1538490480.0,9kr2xb
5423,Anyone began using again after years of sobriety willing to talk?,"['rafsimons213', 'Airborne82D']","[11, 6]",Questionsaplenty1,0,15,12,False,Drugs,1538463384.0,9kogl6
5424,First time smoking crack cocaine advice needed,['psychedfish'],[77],Spankbang91,0,14,7,False,Drugs,1538472873.0,9kp6ry
5425,Convince parents to let me smoke,"['Shroomz603', 'Ismokeshatter92']","[32, 12]",lamest_private,0,23,13,False,Drugs,1538461496.0,9kob3u
5426,Just busted a nut on a whippet,"['Heil--Hydra', 'willm1123']","[195, 191]",Xsyther,0,75,479,False,Drugs,1538387659.0,9kez7q
5427,ODing on speed ?,['SpecificValue'],[7],qu_me,0,5,3,False,Drugs,1538486640.0,9kqkhp
5428,First Times with Weed,['yesnessage'],[3],SushiSalamander,0,4,3,False,Drugs,1538486285.0,9kqiw8
5429,Anyone else love working out when they’re drunk as fuck?,['wizardswrath00'],[6],ohappalled,0,11,7,False,Drugs,1538466589.0,9kopnb
5430,Trapped in basement by German Shepard,['psychedfish'],[3],murt311,0,12,5,False,Drugs,1538475338.0,9kpe58
5431,Pill report: Have I taken PMA?,[],[],okcomput3r,0,3,7,False,Drugs,1538468869.0,9kovmv
5432,Can you guys review my plan - any issues?,['LysergicSNDR'],[6],MrNogi,0,4,1,False,Drugs,1538503727.0,9kt1jm
5433,Crack saved my friend from an overdose?,['vitaminB50000'],[48],metham-sket-amine,0,14,38,False,Drugs,1538430822.0,9kkrka
5434,Need advice,"['murt311', '_ShadowBee_']","[4, 3]",bennis-da-menace,0,7,3,False,Drugs,1538474963.0,9kpd05
5435,Renting a house,[],[],Stonerhendrix4200,0,17,1,False,Drugs,1538502003.0,9kss65
5436,Anybody else adore Cocaine but don't bother with it cause of the price ?,"['downlow1234', 'ingoodspirit']","[21, 18]",COB98,0,30,31,False,Drugs,1538433091.0,9kl2ol
5437,This cats bumping at lunch,[],[],CaliRider748,0,2,1,False,Drugs,1538500102.0,9kshng
5438,Don't play mushroom roulette!,"['Perforationss', 'Airborne82D']","[28, 7]",DirtyHandsMcgee,0,21,6,False,Drugs,1538463864.0,9koi08
5439,Anyone else have such a weak stomach they can't partake in many drugs?,[],[],ElCocaLoco,0,6,6,False,Drugs,1538471269.0,9kp247
5440,What was your most horrific DMT experience?,"['danthedealer', 'JailsucksLEtoo', 'EpiiCideas']","[3, 1, 1]",Lsdbanana,0,6,7,False,Drugs,1538462367.0,9kodld
5441,I love proving people wrong about drugs,"['cr1ptych', 'Captainbuttram']","[15, 9]",-AtomHeartMother-,0,22,15,False,Drugs,1538441853.0,9km6ua
5442,Doing drugs in dreams,"['FatAssMeme', 'deepcool77', 'toelicka']","[60, 28, 19]",skimask7,0,55,75,False,Drugs,1538412200.0,9khzfg
5443,Finding a drug stash,"['Chazza354', 'whip-appeal']","[25, 10]",BigTadz,0,13,18,False,Drugs,1538439544.0,9klwfm
5444,"Very legal, but underrated drug combo.",[],[],AppoX7,0,3,3,False,Drugs,1538478901.0,9kpphl
5445,What's the most profound visual that you have ever seen on a psychedelic?,"['Buklao123', 'O_God_The_Aftermath', 'FromundaBrees']","[29, 10, 8]",Gorillapoopass,0,31,22,False,Drugs,1538432570.0,9kl0aj
5446,"If i was to only try one more drug, what would you recommend?","['EatDaCrayon', 'mykneegrows_', 'scheevsche']","[8, 5, 4]",tasweigan89,0,15,2,False,Drugs,1538478049.0,9kpmil
5447,Anyone else LOVE Caffeine pills?,['pikachuyoloswag'],[17],AndreWigggins,0,11,23,False,Drugs,1538430250.0,9kkoq0
5448,LDS Missionaries Try LSD for the First Time. Sorry if already been posted. thought it belonged here.,['lildopeboy589'],[7],Nadiagrace1,0,4,0,False,Drugs,1538512646.0,9kudrd
5449,"Guys, I may do shrooms tomorrow impulsively and need your advice",['tcald251'],[9],greendray1,0,7,5,False,Drugs,1538459459.0,9ko4v1
5450,"If you have a reliable hookup, be thankful","['throwawayforlewdstuf', 'gintonicisntwater', 'katerkline']","[73, 35, 16]",cokedoutratjazz,0,54,106,False,Drugs,1538400083.0,9kg9kq
5451,"What is your biggest ""I learned it the hard way"" advice about drugs","['Wavycapmurphy', 'mykneegrows_']","[61, 36]",Kaddy03,0,128,34,False,Drugs,1538423097.0,9kjn24
5452,Only little differences between cocaine and methyl/ethylphenidate,"['isxtxpe', 'ElCocaLoco']","[6, 4]",mdmeray,0,6,3,False,Drugs,1538468555.0,9kousn
5453,Is it safe to take psychedelics if you're on medication ?,"['PsychedAmbien', 'petespeyote', 'thepsychedelicsound']","[8, 6, 5]",ezugg,0,6,3,False,Drugs,1538468447.0,9kouia
5454,whats your mdma dose?,['spacecadet-au'],[2],Zyklopi,0,26,2,False,Drugs,1538489100.0,9kqw1y
5455,Favorite Thing To Do on Opiates?,"['trucknjoe', 'wizardswrath00', 'execob']","[7, 3, 3]",tyawesomejohnson,0,16,4,False,Drugs,1538461904.0,9koc9s
5456,Anyone else doing sober October?,['FitChickFourTwennie'],[10],_37_Pieces_of_Flair_,0,30,2,False,Drugs,1538488720.0,9kqu6i
5457,What's good for getting rid of inhibitions and anxiety?,"['fayoK', 'evan2686']","[3, 2]",kibberty,0,13,2,False,Drugs,1538488351.0,9kqsii
5458,Worst. Yayo. Ever.,['heroin_papi_'],[4],OG_Martian,0,25,2,False,Drugs,1538474712.0,9kpc5z
5459,800ug of MDMA over an extended amount of time?,"['gintonicisntwater', 'Finley403', 'spacecadet-au']","[8, 7, 3]",Zyklopi,0,25,2,False,Drugs,1538488049.0,9kqr1w
5460,Trazedone 300mg withdrawal.,['TheRoomsRbugged'],[3],mellowmushroom94,0,9,3,False,Drugs,1538465811.0,9konn2
5461,What are some specific things to do on specific drugs that feels particularly amazing? (Bonus if it’s a lesser known activity),"['EatDaCrayon', 'Ouija-Luigi', 'WildDerpAppears']","[14, 9, 5]",acidbasehead,0,20,6,False,Drugs,1538448709.0,9kn1i0
5462,Whats up with cocaine?,"['killnik420', 'SanPedroLover_', 'RoughJaw']","[14, 8, 6]",Madam_Pigeon,0,22,7,False,Drugs,1538448271.0,9kmzmy
5463,Drugs in prison,['crayonp'],[3],bucksinsix_,0,4,7,False,Drugs,1538444911.0,9kmknn
5464,Weed+Xanax+Ketamine,[],[],youngthugfan64,0,1,11,False,Drugs,1538438510.0,9klrmy
5465,Weed slaping after quiting for 7 months,['wizardswrath00'],[3],undercoveraver,0,3,5,False,Drugs,1538458134.0,9ko0rx
5466,Occasional Adderall use?,['nathansosick'],[4],mdmaziing,0,10,5,False,Drugs,1538453289.0,9knjt2
5467,"Bad DXM+weed interaction, increased anxiety, weird heart symptoms?",['O_God_The_Aftermath'],[1],AvailableHovercraft,0,4,1,False,Drugs,1538484536.0,9kqayt
5468,Just wondering about Xanax,[],[],danthedealer,0,3,3,False,Drugs,1538462393.0,9kodoi
5469,Walgreens prescription question,"['analshaman69', 'O_God_The_Aftermath']","[1, 1]",nitsuan,0,4,0,False,Drugs,1538483182.0,9kq5bs
5470,"Planning on taking some triple c’s, any advice?","['greenkween320', 'dankscammer', 'shetrips-shesmokes']","[9, 4, 3]",iawesome217,0,8,0,False,Drugs,1538504618.0,9kt6ev
5471,Xans(GG249) making me sad all of a sudden?,['Chipklaatu'],[18],Anonymous19981998,0,4,2,False,Drugs,1538482823.0,9kq3uu
5472,How long do Concerta side effects last?,,,maurid,0,0,4,False,Drugs,1538454796.0,9knpc0
5473,Drug Pick-up Lines?,"['p0a1u3l9', 'Litalian']","[131, 44]",trumpsabastard,0,24,20,False,Drugs,1538422448.0,9kjjhg
5474,I need drugs?,[],[],BiggerBadgers,0,2,4,False,Drugs,1538453104.0,9knj3e
5475,A thought about blood donations,['TheInfinityDuck'],[5],TheInfinityDuck,0,5,1,False,Drugs,1538480157.0,9kptvv
5476,150ug or 200ug for 2nd time tripping?,[],[],Dashed12,0,1,1,False,Drugs,1538480107.0,9kptp0
5477,Kapanol (Morphine Sulfate),[],[],captainaustismo,0,10,1,False,Drugs,1538479680.0,9kps8g
5478,Addy,['Spoderr'],[20],smokmajana,0,20,5,False,Drugs,1538447524.0,9kmw67
5479,Any Movie Suggestions for When Taking MDMA,"['Purpleanonymous', 'blindreality']","[16, 8]",worsthumanalive,0,14,3,False,Drugs,1538457101.0,9knxf8
5480,What's the most euphoric psychedelic?,"['Captainbuttram', 'VD531', 'bagofm3th', 'GattFortOppidetsiste']","[7, 4, 4, 4]",outlinked17,0,26,6,False,Drugs,1538443483.0,9kme8u
5481,Codeine and doxylamine,['wizardswrath00'],[1],Suwoo187,0,2,2,False,Drugs,1538464633.0,9kokc1
5482,Should I get prescribed Ritalin,['jagains167'],[2],danthedealer,0,9,1,False,Drugs,1538477858.0,9kplwk
5483,"Politico: ""Why the FBI Should Investigate 'Boofing'""",['Stickey794'],[11],SomaAlchemist,0,4,5,False,Drugs,1538442726.0,9kmaud
5484,Lyrica and klonopin,[],[],PineForest555,0,2,2,False,Drugs,1538464117.0,9kois3
5485,Hey guys I have serious question.,['blindreality'],[2],Sipping_codeine,0,15,3,False,Drugs,1538456185.0,9knu8a
5486,What’s your scariest drug trip?,"['SkeezySkeeter', 'blindreality', 'Squezme', 'GattFortOppidetsiste']","[7, 7, 7, 5]",Lilspoona,0,35,6,False,Drugs,1538442538.0,9km9zu
5487,Friday evening trip,[],[],TheAsinineBassist,0,2,6,False,Drugs,1538442332.0,9km938
5488,"Did DXM a couple years back, just curious...",['robomoboto'],[3],PrimmSlimShady,0,2,4,False,Drugs,1538455291.0,9knr4c
5489,Music on Morphine,['ScheduleIV'],[6],treesand1,0,3,5,False,Drugs,1538448856.0,9kn244
5490,Theory: Dissociatives are the building blocks of Psychedelics which are the building blocks of meditation,,,DisMyDrugAccount,0,0,7,False,Drugs,1538437528.0,9kln8k
5491,Cocaine Instant lightheadedness/dizziness/nausea,[],[],Finequasar3,0,2,3,False,Drugs,1538453845.0,9knm0t
5492,7 days of psychedelics.,"['sqqlut', 'eternal_n0mad', 'Kaddy03']","[4, 3, 2]",GewdMewd,0,10,1,False,Drugs,1538475227.0,9kpdsi
5493,Shroom thoughts,['skate-rat18'],[2],floppyflop123,0,2,11,False,Drugs,1538429973.0,9kkn9a
5494,Smoking Chamomile/Tobacco,['hrefchef'],[6],secret_god,0,7,7,False,Drugs,1538436620.0,9klj2v
5495,Xanax ER vs. Klonopin?,[],[],Questionable_Incel,0,1,4,False,Drugs,1538447337.0,9kmvb1
5496,A suggestion for making/maintaining relationships while getting high with people,"['bori_2791', 'newlightpsych']","[17, 17]",BagelStorm,0,6,63,False,Drugs,1538393286.0,9kfhys
5497,I fucked up by starting an amphetamine binge.. got college and work tomorrow,"['Bbthebest', 'Duggie1330']","[2, 2]",PharmacologyIsCool,0,17,5,False,Drugs,1538447020.0,9kmtvi
5498,Has Anyone Else Experienced This On Weed?,"['oliver413', 'TenaciousC99', 'maamayhem118', 'xanaholic']","[16, 9, 5, 5]",ikea-shark-wen,0,22,9,False,Drugs,1538428849.0,9kkhlh
5499,Have drugs gotten cheaper or did I just stop getting custied as I've gotten older?,"['killnik420', 'tokeymonmon']","[4, 3]",JoshTheWebDev,0,12,4,False,Drugs,1538446633.0,9kms4y
5500,I love/hate molly,['yayoiscrazy'],[8],eetsahmee,0,19,3,False,Drugs,1538452251.0,9knfsx
5501,"Really sick of SSRIs, I feel they've barely helped. I want a new drug","['dr909o', 'sunface7', 'drewsus64', 'hegels_hair', 'savagebongmaster']","[5, 1, 1, 1, 1]",swaggyt123xyz,0,13,5,False,Drugs,1538441084.0,9km3dq
5502,Phenibut Overdose and Horrible Experience,[],[],scintillatingrabbit,0,3,1,False,Drugs,1538472328.0,9kp57f
5503,Suck in a terrible place (please help),['Ayehase'],[2],namazuthedrugdude,0,11,1,False,Drugs,1538472058.0,9kp4f7
5504,"I really need help, please.",['irollwithmoo'],[3],babyycakes69,0,10,8,False,Drugs,1538433761.0,9kl5tw
5505,What’s your Ketamine experience?,"['blueboy710', 'Xsyther']","[4, 2]",inaudible_music,0,9,3,False,Drugs,1538449973.0,9kn6s1
5506,How can I tell if my LSD sugar cubes are legit?,"['rg3Po2', 'fudpuck3r']","[3, 2]",hanktank27,0,20,3,False,Drugs,1538449951.0,9kn6oc
