,title,comments_author_lst,comments_score_lst,author,guilded,num_comments,score,pinned,subreddit,created_utc,r_id
3527,I think I was drugged,"['anonidiotaccount', 'gintonicisntwater']","[2, 2]",DifferentYam,0,17,1,False,Drugs,1538567569.0,9l0fug
3528,Do drugs lead to anxiety?,['SickRanchez_cybin710'],[9],EpiiCideas,0,8,0,False,Drugs,1538567425.0,9l0fad
3529,LSD has freed my thoughts.,['MountainDewFountain'],[3],Cuckheld69420,0,3,12,False,Drugs,1538518680.0,9kv8ru
3530,My confessions as a drug dealer.,"['ly5ergic', 'venault420']","[15, 13]",BluntedAsshole,0,42,7,False,Drugs,1538532032.0,9kwxlr
3531,Religious Use VS Pregnancy,['Tetra-Pharmakos'],[14],KitchenWitchCat,0,5,0,False,Drugs,1538566828.0,9l0cym
3532,In Praise of Kava: the history and importance of kava in the Pacific Islands (and beyond),,,beast-freak,0,0,1,False,Drugs,1538566582.0,9l0c14
3533,"Hey drugs fam, long time no talk","['MightySwag22', 'weedtripper', 'magicmark43']","[22, 7, 7]",shetrips-shesmokes,0,16,71,False,Drugs,1538482512.0,9kq2mm
3534,"Scott Hamilton looks at the history and importance of kava in the Pacific Islands, and why it could be the drug of New Zealand’s future.",,,beast-freak,0,0,1,False,Drugs,1538565979.0,9l09pv
3535,speed overdose like never before?,[],[],crashingmountains,0,4,1,False,Drugs,1538565307.0,9l076p
3536,My friend overdosed on Fentanyl,[],[],AlarmingClock,0,9,1,False,Drugs,1538564816.0,9l05ab
3537,Prank,"['nathansosick', 'pangy12']","[5, 5]",hamstic,0,7,6,False,Drugs,1538529443.0,9kwm0z
3538,LAX airport to allow marijuana in carry-ons,"['trp1784', 'Whatthedarknessdoes']","[497, 295]",o--_-_--o,0,178,1619,False,Drugs,1538420206.0,9kj78w
3539,Took 450ug of acid and sucked my own dick,"['Im_Big_In_Japants', 'BoofingForSoup', 'nathanroot28']","[418, 226, 205]",FlexibleStanley,0,169,702,False,Drugs,1538435853.0,9klfho
3540,What does anxiety mean to you?,['AdamKaragoshi'],[2],anonidiotaccount,0,8,3,False,Drugs,1538542317.0,9ky4h7
3541,What were to actually happen if I were to chew this 2nd to last 20mg Adderall IR tablet of mine?,"['anonidiotaccount', 'wizardswrath00']","[3, 3]",candycane_86,0,9,2,False,Drugs,1538549253.0,9kyse2
3542,I just don’t feel the same anymore,"['Airborne82D', 'traderjos']","[3, 3]",BehindY0U,0,23,3,False,Drugs,1538541329.0,9ky0ua
3543,Need Candyflip Advice,"['Deadmanshand-96', 'Sterrxgamr']","[3, 2]",idkudk11,0,7,3,False,Drugs,1538541267.0,9ky0lz
3544,First time LSD dose,[],[],Liara_94,0,9,1,False,Drugs,1538562663.0,9kzxjt
3545,What if,"['Jlaydc', 'Lonely-God', 'allyourcrappaccinos']","[39, 31, 16]",heytherelolxo,0,44,81,False,Drugs,1538476487.0,9kphlk
3546,"Meth Question, I'm so goddamn tired","['MissLadyPerson', 'anonidiotaccount']","[5, 3]",grey59babe,0,32,5,False,Drugs,1538530760.0,9kwry9
3547,"May not be the best sub to ask, but how has become sober changed your life?","['CreedBrattonHas9Toes', 'spinoram']","[11, 5]",ghostiekat,0,5,8,False,Drugs,1538518253.0,9kv6qj
3548,DMT×ptsd/depression,,,CaliRider748,0,0,7,False,Drugs,1538523119.0,9kvtsh
3549,The luckiest night of my life.,"['ComfortableSolid', 'lilbowpeep369', 'Wolfknife_666']","[116, 16, 15]",ForStoriesOnly,0,24,297,False,Drugs,1538449612.0,9kn59w
3550,Rc like cocaine,"['InfiniteBuddy', 'lucidreamstate']","[12, 5]",hellojsbanan,0,24,7,False,Drugs,1538519982.0,9kvexs
3551,My Kanye Theory,['danthedealer'],[9],WaffleWhiskey,0,10,3,False,Drugs,1538538869.0,9kxr6e
3552,People who abuse LSD?,"['eternal_n0mad', '_Ryman_', 'imymind']","[79, 41, 26]",Sciesmo,0,49,57,False,Drugs,1538481444.0,9kpyfe
3553,Is there anywhere I can read about the effects of taking PEA one a day everyday?,[],[],Sedai09,0,5,2,False,Drugs,1538545995.0,9kyhlh
3554,Having my first psychedelic experience with Hawaiian baby woodrose seeds soon (Advice),[],[],ssbmRezah,0,4,2,False,Drugs,1538545969.0,9kyhih
3555,Man I love sick days,"['yo_feet', 'AstroBearGaming']","[130, 29]",Remember_the_BBQ,0,110,93,False,Drugs,1538470684.0,9kp0gv
3556,Ego death question,"['wizardswrath00', 'ZenArtist99']","[2, 2]",Mason_v17,0,10,2,False,Drugs,1538544907.0,9kyduf
3557,Benzos and alcohol.,['anonidiotaccount'],[9],i_am_cyano,0,10,1,False,Drugs,1538558415.0,9kzk58
3558,Lsd after concussion advice needed,"['Penumbrium', 'GratefulFloydrix']","[6, 5]",clartonP,0,7,7,False,Drugs,1538519915.0,9kvem8
3559,How fast does it take to get addicted to stims?,['Tetra-Pharmakos'],[6],Clee1k,0,9,5,False,Drugs,1538530700.0,9kwrp8
3560,Any wrestling fans on this sub? What have you taken before a live show?,['gintonicisntwater'],[5],mrfivedollertips,0,5,0,False,Drugs,1538557213.0,9kzgc5
3561,"Home rehab , day 2 . Show me some love ❤️",['anonidiotaccount'],[3],Just505,0,9,2,False,Drugs,1538543663.0,9ky9fz
3562,Oxycodone advice sorry,[],[],captinfalafel,0,4,3,False,Drugs,1538534791.0,9kxa3b
3563,Weirdest experience being offered drugs by strangers?,"['fuck_off_ireland', 'Dethkloktopus', 'reppknkram']","[19, 17, 12]",M16A3,0,24,22,False,Drugs,1538495785.0,9krubb
3564,Question on Xanax,['downlow1234'],[10],localwarlord,0,7,3,False,Drugs,1538534369.0,9kx868
3565,Disturbed Neighbor,"['Ratzap', 'Grouse546']","[20, 19]",yung_mad,0,5,7,False,Drugs,1538517392.0,9kv2i0
3566,Does Xanax turn into powder if left out?,"['ripxanman', 'rhynoacid', 'NuckaCorgi', 'droolmessiah', 'Killed0']","[14, 10, 4, 3, 3]",Lkzn,0,11,4,False,Drugs,1538527060.0,9kwbnz
3567,Drug price comparison,"['mollyflowers', 'slightlyburntsnags', 'kimnukesyou', 'Bignum4']","[37, 23, 20, 15]",BRpsychonaut23,0,120,42,False,Drugs,1538479245.0,9kpqnd
3568,Which Myers Briggs personality are you depending on the drug you're on?,['anonidiotaccount'],[3],Throwaway619760858,0,3,1,False,Drugs,1538552558.0,9kz2vv
3569,Should I let my step dad lick me for some Xanax?,"['tomzak14', 'xanxandranq', 'peter_xan']","[59, 50, 27]",cinnamoncum,0,28,12,False,Drugs,1538499506.0,9kseam
3570,Family,[],[],CosmicCatDaddy,0,3,5,False,Drugs,1538518992.0,9kvab6
3571,Hope I make it through death.,"['birdbro685', 'SickRanchez_cybin710']","[135, 53]",Veils93,0,67,192,False,Drugs,1538447166.0,9kmuio
3572,Question Regarding Damage From Psychedelics,[],[],killer2themx,0,20,1,False,Drugs,1538549806.0,9kyu61
3573,Fun things to do on lsd,"['dk42O', 'aitak82', 'DMVbandz']","[8, 3, 3]",0Adiemus0,0,8,4,False,Drugs,1538521684.0,9kvmzm
3574,Psychiatrist making me feel uncomfortable?,['rubym00n'],[4],patientlydenied,0,5,5,False,Drugs,1538513576.0,9kuips
3575,Do ADHD meds just affect me different or do I just need a higher dose?,['Airborne82D'],[4],uhgglw,0,9,2,False,Drugs,1538535041.0,9kxb4s
3576,first time tripping,[],[],BlueFootPanda,0,6,4,False,Drugs,1538521439.0,9kvltp
3577,What should I take for my first psychedelic experience?,['ray198898765'],[5],onarolllikecottonell,0,5,4,False,Drugs,1538521186.0,9kvklj
3578,I have some tramadol and codeine. I was wondering how much of this will get me high?,['ingoodspirit'],[3],Films88888888,0,6,3,False,Drugs,1538525981.0,9kw6xn
3579,I never meet anyone that wants to help me access drugs.,"['StaySick666-', 'EatDaCrayon']","[18, 9]",mintspie,0,18,3,False,Drugs,1538520281.0,9kvgcq
3580,"""Breaking 4th Dimension"" on 300ug acid and getting caught by cops",['asiansune'],[11],Baby_MakingMusic,0,10,18,False,Drugs,1538490672.0,9kr3vx
3581,To those of you who experienced Ego Death,"['rhynoacid', 'yamanamawa', 'mikewirkijowski', 'anonidiotaccount']","[6, 2, 2, 2]",i-haveno-name,0,18,1,False,Drugs,1538546413.0,9kyiyg
3582,Going to the movies with a girl that is on xtc... Help needed,"['FreeManBeat', 'Tylerb0713', 'techhorrors']","[33, 27, 26]",Kaddy03,0,29,17,False,Drugs,1538490191.0,9kr1h5
3583,What is the best way to ingest Calea zacatechichi?,"['pangy12', 'mycmush33']","[3, 3]",Ajk973,0,3,2,False,Drugs,1538531284.0,9kwuct
3584,L-theanine after rolling?,[],[],PegaSwoop,0,2,1,False,Drugs,1538543456.0,9ky8od
3585,Question: Percs after Kratom,,,futurefiction2,0,0,5,False,Drugs,1538516313.0,9kux2o
3586,I never take xanax again,['ErLeo'],[11],perfectmolly,0,8,9,False,Drugs,1538498366.0,9ks8bc
3587,high school drugs ;(,"['persistence11', 'skinney_nips']","[7, 6]",oswoodruhs,0,6,0,False,Drugs,1538543104.0,9ky7cb
3588,First time IM Ketamine questions,['gintonicisntwater'],[9],newlightpsych,0,5,5,False,Drugs,1538511580.0,9ku86j
3589,Is GHB worth it? If not whats worth a go ?,"['DaddysAsianToy', 'youngforever1998', 'youngforever1998']","[9, 7, 6]",Jk1292,0,25,5,False,Drugs,1538511208.0,9ku66r
3590,"Addicted to Caffeine, can anyone help me?",['memeshroud'],[6],mcafc,0,8,5,False,Drugs,1538514736.0,9kuoyg
3591,How is acid supposed to effect you?,"['mikewirkijowski', 'Ismokeshatter92', 'Montog7711']","[10, 5, 4]",FamousCx,0,29,9,False,Drugs,1538500878.0,9kslzo
3592,Positive long term effects of responsible cocaine usage?,['gangsterdam020'],[7],daddanm,0,6,4,False,Drugs,1538514348.0,9kumu7
3593,"After a bad trip, I have trapped my mind into a living hell of paranoia and hopelessness","['MarkSpenecer', 'Kaddy03']","[44, 15]",321231j,0,40,31,False,Drugs,1538472745.0,9kp6eu
3594,Probation questions,[],[],RoosterInMahRari,0,9,1,False,Drugs,1538540973.0,9kxzg4
3595,Me and my SO took DXM and she's still feeling weird after four days.,,,jojoDUB,0,0,2,False,Drugs,1538527006.0,9kwbex
3596,Unexperienced drug use,['tweaker_withfeelings'],[3],suicidalcrybaby,0,8,3,False,Drugs,1538518157.0,9kv6al
3597,I boofed the marijuanas,"['schlonghornbbq8', 'sebseb420', 'oswoodruhs', 'lilmeepkin']","[54, 27, 21, 17]",Hautla,0,37,143,False,Drugs,1538442493.0,9km9s9
3598,Let me tell you a story about the war on drugs,['mikewirkijowski'],[3],AnatomyOfTrees,0,6,9,False,Drugs,1538496170.0,9krwdj
3599,Questions before first xanax experience,"['Airborne82D', 'kellik123', 'lizardnamedoxy', 'InfiniteBuddy', 'blood_clot_drip']","[2, 1, 1, 1, 1]",Not_A_Creative_Color,0,14,1,False,Drugs,1538539023.0,9kxrrb
3600,"Official Weekly Free-For-All Thread (Week 38 -- September 24, 2018)","['Danny365', 'nicolasZA', 'kdtallllll']","[8, 7, 7]",AutoModerator,0,104,39,False,Drugs,1537795065.0,9ihu2t
3601,Anyone know of any sites like Psychonautwiki in Spanish?,['ald97sp'],[3],illpourthisonurhead,0,5,14,False,Drugs,1538452817.0,9knhyf
3602,8 ball in a store,"['BCD195', 'Loganjohn11', 'cat_fondu']","[288, 171, 80]",hamstic,0,72,426,False,Drugs,1538579510.0,9l214o
3603,The guy I did acid with for the first time as a teenager od'd on Sunday.,"['elecfever', 'IceColdSeltzer', 'yaboynatan']","[337, 204, 176]",nicolix9,0,187,1016,False,Drugs,1538558217.0,9kzjj1
3604,"Please tell me you're joking Ohio. ""Participants reported that the most common route of administration for kratom is intravenous injection (aka “shooting”).""","['justhrowinawaymylife', 'ARobotJew', 'mikewirkijowski']","[68, 59, 29]",flamingjoints,0,30,130,False,Drugs,1538590867.0,9l3sll
3605,If this sub has taught me anything. It’s that it takes a lot more drugs to kill yourself than I was lead to believe.,"['bothunter', 'mrfuzzyasshole', 'Djvacuumseal']","[123, 49, 34]",ThisEffingGuyC,0,52,114,False,Drugs,1538581925.0,9l2e0u
3606,Be incredibly care with who you trip with (LSD catastrophe report),"['Trump_is_the_Cuckold', 'sqqlut', 'ThisIsMyFifthAcc']","[83, 29, 27]",psychosets,0,53,127,False,Drugs,1538579338.0,9l2082
3607,"Watching planet earth II while tripping is the best, emotional and mind bending experience ever.","['leeham93', 'leagueredditor', 'UntitledDude']","[72, 30, 19]",lucykid,0,58,273,False,Drugs,1538559371.0,9kzmzw
3608,LSD Permanent Changes,"['hotdanish91', 'MedicineMan202']","[103, 53]",Tidus9631,0,81,52,False,Drugs,1538578005.0,9l1tcf
3609,Being sober,"['thatguyakira123', 'killer2themx']","[6, 3]",metallicusovwinter,0,9,53,False,Drugs,1538576272.0,9l1kan
3610,I think the reason I love MDMA is it allows me to touch other people. I'm so touch-deprived in my regular life.,"['Zanmatox123', 'Bensonion']","[14, 9]",Firsttimerolling,0,18,37,False,Drugs,1538581590.0,9l2cay
3611,"I'm pretty stoked that my ""slight HPPD"" went away.",['sirredsalot'],[9],lsdthrowaway1234567,0,20,16,False,Drugs,1538586821.0,9l35b3
3612,How to develop self-control?,['Oakester'],[15],pelpeh,0,11,13,False,Drugs,1538586372.0,9l31r5
3613,I haven't slept in 4 days thanks to Mydayis,[],[],dogwhisperer3242,0,4,10,False,Drugs,1538591131.0,9l3uee
3614,y'all niggas slipping on semen in the bathroom and I'm walking on clean tile.,['cosyrelaxedsetting'],[2],somethingsmatter,0,3,5,False,Drugs,1538600198.0,9l59td
3615,A fun story about smokin in Disney,"['uncomfortablerhino', 'hahakon11', 'dlxnj']","[40, 19, 14]",Salty_Shiba_,0,20,48,False,Drugs,1538559698.0,9kznze
3616,I appreciate arts,[],[],HamTam,0,4,8,False,Drugs,1538593817.0,9l4ae2
3617,Almost got checked by cops,"['beanster', 'fancypants_']","[101, 35]",vsdoom,0,28,89,False,Drugs,1538546216.0,9kyibm
3618,Feeling high for almost a week now. Will it go away?,"['coldanddarkinside', 'moneykillinq']","[8, 6]",fedra_,0,25,7,False,Drugs,1538592741.0,9l445c
3619,Cool Idea for a super power,['stepaside22'],[8],Serielhexilon,0,2,12,False,Drugs,1538581484.0,9l2bqe
3620,Has anyone noticed a decrease in cognitive functioning ever since using cannabis long term?,"['robomoboto', 'evidencebasedDC']","[3, 3]",qwerty0521,0,7,5,False,Drugs,1538600106.0,9l59cp
3621,Scientists give MDMA to octopuses,,,JustSayNo_,0,0,4,False,Drugs,1538603526.0,9l5r1w
3622,Anybody have any experience with combining shrooms and LSD?,"['Djvacuumseal', 'PotatoKing0613', 'applestruddel']","[3, 3, 3]",surreal_squirrel,0,4,5,False,Drugs,1538599132.0,9l548a
3623,Why is Ketamine so unpopular still?,"['Oz_a_day', 'Fleeto95']","[31, 9]",shortdickedman,0,11,6,False,Drugs,1538589551.0,9l3ks9
3624,Fuck the people who always want you to share but never offer once,"['TheRickestMorty10', 'ProktosRS', 'psychedfish']","[613, 352, 222]",flyfreeNhigh,0,295,1623,False,Drugs,1538482948.0,9kq4ey
3625,Do alcoholics enjoy drinking alcohol?,"['billy_the_kid16', 'j0hnk50', 'kennedysleftnut']","[10, 3, 3]",Percle,0,8,3,False,Drugs,1538598815.0,9l52k3
3626,About to get set up (again),"['Intercontinentalmove', 'Djvacuumseal', 'ReddiStediGo']","[7, 5, 3]",NewBallista,0,17,8,False,Drugs,1538584630.0,9l2svh
3627,What drug should I take for getting into a book?,"['trippy_toaster', 'Ovrcast67']","[24, 12]",anaonmise,0,39,9,False,Drugs,1538581840.0,9l2dmi
3628,High doses of Suboxone eliminated my opioid addiction - I don't understand this,"['mistertheinternet', 'Djvacuumseal']","[4, 3]",subarashiman,0,3,5,False,Drugs,1538592845.0,9l44rb
3629,My DXM vision dream about Kim Kardashian's manhunt for me,[],[],Fork_On_The_Left_,0,1,6,False,Drugs,1538585692.0,9l2yev
3630,Phenylpiracetam + 2c-b?,,,digydongopongo,0,0,6,False,Drugs,1538588188.0,9l3d23
3631,Constant dreaming after K.,[],[],BullionGodspeed,0,1,3,False,Drugs,1538601577.0,9l5h5c
3632,Me and my two mates did ket and became the characters in big lez,[],[],howmanygramsinapound,0,1,4,False,Drugs,1538590706.0,9l3r91
3633,16 year old addict,"['Jlane887', 'DeadbeatPieceOfShit6']","[11, 8]",Quantas500,0,36,10,False,Drugs,1538576211.0,9l1k09
3634,"Honestly though, these are my brain cells when I give them a break and be sober for a day...",['InfiniteBuddy'],[17],sprakx,0,6,34,False,Drugs,1538549570.0,9kyter
3635,What's your favorite psych and why? And how are you doing? <3,"['SacredGeometry25', 'weedtripper', 'TitanicMan']","[11, 6, 4]",AyahuascaAdvocate,0,31,8,False,Drugs,1538577937.0,9l1syb
3636,Medical marijuana for minors,"['crews007', 'WilfordBrimleyOnAcid']","[8, 5]",robloxdruglord,0,10,4,False,Drugs,1538591464.0,9l3wi2
3637,Comedowns,['VapeMcdrippington'],[9],tasteofink85,0,6,7,False,Drugs,1538580009.0,9l23kq
3638,"LSD trip report, great experience",,,jannshi,0,0,2,False,Drugs,1538604277.0,9l5ute
3639,why salvia or kratom got never as common and popular as weed?,"['sjemka', 'AnxiousState', 'robomoboto']","[7, 5, 4]",neverbeanotherone,0,13,3,False,Drugs,1538596267.0,9l4oby
3640,How fucked will my friend be if she takes 8 bars?,"['Ismokeshatter92', 'Kadebladekehd', 'Woonasty']","[160, 159, 66]",LevelVS,0,103,58,False,Drugs,1538538561.0,9kxq0b
3641,I hate taking stimulants everyday but I need them.,"['Airborne82D', 'horacetheclown', 'Randy_lahey3']","[23, 15, 10]",teefbango,0,47,43,False,Drugs,1538541109.0,9kxzzm
3642,"Could Gotu Kola, L theanine, or passion flower make depression worse long term?",[],[],jellybeanzx,0,3,2,False,Drugs,1538601732.0,9l5hwa
3643,my best friend saved my l,"['shittingbiscuits', 'anonidiotaccount']","[15, 4]",stopdropandwop,0,8,19,False,Drugs,1538558459.0,9kzk91
3644,Do you think more drugs should be legal?,"['The_MuffinPrince', 'Stickey794']","[12, 5]",Rohit49plus2,0,23,9,False,Drugs,1538570689.0,9l0th7
3645,Peter Theil launches psychedelic research firm,,,Astronautswag,0,0,3,False,Drugs,1538588966.0,9l3hke
3646,Meth smell/taste,['JustThinkAboutThings'],[18],DirtyHandsMcgee,0,10,15,False,Drugs,1538558047.0,9kziz0
3647,Mushrooms for a concert?,"['sokodank', 'kummatus']","[5, 4]",corajade17,0,5,2,False,Drugs,1538595522.0,9l4k2b
3648,4th Ketamine infusion.,"['HyImHylo', 'Molokai420']","[24, 11]",Airborne82D,0,37,88,False,Drugs,1538520883.0,9kvj7t
3649,Power-outs and weed,['stepaside22'],[9],RapidTrash,0,10,22,False,Drugs,1538548277.0,9kyp92
3650,Been sober for 3 months tomorrow...,"['c4inem4ne', 'SubconciousExplorer']","[13, 3]",c4inem4ne,0,27,42,False,Drugs,1538536070.0,9kxfm8
3651,I'm a terrible procrastinator and now I need your drug advice,[],[],greendray1,0,1,2,False,Drugs,1538591707.0,9l3y0w
3652,I want to learn more about crack. Teach me.,['danthedealer'],[8],InterestedInCrack,0,6,9,False,Drugs,1538566903.0,9l0d7q
3653,Ketanserin to abort trips,,,------___-___------,0,0,1,False,Drugs,1538604164.0,9l5u92
3654,Currently withdrawing hard from heroine should I suck it up and try again to quit cold turkey or use and prepare and plan my withdrawal I’m not sure I’ll last much longer last use 24hrs,"['ambivalenceingray', '9x19gen4', 'The_Young_Lenin']","[24, 9, 6]",blitzofftheshbligity,0,19,7,False,Drugs,1538565856.0,9l09ab
3655,Serious LSD Discussion,[],[],Dirazi,0,1,1,False,Drugs,1538603563.0,9l5r9a
3656,Old school sedatives - chloral hydrate,[],[],necrodaemon666,0,1,1,False,Drugs,1538602742.0,9l5n12
3657,"Excerpt from my drug journal, on ALD-52",[],[],1-P-Leo-Sydd-Darrel-,0,2,3,False,Drugs,1538581262.0,9l2ak6
3658,Fucked a crazy chick high on meth,[],[],metham-sket-amine,0,7,1,False,Drugs,1538602333.0,9l5l24
3659,Weed and cold,[],[],cokcndjsla,0,4,1,False,Drugs,1538601811.0,9l5ial
3660,When my friend tried to jump rooftops on 2 tabs. Fractured a vertibrae,"['danthedealer', 'shrugs19', 'EternalTurmoil']","[11, 9, 5]",jh102499,0,14,31,False,Drugs,1538533942.0,9kx67s
3661,Help Ambien Sleepless help,[],[],farrow73,0,1,1,False,Drugs,1538600585.0,9l5buy
3662,Trying coke soon what should I know?,['shycadelic'],[8],flacko5er,0,4,2,False,Drugs,1538586751.0,9l34qu
3663,Morphine vs oxycodone,[],[],kerstun,0,3,1,False,Drugs,1538600246.0,9l5a1d
3664,Kratom,"['hotdanish91', 'braapbraap69']","[2, 2]",geooometrix,0,5,2,False,Drugs,1538586346.0,9l31jz
3665,Will I still be able to use ecstasy two weeks after today?,"['chavezz4', 'Veryoriqinal']","[5, 3]",sleepydisaster,0,5,1,False,Drugs,1538599316.0,9l557r
3666,Saw an interesting question on Twitter...,"['hamstic', 'benzoboy199', 'anonidiotaccount', 'TheRoomsRbugged', 'danthedealer']","[6, 6, 5, 5, 4]",samuelevans1999,0,16,6,False,Drugs,1538567853.0,9l0gz3
3667,Im on half an extasis pill at home,['Veryoriqinal'],[2],stefanocant,0,4,1,False,Drugs,1538599202.0,9l54lo
3668,Trippy music video. What song should I use?,"['kunstkamera', 'ProktosRS', 'Billith']","[3, 2, 2]",erinlewisfudge,0,7,3,False,Drugs,1538577438.0,9l1qe4
3669,Can you “taper” down on weed for your tolerance?,[],[],BigFig32,0,5,1,False,Drugs,1538598841.0,9l52op
3670,Trying medical s ketamin Need advice,[],[],jugobetrugo1,0,2,1,False,Drugs,1538598640.0,9l51kx
3671,"What all drugs are ""legal"" and easily obtainable?","['ShitNRun18', 'allovertheplaces', 'Wiseguy2013']","[17, 12, 6]",TitanicMan,0,37,3,False,Drugs,1538577128.0,9l1oq3
3672,My Friend Overdosed Last Week: (advice welcome),['self_medic'],[3],starfishfish,0,3,4,False,Drugs,1538571443.0,9l0wq7
3673,What’s a good substitute for alcohol?,"['Neanderthulean', 'DooDooFalcon']","[3, 3]",rantyturd,0,9,1,False,Drugs,1538598347.0,9l5007
3674,Big ket lines,"['robomoboto', 'Djvacuumseal']","[1, 1]",bigbadburgess120,0,6,1,False,Drugs,1538598278.0,9l4zmg
3675,Do any of you like the feeling of being the sketchiest person in a group?,['devilsdancing'],[324],livinonlocust,0,55,144,False,Drugs,1538501556.0,9kspt3
3676,Nexus flip with MDA,['enthusiast_of_lsd'],[8],space22ify,0,10,2,False,Drugs,1538584683.0,9l2t67
3677,Lsd or mdma first (in a candyflip) and why,"['manicpixi4200', 'WilfordBrimleyOnAcid']","[5, 2]",undercoveraver,0,8,1,False,Drugs,1538598186.0,9l4z4m
3678,GHB and Acid ?,,,youngforever1998,0,0,2,False,Drugs,1538584630.0,9l2sve
3679,Songs and tips for tripping the fuck out on acid?,"['BeKindAndSwallow', 'nerf-gun', 'liquid---courage', 'Djvacuumseal']","[3, 3, 2, 2]",ZrNdjenja,0,37,2,False,Drugs,1538584619.0,9l2ssx
3680,Doing LSD,[],[],TheHolyRedCow,0,3,1,False,Drugs,1538597998.0,9l4y5l
3681,How to sleep when taking Adderall.,['FreeManBeat'],[5],newbinha,0,7,1,False,Drugs,1538597921.0,9l4xr6
3682,Molly and Shrooms,['Spidda'],[2],Glenjamin443,0,8,1,False,Drugs,1538597853.0,9l4xeu
3683,Best RC's for each drug type?,,,HopeFiend22,0,1,1,False,Drugs,1538597548.0,9l4voc
3684,Benzo detox cold turkey complete hell on Earth,[],[],nyc420clouds,0,4,1,False,Drugs,1538597375.0,9l4uo5
3685,Went on a bender and now I'm super tired....4 days later,['Airborne82D'],[12],mjonat,0,25,17,False,Drugs,1538541712.0,9ky293
3686,I tried edibles for the very first time before my shift at work,"['gintonicisntwater', 'IssaLeroy']","[492, 165]",Nitr0_dubs,0,197,550,False,Drugs,1538472448.0,9kp5k0
3687,What do you guys think about LSD on the under developed brain?,"['wizardswrath00', 'jakobmuellerr']","[13, 9]",Very_Abel,0,53,9,False,Drugs,1538551747.0,9kz0ha
3688,How to do whip-it’s out of whipped cream can?,['mikewirkijowski'],[9],teflondon0589,0,7,2,False,Drugs,1538580316.0,9l25e3
3689,Snorting Adderall (ER)? First Time,"['PlatoIsDead', 'EpiiCideas']","[2, 2]",gunpartys,0,8,1,False,Drugs,1538593153.0,9l46je
3690,Tattoo + Weed= Heaven,"['seangriffin63', 'Kylerdub']","[13, 3]",brunoxx19,0,6,15,False,Drugs,1538538692.0,9kxqhz
3691,Impersonating Drug Test (hair test),[],[],zxclkmweq,0,1,1,False,Drugs,1538592835.0,9l44pg
3692,What does an opiate/opioid overdose like?,['throwawayod456'],[2],brianl1018,0,5,1,False,Drugs,1538592833.0,9l44p9
3693,xanax or lsd for denzel curry?,"['shycadelic', 'Oz_a_day', 'grey59babe']","[8, 5, 3]",forgottenp,0,16,1,False,Drugs,1538592681.0,9l43sw
3694,What happens if you take more addy after the come down?,[],[],FireMarshallFewtch,0,5,1,False,Drugs,1538592594.0,9l439f
3695,Swiss Crystal,['n3wbi3toBTC'],[3],WillLovesWeed,0,11,6,False,Drugs,1538557381.0,9kzgvn
3696,"First Time Meth, Lube, & Porn Trip Report","['j0hnk50', 'wizardswrath00']","[8, 3]",jermaine26,0,9,12,False,Drugs,1538544967.0,9kye1o
3697,How do I boof ketamine?,"['Molokai420', 'bagofm3th']","[3, 3]",honeybun-xxx,0,8,1,False,Drugs,1538591694.0,9l3xya
3698,Probation: FML,"['execob', 'FlyByWeekendMan', 'DeadbeatPieceOfShit6']","[3, 3, 3]",robloxdruglord,0,9,1,False,Drugs,1538591369.0,9l3vwb
3699,2CB traditional/entheogenic use?,[],[],youngthugfan64,0,9,4,False,Drugs,1538564042.0,9l02b2
3700,~500 mcg of lsd and weed. Enlightened,[],[],andreiblc,0,2,2,False,Drugs,1538577559.0,9l1r0f
3701,Im on withdrawal of codeine and was on 39°C fever and had to go the to the hospital and they said I had dengue fever?,[],[],leanwitxannys,0,1,0,False,Drugs,1538590088.0,9l3ntx
3702,Tapering progress,,,Keith_H23,0,0,2,False,Drugs,1538576154.0,9l1jqa
3703,How often can one smoke marijuana without negatively impacting their short-term memory?,"['Jornillo', 'danthedealer']","[3, 3]",Olaffurg,0,16,3,False,Drugs,1538567585.0,9l0fw9
3704,Never hid your drugs when your buzzed beyond belief. Cuz you just mind find them someday.,['ChefRobH'],[13],72dead,0,4,31,False,Drugs,1538520361.0,9kvgqz
3705,my strange pill of addiction,['Shortstaffer'],[6],CorrosiveBlueberry,0,7,2,False,Drugs,1538573579.0,9l16tb
3706,Safe to take mdma?,['DMVbandz'],[1],SuperSkunk012,0,5,1,False,Drugs,1538586860.0,9l35l0
3707,Advice for trip-sitting 2 friends on their first time trying LSD?,[],[],Acid_Enthusiast,0,3,1,False,Drugs,1538586549.0,9l334z
3708,Tripping on my plane ride to Florida,"['akfortyevan', 'vadoooom335']","[35, 15]",cloudsrtrippy,0,17,97,False,Drugs,1538496991.0,9ks0ux
3709,Stupid question but I just want to be safe- is it ok to take 10mg Percocet after doing some coke?,['Oakester'],[2],cinnamoncum,0,7,1,False,Drugs,1538586371.0,9l31qk
3710,How to extract lsa from HBR?,[],[],fable817,0,1,1,False,Drugs,1538586309.0,9l31a3
3711,2CB and LSD tolerance question,,,gearshake,0,0,1,False,Drugs,1538585766.0,9l2ypm
3712,Best product / drug to boost creativity / motivation / productivity,"['Kiwii2006', 'Dundler42', 'yodathepwnzr']","[1, 1, 1]",yodathepwnzr,0,5,2,False,Drugs,1538571872.0,9l0yrs
3713,Nitrous tanks,"['Wiseguy2013', 'Sterrxgamr', 'martinmartin538']","[5, 4, 3]",CosmicCatDaddy,0,19,4,False,Drugs,1538553660.0,9kz63b
3714,First Ever LSD Trip - 14 Years Old,"['Trolllllzor', 'KratomKramer']","[8, 3]",jakobmuellerr,0,26,2,False,Drugs,1538569277.0,9l0n71
3715,GBL vs GHB for occasional use,['youngforever1998'],[2],Crayonlover123,0,2,1,False,Drugs,1538582771.0,9l2iq4
3716,Good morning so far,,,caughtyoulookinn,0,0,2,False,Drugs,1538568881.0,9l0lh3
3717,I don’t want to give my girlfriend adderall.,"['Ismokeshatter92', 'acid_-_monkey', 'rubym00n']","[99, 72, 72]",uhm123456,0,55,32,False,Drugs,1538514008.0,9kukxe
3718,Favorite music to listen to under the influence of LSD or other psychedelics.,"['ThKinglui', 'violetgodform', 'His_Dudeness_94']","[5, 3, 3]",spookysvedka,0,15,4,False,Drugs,1538554661.0,9kz91g
