,title,comments_author_lst,comments_score_lst,author,guilded,num_comments,score,pinned,subreddit,created_utc,r_id
307,Climate gentrification: the rich can afford to move – what about the poor?,"['TrumpSucksMyBalls', 'ElonTrump']","[16, 8]",trumpsuxd,0,20,136,False,politics,1537893187.0,9itou3
308,U.N. General Assembly Bursts Into Laughter As Trump Brags About ‘Accomplishments’,['binawyle'],[5],billthomson,0,4,158,False,politics,1537890312.0,9it9bx
309,Millions of Americans are Unknowingly Bailing out Coal-Fired Power Plants,[],[],RyanSmith,0,24,123,False,politics,1537895313.0,9iu0ce
310,Mueller Asked About Trump’s Link to Billionaire Russian-Azerbaijani Family,"['JeSuisCovfefe', 'whatzgood', 'truffs1010']","[1573, 621, 462]",slaysia,1,352,9417,False,politics,1537816398.0,9ikvhm
311,How voter suppression threatens our democracy,[],[],WorkTomorrow,0,9,115,False,politics,1537895926.0,9iu3q8
312,"Faced With Second Accuser, Republicans Fight for Kavanaugh",[],[],Markovitch12,0,3,64,False,politics,1537906179.0,9ivm6q
313,Poll: Democrats have narrow lead in top Florida contests,[],[],throwaway5272,0,4,58,False,politics,1537909388.0,9iw2pp
314,President Trump earns laughs as he boasts about administration's accomplishments in United Nations address,['zsreport'],[3],zsreport,0,4,155,False,politics,1537890487.0,9itaam
315,Texas coal plant to shut down by 2020,[],[],BEARlovesCOOKIE,0,5,60,False,politics,1537906715.0,9ivp09
316,'Ted Cruz and Brett Kavanaugh Are Best Friends!': Texas Senator Flees Restaurant After Confronted by Sexual Assault Survivor and Allies,"['testlock', 'lifeinthecell']","[18, 10]",roku44,0,56,214,False,politics,1537882717.0,9is70c
317,The Latest: Tardy Trump throws off UN’s top event,"['LookAtMeNow247', 'TrumpUberAlles', 'MydniteSon']","[46, 29, 28]",Mamacrass,0,30,170,False,politics,1537886696.0,9isqne
318,Trump keeps threatening to end foreign aid for disloyal countries. Here’s why it hasn’t happened.,[],[],swinglinefan,0,8,72,False,politics,1537904744.0,9ivej7
319,Is a New Russian Meddling Tactic Hiding in Plain Sight?,[],[],pipsdontsqueak,0,6,52,False,politics,1537913791.0,9iwoag
320,The Decision Not to Call in the FBI is Looking Worse and Worse,"['Mitchy2Spoons', 'PoppinKREAM']","[1652, 1239]",billthomson,0,889,12596,False,politics,1537812724.0,9ikc22
321,"Martin County, KY is the worst-performing white-majority county in the nation",[],[],CrotalusHorridus,0,16,76,False,politics,1537904972.0,9ivftg
322,It Sounds Like Susan Collins Wants to Confirm Brett Kavanaugh,"['PoliticalPleionosis', 'religatex']","[1265, 479]",nightwatcharrow,0,331,3724,False,politics,1537825811.0,9im80w
323,Kavanaugh's former 'sherpa' won't commit to vote for him,[],[],WileECyrus,0,6,28,False,politics,1537921068.0,9ixl1c
324,Brett Kavanaugh Has Already Disqualified Himself,"['WorkTomorrow', 'couldbetanner']","[1027, 257]",WorkTomorrow,0,296,5937,False,politics,1537818931.0,9il8wf
325,Prisons’ Refusal to Provide Adequate Opioid Treatment is Cruel and Unlawful,[],[],GriffonsChainsaw,0,4,58,False,politics,1537905992.0,9ivl81
326,"Kavanaugh Was 'Aggressive And Belligerent' When Drunk, His Yale Roommate Says","['cybersecp', 'brianwantsblood', 'AutoModerator']","[7, 2, 1]",cybersecp,0,11,136,False,politics,1537890328.0,9it9fz
327,Trump's U.N. Speech Was a Laughingstock Until It Was a Terror,[],[],zsreport,0,8,40,False,politics,1537918737.0,9ixawh
328,Fact-checking Donald Trump’s United Nations speech,[],[],LordOverThis,0,11,54,False,politics,1537911259.0,9iwc2p
329,Arlington educator suspended after sending expletive-laced Twitter message,[],[],zorblatt9,0,16,93,False,politics,1537898244.0,9iug30
330,GOP hires female attorney to question Kavanaugh accuser,[],[],Psyworld,0,29,91,False,politics,1537897899.0,9iueak
331,"All Fetal Tissue Research Is Now Under Review, The Trump Administration Announced","['JacobCrim88', 'Ratermelon', 'gingerblz']","[41, 31, 20]",kerovon,0,24,125,False,politics,1537890853.0,9itc6f
332,Alaska judge targeted after giving no jail time for assault,[],[],pipsdontsqueak,0,3,52,False,politics,1537908457.0,9ivxy5
333,Ignored Latino vote will be key in future elections,[],[],Ryan_Abraham,0,10,67,False,politics,1537903876.0,9iv9wz
334,Milwaukee GOP group removes tweet mocking Justice Ginsburg,[],[],helpmeredditimbored,0,2,30,False,politics,1537920275.0,9ixhib
335,Mormon Women’s Group Calls for Probe of Allegations Against Kavanaugh,[],[],MaidMarien,0,6,73,False,politics,1537902807.0,9iv4d4
336,"Iran’s Rouhani Says Trump Has ‘A Nazi Disposition,’ and Much of the World Backs Iran",[],[],Assholio69,0,11,51,False,politics,1537909120.0,9iw190
337,Milwaukee GOP group removes tweet mocking Justice Ginsburg,[],[],cybersecp,0,6,55,False,politics,1537909096.0,9iw14i
338,Avenatti denies being 'duped' by 4Chan user on Kavanaugh claims,[],[],Athelric,0,70,57,False,politics,1537908611.0,9ivypr
339,"Megathread: Deupty AG Rod Rosenstein to remain in job, meeting with President Trump on Thursday","['Zipzmahpantzup', 'Obersts001', 'dr_pepper_35']","[7245, 5854, 3596]",PoliticsModeratorBot,0,4035,23887,False,politics,1537808859.0,9ijrf7
340,Kavanaugh Accuser Deborah Ramirez Will Be Represented by Two Powerhouse Attorneys,"['dragonballzgirl', 'squibblededoo', 'jmatthews2088']","[545, 461, 168]",throwaway5272,0,197,4158,False,politics,1537822373.0,9ilqvh
341,"Trump Gets 100 Countries to Sign On to His U.N. Drug War Plan, Ignoring Changing Thinking on Human Rights and Legalization",[],[],galt1776,0,15,65,False,politics,1537902278.0,9iv1n4
342,"Brett Kavanaugh, Yale and Sexual Misconduct: Here's Why Students Are Protesting at Law School",[],[],LudovicoSpecs,0,1,48,False,politics,1537911146.0,9iwbid
343,Trump says no statehood for Puerto Rico as long as San Juan mayor is in office,"['TrumpSucksMyBalls', 'screw_trump4', '2650_CPU']","[57, 35, 20]",skyliner360,0,34,111,False,politics,1537892539.0,9itlav
344,Yale cancels classes as law students protest Brett Kavanaugh nomination,"['drogonz', 'AtrophyOfTheHeart', 'The_Bagel_Guy', 'Mitchy2Spoons']","[3351, 2748, 1892, 1162]",SplittingEnnui,0,2204,23108,False,politics,1537808059.0,9ijmsl
345,Conservative NY Times columnist calls Ted Cruz ‘a serpent covered in Vaseline’,"['cumsundae', 'catjpg']","[13, 9]",silevram,0,14,140,False,politics,1537887412.0,9isu34
346,UN General Assembly 2018: Trump forced to pause amid laughter at claims he has 'accomplished almost more than any administration',[],[],mps1729,0,6,102,False,politics,1537893462.0,9itq8f
347,Former Trump hotel in Panama City rebranded as JW Marriott,[],[],Hysterical_Realist,0,12,45,False,politics,1537911923.0,9iwfc3
348,This GOP Senate Candidate Isn’t Sure that Attempted Rape Claim Should Disqualify Kavanaugh,[],[],PM_ME_YOUR_KOMPROMAT,0,11,72,False,politics,1537900407.0,9iurgg
349,Trump arrives at U.N. struggling to sell his foreign policy record,"['yourmansconnect', 'brainsong', 'ThoughtStrands']","[54, 22, 12]",Jarijari7,0,17,254,False,politics,1537874488.0,9ir9jr
350,Cramer questions whether Kavanaugh assault allegation is disqualifying — even if true,[],[],intelligentish,0,7,34,False,politics,1537916911.0,9ix2wo
351,Kavanaugh’s ‘Golden Résumé’ Turns Into a Lead Weight,['theClumsy1'],[19],Cerberusz,0,4,175,False,politics,1537882011.0,9is3pt
352,The Memo: Trump critics and allies unite: Don't fire Rosenstein,"['doowgad1', 'ImLikeReallySmart', 'Hoxha_Posadist']","[23, 13, 12]",unicoitn,0,13,325,False,politics,1537869702.0,9iqtp9
353,Opinion: Donald Trump's UN speech makes authoritarians great again,[],[],progress18,0,7,42,False,politics,1537912767.0,9iwjg8
354,Kavanaugh protesters chase Cruz out of restaurant,"['SheriffComey', 'all4reddit', 'Scubalefty']","[22, 9, 8]",FunAir,0,37,236,False,politics,1537875870.0,9ireio
355,Domestic abuse victim turned congressional candidate talks candidly about challenges women have talking to police,[],[],abid111official,0,3,90,False,politics,1537895425.0,9iu0zk
356,Brett Kavanaugh And The Men Who Say Nothing,[],[],toincosser,0,2,52,False,politics,1537906751.0,9ivp6p
357,Hirono: Kavanaugh's name will have an asterisk if he's confirmed,['lolmonade'],[25],throwaway5272,0,12,125,False,politics,1537887772.0,9isvzn
358,Nike Donates Millions to Republicans While Making Billions From Kaepernick Endorsement,"['newolderguy', 'CToxin', 'nom-nom-nom-de-plumb']","[91, 43, 25]",francisxdonut,0,63,735,False,politics,1537852330.0,9ipdig
359,"The White House Is Open To Brett Kavanaugh's Second Accuser Testifying, Sarah Sanders Says","['geodynamics', 'Localman1972', 'layer8issues']","[13, 8, 5]",lebrilla,0,12,126,False,politics,1537886760.0,9isqy2
360,"Nelson Takes Lead In Critical Florida U.S. Senate Race, Quinnipiac University Poll Finds; Women Are Key To Democrat's Lead",[],[],throwaway5272,0,11,91,False,politics,1537893944.0,9itsse
361,Top Senate Republicans aren’t even pretending Kavanaugh’s accusers will make a difference,"['devolka', 'Fuqwon']","[9, 9]",supercubbiefan,0,9,122,False,politics,1537889132.0,9it319
362,Deborah Ramirez’s Allegation Against Brett Kavanaugh Raises Classic Questions Of Campus Assault Cases,[],[],swinglinefan,0,2,59,False,politics,1537902573.0,9iv36d
363,The President Treats the U.N. to a Good Old-Fashioned Trump Rally,[],[],Trump_Wears_Diapers,0,10,65,False,politics,1537900431.0,9iurlr
364,Kamala Harris calls for Senate to protect Mueller probe as Rosenstein faces potential dismissal,"['BEARlovesCOOKIE', 'Yes-Lawd']","[3433, 2860]",BEARlovesCOOKIE,0,1251,30360,False,politics,1537805507.0,9ij9a9
365,Beto O’Rourke Condemns Activists for Forcing Ted Cruz From Restaurant,[],[],Beto-Hero,0,35,34,False,politics,1537911516.0,9iwdbu
366,US diplomat found dead in Madagascar,"['frogelixir', 'ScaryInjury', 'MaresEatOatsAndDoes']","[50, 35, 26]",bint_elkhandaq,0,22,222,False,politics,1537875434.0,9ircwr
367,Trump On Track To Sign Another Spending Bill That Fails To Pay For His Wall,[],[],jalertisane,0,3,47,False,politics,1537905442.0,9ivi88
368,Brett Kavanaugh: third woman expected to make accusations of sexual misconduct | US news,"['lebrilla', 'Brandeez0', 'vegetabledetritus']","[218, 106, 65]",Showmethepathplease,0,192,3336,False,politics,1537823378.0,9ilw44
369,Minnesota lawmaker abandons campaign amid daughter's allegations of inappropriate conduct,[],[],NeighborhoodVeteran,0,12,35,False,politics,1537914559.0,9iwrzc
370,Dem Lawmaker Trolls Trump Over Reception of UN Speech,[],[],Creasy007,0,4,29,False,politics,1537916671.0,9ix1ro
371,Anti-Kavanaugh protesters confront Ted Cruz and wife at fancy DC restaurant: 'We believe survivors!',"['cumsundae', 'dallasmorningnews']","[21, 5]",dallasmorningnews,0,10,178,False,politics,1537879561.0,9irsr7
372,Murkowski urges senators to take Kavanaugh accusers' allegations seriously,[],[],Comassion,0,10,77,False,politics,1537897573.0,9iucgs
373,Amnesty International calls to halt Kavanaugh nomination,"['bymeadollor', 'bexmex', 'mtarascio']","[563, 437, 284]",Yzily,0,235,7388,False,politics,1537811151.0,9ik3r5
374,Trump administration cancels FDA fetal tissue contract,[],[],BennieMPierce,0,5,40,False,politics,1537909788.0,9iw4t4
375,Cramer questions if allegations should disqualify Kavanaugh ‘even if it’s all true’,"['shakatanl', 'brainsong', 'Jeffersons_Mammoth', 'crooked-heart']","[24, 22, 19, 14]",BEARlovesCOOKIE,0,40,128,False,politics,1537885920.0,9ismro
376,Senate Judiciary Committee Schedules Brett Kavanaugh Vote For Friday,[],[],cybersecp,0,22,25,False,politics,1537919131.0,9ixcmb
377,Ex Trump aide Jason Miller accused of putting abortion pill in Strippers smoothie,"['GordonsHearingAid', 'wigletbill', 'thelastcookie']","[230, 52, 48]",TheCzar11,0,88,1088,False,politics,1537842900.0,9ioct2
378,Collins: Second Kavanaugh accuser should speak with Senate panel under oath,"['EwwYetiPubes', 'PoliticalPleionosis']","[622, 142]",_basquiat,0,122,2292,False,politics,1537828885.0,9immr0
379,"Yale Law Students Refuse to Go to Class, Stage ‘Sit-in’ Over Brett Kavanaugh Assault Claims","['muffler48', 'bymeadollor']","[1935, 622]",readet,0,529,8487,False,politics,1537809172.0,9ijt5u
380,'You can kiss the midterms goodbye': Republicans fear for their election fate if Democrats defeat Brett Kavanaugh,[],[],vriska1,0,16,30,False,politics,1537918929.0,9ixbq7
381,Iranian President denies requesting meeting with Trump,[],[],Baarney23,0,4,44,False,politics,1537907181.0,9ivrdu
382,Census Citizenship Question: Appeals Court Rules DOJ Official Must Testify,[],[],michkennedy,0,2,29,False,politics,1537917819.0,9ix6yv
383,Democratic AGs warn Sessions against policing tech speech,[],[],ricssmit,0,1,57,False,politics,1537900924.0,9iuu7g
384,China places ad in Iowa warning trade war will hurt economy,[],[],liquiddemocracy,0,5,29,False,politics,1537916811.0,9ix2fs
385,Ted Cruz Spotted On Flight Looking At Photo Of Senate Rival Beto O'Rourke,[],[],scadonl,0,10,23,False,politics,1537921460.0,9ixmuv
386,Immigration activists bring a giant cage to Salesforce convention,[],[],evanFFTF,0,3,50,False,politics,1537903077.0,9iv5ux
387,"Insurers could charge huge premiums under Yoder-backed bill, health care experts say",[],[],StrictScrutiny,0,4,42,False,politics,1537907855.0,9ivutu
388,Avenatti representing new Kavanaugh accuser,"['Raptop', 'lucrezia__borgia', 'AutoModerator', 'DeltaBlues1']","[13, 2, 1, 1]",DeltaBlues1,0,45,135,False,politics,1537884813.0,9ishcx
389,Nevada’s most notorious brothel-keeper is also a Republican candidate,"['GOPniks2', 'all4reddit', 'TheBoggyFundus']","[26, 20, 12]",Gambit08,0,13,226,False,politics,1537873083.0,9ir4lf
390,'I didn't expect that reaction': Trump's boasting provokes laughter at UN,[],[],TowelCarryingTourist,0,12,35,False,politics,1537912025.0,9iwfuj
391,Snapchat’s users are surprisingly old and it’s telling them to vote,[],[],AcceptableObject,0,15,56,False,politics,1537901253.0,9iuw1h
392,China denies Hong Kong port visit for U.S. navy ship amid trade tensions,[],[],liquiddemocracy,0,12,61,False,politics,1537898425.0,9iuh1k
393,The Health 202: Rural Trump voters hurt most when states don’t expand Medicaid,"['d15d17', 'trokellem', 'Leiawen', 'Nostromo1905']","[12, 9, 8, 5]",MIIAIIRIIK,0,14,140,False,politics,1537883679.0,9isbiz
394,Press: Judge Kavanaugh Must Withdraw,"['drogonz', 'smutketeer']","[109, 54]",Creasy007,0,84,1695,False,politics,1537832618.0,9in3pc
395,"Yes, the Supreme Court is facing a legitimacy crisis. And we know exactly whose fault it is.","['inhabbalabba', 'analogsmoke', 'The-Autarkh', 'Drifter128']","[303, 257, 132, 104]",The-Autarkh,0,252,4234,False,politics,1537816291.0,9ikuxp
396,Watchdog: MDs with convictions hired to examine immigrants,[],[],aubonpaine,0,2,61,False,politics,1537896585.0,9iu790
397,Bryan Fischer Wages ‘Major League Spiritual Warfare’ Against the ‘Demons of Hell’ Attacking Kavanaugh,[],[],Jonny43,0,41,69,False,politics,1537895899.0,9iu3l5
398,"Brett Kavanaugh's Body Language Says It All, According To An Expert","['wonderingsocrates', 'TrumpIsAhugeRacist', 'Chukklez350', 'erc80']","[33, 27, 23, 18]",wonderingsocrates,0,45,132,False,politics,1537884125.0,9isds9
399,Elizabeth Warren’s Ambitious Fix for America’s Housing Crisis,[],[],p4177y,0,3,31,False,politics,1537911244.0,9iwbzq
