,title,comments_author_lst,comments_score_lst,author,guilded,num_comments,score,pinned,subreddit,created_utc,r_id
151,Senators told to expect to be in town this weekend for Kavanaugh,[],[],silevram,0,42,310,False,politics,1537899921.0,9iup12
152,The Latest: Trump gets a laugh in opening of UN speech,"['_PM_ME_UR_CRITS_', 'jonttu125', 'Localman1972', 'Yeeaaaarrrgh']","[88, 37, 32, 28]",WOODEN_COUCH,0,54,584,False,politics,1537887362.0,9istt1
153,Roger Stone Offered to Assist His Alleged WikiLeaks Source With Legal Expenses,"['charging_bull', 'hotpackage']","[52, 18]",charging_bull,0,15,730,False,politics,1537882139.0,9is48u
154,Brett Kavanaugh is hard to believe,[],[],JuDGe3690,0,37,161,False,politics,1537913657.0,9iwnmg
155,Donald Trump bragged about himself to the United Nations. The UN laughed.,[],[],amjad2810084,0,6,346,False,politics,1537896976.0,9iu9bp
156,"Iran's president suggests Trump has ""Nazi disposition""",[],[],ToadProphet,0,20,143,False,politics,1537916940.0,9ix30z
157,Beto O'Rourke Says The Protesters Who Forced Ted Cruz Out of a Restaurant Were 'Not Right',[],[],dadamugglemumsawitch,0,163,232,False,politics,1537904130.0,9ivbae
158,Trump has leaders from around the world openly laughing at him at UN: ‘I didn’t expect that reaction’,[],[],wazzel2u,0,43,334,False,politics,1537895596.0,9iu1wo
159,Tim Scott could change his mind on backing Kavanaugh,[],[],ReclaimLesMis,0,45,181,False,politics,1537909138.0,9iw1c6
160,NBC News poll: It's neck-and-neck in the Arizona Senate race,['abcde9999'],[222],shabuluba,0,29,1144,False,politics,1537871220.0,9iqyo2
161,"Another Kavanaugh accuser has talked to Maryland authorities, report says","['MBAMBA0', 'nanopicofared', 'emmerick', 'LiquidPuzzle']","[657, 561, 306, 275]",nanopicofared,0,557,6046,False,politics,1537842404.0,9ioamz
162,"Third Kavanaugh Accuser, a Former U.S. State and Mint Employee, is '100 Percent Credible,' Avenatti Says","['KatanaAmerica', 'masstrip']","[1867, 1779]",PoliticsBeepBooper,0,1355,12736,False,politics,1537835660.0,9inhbh
163,"Michael Avenatti says he will reveal the name of the 3rd Kavanaugh accuser, detail her allegations 'within 48 hours'","['BeerNirvana', 'ChrisFromLongIsland', 'lttlfshbgfsh']","[123, 50, 40]",Fitbitnitwit,0,108,1074,False,politics,1537872483.0,9ir2p7
164,"Trump attacks Kavanaugh’s second accuser, saying she was “totally drunk”",[],[],KFSattmann,0,42,243,False,politics,1537901431.0,9iuwzd
165,UN laughs as Trump claims America made most strides during his presidency,"['chelseamarket', '000000robot']","[28, 18]",GoldieNYC1010,0,18,466,False,politics,1537888090.0,9isxnv
166,Deputy Press Secretary Raj Shah plans to leave White House after Kavanaugh confirmation,[],[],WileECyrus,0,36,150,False,politics,1537912042.0,9iwfxm
167,"Hold Kavanaugh to his Own Standard for Bill Clinton, and Take Him Apart Piece by Painful Piece",[],[],CharleyMarley512,0,14,104,False,politics,1537920891.0,9ixkb0
168,Did Brett Kavanaugh 'Cut Off' His Wife on Fox News? | Law & Crime,[],[],MartialBob,0,9,131,False,politics,1537913631.0,9iwnil
169,"Senate Intelligence Committee subpoenas Randy Credico, who Roger Stone claims was Wikileaks' back channel",[],[],Ray3142,0,5,106,False,politics,1537920205.0,9ixh8c
170,Why this lifelong Republican is voting Democratic in the 48th District,"['AT5squared', 'coontbiscuit']","[36, 16]",scaryberry,0,23,495,False,politics,1537886087.0,9isnl4
171,Democrat says Kavanaugh denial is not credible,"['RosesAreBad', 'unknownpoltroon', 'metalysis']","[49, 34, 16]",bint_elkhandaq,0,32,888,False,politics,1537873962.0,9ir7r6
172,"Nelson Takes Lead In Critical Florida U.S. Senate Race, Quinnipiac University Poll Finds; Women Are Key To Democrat's Lead",[],[],nowhathappenedwas,0,27,319,False,politics,1537894182.0,9itu5k
173,Ted Cruz Staring At a Photo of Beto O'Rourke Tells You What Kind of Week He's Having,[],[],RegretfulTrumpVoter,0,33,103,False,politics,1537919409.0,9ixdx2
174,"Climate change is destroying our national parks at an alarming rate, study finds",[],[],The-Autarkh,0,6,133,False,politics,1537911501.0,9iwd9a
175,"Brett Kavanaugh: ‘Horrible, hurtful taunts’ towards schoolgirl in high school yearbook revealed","['just_a_timetraveller', 'BulbousAlsoTapered', 'ThePlanck']","[263, 139, 89]",madam1,0,137,1358,False,politics,1537864688.0,9iqf0f
176,Ted Cruz Staring At A Photo Of Beto O'Rourke Tells You What Kind Of Week He's Having,"['donkeypunchtrump', 'imnotanevilwitch']","[35, 30]",MuskofElon,0,42,338,False,politics,1537892705.0,9itm86
177,The Latest: Murkowski backs FBI probe of Kavanaugh claims,"['AlternativeSuccotash', 'mistersuits']","[26, 13]",PM_ME_YOUR_KOMPROMAT,0,7,392,False,politics,1537889680.0,9it5zs
178,Trump Laughed at While Bragging about Accomplishments at UN,"['ianrl337', 'Fagatron9001', 'DeCovfefe']","[16, 12, 10]",YouKnowCranjis,0,13,359,False,politics,1537890671.0,9itb8j
179,Kavanaugh floats new defense against sexual assault claims: I was a virgin – VICE News,"['ThatsWonderful', 'viva_la_vinyl', 'silverwyrm']","[240, 136, 103]",huskies4life,0,171,942,False,politics,1537871311.0,9iqyxk
180,Texas AG Ken Paxton defends law requiring schoolchildren to say pledge after black teen kicked out of school,[],[],dallasmorningnews,0,49,113,False,politics,1537913562.0,9iwn77
181,Kavanaugh is losing support in 10 crucial districts,[],[],abid111official,0,18,282,False,politics,1537895243.0,9itzyv
182,Supreme Court nominee Brett Kavanaugh's Yale roommate says he believes second accuser,"['thenewyorkgod', 'ZebAtlasFan', 'AHarshInquisitor']","[10009, 5059, 3038]",2big_2fail,2,4031,42914,False,politics,1537830453.0,9imu1r
183,"Trump touts his own achievements, and the U.N. laughs",[],[],gjacques5239,0,17,249,False,politics,1537896764.0,9iu86k
184,"Rebuking Trump, major powers reaffirm Iran nuclear deal","['brainsong', 'nakedsamurai', 'MatofPerth']","[47, 32, 27]",stone_dog,0,23,772,False,politics,1537874307.0,9ir8yh
185,Lindsey Graham's depressing and disappointing admission about Thursday's Brett Kavanaugh hearing,[],[],Assholio69,0,35,105,False,politics,1537918170.0,9ix8hn
186,"Kavanaugh is a 'huge step backwards,' says Dem congressional candidate","['brainsong', 'letsgoantiquing', 'AutoModerator', 'xmagusx', 'Mockanopolis', 'SansSauce']","[10, 6, 1, 1, 1, 1]",Mandar391,0,27,539,False,politics,1537881071.0,9irzgv
187,Sen. Ted Cruz chased out of DC restaurant,"['Lucetti', 'Malodoror', 'PhillyIndy']","[415, 345, 202]",poodleswamp,0,407,2977,False,politics,1537848069.0,9ioxqh
188,Senate Judiciary Committee sets Kavanaugh vote for Friday,[],[],_basquiat,0,47,98,False,politics,1537915652.0,9iwx3z
189,"American Adults, It's Time to Register to Vote","['trustmeiwouldntlie2u', 'Trumpisfakenews17']","[8, 6]",seanpeery,0,16,348,False,politics,1537888067.0,9isxjg
190,Five countries announce deal to defy Trump on oil trade with Iran,"['StanDaMan1', 'row_guy']","[72, 26]",travolta_cage,0,24,561,False,politics,1537878932.0,9irq7q
191,China denies request for U.S. warship to dock in Hong Kong,[],[],SamDumberg,0,44,187,False,politics,1537900988.0,9iuuim
192,Bloomberg-founded gun control group launches ads to flip 15 GOP House districts,['Secularnirvana'],[57],Ayrane,0,64,667,False,politics,1537875393.0,9ircrd
193,Attempted rape isn’t boys will be boys. It’s criminals will be criminals.,"['aftermorning', 'Cinemaphreak', 'Final_Senator']","[554, 425, 279]",supercubbiefan,0,841,10803,False,politics,1537829954.0,9imrpy
194,Donald Trump's isolationism is a gift to his greatest enemies,[],[],stone_dog,0,5,201,False,politics,1537899078.0,9iukib
195,"Study: 11,000 More Homes in Carolinas Were Damaged in Storm Due to Rising Sea Levels",[],[],PoliticsBeepBooper,0,13,227,False,politics,1537896452.0,9iu6ko
196,"Trump attacks Deborah Ramirez, argues she ‘has nothing’ because she was drinking",[],[],24identity,0,17,83,False,politics,1537916326.0,9ix05m
197,O'Rourke defends Cruz after protesters heckle senator at restaurant,"['bugyotll', 'ivereadthings', 'SheriffComey']","[268, 116, 91]",dannlee,0,130,394,False,politics,1537884727.0,9isgwz
198,Kavanaugh Allegations Bring a Reckoning at Yale Law School,[],[],Assholio69,0,3,111,False,politics,1537911578.0,9iwdnm
199,New GOP position: Voters should Not have any say in Supreme Court nominations,['DJTsVaginaMonologue'],[41],DJTsVaginaMonologue,0,24,274,False,politics,1537892212.0,9itjij
200,‘How’d you find me?’: Mark Judge has been holed up in a beach house in Delaware amid a media firestorm,"['Kazyole', 'Damn_Dog_Inappropes', 'anoxiousweed', 'GRVrush2112', 'higher_moments']","[1113, 440, 332, 309, 292]",TrillboBaggins,0,276,3532,False,politics,1537842654.0,9iobp7
201,Kavanaugh classmate who wrote of partying goes silent,[],[],cynycal,0,6,112,False,politics,1537909979.0,9iw5qr
202,A TV ad that crystallizes the biggest GOP lie about health care,[],[],The-Autarkh,0,4,162,False,politics,1537902928.0,9iv53h
203,Mark Taylor: Trump Downgraded Hurricane Florence with Weather Control Technology,[],[],demosthenes131,0,44,141,False,politics,1537905504.0,9ivik8
204,Seattle Throws Out 15 Years of Marijuana Convictions,"['teyhan_bevafer', 'CTU']","[207, 52]",TrumpSharted,0,74,3198,False,politics,1537843888.0,9iogyp
205,Mormon women call on senators to postpone Kavanaugh confirmation,"['Nano_Burger', 'Radiopw31', 'dugyotun']","[27, 11, 6]",silevram,0,25,303,False,politics,1537888675.0,9it0og
206,Frat boy vs. choir boy: Dueling versions of Kavanaugh raise credibility questions,[],[],Assholio69,0,9,80,False,politics,1537918359.0,9ix9aj
207,Trump urges world to reject globalism in UN speech that draws mocking laughter,[],[],branstarktreewizard,0,16,78,False,politics,1537916173.0,9iwzgl
208,Yellowstone grizzlies safe from hunting as judge returns them to protected list,"['zsreport', 'wildwaterwhisperer', 'KeystrokeCowboy']","[23, 7, 5]",zsreport,0,19,549,False,politics,1537876740.0,9irhi4
209,Indicted GOP congressman called out by Democrat as a 'bigot' over Korean language ad,[],[],progress18,0,9,88,False,politics,1537915253.0,9iwv62
210,Laughter at Trump among a long line of shocking UN moments,[],[],StevenSanders90210,0,7,92,False,politics,1537913388.0,9iwmem
211,"Chef to Trump: ‘If you cannot give love, you shouldn’t be in a position of leadership",[],[],24identity,0,11,77,False,politics,1537917375.0,9ix50u
212,Trump accused Germany of becoming ‘totally dependent’ on Russian energy at the U.N. The Germans just smirked.,[],[],docellisdee,0,5,105,False,politics,1537910397.0,9iw7t1
213,Two Kavanaugh Allies Withdraw From Statement Disputing New Yorker Allegation,"['Womps_And_Prayers', 'helemaalnicks']","[2182, 1555]",toincosser,0,849,11042,False,politics,1537826958.0,9imdq2
214,Texas coal plant announces plan to shut down,[],[],Athelric,0,13,122,False,politics,1537906763.0,9ivp97
215,Senate panel schedules Friday morning vote for Kavanaugh,[],[],Whoshabooboo,0,33,80,False,politics,1537914909.0,9iwtn1
216,"If a Woman Drinks, It’s Her Fault. If a Man Drinks, It’s an Excuse","['Minion_Retired', 'thiscouldbemassive', 'dead_pirate_robertz']","[425, 393, 203]",CavePrisoner,0,483,7872,False,politics,1537829945.0,9imroc
217,"Rod Rosenstein’s departure was imminent. Now he is likely to survive until after the midterms, officials say",[],[],slakmehl,0,14,74,False,politics,1537917954.0,9ix7jz
218,Kavanaugh classmate Mark Judge spotted hiding out at Delaware beach house by reporter,"['szyalk', 'NoLongerRepublican', 'AFrustratedIdealist']","[22, 17, 13]",AFrustratedIdealist,0,24,354,False,politics,1537884111.0,9isdow
219,"Former UN chief Ban Ki-moon: US health care system is ‘politically wrong, morally wrong’","['MonsieurGideon', 'qcezadwx', 'distractonator', 'd_nijmegen']","[9, 8, 5, 4]",ToadProphet,0,15,319,False,politics,1537885977.0,9isn1w
220,"Trump claims he wanted the UN to laugh at his speech, calls it 'great'",[],[],bluetexan62,0,39,73,False,politics,1537916058.0,9iwyze
221,Tuesday US briefing: third Kavanaugh accuser may come forward,"['braidenshere', 'muskieguy13']","[28, 11]",Cerberusz,0,24,416,False,politics,1537880173.0,9irvc7
222,The GOP’s Least-Worst Option Is If Kavanaugh Withdraws — And Soon,[],[],viva_la_vinyl,0,14,64,False,politics,1537919181.0,9ixcv2
223,"Election security bill won't pass ahead of midterms, says key Republican",[],[],Athelric,0,11,110,False,politics,1537907760.0,9ivubc
224,The Kavanaugh Allegations Are Awfully Similar to What I Saw at D.C.’s Prep School Parties in the ’80s,"['astronaughts', 'MuskofElon']","[377, 197]",francisxdonut,0,307,3665,False,politics,1537838452.0,9intk6
225,"After Actively Making Life Worse for Millions Worldwide, Trump Tells Refugees to Suck It Up and Stay in 'Their Own Countries'",[],[],adlerchen,0,11,60,False,politics,1537919219.0,9ixd19
226,Group sees uptick in female voter interest in midterms compared to 2016,[],[],Lionel_Hutz_Law,0,2,58,False,politics,1537919761.0,9ixfed
227,An FBI Investigation Could Become GOP’s Backup Plan on Kavanaugh,[],[],Pro_Game_Xom9k,0,10,72,False,politics,1537915177.0,9iwutw
228,"Kavanaugh’s Yearbook Page Is ‘Horrible, Hurtful’ to a Woman It Named","['myadviceisntgood', 'herbibenevolent', 'GhostFish', 'peakedattwentyone']","[1482, 601, 594, 585]",just__Steve,1,657,4868,False,politics,1537833631.0,9in87p
229,Kavanaugh Witness Mark Judge Found Holed Up at Delaware Beach House,"['ClownholeContingency', 'shhalahr', 'brownribbon', 'TheyAreAllComplicit']","[27, 25, 15, 15]",Yzily,0,19,289,False,politics,1537886317.0,9isor4
230,Russia Is Running an Actual Contest to Troll the World,[],[],JSTARR356,0,23,97,False,politics,1537908866.0,9iw004
231,Democrats Sound Alarm: Trump Firing Rosenstein Would 'Provoke a Constitutional Crisis',[],[],mikegeorgebob,0,22,92,False,politics,1537910009.0,9iw5wi
232,Why Kavanaugh Should Welcome An FBI Investigation,[],[],IanHurley7,0,21,195,False,politics,1537894533.0,9itw29
233,UN Laughs After Trump Claims His Admin Has Done More Than ‘Almost Any’ Other,"['darkkilla123', 'DailyCloserToDeath']","[5, 3]",themollusk,0,10,231,False,politics,1537890425.0,9it9yh
234,Jeff Sessions Couldn’t Get State AGs to Back His Campaign Against Tech,[],[],mjk1093,0,2,69,False,politics,1537916437.0,9ix0oi
235,Trump claim of historic accomplishments elicits unintended laughter from world leaders at U.N,[],[],Trumpcarekills,0,8,124,False,politics,1537902201.0,9iv16v
236,Seattle drops over 500 convictions for marijuana possession after legalization,[],[],Innocul8,0,4,102,False,politics,1537906470.0,9ivnq0
237,Red-state Democrats refuse to come out against Kavanaugh,[],[],Assholio69,0,36,63,False,politics,1537918296.0,9ix90p
238,Trump Defends Kavanaugh: ‘I Understand College Very Well’,[],[],_basquiat,0,68,173,False,politics,1537895241.0,9itzyf
239,Sarah Sanders: ‘Not true’ that Trump always sides with men in cases of sexual misconduct allegations,[],[],planitorsunion,0,51,188,False,politics,1537894095.0,9ittox
240,The UN General Assembly Just Laughed in Trump’s Face as He Bragged of His Successes,[],[],Me-Mongo,0,4,163,False,politics,1537896636.0,9iu7i1
241,All-Male Senate Judiciary Republicans Hire Outside Attorney For Kavanaugh Hearing,[],[],nanopicofared,0,12,99,False,politics,1537906799.0,9ivpgf
242,Avenatti: New client will go public with Kavanaugh accusations in next 48 hours,"['Mikebyrneyadigg', 'AFK42', 'enkidomark']","[5007, 2545, 1945]",intelligentish,0,3792,27077,False,politics,1537820761.0,9iligm
243,Trump official accused of violating Hatch Act for speech at Hawaii GOP fundraiser,[],[],KeyGas,0,10,187,False,politics,1537893965.0,9itswq
244,"White House open to public testimony from second Kavanaugh accuser, Sanders says","['AcceptableObject', 'nanopicofared']","[63, 15]",WOODEN_COUCH,0,52,418,False,politics,1537878102.0,9irmxy
245,Mitch McConnell appears to have conveniently forgotten who Merrick Garland is,"['SOSovereign', 'flamethrower2']","[1808, 478]",Skooma_Lite,0,482,8156,False,politics,1537824848.0,9im3c8
246,We Asked 17-Year-Olds About Brett Kavanaugh and Consent,[],[],RegretfulTrumpVoter,0,76,124,False,politics,1537902983.0,9iv5dp
247,"After Actively Making Life Worse for Millions Worldwide, Trump Tells Refugees to Suck It Up and Stay in 'Their Own Countries'",[],[],no-militarism,0,31,132,False,politics,1537899730.0,9iunzn
248,"Kavanaugh isn’t entitled to a Supreme Court seat, just as men aren’t entitled to sex","['KatanaAmerica', 'ihohjlknk']","[479, 108]",dont_tread_on_dc,0,279,5108,False,politics,1537830852.0,9imvtz
249,Ted Cruz forced from restaurant amid Kavanaugh drama,"['ProbablyHighAsShit', 'MyRpoliticsaccount', 'lifeinthecell', 'distractonator']","[53, 24, 16, 6]",amjad2810084,0,67,359,False,politics,1537880081.0,9iruyt
250,'Even if it's all true': GOP Senate candidate questions if Kavanaugh allegations disqualify him,[],[],UnionVGF,0,47,150,False,politics,1537897622.0,9iucq7
251,Anita Hill Says Kavanaugh Accuser Hearing 'Cannot Be Fair',[],[],AldoTheeApache,0,3,95,False,politics,1537906661.0,9ivopr
252,"Judge restores protections for grizzly bears, blocking hunts","['stoniegreen', 'SaltHash', 'idontfwithu']","[155, 104, 68]",craig1818,0,264,3768,False,politics,1537834195.0,9inan6
253,Democrats Bill Nelson and Andrew Gillum have an edge in critical Florida races: NBC News/Marist poll,[],[],slingtarp,0,7,80,False,politics,1537909549.0,9iw3jp
254,Avenatti Says Democrats Won't Win by Shaming Trump Voters,"['CovfefeForAll', 'TreasonalAllergies', 'not-a-bad-guy']","[63, 42, 41]",Assholio69,0,91,180,False,politics,1537892510.0,9itl58
255,Governor Cuomo Signs Bill Adding Pain Management to List of Eligible Conditions for Treatment with Medical Marijuana,[],[],Kent21Kent,0,5,59,False,politics,1537916183.0,9iwzi8
256,Christine Blasey Ford’s legal team slams Senate plan to use “sex crimes prosecutor”,[],[],Bert-Goldberg,0,47,136,False,politics,1537897917.0,9iuedg
257,We Know Brett Kavanaugh Has Lied Already,"['theLusitanian', 'ideogon']","[11, 3]",katrina1215,0,15,216,False,politics,1537888525.0,9iszws
258,"The Democratic Dream: Defeat Kavanaugh, Win the Senate and Stop Trump Supreme Court Picks","['good_nazi_dead_nazi', 'devolka']","[36, 13]",Cerberusz,0,74,299,False,politics,1537881955.0,9is3gn
259,Senate Judiciary hires an outside counsel to question Kavanaugh accuser on Thursday,[],[],Creddit999,0,30,136,False,politics,1537898391.0,9iugue
260,"McConnell and Grassley Have Prevented Proper Scrutiny of Kavanaugh. That Has to End, Now.","['JijiLV29', 'Uncle_Charnia']","[551, 96]",_basquiat,0,184,7695,False,politics,1537823412.0,9ilwag
261,UN General Assembly Laughs in Trump’s Face When He Touts His Administration,"['Eurynom0s', 'Hungry_Horace', 'TrumpSucksMyBalls']","[19, 11, 8]",Eurynom0s,0,16,217,False,politics,1537888397.0,9isz8t
262,Macron rebukes Trump's isolationist message,[],[],jalertisane,0,2,82,False,politics,1537908350.0,9ivxd3
263,"Republicans Knew More Kavanaugh Claims Were Coming, Democratic Aides Say","['Fakher-123', 'sadi212']","[93, 65]",francisxdonut,0,39,1157,False,politics,1537854785.0,9ipll4
264,Safari’s “Siri Suggested” Search Results Highlighted Conspiracy Sites And Fake News,[],[],mixplate,0,4,59,False,politics,1537917229.0,9ix4dq
265,Md. state workers get 60 paid parental leave days in new plan,[],[],WileECyrus,0,4,81,False,politics,1537908241.0,9ivwra
266,Evangelical leaders push hard for Kavanaugh confirmation,[],[],elguiridelocho,0,56,120,False,politics,1537899665.0,9iunmh
267,Over 1000 Female Yale Grads Sign Letter Supporting Brett Kavanaugh Accusers: 'We Have Their Backs',"['thenewyorkgod', '-Jakoon']","[271, 144]",chris-jjj,0,231,4154,False,politics,1537831271.0,9imxrv
268,UN General Assembly 2018: Trump forced to pause amid laughter at claims he has 'accomplished almost more than any administration,[],[],Chamanzan,0,3,232,False,politics,1537887502.0,9isujp
269,Florida's Bill Nelson has helped my family. We need him to stay in the Senate. | Opinion,[],[],FactOrFactorial,0,4,54,False,politics,1537920277.0,9ixhiq
270,Amnesty International USA Issues Rare Call for a Halt on Kavanaugh Nomination,"['only-read-headlines', 'PutinsPawn', 'royalblue4']","[163, 69, 63]",only-read-headlines,0,28,1654,False,politics,1537847507.0,9iovkr
271,"NBC/Marist poll: Democrats inch ahead in U.S. Senate, Governor’s races",[],[],readet,0,6,64,False,politics,1537913655.0,9iwnm6
272,Pence is first VP to speak at anti-gay group's Values Voter Summit,"['VROF', 'theLusitanian', 'Allbanned1984']","[1679, 719, 583]",mixplate,0,696,9543,False,politics,1537820891.0,9ilj5h
273,"Drug prices climb despite Trump promise, investigation finds",[],[],jalertisane,0,3,62,False,politics,1537913943.0,9iwp1b
274,"Trump Considers Keeping Rosenstein On, Advisers Say",[],[],slakmehl,0,17,48,False,politics,1537918990.0,9ixbza
275,Trump unloads on Brett Kavanaugh accuser: 'She admits she was drunk',[],[],DJTsVaginaMonologue,0,71,165,False,politics,1537893388.0,9itpvw
276,Kavanaugh's former 'sherpa' won't commit to vote for him,[],[],Kent21Kent,0,16,145,False,politics,1537895424.0,9iu0zi
277,Grassley to Feinstein: We won't delay Kavanaugh hearing,[],[],GeneLatifah,0,20,49,False,politics,1537918627.0,9ixafr
278,Bill Cosby’s spokesperson says his client and Brett Kavanaugh are victims of a “sex war”,[],[],LefthandedLunatic,0,36,67,False,politics,1537913869.0,9iwoof
279,Avenatti: Kavanaugh accuser client may pursue criminal case,"['Dddydya', 'themilkisbad357', 'KatanaAmerica', 'NlightenedSelfIntrst']","[184, 130, 123, 106]",a_fuller,0,134,1831,False,politics,1537844623.0,9iojzn
280,‘Back in the foxhole together’: Conservatives rally around Kavanaugh amid accusations,[],[],Ray3142,0,20,34,False,politics,1537920287.0,9ixhko
281,"Beto O’Rourke, the Reaganesque Anti-Trump",[],[],throwaway5272,0,24,80,False,politics,1537906437.0,9ivnjp
282,Senate panel schedules Friday morning for Kavanaugh vote.,[],[],candianchicksrule,0,56,52,False,politics,1537917053.0,9ix3k8
283,Republican Senators Do Not Appear to Give a Damn About Latest Kavanaugh Allegation,"['Kazyole', 'cavecricket49', 'avenatti2020']","[180, 175, 72]",progress18,0,182,2374,False,politics,1537839530.0,9iny8l
284,Snapchat is letting users register to vote from its app,"['imreallybadatJS', 'brute-squad']","[16, 14]",ThumbMuscles,0,25,171,False,politics,1537891223.0,9ite25
285,Why Brett Kavanaugh’s yearbook page matters.,[],[],candianchicksrule,0,18,63,False,politics,1537912711.0,9iwj60
286,"Alabama Revisits Ten Commandments, Hoping for Help from Kavanaugh",[],[],aubonpaine,0,55,107,False,politics,1537900446.0,9iuroi
287,"Midterms: Florida's Rick Scott trails Bill Nelson in US Senate race by 7 points, poll says",[],[],job_van_dam,0,9,75,False,politics,1537907988.0,9ivvg5
288,Senate Judiciary Committee will vote on Kavanaugh's nomination for 9:30am on Friday. (Less than 24 hours after Ford’s testimony and allows McConell prevent a filibuster),[],[],NeedARoommatelol,0,3,50,False,politics,1537916656.0,9ix1p7
289,Twitter Roasts Trump With His Own Tweet After Being Laughed at the UN,"['CornFedIABoy', 'cindylouwhovian', 'Un-EducatedWhiteMale']","[25, 18, 8]",Penn1217,0,29,156,False,politics,1537891813.0,9ithdg
290,Republicans are going to ‘plow right through’ a minefield,[],[],viva_la_vinyl,0,4,41,False,politics,1537919251.0,9ixd7q
291,The first source of the New Yorker bombshell wasn’t Deborah Ramirez. It was Yale alumni.,"['Globalist_Nationlist', 'Brandeez0', 'EwwYetiPubes', 'Showmethepathplease']","[1014, 283, 245, 220]",jaug1,0,140,5511,False,politics,1537824540.0,9im1tv
292,Brett Kavanaugh and the Cruelty of Male Bonding,[],[],planitorsunion,0,11,81,False,politics,1537906180.0,9ivm78
293,Judge Restores Grizzly Bears' Protections As Endangered Species,"['Chit-fur-brains', 'Usernamesareoutdated', 'Goodbye11035Karma']","[10, 7, 5]",pnewell,0,8,272,False,politics,1537880098.0,9irv1o
294,"National parks bearing brunt of climate change, scientists find",[],[],asminaut,0,1,69,False,politics,1537907410.0,9ivskf
295,CNN's Lemon gets emotional discussing experience with sexual assault,"['Guera66', 'brainsong']","[69, 41]",Guera66,0,43,267,False,politics,1537880945.0,9irytw
296,Murkowski says Kavanaugh's second accuser should testify,[],[],dannlee,0,3,123,False,politics,1537895854.0,9iu3ci
297,Avenatti Claims to Have Evidence That Brett Kavanaugh Was Involved in 'Gang Rapes' in High School,"['syncopator', 'ghettobruja', 'rikki-tikki-deadly', 'master_dude']","[6581, 4108, 3091, 2564]",Yzily,0,4168,25054,False,politics,1537815004.0,9iko2q
298,'I'm Confident We're Going to Win': Republicans Are Now Bullish About Confirming Brett Kavanaugh Very Soon,[],[],PoliticsBeepBooper,0,70,53,False,politics,1537912898.0,9iwk2o
299,Michael Avenatti Implicates Kavanaugh in Pattern of Teenage Sexual Assault,"['kevinnetter', '2Cosmic_2Charlie', '4535435435345345']","[98, 80, 78]",holierthanthee,0,102,1284,False,politics,1537849309.0,9ip2n4
300,Donald Trump's economic boasts draw laughter from world leaders at United Nations,[],[],Baarney23,0,1,72,False,politics,1537907333.0,9ivs61
301,McConnell: I Believe We Have The Votes To Confirm Kavanaugh,[],[],toincosser,0,84,84,False,politics,1537902856.0,9iv4nt
302,"Grassley Announces Friday Committee Vote On Kavanaugh, Day After Hearing",[],[],EmoLibrarian,0,15,50,False,politics,1537915602.0,9iwwut
303,Voter ID law revived in major setback to Native American voters,[],[],westondeboer,0,10,142,False,politics,1537893020.0,9itny4
304,Milwaukee County Republicans' tweet mocks accusations against Supreme Court nominee Brett Kavanaugh,[],[],DJTsVaginaMonologue,0,14,123,False,politics,1537896695.0,9iu7u5
305,"In his speech at the U.N., Trump again embraces Poland’s shift away from liberal democracy",[],[],aubonpaine,0,6,79,False,politics,1537904408.0,9ivcos
306,Brett Kavanaugh developments - live updates: Senate Judiciary Committee schedules Friday vote,[],[],BiblicalGodlike,0,7,49,False,politics,1537914813.0,9iwt5n
