,title,comments_author_lst,comments_score_lst,author,guilded,num_comments,score,pinned,subreddit,created_utc,r_id
0,r/politics Wants You! (...to register to vote for National Voter Registration Day),"['rutefoot', 'Seize-The-Meanies', 'Firstofhispaw', 'PossiblyADoucheBag']","[416, 322, 207, 189]",likeafox,0,588,2627,False,politics,1537877481.0,9irkg3
1,We are Secretaries of State Steve Simon (MN) and Kim Wyman (WA) - today is National Voter Registration Day and we want you to get registered! Ask Us Anything!,"['A_Syrian_Named_Lia', 'DesperateSysadmin', 'AncientMarinade', 'MNSecofState']","[67, 54, 51, 47]",WA_SecretaryOfState,0,355,1437,False,politics,1537881852.0,9is2zm
2,President Trump Is Literally the Laughingstock of the World,[],[],tank_trap,0,2468,29320,False,politics,1537905532.0,9ivipc
3,Trump's 'She Was Drunk' Argument Is a Disaster for Republicans,[],[],AldoTheeApache,0,732,7131,False,politics,1537908456.0,9ivxxr
4,"Kavanaugh says it was legal for seniors to drink when he was in high school, but Maryland's drinking age was raised to 21 when he was 17",[],[],AshleytheTaguel,0,611,5127,False,politics,1537912636.0,9iwiru
5,The World Just Laughed at Donald Trump,[],[],HottiAvenatti,1,1921,27156,False,politics,1537893789.0,9itrwt
6,Twitter Users Burn Sarah Sanders After She Says Every Supreme Court Nominee Deserves A Vote,[],[],MCStuttteringBbuddha,0,205,3057,False,politics,1537910890.0,9iwa87
7,Trump Probably Gonna Go Bomb Some Countries After U.N. Assembly Laughs in His Face,[],[],Trump_Wears_Diapers,0,423,4426,False,politics,1537903225.0,9iv6lm
8,We Now Have Even More Proof That Family Separation Was the Policy,[],[],RyanSmith,1,152,3171,False,politics,1537907237.0,9ivro7
9,"On Reddit, Russian propagandists try new tricks",[],[],Nerd_199,3,331,1932,False,politics,1537916661.0,9ix1q7
10,Sanders: Kavanaugh accusers 'have risked their lives to come forward',[],[],Wr4thofkhan,0,375,4310,False,politics,1537900317.0,9iuqzy
11,Watch: Donald Trump laughed at by U.N. General Assembly for claiming his administration is greatest in history,"['CrushMyCamel', 'AnotherAccount636', 'TrumpImpeachedInJuly', 'legomaniac89']","[15850, 8213, 7762, 5718]",stupidstupidreddit2,3,6269,53976,False,politics,1537887503.0,9isuk2
12,The United Nations literally laughs at Trump,"['whatwhatinthepretzel', 'ImanShumpertplus', 'westondeboer']","[616, 533, 205]",StevenSanders90210,0,475,8960,False,politics,1537890910.0,9itcha
13,UN audience laughs when Trump boasts of achievements,"['Grsz11', '_Reformed-Peridot_']","[2173, 499]",thenewsmans,0,692,10937,False,politics,1537888734.0,9it0zs
14,"Michael Avenatti Is a Relentless Self-Promoter, But He Hasn't Been Wrong Yet",[],[],abid111official,0,817,5346,False,politics,1537895946.0,9iu3um
15,The virginity defense is a reminder of our ignorance about sexual violence,[],[],wonderingsocrates,0,256,3984,False,politics,1537900266.0,9iuqqs
16,Schumer demands McConnell apologize to Kavanaugh accuser,[],[],FunnyWut,0,120,2343,False,politics,1537908988.0,9iw0l6
17,Murkowski: FBI investigation into Kavanaugh would ‘clear up all the questions’,"['abourne', '_PM_ME_UR_CRITS_', 'rikki-tikki-deadly']","[1739, 629, 404]",BEARlovesCOOKIE,0,963,10438,False,politics,1537886856.0,9isrg0
18,"‘People actually laughed at a president’: At U.N. speech, Trump suffers the fate he always feared",[],[],_basquiat,0,161,1874,False,politics,1537911705.0,9iwe90
19,Boulder’s Deborah Ramirez “adamant” that FBI should investigate her claims against Kavanaugh,[],[],progress18,0,347,5059,False,politics,1537893481.0,9itqba
20,"Kavanaugh claims he had a sterling reputation at Yale, is immediately shot down by ex-roommate","['letdogsvote', 'Jeffersons_Mammoth', 'JDSchu']","[3031, 1151, 1134]",Yzily,0,1214,14537,False,politics,1537884045.0,9isd8p
21,Trump greeted with laughter while touting his administration at UN,"['nightschwing', 'imnotanevilwitch', 'Geaux', 'LudovicoSpecs', 'Jeffersons_Mammoth']","[623, 234, 213, 203, 188]",Tangocan,0,371,6304,False,politics,1537887628.0,9isv6a
22,Kavanaugh’s Yale Classmate Casts Doubt On “I Was A College Virgin” Story,[],[],mps1729,0,252,3135,False,politics,1537898309.0,9iugfn
23,"Democrats: Hold Kavanaugh to his Own Standard for Bill Clinton, and Take Him Apart Piece by Painful Piece",[],[],ToadProphet,0,58,1414,False,politics,1537912372.0,9iwhi5
24,Rand Paul Wants to Scrap Some U.S. Sanctions on Russia,[],[],aubonpaine,0,385,3526,False,politics,1537894659.0,9itwsa
25,"Yale Colleague Accuses Kavanaugh of Lying About Virginity Status, Doesn’t Want to Comment Further",[],[],PutinsPawn,0,149,2092,False,politics,1537902909.0,9iv4z6
26,GOP Senate candidate suggests Brett Kavanaugh should be confirmed even if he’s guilty,[],[],TheCocksmith,0,258,2724,False,politics,1537897044.0,9iu9p5
27,Trump claims he meant to make world leaders laugh during UN speech when he claimed his administration was most successful in US history,[],[],The-Autarkh,0,251,1665,False,politics,1537905897.0,9ivkrv
28,World Audibly Laughs After Trump Claims His Administration Among Most Accomplished in US History During UN Address,"['Eurynom0s', 'Frying_Dutchman', 'MaresEatOatsAndDoes']","[230, 168, 112]",abott1984,0,185,4541,False,politics,1537887614.0,9isv3s
29,Kaine trolls Trump over laughter at UN by resurfacing old tweet calling Obama a 'laughingstock',[],[],dannlee,0,68,2647,False,politics,1537896346.0,9iu5zr
30,"Americans! Your voting habits are terrible, so register to vote","['distractonator', 'lJanusl']","[346, 73]",FunAir,0,484,6694,False,politics,1537881874.0,9is338
31,Kavanaugh’s College Roommate Releases Statement About New Accuser: ‘I Believe Her’,"['billthomson', 'JacobCrim88']","[1295, 553]",billthomson,0,569,8176,False,politics,1537879867.0,9iru1c
32,Avenatti Reacts to Brett Kavanaugh’s Fox News Interview: ‘He’s a Liar’,"['VladimirBinPutin', 'drogonz', 'JacobCrim88', 'wonderingsocrates']","[1552, 670, 472, 427]",wonderingsocrates,0,797,7177,False,politics,1537880567.0,9irx40
33,Kavanaugh May Now Need an FBI Investigation,[],[],PM_ME_YOUR_KOMPROMAT,0,170,1440,False,politics,1537906834.0,9ivpme
34,Murkowski wants Senate panel to hear from second Kavanaugh accuser,[],[],progress18,0,78,1680,False,politics,1537903335.0,9iv75z
35,"Yes, we can investigate decades-old allegations against judges. I’ve done it.",[],[],PutinsPawn,0,24,1224,False,politics,1537908267.0,9ivwx7
36,"Texas board of education removes Helen Keller and Hillary Clinton from history texts, keeps Bill Clinton's impeachment, and Moses, whose “principles of laws and government institutions informed the American founding documents”","['PoliticalThrowawayy', 'ElonTrump', 'ImInterested', 'Junkstar']","[208, 121, 105, 98]",chicomathmom,0,379,2728,False,politics,1537892349.0,9itk90
37,"Brett Kavanaugh’s Yale Roommate Says Nominee Was ‘Capable’ of Sexual Misconduct, Was ‘Aggressive’ When Drunk","['Dickless-4-Chiklis', 'abcde9999', 'ItsJustAJokeLol']","[8124, 2314, 1851]",progress18,0,3439,26033,False,politics,1537873426.0,9ir5wd
38,Critics Say Kavanaugh's Soft-Ball Interview on Fox Shows Just 'How Blatantly He'll Lie to Try and Advance His Career',"['AlertVast7', 'legomaniac89', 'tejmin']","[242, 208, 82]",iampv30,0,135,3825,False,politics,1537886424.0,9isp9u
39,Poll: Dem leads Arizona race for Flake’s Senate seat by 3 points,"['VladimirBinPutin', 'Leenewyork', 'StevenSanders90210', 'Lionel_Hutz_Law']","[556, 298, 261, 210]",Lionel_Hutz_Law,0,334,5157,False,politics,1537881680.0,9is295
40,Judiciary Committee reschedules Kavanaugh vote for Friday morning,[],[],mepper,0,298,893,False,politics,1537914732.0,9iwssk
41,How in the world is Mark Judge not testifying?,"['PoliticalPleionosis', 'muffler48']","[505, 151]",SamDumberg,0,155,3050,False,politics,1537889442.0,9it4no
42,Kavanaugh’s memory of himself in high school is very different than his portrayal in the yearbook,"['Ninjasteevo', 'appleorangered9293']","[876, 445]",Mandar391,0,370,4086,False,politics,1537883288.0,9is9om
43,Yale Law professor who endorsed Kavanaugh says he has second thoughts,"['RellenD', 'Laser-circus', 'mbrant66']","[384, 115, 97]",Innocul8,0,212,5025,False,politics,1537879818.0,9irtso
44,Newly Uncovered Memo Suggests Kirstjen Nielsen Lied to Congress About Family Separation,[],[],N0tAG00dUserName,0,48,641,False,politics,1537919641.0,9ixevr
45,Kavanaugh says he never blacked out from drinking. Yeah right.,[],[],docellisdee,0,148,910,False,politics,1537910629.0,9iw8zr
46,Lisa Murkowski Delivers Message: Take Kavanaugh Accusations Seriously,['VladimirBinPutin'],[191],slakmehl,0,160,2121,False,politics,1537892734.0,9itmeb
47,Military worship hurts US democracy,"['wittyname83', 'Slaysme', 'muffler48']","[305, 273, 201]",EmoLibrarian,0,360,3806,False,politics,1537881707.0,9is2dr
48,"U.S. displaying ‘Nazi disposition’ under Trump, Iranian leader tells UN",[],[],jalertisane,0,79,1119,False,politics,1537904610.0,9ivdrg
49,"Analyst Finds Gov. Scott Walker May Have Cost Wisconsin 80,000 Jobs","['HandSack135', 'Jeffersons_Mammoth', 'AT5squared']","[238, 158, 73]",career_whatcareer,0,122,2626,False,politics,1537887666.0,9isve3
50,Trump is the laughingstock of the world,[],[],docellisdee,0,41,652,False,politics,1537915421.0,9iwvyy
51,Ex-UN chief Ban Ki-moon says US healthcare system is 'morally wrong',"['Scubalefty', 'morningreis']","[2480, 508]",bint_elkhandaq,0,1003,11643,False,politics,1537866916.0,9iqlip
52,U.S. diplomats blast President Trump's 'unpatriotic' United Nations speech: 'He is accepting the Putin view of the world',[],[],cybersecp,0,28,771,False,politics,1537911055.0,9iwb2y
53,World leaders literally laugh at Trump when he claims he has 'accomplished more than almost any administration',"['Wombatwoozoid', 'minimalist_reply', 'crimsonBZD']","[178, 82, 73]",mepper,0,90,2330,False,politics,1537888347.0,9isz0f
54,'Baby Trump' balloon to float through Chicago for March to the Polls rally,[],[],Igneous_Aves,0,50,963,False,politics,1537904989.0,9ivfwf
55,Brett Kavanaugh's Fox News Interview Spelled Out the Shameless Depravity of This Whole Process,[],[],RyanSmith,0,95,1144,False,politics,1537901689.0,9iuydv
56,"Michael Avenatti Warns Trump, Kavanaugh: ‘Be Very, Very Careful’ About What You Do Next","['smutketeer', 'KerbalFactorioLeague', 'WOODEN_COUCH', 'viva_la_vinyl']","[3280, 1335, 825, 771]",WOODEN_COUCH,0,1490,7841,False,politics,1537869505.0,9iqt2g
57,I Was The US Treasurer. I Didn't Tell The FBI Background Checkers About My Abuser.,[],[],CrushMyCamel,0,14,768,False,politics,1537909913.0,9iw5ew
58,Top Republican on Tax Subcommittee Received Yacht Loan From Foreign Bank Lobbying on 2017 Tax Bill,"['Molotova', 'Scubalefty']","[375, 173]",Markovitch12,0,96,4093,False,politics,1537877518.0,9irkkv
59,"Michael Avenatti expects new accuser of Supreme Court pick Brett Kavanaugh to go public in next 36 hours, but only after 'adequate security measures'",[],[],Quirkiness101,0,199,794,False,politics,1537908761.0,9ivzgj
60,"Trump Cracks, Calls Second Kavanaugh Accuser ""Totally Inebriated"" and ""All Messed Up""",[],[],Skooma_Lite,0,54,684,False,politics,1537911418.0,9iwctz
61,Trump bragged about his presidency and world leaders laughed,"['johnny_utah16', 'segvcore', 'Bobinct']","[90, 66, 43]",dannlee,0,56,1986,False,politics,1537888641.0,9it0im
62,The GOP’s Least-Worst Option Is If Kavanaugh Withdraws — And Soon,"['PhyterNL', 'KeyGas']","[992, 266]",madam1,0,471,4730,False,politics,1537873957.0,9ir7qm
63,UN audience literally bursts out laughing at Trump’s speech,"['oldhippiesailor', 'Bootleking']","[145, 101]",bluestblue,0,95,1826,False,politics,1537890468.0,9ita76
64,Pigs All the Way Down: Kavanaugh and our rotten ruling class,"['JeremyMo88', 'trundyl', 'Local_Human']","[129, 61, 55]",LudovicoSpecs,0,125,2515,False,politics,1537884229.0,9isecm
65,A Leaked White House Memo Reveals Trump’s Plan For Going After Google and Facebook,"['luc-jean-diparc', 'saltiestmanindaworld']","[765, 361]",beach-bum,0,370,3705,False,politics,1537876851.0,9irhxm
66,Murkowski backs FBI probe of Kavanaugh claims,"['Defyingnoodles', 'AndIAmEric']","[143, 93]",SplittingEnnui,0,45,1736,False,politics,1537890285.0,9it97d
67,Kaine is right: Record jobs growth streak precedes Trump,"['letdogsvote', 'pooponagoose', 'reatest']","[115, 57, 47]",Sariel007,0,72,2422,False,politics,1537883573.0,9isb26
68,"The DHS Secretary Said There Was ""No Policy Of Separating Families."" A Memo Proves There Was.",[],[],caftanbeerfart,0,29,543,False,politics,1537914324.0,9iwqxi
69,Burn down the 'boys will be boys' club,"['RussiaIfUrListening', 'Casual_OCD', 'juanzy']","[108, 30, 25]",RussiaIfUrListening,0,48,1784,False,politics,1537888820.0,9it1fq
70,The Republican party is about to face the wrath of women,"['By_your_command', 'RosesAreBad']","[755, 255]",newnemo,0,628,4160,False,politics,1537873582.0,9ir6en
71,Poll: Nelson leads Scott in Florida by 7 points,[],[],Whoshabooboo,0,149,1236,False,politics,1537895611.0,9iu1zz
72,"Kavanaugh 'Does Not Have The Support Of Yale Law School,' Student Says",[],[],mixplate,0,25,609,False,politics,1537910029.0,9iw609
73,World leaders stumble upon a potent response to Trump’s claims: Laughter,"['i-am-sancho', 'ConsistentArmadillo', 'throwaweigh69696969', 'formeraide']","[188, 80, 57, 50]",i-am-sancho,0,75,1543,False,politics,1537890862.0,9itc89
74,"Rod Rosenstein’s departure was imminent. Now he likely survives until after the midterms, officials say",[],[],i-am-sancho,0,104,457,False,politics,1537917000.0,9ix3bp
75,Brett Kavanaugh’s Fox News Interview Was a Disaster—For Him,['ideogon'],[257],ideogon,0,97,1347,False,politics,1537892841.0,9itmz5
76,Tomi Lahren faces furious backlash after telling former first lady ‘sit down Michelle’,[],[],Assholio69,0,135,579,False,politics,1537909488.0,9iw391
77,Republicans reportedly set to vote on Kavanaugh confirmation over the weekend,[],[],StupendousMan1995,0,114,739,False,politics,1537904316.0,9ivc90
78,Twitter is taking aim at Brett Kavanaugh for interrupting his wife on Fox News,"['dubblies', 'luc-jean-diparc', 'letdogsvote']","[756, 555, 386]",progress18,0,217,2214,False,politics,1537881722.0,9is2fq
79,A Supreme Court Case Could Liberate Trump to Pardon His Associates,[],[],Trump_Wears_Diapers,0,86,861,False,politics,1537899538.0,9iumy9
80,"Senate Judiciary Committee schedules Friday vote on Kavanaugh nomination, one day after hearing from accuser",[],[],gwarslash,0,115,424,False,politics,1537915170.0,9iwusx
81,"Kavanaugh says it was legal for seniors to drink when he was in high school, but Maryland's drinking age was raised to 21 when he was 17",[],[],docellisdee,0,34,435,False,politics,1537914208.0,9iwqdb
82,Republicans keep saying there’s no evidence behind claims of Kavanaugh’s misconduct. That’s not true.,[],[],geodynamics,0,18,596,False,politics,1537906754.0,9ivp7h
83,Mormon women’s group calls on Senate to postpone Kavanaugh confirmation until allegations are investigated,"['drogonz', 'NEEThimesama', 'PoliticalPleionosis']","[187, 91, 55]",NEEThimesama,0,105,1835,False,politics,1537883529.0,9isaty
84,Opinion | Kavanaugh Defenders Are Sending A Message: Women Aren't People,[],[],Bullingdon1973,0,56,966,False,politics,1537896397.0,9iu69q
85,"The Long Decline of DKE, Brett Kavanaugh’s Fraternity at Yale",[],[],wonderingsocrates,1,59,640,False,politics,1537904412.0,9ivcpx
86,Padma Lakshmi: I Was Raped at 16 and I Kept Silent,['GDeMarco'],[523],WOODEN_COUCH,0,56,1333,False,politics,1537889237.0,9it3la
87,Anita Hill: Kavanaugh hearing 'cannot be fair' without investigation,[],[],Athelric,0,14,421,False,politics,1537911865.0,9iwf1s
88,Murkowski backs FBI probe into Kavanaugh accusations,[],[],cybersecp,0,32,393,False,politics,1537912795.0,9iwjk9
89,Kavanaugh’s Drinking Should Be Investigated,[],[],romeoinverona,0,35,329,False,politics,1537918882.0,9ixbje
90,Memo Confirms that prosecuting parents--and separating families--was meant to deter migration,"['czj113', 'theseekerofbacon', 'oneonegreenelftoken']","[108, 60, 34]",FluidHips,0,69,1780,False,politics,1537881420.0,9is122
91,UN members laugh at Trump after he says his administration has 'accomplished more than almost any in US history',"['Moop4269', 'xXGNR4EVERXx', 'Edward_Tellerhands']","[78, 21, 20]",tracygav,0,47,1200,False,politics,1537888487.0,9iszq9
92,Group to project 'Kavanaugh is a sexual predator' onto Supreme Court,[],[],randyrandp,0,31,722,False,politics,1537898518.0,9iuhik
93,Republicans Are Standing by Kavanaugh Just to Own the Libs,[],[],missmegz1492,0,81,496,False,politics,1537905766.0,9ivk2c
94,Sen. Ted Cruz of Texas heckled in restaurant over Kavanaugh controversy,"['Electrical_Pattern', 'DonaldKey', 'BigGermanGuy']","[194, 162, 82]",Ed_Krassenstein,0,230,2218,False,politics,1537875801.0,9irea1
95,"Kavanaugh wouldn't have done Fox interview if he wasn't in trouble, says Dem strategist",[],[],Showmethepathplease,0,35,411,False,politics,1537909847.0,9iw53m
96,"At the United Nations, Trump proves the world is indeed laughing at America",[],[],WorkTomorrow,0,21,728,False,politics,1537896889.0,9iu8uy
97,"Whatever happens, Rosenstein shouldn’t resign",[],[],docellisdee,0,17,345,False,politics,1537912659.0,9iwiwg
98,Five major contradictions Brett Kavanaugh made in 'unprecedented' interview with wife,[],[],RyanSmith,0,23,312,False,politics,1537914407.0,9iwr9t
99,Bill Nelson leads Rick Scott by 7 points in new Quinnipiac poll,[],[],readet,0,32,633,False,politics,1537898906.0,9iujm7
100,Trump Gets Mercilessly Mocked Over His ‘False Acquisitions’ Twitter Typo,"['wwarnout', 'kaleosaurusrex', 'shabby47']","[202, 81, 60]",Trumpcarekills,0,105,1617,False,politics,1537880088.0,9iruzw
101,The Game is Rigged: Congress Invites No Consumer Privacy Advocates to its Consumer Privacy Hearing,[],[],prime_nommer,0,6,264,False,politics,1537918667.0,9ixame
102,"Whatever happens, Rosenstein shouldn’t resign",[],[],docellisdee,0,17,349,False,politics,1537912659.0,9iwiwg
103,"At the United Nations, Trump proves the world is indeed laughing at America",[],[],WorkTomorrow,0,21,729,False,politics,1537896889.0,9iu8uy
104,Five major contradictions Brett Kavanaugh made in 'unprecedented' interview with wife,[],[],RyanSmith,0,24,315,False,politics,1537914407.0,9iwr9t
105,Bill Nelson leads Rick Scott by 7 points in new Quinnipiac poll,[],[],readet,0,32,632,False,politics,1537898906.0,9iujm7
106,Trump Gets Mercilessly Mocked Over His ‘False Acquisitions’ Twitter Typo,"['wwarnout', 'kaleosaurusrex', 'shabby47']","[197, 83, 61]",Trumpcarekills,0,105,1612,False,politics,1537880088.0,9iruzw
107,'Shameless': Trump Repeals Rule Meant to Prevent Oil-Carrying 'Bomb Trains' From Derailing and Exploding,[],[],Mandar391,0,26,465,False,politics,1537904930.0,9ivfl0
108,Stormy Daniels’ lawyer says third Kavanaugh accuser is ready to come forward,"['amputeenager', 'Lumburg76', 'BigGermanGuy', 'FadingTruth', 'PDXGrizz']","[94, 42, 38, 31, 29]",Veloce45,0,157,1180,False,politics,1537885440.0,9iskda
109,"Lawyer, not Republican senators, to question Kavanaugh, accuser: lawmaker",[],[],anzhalyumitethe,0,128,622,False,politics,1537897728.0,9iude4
110,Macron Rejects Trade Deals with Countries Outside of Paris Climate Accord,[],[],teemosupremo,0,17,257,False,politics,1537916831.0,9ix2iv
111,Oil prices reach four-year high as OPEC defies Trump,[],[],Ryan_Abraham,0,64,587,False,politics,1537898591.0,9iuhx1
112,Kavanaugh And His High School Friends Listed As ‘Alumni’ Of A Girl In Yearbook,"['TedCruzsAnalFissure', 'jefferson_waterboat', 'auglove']","[232, 111, 89]",EmoLibrarian,0,93,1217,False,politics,1537883954.0,9iscsm
113,Brett Kavanaugh’s Yale Classmates Remember Him In A “Drinky Crowd”,[],[],ThouHastLostAn8th,0,40,258,False,politics,1537916063.0,9iwz06
114,The moment when the Republican Party lost its mind and embraced judicial nihilism,[],[],Hoxha_Posadist,0,23,650,False,politics,1537896067.0,9iu4hn
115,President Trump Boasted About His Accomplishments at the United Nations. The Audience Laughed,[],[],nattywow,0,23,721,False,politics,1537893558.0,9itqq9
116,Mormon women call on Mormon senators to delay Kavanaugh vote,[],[],freddiethebaer,0,21,241,False,politics,1537918782.0,9ixb3k
117,"Trump Misspells Tweet, Accuses Democrats of Using 'False Acquisitions' to Destroy Kavanaugh","['Brock_Hard_Canuck', 'sausage_ditka_bulls', 'xumun', 'FertilityHollis']","[870, 381, 297, 226]",headee,0,274,2557,False,politics,1537869106.0,9iqrxh
118,Donald Trump's worldview was laid bare at the UN -- and it should worry anyone who understands history,[],[],maxwellhill,0,32,238,False,politics,1537916965.0,9ix35k
119,"Texas private school leader harasses Michael Avenatti with expletive filled DMs, suspended indefinitely","['bananafor', 'jlaux', 'muffler48', 'DNiiice']","[182, 76, 60, 54]",maxwellhill,0,75,833,False,politics,1537890391.0,9it9sh
120,McConnell says Supreme Court nominee Kavanaugh will be confirmed,[],[],WOODEN_COUCH,0,123,471,False,politics,1537901654.0,9iuy6n
121,"Cosby publicist: Cosby, Kavanaugh both victims of a 'sex war'",[],[],Lixard52,0,120,355,False,politics,1537907892.0,9ivuzz
122,This Is the Last Chance to Hold Brett Kavanaugh Accountable,[],[],planitorsunion,0,13,340,False,politics,1537907867.0,9ivuw1
123,"Michelle Obama, black organizations push midterm voter turnout",[],[],ThePowerOfNoLib,0,5,342,False,politics,1537907481.0,9ivsy6
124,US diplomat found dead in Madagascar,[],[],cybersecp,0,44,230,False,politics,1537915272.0,9iwv9b
125,Donald Trump's worldview was laid bare at the UN -- and it should worry anyone who understands history,[],[],jalertisane,0,23,274,False,politics,1537911015.0,9iwavk
126,Mormon Women for Ethical Government calls for probe over Brett Kavanaugh allegations,[],[],wiznewton,0,12,216,False,politics,1537916863.0,9ix2oh
127,Sexual assault accusations against Brett Kavanaugh are consistent with mark judge’s stories of drunken aggression at their High School.,[],[],Globalist_Nationlist,0,12,313,False,politics,1537908286.0,9ivx1i
128,"Historian says Trump probably hasn't read Kavanaugh, Gorsuch opinions","['geodynamics', '2_Spicy_2_Impeach', 'PoliticalPleionosis']","[156, 67, 36]",Yzily,0,84,923,False,politics,1537885043.0,9isigp
129,Texas Just Said In Court That A Black Girl Had To Stand For The Pledge Of Allegiance,[],[],whoiswillo,0,84,217,False,politics,1537915020.0,9iwu5h
130,"Attorney for Boulder’s Deborah Ramirez expresses frustration with Senate Judiciary Committee, will appear on CNN",[],[],Veloce45,0,20,182,False,politics,1537920286.0,9ixhkk
131,Lisa Murkowski Hints FBI Probe Needed For Kavanaugh Sexual Assault Allegations,[],[],growyurown,0,16,294,False,politics,1537907815.0,9ivum3
132,What more evidence of contempt for women is needed?,[],[],docellisdee,0,12,262,False,politics,1537910112.0,9iw6f0
133,Ted Cruz heckled out of D.C. restaurant: ‘We believe survivors!’,"['HollyDiver', 'BigScarySmokeMonster', 'Var_MyName', 'only-read-headlines']","[8220, 4832, 3965, 2479]",danielthetemp,0,4602,29718,False,politics,1537843983.0,9iohcp
134,Tom Steyer to Spend Millions Backing Andrew Gillum in Florida,[],[],throwaway5272,0,16,170,False,politics,1537919648.0,9ixewo
135,Avenatti: I wasn’t scammed,[],[],Assholio69,0,138,204,False,politics,1537914195.0,9iwqap
136,Opinion: The privilege of the master class. My experience in Judge Kavanaugh's world,[],[],lightninhopkins,0,8,284,False,politics,1537906318.0,9ivmyq
137,"Trump is a laughingstock. But if we weren't laughing, we'd be crying",[],[],Assholio69,0,8,232,False,politics,1537910230.0,9iw704
138,Poll: Tester leads GOP challenger by 4 in Montana,[],[],VOTE-November-6-2018,0,34,443,False,politics,1537896409.0,9iu6c0
139,World leaders laugh as Trump claims his administration has accomplished more than any other in US history,"['brianwantsblood', 'ProgressiveLogic', 'sinnerbenkei']","[31, 15, 12]",ProgressiveLogic,0,34,597,False,politics,1537889967.0,9it7ha
140,House conservatives threaten Rosenstein impeachment vote,[],[],danielthetemp,0,73,403,False,politics,1537898151.0,9iufku
141,How to humiliate a woman: the ugly lesson of Brett Kavanaugh's yearbook,[],[],Assholio69,0,28,517,False,politics,1537893461.0,9itq8d
142,Senate Republicans hire female sex-crimes prosecutor to grill Kavanaugh and accuser Ford at hearing,[],[],_basquiat,0,72,284,False,politics,1537905077.0,9ivgd5
143,Lawyer for Christine Blasey Ford working for free,"['SpankyTheSpank', 'brasswirebrush', 'scdayo', 'wildwaterwhisperer']","[117, 60, 58, 41]",FunAir,0,33,1116,False,politics,1537877259.0,9irjju
144,Conspiracy-theorist Republican congressman blames Obama after siblings film ad for his opponent,[],[],rit56,0,28,381,False,politics,1537897908.0,9iuec1
145,‘No Intercourse’: Republican Vying to Boot Democrat from Senate Has Rambling Defense of Kavanaugh,[],[],michkennedy,0,24,221,False,politics,1537909168.0,9iw1i0
146,Brett Kavanaugh’s First and Highest Loyalty Is to the Right-Wing Machine,[],[],Pro_Game_Xom9k,0,7,458,False,politics,1537894141.0,9itty1
147,U.S. Military Contractor Kicked Out Of Afghanistan Over White Nationalist Patch,[],[],cybersecp,0,31,193,False,politics,1537910586.0,9iw8qo
148,'He became aggressive and belligerent when he was very drunk': Brett Kavanaugh's former roommate sides with accuser who claims he exposed himself at college party,"['Loveinthemud', 'new_opportunities']","[273, 115]",ProgressiveLogic,1,165,3050,False,politics,1537855894.0,9ipp3c
149,GOP senate candidate says he supports preexisting conditions while backing lawsuit to end them,['UWCG'],[28],UWCG,0,15,438,False,politics,1537893128.0,9itoiq
150,Ted Cruz Spotted On Flight Looking At Photo Of Senate Rival Beto O'Rourke,"['thisishorsepoop', 'progress18', 'JacobCrim88', 'pakattak']","[177, 118, 82, 82]",nano2492,0,109,552,False,politics,1537888571.0,9it05z
