,author,comments_author_lst,comments_score_lst,created_utc,guilded,num_comments,pinned,r_id,score,subreddit,title
0,markssharkpark,[],[],1538329191.0,0,267,False,9k89xr,3551,explainlikeimfive,ELI5: what is 'the golden ratio' and what is its relevance to the way plants grow?
1,doctorinfinite,[],[],1538320026.0,0,130,False,9k70qx,274,explainlikeimfive,ELI5: Why do American and British (for one) television look so different?
2,Vexvertigo,[],[],1538295954.0,0,95,False,9k4q7r,302,explainlikeimfive,ELI5: How do computers turn a million yes and nos into a basic program?
3,JimmyThrowaway1,[],[],1538328745.0,0,17,False,9k87ns,41,explainlikeimfive,ELI5: Why electrons do not interact/get affected with strong force?
4,PinealPunch,[],[],1538326790.0,0,15,False,9k7xk0,34,explainlikeimfive,ELI5: Why do metal playgrounds shock you if they are (literally) always grounded?
5,JossyMossy,[],[],1538353271.0,0,1,False,9kbhvm,3,explainlikeimfive,ELI5: How do surgeons know what can be cut and what can not? Can every part of your body 'heal' like a cut?
6,Kornell2018,[],[],1538343413.0,0,1,False,9ka9c5,3,explainlikeimfive,ELI5: What is Modernism and other movements?
7,Parzival_03,[],[],1538342774.0,0,14,False,9ka687,3,explainlikeimfive,"ELI5 How do rockets ""fly""in space?"
8,ChristianJ84,[],[],1538341122.0,0,7,False,9k9y00,3,explainlikeimfive,ELI5 why a smartphone camera makes several flashes before taking the actual picture?
9,Bobswarly88,[],[],1538326747.0,0,9,False,9k7xc5,7,explainlikeimfive,"ELI5: When listening to loud music, why is it that we feel and see the effects of low frequency notes and not high frequency notes?"
10,WaxuTutu,[],[],1538339204.0,0,8,False,9k9old,3,explainlikeimfive,"ELI5: Why does atomic radius ""reset"" when an element shell is filled?"
11,KendrickLama1,['diekurzekatze'],[12510],1538193527.0,0,1322,False,9jtnaw,12249,explainlikeimfive,ELI5: Why is the Queen in chess the most effective piece?
12,Neon-Predator,[],[],1538320888.0,0,6,False,9k74ne,8,explainlikeimfive,ELI5: Why are mold spores so ubiquitous to all environments? How do mold spores spread to the point where they are basically everywhere?
13,sloxxy,[],[],1538344226.0,0,3,False,9kad40,2,explainlikeimfive,ELI5: Where does wind start?
14,Don_Hoomer,[],[],1538346150.0,0,3,False,9kam3t,1,explainlikeimfive,ELI5: The four seasons
15,Galaxy_Bot,[],[],1538302342.0,0,3,False,9k59my,5,explainlikeimfive,ELI5: 'Liquefaction' of hard soil to quick sand as seen in the recent Indonesian earthquake in the island of Sulawesi
16,monkeymafia24,['BonnieBottom'],[28],1538261697.0,0,11,False,9k1bt1,42,explainlikeimfive,ELI5: Why does fake jewelery turn the skin around it green?
17,beytrod,[],[],1538305290.0,0,3,False,9k5iev,3,explainlikeimfive,ELI5: Why do fingernails grow quicker than toenails?
18,Omstar,[],[],1538316435.0,0,12,False,9k6l9c,1,explainlikeimfive,ELI5: How do genetics actually work?
19,TheIcyPyro,[],[],1538321890.0,0,8,False,9k79cw,0,explainlikeimfive,ELI5: Why does Jupiter have so many moons in comparison with other planets in our solar system?
20,oeynhausener,[],[],1538320962.0,0,6,False,9k7500,1,explainlikeimfive,ELI5: Giant Magnetoresistance and Tunnel Magnetoresistance
21,WaterIsALiquid,[],[],1538316261.0,0,5,False,9k6klc,1,explainlikeimfive,ELI5: How do prosthetics work?
22,Graylander54,[],[],1538280926.0,0,3,False,9k3d6w,5,explainlikeimfive,ELI5: How do Wire Transfer work?
23,5Oprano5,['Helvete-73'],[13],1538257731.0,0,3,False,9k0v1s,12,explainlikeimfive,Eli5: How do we know how prehistoric animals behaved?
24,nomnombubbles,[],[],1538294175.0,0,11,False,9k4lo3,3,explainlikeimfive,ELI5: Why does drinking alcohol make you experience auditory and visionary hallucinations?
25,whatthecraplol,[],[],1538306959.0,0,7,False,9k5ocu,2,explainlikeimfive,ELI5: How does an automatic transmission in a car work?
26,herKushu,,,1538283741.0,0,1,False,9k3owa,2,explainlikeimfive,ELI5: what's the difference between Three dimensional airflow and Two dimensional airflow for Subsonic Airflow.
27,DanTheCan42,[],[],1538282083.0,0,12,False,9k3i0y,2,explainlikeimfive,ELIF: Why does the pitch of voices go up or down when you speed up or slow down a video?
28,emok31,['mister_peeberz'],[16],1538247460.0,0,12,False,9jzkaw,19,explainlikeimfive,"ELI5: How do DNA or cells grow a body? If all DNA or cells are ""identical"" then how to they know to grow a lung or a brain at the right time?"
29,spermwhalejail,[],[],1538274907.0,0,2,False,9k2qys,6,explainlikeimfive,ELI5: Why is nitrogen (rather than some other element) the atom of choice for the creation of a stable protein peptide?
30,Derelict_Desmond,[],[],1538271885.0,0,15,False,9k2fmh,4,explainlikeimfive,ELI5: How does Iambic Pentameter work?
31,toth42,[],[],1538295709.0,0,2,False,9k4pmh,1,explainlikeimfive,ELI5 how Bunsen and co. discovered new metals through spectrochemical analysis
32,nitermania,[],[],1538281842.0,0,8,False,9k3h36,2,explainlikeimfive,ELI5: How does Naloxone work once put into the body? How does it counteract the effects of an overdose?
33,growleroz,['restricteddata'],[66],1538235657.0,0,22,False,9jxvi9,21,explainlikeimfive,ELI5: How did scientists know that uranium could be used to make an atomic bomb?
34,Undercraft_gaming,[],[],1538281479.0,0,6,False,9k3fmn,2,explainlikeimfive,ELI5: The significance of normal force in dynamics
35,kammon2,[],[],1538281000.0,0,4,False,9k3dj3,1,explainlikeimfive,ELI5: How do the cyborg arms where you can control the hand movements with your brain work?
36,cursedbaklava,[],[],1538277598.0,0,10,False,9k30nm,2,explainlikeimfive,"ELI5: If D.I.D patients can have different allergies per alter, how does this work physically? Is it placebo?"
37,KL_boy,[],[],1538289391.0,0,6,False,9k48z1,1,explainlikeimfive,ELI5: What makes a gene dominant and why? Why not just have a 50/50 chance of a gene being expressed?
38,WutsGoodMyDood,[],[],1538282836.0,0,7,False,9k3l5f,1,explainlikeimfive,"ELI5: What makes a CPU well, a CPU?"
39,wildddin,['TheGinnnnnnger'],[5165],1538117211.0,0,205,False,9jkp11,8530,explainlikeimfive,ELI5: Why do (in most cases) our eyes need to be closed for us to be able to sleep? And what happens to people who can sleep with their eyes open?
40,Chrisant000,"['False_Bee', 'Hoax13']","[88, 17]",1538195231.0,0,49,False,9jtt09,86,explainlikeimfive,ELI5: What is Alcohol poisoning?
41,JPGAW,[],[],1538282460.0,0,4,False,9k3jiy,0,explainlikeimfive,"ELI5: Why does skin feel dry after showing, regardless of exposure to water?"
42,themaxviwe,"['OmegaWarrior686', 'RhynoD']","[8, 5]",1538242748.0,0,9,False,9jyxkf,5,explainlikeimfive,ELI5: Why quarks are not able to exist isolated? Why does they have to always be in other particles?
43,communisttankengine,"['helpimapenguin', 'WRSaunders']","[5, 3]",1538253056.0,0,5,False,9k09pr,2,explainlikeimfive,ELI5 how the simple concept of electron shells you learn in middle school relates to concepts about atomic orbitals
44,communisttankengine,['communisttankengine'],[38],1538189872.0,0,24,False,9jta4g,56,explainlikeimfive,ELI5 Why do pickles have less calories than a fresh cucumber of the same size?
45,imnotlegolas,['cosmoboy'],[2],1538228254.0,0,9,False,9jwrhn,5,explainlikeimfive,"ELI5: When exercising, why do muscles hurt not until the next day after sleep?"
46,SenorDuck96,"['rld3x', 'iechosale']","[3, 3]",1538245912.0,0,5,False,9jzct2,2,explainlikeimfive,ELI5: How does a blister form and how do you get rid of one?
47,NitrousAcid,"['tjsunday87', 'kouhoutek', 'marypoppinsbrolly']","[10, 6, 5]",1538211715.0,0,7,False,9jv49a,10,explainlikeimfive,ELI5: Whats the difference between ethics and morals?
48,WhatIsTeleport,"['police-ical', 'cdb03b', 'blipsman']","[12, 5, 5]",1538240468.0,0,11,False,9jylr1,2,explainlikeimfive,ELI5: Why is cake the go-to celebration food?
49,MaddoxX_1996,"['Wormsblink', 'MillerCreek']","[2, 2]",1538229329.0,0,4,False,9jwxan,3,explainlikeimfive,ELI5: How do geologists record historic and pre-historic tsunamis?
50,askingquestionsblog,['cnash'],[4],1538228639.0,0,2,False,9jwtln,2,explainlikeimfive,"ELI5: A ""paean,"" versus an ""encomium,"" versus a ""hagiography"""
51,Techfault,[],[],1538227589.0,0,3,False,9jwo0r,3,explainlikeimfive,ELI5: Why is glucose in the blood filtered into the Bowman’s capsule if it just gets re-absorbed into the blood in the convoluted tubule?
52,SqueamishDesign,"['Holy_City', 'falconzord']","[28, 8]",1538193900.0,0,48,False,9jtolz,16,explainlikeimfive,"ELI5: What is the difference between C, C#, C-- and C++ other than the fact that they are different languages?"
53,GodotF2P,['lollo9770'],[7],1538210951.0,0,7,False,9jv27h,6,explainlikeimfive,ELI5: Why is a liquid not moving when a plane is flying a curve?
54,Tekno9000,[],[],1538241729.0,0,1,False,9jysl5,0,explainlikeimfive,ELI5: What is the difference between S&OP and IBP?
55,Deskbot,['Thrillho29'],[8],1538189017.0,0,3,False,9jt6v4,13,explainlikeimfive,ELI5: How does a stock broker borrow stocks for you to short-sell
56,Classy_Amir,['Straight-faced_solo'],[6],1538252546.0,0,10,False,9k07ev,0,explainlikeimfive,ELI5: How does a barrel work in a firearm?
57,absolutely_cancer,['DaniRainbow'],[7],1538200887.0,0,2,False,9juann,5,explainlikeimfive,ELI5 Why does our ability to resist urges fade and we lose control when we just arrive at the bathroom
58,lzldmb,['kinyutaka'],[4],1538230777.0,0,5,False,9jx5hj,2,explainlikeimfive,ELI5: How does allowing the left turn lane to go first and only one direction at a time at an intersection improve traffic flow?
59,FlockingSheep,['CamKen'],[13],1538191574.0,0,2,False,9jtggd,7,explainlikeimfive,ELI5: Why is there an interference with bluetooth headsets whenever shredding documents?
60,ducksandshawarma,"['Bigjoemonger', 'ViskerRatio']","[11, 6]",1538215618.0,0,7,False,9jvef2,1,explainlikeimfive,ELI5: What is a Memory Cache ? And how does it resemble and differs from RAM ?
61,sgsfx,[],[],1538228485.0,0,9,False,9jwssw,1,explainlikeimfive,ELI5 cellular age
62,CuriousCommittee,['B797'],[4],1538214736.0,0,3,False,9jvc70,2,explainlikeimfive,ELI5: What's the mechanism behind LCD screen burn-in? How often does it happen?
63,dad_hacker_maq,"['kouhoutek', 'goatharper']","[4, 3]",1538214517.0,0,17,False,9jvbna,2,explainlikeimfive,"ELI5: if electric motors are basically spinning magnets on some level, where do they get all the magnets from?"
64,cantwaittillcollege,['calste'],[8],1538188787.0,0,13,False,9jt5yz,8,explainlikeimfive,ELI5: Blackbodies & Blackbody Radiation
65,WVAviator,[],[],1538212355.0,0,2,False,9jv60d,2,explainlikeimfive,ELI5: What's happening on some nights when you try to wipe the thick layer of moisture off your windshield but it reappears almost immediately?
66,oz1cz,['SamRothstein72'],[234],1538127699.0,0,123,False,9jlka0,148,explainlikeimfive,ELI5: How can you pull up an anchor?
67,bicureyooz,"['Cantaimforshit', 'Oishii88']","[3, 3]",1538196738.0,0,10,False,9jtxy0,3,explainlikeimfive,ELI5: How does a US employer get affected when an employee files for unemployment through the state?
68,AncestralSpirit,['kouhoutek'],[10],1538210058.0,0,7,False,9jv007,2,explainlikeimfive,ELI5: Why do pawns in chess that cross the board get to choose something other than the Queen? Why would you choose something inferior that has less moves?
69,Baredare,"['Concise_Pirate', 'Glasnerven']","[27, 15]",1538170161.0,0,14,False,9jr0k5,16,explainlikeimfive,ELI5: Why not use single edged blades?
70,danielle732,"['cdb03b', 'springsteentrack9', 'bettinafairchild']","[48, 13, 12]",1538168795.0,0,17,False,9jqtzz,14,explainlikeimfive,ELI5: Why can’t we eat cows that die of natural causes or of old age?
71,MohnJaddenPowers,['epiqu1n'],[6],1538167088.0,0,5,False,9jqllx,15,explainlikeimfive,"ELI5: If the female hemp plant contains THC, how do farmers make sure they don't grow it?"
72,Ssauwrk,['1337gamer47'],[10],1538184812.0,0,6,False,9jsqkw,6,explainlikeimfive,ELI5: How does a game know what to load when you select a load to play?
73,StoneEagleCopy,['BcTheCenterLeft'],[6],1538217478.0,0,6,False,9jvk6l,1,explainlikeimfive,"ELI5: Why when 2 liquids are put into a cup, they mix, but when 2 solids are put together, they stay separated. What 'barrier' stops it from mixing?"
74,askingquestionsblog,['Drgeebee'],[2830],1538050031.0,0,428,False,9jcadl,8465,explainlikeimfive,"ELI5: How come working most muscle groups in the body leads them to be come ""built up"" and stronger, while one's eye muscles only seem to strain and weaken over time?"
75,bluetack_man,['zifnab90'],[6],1538215312.0,0,11,False,9jvdn1,0,explainlikeimfive,ELI5: Why are there always tomes of old dictionaries in old manor houses?
76,DonnaPinciotti420,['dramawahoo'],[36],1538193557.0,0,25,False,9jtndv,3,explainlikeimfive,"ELI5: How do printers print white when the cartidges only hold black, yellow, cyan & magenta ink?"
77,youdontrate315,['Phage0070'],[9],1538183452.0,0,12,False,9jsla0,4,explainlikeimfive,ELI5: Trans Atlantic calls in the early 1900s
78,Iamconno,['cnash'],[6],1538200406.0,0,3,False,9ju9a0,2,explainlikeimfive,ELI5: How do countries pay other countries?
79,entropyNull,[],[],1538199876.0,0,12,False,9ju7pf,2,explainlikeimfive,ELI5: What exactly is the relation between heat and light?
80,ruisleipa_3000,"['BeautylicousBabe', 'Target880']","[14, 5]",1538212643.0,0,8,False,9jv6qh,1,explainlikeimfive,"ELI5: Why does unhealthy food taste so good, and healthy food taste so bad?"
81,Anti_42,"['Psyk60', 'Whyistheplatypus']","[3, 2]",1538210116.0,0,5,False,9jv055,1,explainlikeimfive,ELI5: Why there are still Kings and Queens in some countries and how effective they are in modern world?
82,Mrben13,"['BitsyBigBoyBoomeroo', 'blipsman', 'geuben']","[10, 9, 6]",1538166782.0,0,20,False,9jqk1r,8,explainlikeimfive,ELI5: Why some companies pay bi-weekly and some pay weekly? Is there a benefit of one over the other for the company?
83,ScottishGigolo,"['TheOnlyMego', 'stuthulhu']","[12, 4]",1538163457.0,0,14,False,9jq3cx,9,explainlikeimfive,ELI5: Why do stars expand as they age and what causes them suddenly contract as they go Nova?
84,FlyingLemurs76,[],[],1538208324.0,0,43,False,9juvgt,1,explainlikeimfive,ELI5: The difference between atoms as waves vs atoms as particles
85,ethancg_,['succaneers'],[6],1538206162.0,0,8,False,9jupu8,1,explainlikeimfive,ELI5: why is it harder to stop a projectile than it is to create one?
86,X1x3x3x7,"['goatymcgoatfacesings', 'speakerchef']","[3, 2]",1538191596.0,0,10,False,9jtgiy,4,explainlikeimfive,ELI5: Why are there so many more types of apples than other fruits?
87,Kaitah,"['internetboyfriend666', 'TheSoup05']","[14, 6]",1538204976.0,0,15,False,9jumgm,1,explainlikeimfive,"ELI5: Why can’t we surgically switch switch peoples brains around like we do hearts, kidney, etc?"
88,Task876,['Surfin_Bro'],[2],1538183208.0,0,3,False,9jskdj,3,explainlikeimfive,ELI5: What is a state in thermodynamics?
89,Ehrahbass,"['GrayPhilosophy', 'Nez_bit']","[5, 1]",1538159275.0,0,10,False,9jphhj,8,explainlikeimfive,"ELI5: Why do we sometimes sneeze once and sometimes twice (and maybe rarely three times)? How does our body determine the amount of times we sneeze in one ""episode"" of sneezing?"
90,IminPeru,[],[],1538176515.0,0,7,False,9jrtha,4,explainlikeimfive,ELI5: How does the process of patching/updating a software work?
91,Sherman2020,['pitroms'],[5],1538158782.0,0,14,False,9jpexs,9,explainlikeimfive,ELI5: What is the fundamental difference between different types of cells in our body; ie muscle tissue vs organs vs bones
92,Spoolx21,['henstepl'],[3],1538184416.0,0,5,False,9jsp1c,2,explainlikeimfive,ELI5:Why does a space objects speed change when it gets closer to a body?
93,Watanuki-Kun207,[],[],1538180955.0,0,4,False,9jsbck,2,explainlikeimfive,ELI5: How do chemicals from smoking (cigarettes or marijuana) get from our lungs to our brain?
94,jayzv26,[],[],1538193298.0,0,4,False,9jtmjn,1,explainlikeimfive,ELI5: Can you rely on Google Maps ETA when your are looking for Supply chain ETA Solution?
95,MaelstromNyxus,['Help_Me_Im_Diene'],[3],1538158055.0,0,5,False,9jpb84,5,explainlikeimfive,ELI5: How exactly do toxins/bacteria from things like food poisoning affect the body? What are the processes that lead to being sick?
96,DannyTheDragonSlayer,[],[],1538160905.0,0,11,False,9jppmk,4,explainlikeimfive,ELI5: What does Botulism need to grow? Why isn't it growing in all sorts of leftover foods and liquids?
97,griffinmiller14,[],[],1538165390.0,0,2,False,9jqdea,2,explainlikeimfive,"ELI5: Stock options (puts, calls, etc.)"
98,qwerty1q2w3e4r5t6y,[],[],1538172873.0,0,2,False,9jrdag,3,explainlikeimfive,ELI5: calculating the percentage of dissociation of a weak acid using Henderson-Hasselbalch
99,forgettingpiglet,['WRSaunders'],[9],1538169483.0,0,6,False,9jqxb6,2,explainlikeimfive,ELI5: How can the spin of an electron be measured? Is this measurement 100% reliable?
100,oXtC,['Glasnerven'],[5],1538165940.0,0,4,False,9jqg4y,2,explainlikeimfive,ELI5: Hot and cold sound
101,Remix73,['mredding'],[17],1538165713.0,0,10,False,9jqez0,2,explainlikeimfive,"ELI5:Why do train wheels not slip on a smooth track, given that they have no grip like tyres do - especially going up a hill or in the wet!"
102,t5_bluBLrv,['dalkride'],[16],1538147332.0,0,5,False,9jnrhi,3,explainlikeimfive,ELI5 how does Youtube pay its content creators?
103,moon_fox_,[],[],1538141658.0,0,3,False,9jmzpl,7,explainlikeimfive,ELI5: Why does tapping the top of a bottle create an explosive foam beer reaction?
104,seveortiz,['CogitoNM'],[1],1538162307.0,0,6,False,9jpwvt,2,explainlikeimfive,ELI5: Wind cramps
105,domoappo9,['Concise_Pirate'],[8],1538175259.0,0,9,False,9jrnv8,1,explainlikeimfive,ELI5: Why does a railgun produce a muzzle flash and recoil?
106,AggressiveMarsupial,['kryzsec'],[29],1538110050.0,0,14,False,9jk1hn,28,explainlikeimfive,"ELI5: How does ""barehanding"" or ""hothanding"" work for power lines"
107,DrMantusToboggan,['GoBlindOrGoHome'],[13],1538159676.0,0,6,False,9jpjig,1,explainlikeimfive,ELI5: How do we know how to whistle certain notes instinctively?
108,IamKidneyCastle,"['Gladix', 'stuthulhu']","[14, 4]",1538169876.0,0,18,False,9jqz78,0,explainlikeimfive,ELI5: Why do mirrors and reflections have zero input lag?
109,TiBlode,['saysuptoyourmom'],[10],1538155686.0,0,7,False,9joz0q,3,explainlikeimfive,ELI5: Why brain size doesn't equate to intelligence?
110,hot_doge_,['cdb03b'],[20],1538122155.0,0,10,False,9jl400,9,explainlikeimfive,ELI5: What purpose do silent letters in words serve?
111,jplank1983,['Arianity'],[8],1538154276.0,0,16,False,9jori1,2,explainlikeimfive,"ELI5: The problem with the recent ""proof"" of the Riemann Hypothesis"
112,VennieQ,"['TehWildMan_', 'mikeyd8888']","[10, 7]",1538153029.0,0,11,False,9jokuv,2,explainlikeimfive,ELI5: What's the point in stealing a credit card? Can't they trace each purchase a thief makes with it?
113,AyanAC_,['UCLACommie'],[10],1538139317.0,0,4,False,9jmp96,4,explainlikeimfive,ELI5: Reverse acquisitions
114,GiddySwine,['semioticscissors'],[3],1538165998.0,0,5,False,9jqgf6,1,explainlikeimfive,ELI5: why do MLB outfielders throw overhand while infielders more often sidearm their throws even when they have time or are throwing around the horn?
115,,['alexgabriel_i'],[5],1538135820.0,0,7,False,9jmbhk,5,explainlikeimfive,ELI5: How do researches begin a study on a new disease?
116,amandakatewi,['tgpineapple'],[11],1538105100.0,0,11,False,9jjifh,16,explainlikeimfive,ELI5: Why do humans and many animals have a dominant hand?
117,Lubo95,['ForumWarrior'],[6],1538114060.0,0,6,False,9jkez5,9,explainlikeimfive,"ELI5: Why does other people wake you up when they snore, but when you do it you don't wake yourself up."
118,Anything13579,['dumbphone77'],[5],1538137216.0,0,5,False,9jmgxp,3,explainlikeimfive,ELI5: Why are some tumors are cancer and some are not?
119,Fuzzinstuff,['Loki-L'],[12],1538110067.0,0,9,False,9jk1k4,13,explainlikeimfive,ELI5: How do hippos move so quickly through water?
120,anounmouse,['Alexaflohr'],[9],1538130072.0,0,4,False,9jlrwh,4,explainlikeimfive,"ELI5: If monkeypox mutates, would there really be a similar number of fatalities as the Spanish influenza?"
121,CrazyEyezKillah,[],[],1538156105.0,0,4,False,9jp179,1,explainlikeimfive,ELI5: How does a company discover that they've been the victim of a computer security breach?
122,Kingboomber,['rehcsel'],[10],1538154798.0,0,10,False,9jouga,1,explainlikeimfive,ELI5: The Bends? Can someone explain in detail (simple detail) what it is?
123,Traffodil,['ItsOliviaWilde'],[25],1538064501.0,0,13,False,9je6hz,90,explainlikeimfive,ELI5: Why do some sunsets fill the sky and others don’t?
124,KappaMaus,['aenemenate'],[9],1538116703.0,0,5,False,9jknhl,6,explainlikeimfive,[ELI5] Would your vision/eyesight/eyes detoriate if you would wear a blindfold for a long time?
125,curioustraveller1985,['Twin_Spoons'],[3],1538151357.0,0,9,False,9jocd1,1,explainlikeimfive,ELI5: Why does the US Fed buys US' Treasury bills?
126,RusticBohemian,['vgnEngineer'],[3],1538151069.0,0,9,False,9joaus,0,explainlikeimfive,"ELI5: What element of a piece of music is being praised when someone says that it's the ""hardest drop in music history""?"
127,Yousef_A,"['SaiphSDC', 'LurkmasterP']","[51, 39]",1538059630.0,0,39,False,9jdhk7,103,explainlikeimfive,"ELI5: In Newton’s cradle, when raising two balls, why doesn’t just one ball move from the opposite side with double the velocity of the 2 balls on the other side? Why do 2 balls move? Why can’t the collective momentum from both balls all be transferred to a single ball?"
128,BeaverDelightTonight,['silverwolf874'],[6],1538136642.0,0,6,False,9jmeni,1,explainlikeimfive,ELI5: why do the first two or three pages of kids books all just say the title of the book?
129,djcoinmoney,['quincium'],[13],1538109234.0,0,9,False,9jjyj1,9,explainlikeimfive,ELI5: What purpose do grains serve to wheat and rice plants?
130,tmobilekid,"['False_Bee', 'wowitsdaniel', '407J-219']","[15, 11, 5]",1538114305.0,0,12,False,9jkfry,7,explainlikeimfive,ELI5: How is the universe expanding proof of the big bang?
131,octopanda4,['Izaran'],[17],1538105562.0,0,29,False,9jjk9y,8,explainlikeimfive,ELI5: Why is the Pledge of Allegiance allowed in public schools if it includes the phrase “under God”?
132,Rhinoaf,[],[],1538098159.0,0,3,False,9jipwa,12,explainlikeimfive,ELI5: why do large wet spots remain around small leaves on pavement?
133,Randle2318,[],[],1538117407.0,0,2,False,9jkpn4,4,explainlikeimfive,ELI5: what makes gallium a liquid but not aluminum or some element close to it?
134,Brodio09,"['Argis13', 'FiveDozenWhales']","[9, 6]",1538144207.0,0,6,False,9jnc0v,1,explainlikeimfive,"ELI5: What about the 5, 7, 5 structure makes haikus “poetic?”"
135,JimmyThrowaway1,['Argis13'],[5],1538143530.0,0,8,False,9jn8h8,0,explainlikeimfive,"ELI5: Hilbert Space. Do we live in Hilbert space? The spacetime we exist into can be called Hilbert space? If not, why?"
136,poopoocologne,"['TheFotty', 'JCAPER']","[2810, 2304]",1537971548.0,0,725,False,9j2wki,7197,explainlikeimfive,"ELI5: What is the difference between Country A printing more currency, and Country B giving Country A currency? I understand why printing more currency can lead to inflation, but am confused about why the second scenario does not also lead to inflation."
137,Digby_M,['gtagi'],[10],1538082505.0,0,5,False,9jgqgt,14,explainlikeimfive,ELI5: The difference between speaking from the throat and speaking from the diaphragm.
138,gaaerre,['stuthulhu'],[13],1538094029.0,0,10,False,9ji89v,7,explainlikeimfive,ELI5: Did prehistoric humans cut their nails?
139,Zach_Attakk,['B797'],[2],1538134214.0,0,6,False,9jm5pb,1,explainlikeimfive,ELI5: What do the numbers on my contact lens mean?
140,Its-cheesus,['rhomboidus'],[11],1538092868.0,0,7,False,9ji37k,9,explainlikeimfive,ELI5: how scientists landed a probe on a moving asteroid?
141,Ellinov,['mmmmmmBacon12345'],[9],1538100804.0,0,8,False,9jj0xp,5,explainlikeimfive,ELI5: Does a radioactive molecule's half life stay constant or does it increase/decrease as it decays?
142,knockerball,['ScrufyNerdHerder'],[248],1538014557.0,0,60,False,9j8w6v,362,explainlikeimfive,"ELI5: What is it about seafood that causes it to have a “fishy” flavor/scent, and why is it that the less fresh it gets, the stronger the fishy flavor/scent gets even though it’s not necessarily rotten/bad?"
143,cfk77,"['pork_king', 'capilot']","[13, 7]",1538102532.0,0,6,False,9jj818,4,explainlikeimfive,ELI5 How are film projectors able to sync the two wheels up when one with a lot more film must have a much slower rpm than the one with a less film on it?
144,DaRandomGitty,"['Bluefalcon325', 'big_willy_steelo', '56Subject', 'incruente']","[17, 7, 6, 5]",1538161062.0,0,26,False,9jpqf2,0,explainlikeimfive,ELI5: Why do militaries use automatic rifles instead of rifles that fire one single powerful round?
145,gabzlel,"['Concise_Pirate', '_--phoenix--_', 'paolog']","[10, 10, 3]",1538115697.0,0,13,False,9jkkd3,3,explainlikeimfive,ELI5: How can you gain weight from drinking coca cola zero if it contains zero calories?
146,MoroccanMaracas,"['rhomboidus', 'mmmmmmBacon12345']","[12, 8]",1538092279.0,0,9,False,9ji0pk,8,explainlikeimfive,ELI5: Why do some countries that are completely different cultures/origins share some names that are more often associated with another?
147,FPS_LIFE,['ghoulbug'],[20],1538090798.0,0,3,False,9jhu8m,6,explainlikeimfive,"ELI5: How come children are more drawn to cartoons and animation, than ""real tv""?"
148,happy-cig,"['evil_burrito', 'Eiswraith']","[14, 9]",1538072813.0,0,22,False,9jfdg6,17,explainlikeimfive,ELI5 Why are so many more kids allergic to peanuts nowadays?
149,bythepowerofscience,"['ThisAfricanboy', 'ColanSA']","[75, 39]",1538050218.0,0,58,False,9jcb5d,41,explainlikeimfive,ELI5: Why was Africa not as developed as other continents?
