,author,comments_author_lst,comments_score_lst,created_utc,guilded,num_comments,pinned,r_id,score,subreddit,title
2372,Recalc,"['Nephisimian', 'paolog']","[8, 3]",1537863748.0,0,8,False,9iqck8,1,explainlikeimfive,ELI5: How do we feel stares from other people or animals?
2373,Meowbium,"['a-large-bee', 'thetreece', 'brazzy42']","[11, 6, 4]",1537824963.0,0,13,False,9im3w7,7,explainlikeimfive,ELI5: How much exercise is too much?
2374,jotaviox,['stoppage_time'],[13],1537808521.0,0,6,False,9ijpgv,13,explainlikeimfive,"ELI5: How does ""natural"" fear works (eg. fear of snakes, spiders, the dark, heights)? I understand it has to do with natural selection, but I don't get how the mechanism functions on the brain and how it passes forward from parents to children. Is that DNA related somehow?"
2375,HellBounddd,['flashfyr3'],[12],1537820312.0,0,4,False,9ilg7z,8,explainlikeimfive,ELI5: What’s happening to wine when it aerates? Why does it make the wine seem a little easier to drink? Does aeration cause it to go down in percentage of alcohol? Can alcohol expire?
2376,Zockerland99,['mmmmmmBacon12345'],[28],1537797509.0,0,11,False,9ii4vu,23,explainlikeimfive,ELI5: What is registered RAM and what is the difference to ECC RAM and regular desktop RAM
2377,ThirdAppendix,['Concise_Pirate'],[6],1537841857.0,0,7,False,9io8cc,2,explainlikeimfive,ELI5: What is the difference between a C-Corp and an S-Corp?
2378,Theuserr,"['Concise_Pirate', 'Tederator', 'blipsman', 'bclayton72']","[4, 2, 2, 2]",1537832348.0,0,15,False,9in2h7,3,explainlikeimfive,"ELI5: why is it bad for companys shares to ""go down""?"
2379,heywhatsuphaha,"['WitTwitLizBit888', 'Hairmetal411']","[13, 6]",1537808419.0,0,8,False,9ijow4,11,explainlikeimfive,ELI5: benefits of hot showers and cold showers - which is better & why?
2380,CannotRememberThis,['Concise_Pirate'],[6],1537826072.0,0,7,False,9im9ax,5,explainlikeimfive,ELI5: How fast does heat transfer between two objects? Does more heat cause it to transfer faster?
2381,Housefosale,['Concise_Pirate'],[2],1537852948.0,0,3,False,9ipfjf,0,explainlikeimfive,ELI5: Why do addresses have cnr of Smith Rd and cnr of John Rd. Why not just the number?
2382,flanmorrison,['princezukosfire'],[3],1537850292.0,0,3,False,9ip6bq,1,explainlikeimfive,ELI5: Why do windshield wipers make the window streaky for the first few strokes?
2383,thaharshtruth,['Eulers_ID'],[6],1537834312.0,0,7,False,9inb97,2,explainlikeimfive,ELI5: What’s the difference between vapor and smoke ?
2384,macaryl95,['krystar78'],[7],1537820745.0,0,6,False,9ilie3,4,explainlikeimfive,"ELI5: If you collect something from the ground like, say a dead bug, and you store it, it seems to last forever. But if you leave it be, it decays rather quickly. What exactly would be the cause or causes of this?"
2385,TGotAReddit,['Concise_Pirate'],[3],1537825866.0,0,6,False,9im8aq,3,explainlikeimfive,"ELI5, why does it seem like we get more precipitation in non-summer months?"
2386,Der_letzte_Baron,"['stuthulhu', 'Qwerty_Resident', 'krystar78']","[6, 6, 4]",1537814556.0,0,10,False,9iklnr,4,explainlikeimfive,ELI5: Rocket trajectories
2387,Losername01,['mredding'],[14],1537807949.0,0,11,False,9ijm5b,9,explainlikeimfive,"ELI5 What is happening when my phone displays that it has full 4G signal, but it clearly doesn't because it can't load anything?"
2388,Sigdavtilmig,"['stuthulhu', 'kouhoutek', 'Miliean']","[16, 13, 10]",1537814376.0,0,17,False,9ikkpg,4,explainlikeimfive,ELI5 how come no other species on earth have reached intelligence close to humans?
2389,FerynaCZ,"['stumblepretty', 'mugenhunt', 'Qwerty_Resident']","[17, 14, 8]",1537808418.0,0,11,False,9ijovw,6,explainlikeimfive,ELI5: Why illegal recordings don't count as a full-value proof at court?
2390,girlholdingtherose,[],[],1537829736.0,0,7,False,9imqoz,4,explainlikeimfive,ELI5: Why can't we taste anything while our nose is plugged/ when we're sick?
2391,TheOriginalJunglist,[],[],1537829641.0,0,2,False,9imq91,2,explainlikeimfive,ELI5: How do we adopt new fears and irrational phobias?
2392,Slaytounge,"['FiveDozenWhales', 'bboysil']","[23, 5]",1537766220.0,0,10,False,9ifand,49,explainlikeimfive,"ELI5: If sound can't travel through the near vacuum of space, what happens to the energy that would have vibrated the air to make a sound? Also how do other wave forms travel in space if the atoms are spaced so far apart?"
2393,,[],[],1537840417.0,0,5,False,9io22j,1,explainlikeimfive,ELI5: why does dark skin appear to have a blue or purplish sheen in certain lighting?
2394,Gideon_Crumb,['Lithuim'],[4],1537812660.0,0,4,False,9ikbpj,6,explainlikeimfive,ELI5: How does hemoglobin decrease when you bleed?
2395,clarianneross,['MyNameIsRay'],[7],1537811990.0,0,2,False,9ik86c,4,explainlikeimfive,ELI5: How are maximum occupancies calculated for rooms and buildings?
2396,lanceparth,"['coolwool', 'thewisesloth', 'AmorinMorin']","[6, 4, 3]",1537837180.0,0,11,False,9innys,1,explainlikeimfive,"ELI5: If oil and other fossil fuels come from once living organisms that have been pressurized over millions of years and Saudi Arabia is basically a giant desert, why does SA have so much damn oil? Wouldn’t a place like the rain forest (much denser in both plants and animals) have more?"
2397,MiserableBean,[],[],1537836980.0,0,1,False,9inn3n,1,explainlikeimfive,ELI5: The curves in radiocarbon calibration graphics
2398,willobbum,"['lofunkybot', 'Target880', 'KristenM365']","[11, 5, 4]",1537801120.0,0,14,False,9iimic,5,explainlikeimfive,ELI5: How come mammals other than humans don't get periods? Or do they?
2399,dozzer85,"['DecentChanceOfLousy', 'r3fl3kT0r']","[61, 24]",1537749874.0,0,30,False,9idjun,72,explainlikeimfive,ELI5: What happens to all the bleach and washing liquids and chemicals we use. Is any of it filtered out or degrades once it goes down the drain or are we simply polluting the seas?
2400,KendrickLama1,[],[],1538193527.0,0,972,False,9jtnaw,8020,explainlikeimfive,ELI5: Why is the Queen in chess the most effective piece?
2401,wildddin,['TheGinnnnnnger'],[5140],1538117211.0,0,207,False,9jkp11,8497,explainlikeimfive,ELI5: Why do (in most cases) our eyes need to be closed for us to be able to sleep? And what happens to people who can sleep with their eyes open?
2402,Chrisant000,[],[],1538195231.0,0,48,False,9jtt09,76,explainlikeimfive,ELI5: What is Alcohol poisoning?
2403,communisttankengine,[],[],1538189872.0,0,21,False,9jta4g,56,explainlikeimfive,ELI5 Why do pickles have less calories than a fresh cucumber of the same size?
2404,Digibac0n,[],[],1538236427.0,0,6,False,9jxzqc,5,explainlikeimfive,ELI5: Does being a bouncer or security guard exclude you from the consequences of beating someone up?
2405,batman985,[],[],1538235311.0,0,3,False,9jxtpk,3,explainlikeimfive,ELI5: Whats the difference between a nation and a culture?
2406,growleroz,[],[],1538235657.0,0,7,False,9jxvi9,3,explainlikeimfive,ELI5: How did scientists know that uranium could be used to make an atomic bomb?
2407,intrinsic_space,[],[],1538229531.0,0,2,False,9jwyej,3,explainlikeimfive,ELI5: How has twitter closing off its API affected third party developers?
2408,martinator001,[],[],1538233894.0,0,4,False,9jxm6w,4,explainlikeimfive,"ELI5: Why in ASCII, the character '1' is equal to 49?"
2409,Derikoopa,[],[],1538225515.0,0,3,False,9jwdzd,6,explainlikeimfive,ELI5: What is that small dry stuff that gathers near your eyes when you sleep? How is it made and how does it get there? Is it used for anything? Should I keep rubbing it away like I do?
2410,askingquestionsblog,,,1538228639.0,0,0,False,9jwtln,4,explainlikeimfive,"ELI5: A ""paean,"" versus an ""encomium,"" versus a ""hagiography"""
2411,imnotlegolas,[],[],1538228254.0,0,6,False,9jwrhn,4,explainlikeimfive,"ELI5: When exercising, why do muscles hurt not until the next day after sleep?"
2412,Techfault,[],[],1538227589.0,0,2,False,9jwo0r,3,explainlikeimfive,ELI5: Why is glucose in the blood filtered into the Bowman’s capsule if it just gets re-absorbed into the blood in the convoluted tubule?
2413,KimJongFunnest,[],[],1538235181.0,0,2,False,9jxszz,2,explainlikeimfive,ELI5: Why does using a pillow feel comfortable when it makes your head tilted?
2414,SqueamishDesign,[],[],1538193900.0,0,40,False,9jtolz,14,explainlikeimfive,"ELI5: What is the difference between C, C#, C-- and C++ other than the fact that they are different languages?"
2415,NitrousAcid,[],[],1538211715.0,0,5,False,9jv49a,6,explainlikeimfive,ELI5: Whats the difference between ethics and morals?
2416,Konichi_Waffles,[],[],1538224175.0,0,8,False,9jw8hl,3,explainlikeimfive,ELI5: Where do birds go to die?
2417,zSalsy,[],[],1538231622.0,0,1,False,9jxa61,2,explainlikeimfive,ELI5: Why is the camera on the measurement app (on iPhone) so smooth compared to your camera app?
2418,MaddoxX_1996,[],[],1538229329.0,0,2,False,9jwxan,2,explainlikeimfive,ELI5: How do geologists record historic and pre-historic tsunamis?
2419,TiBlode,[],[],1538226705.0,0,26,False,9jwjc3,2,explainlikeimfive,ELI5: Why do non white adults come out the womb with white skin as babies?
2420,absolutely_cancer,[],[],1538200887.0,0,2,False,9juann,5,explainlikeimfive,ELI5 Why does our ability to resist urges fade and we lose control when we just arrive at the bathroom
2421,allenind,[],[],1538225180.0,0,4,False,9jwcik,2,explainlikeimfive,ELI5: Why do different types of alcohol affect us differently?
2422,clumsy_turtle,[],[],1538174214.0,0,11,False,9jrjc1,31,explainlikeimfive,ELI5: How does Google Maps know to update bus routes?
2423,TastyWavesSpicoli,[],[],1538200365.0,0,14,False,9ju95s,8,explainlikeimfive,ELI5: How does math exist?
2424,iamachicken14,,,1538238308.0,0,0,False,9jya12,1,explainlikeimfive,ELI5: Why do humans sense infrared radiation in relation to warmth/heat the same way as e.g. touching hot surfaces?
2425,Deskbot,[],[],1538189017.0,0,3,False,9jt6v4,13,explainlikeimfive,ELI5: How does a stock broker borrow stocks for you to short-sell
2426,snortcokeeveryday,[],[],1538237194.0,0,2,False,9jy41l,1,explainlikeimfive,ELI5: all Oceans are continuous water body.what makes one Ocean different from another?
2427,ducksandshawarma,[],[],1538215618.0,0,5,False,9jvef2,3,explainlikeimfive,ELI5: What is a Memory Cache ? And how does it resemble and differs from RAM ?
2428,Kohop_Kapah,[],[],1538235631.0,0,2,False,9jxvdp,0,explainlikeimfive,ELI5: Where the term wee came from?
2429,CreeperIan02,[],[],1538233791.0,0,4,False,9jxlm4,1,explainlikeimfive,"ELI5: If water is absorbed into the ground but doesn't go into a well or underground river on the way down, what happens to it? Where does it go?"
2430,GodotF2P,[],[],1538210951.0,0,6,False,9jv27h,3,explainlikeimfive,ELI5: Why is a liquid not moving when a plane is flying a curve?
2431,lzldmb,[],[],1538230777.0,0,4,False,9jx5hj,0,explainlikeimfive,ELI5: How does allowing the left turn lane to go first and only one direction at a time at an intersection improve traffic flow?
2432,FlockingSheep,[],[],1538191574.0,0,1,False,9jtggd,5,explainlikeimfive,ELI5: Why is there an interference with bluetooth headsets whenever shredding documents?
2433,sgsfx,[],[],1538228485.0,0,5,False,9jwssw,1,explainlikeimfive,ELI5 cellular age
2434,dad_hacker_maq,[],[],1538214517.0,0,11,False,9jvbna,2,explainlikeimfive,"ELI5: if electric motors are basically spinning magnets on some level, where do they get all the magnets from?"
2435,Bentheball1,[],[],1538227994.0,0,2,False,9jwq5a,1,explainlikeimfive,ELI5: what are server nodes?
2436,skilledneuronfirer,[],[],1538214209.0,0,7,False,9jvav2,3,explainlikeimfive,"ELI5: Why dont people feel the urge to urinate while out, but as soon as we get into our house we cant hold it in?"
2437,delirium_3,[],[],1538227592.0,0,11,False,9jwo16,0,explainlikeimfive,ELI5: Why do women for the most part go to the bathroom together?
2438,DerivativeSavant,[],[],1538205892.0,0,1,False,9jup2y,3,explainlikeimfive,"ELI5: Is there a reason, or method, that amendment options on ballots become illogically tied?"
2439,cantwaittillcollege,[],[],1538188787.0,0,12,False,9jt5yz,7,explainlikeimfive,ELI5: Blackbodies & Blackbody Radiation
2440,WVAviator,[],[],1538212355.0,0,2,False,9jv60d,2,explainlikeimfive,ELI5: What's happening on some nights when you try to wipe the thick layer of moisture off your windshield but it reappears almost immediately?
2441,DonnaPinciotti420,[],[],1538193557.0,0,24,False,9jtndv,5,explainlikeimfive,"ELI5: How do printers print white when the cartidges only hold black, yellow, cyan & magenta ink?"
2442,oz1cz,['SamRothstein72'],[226],1538127699.0,0,122,False,9jlka0,143,explainlikeimfive,ELI5: How can you pull up an anchor?
2443,Ssauwrk,[],[],1538184812.0,0,4,False,9jsqkw,9,explainlikeimfive,ELI5: How does a game know what to load when you select a load to play?
2444,ilmBianca2000,[],[],1538222673.0,0,5,False,9jw2kp,1,explainlikeimfive,"ELI5: Why are the lights still on inside closed shops, banks etc?"
2445,mathlearner1,[],[],1538222382.0,0,1,False,9jw1gt,1,explainlikeimfive,ELI5: The relationship between emotions and memory/learning retention?
2446,Symrun,[],[],1538222039.0,0,1,False,9jw080,1,explainlikeimfive,ELI5: Why is it so much easier for me to read on cream/off-white paper rather than white paper?
2447,danielle732,[],[],1538168795.0,0,16,False,9jqtzz,12,explainlikeimfive,ELI5: Why can’t we eat cows that die of natural causes or of old age?
2448,Baredare,[],[],1538170161.0,0,14,False,9jr0k5,15,explainlikeimfive,ELI5: Why not use single edged blades?
2449,bicureyooz,[],[],1538196738.0,0,9,False,9jtxy0,2,explainlikeimfive,ELI5: How does a US employer get affected when an employee files for unemployment through the state?
2450,StoneEagleCopy,[],[],1538217478.0,0,5,False,9jvk6l,1,explainlikeimfive,"ELI5: Why when 2 liquids are put into a cup, they mix, but when 2 solids are put together, they stay separated. What 'barrier' stops it from mixing?"
2451,MohnJaddenPowers,[],[],1538167088.0,0,5,False,9jqllx,14,explainlikeimfive,"ELI5: If the female hemp plant contains THC, how do farmers make sure they don't grow it?"
2452,askingquestionsblog,['Drgeebee'],[2821],1538050031.0,0,428,False,9jcadl,8457,explainlikeimfive,"ELI5: How come working most muscle groups in the body leads them to be come ""built up"" and stronger, while one's eye muscles only seem to strain and weaken over time?"
2453,bluetack_man,[],[],1538215312.0,0,9,False,9jvdn1,2,explainlikeimfive,ELI5: Why are there always tomes of old dictionaries in old manor houses?
2454,youdontrate315,[],[],1538183452.0,0,12,False,9jsla0,5,explainlikeimfive,ELI5: Trans Atlantic calls in the early 1900s
2455,CuriousCommittee,[],[],1538214736.0,0,2,False,9jvc70,1,explainlikeimfive,ELI5: What's the mechanism behind LCD screen burn-in? How often does it happen?
2456,Gilianus,[],[],1538179098.0,0,4,False,9js3x1,4,explainlikeimfive,"ELI5: Why does a hot shower make a hangover feel more bearable, and why does it kick right back in when you step out of it?"
2457,Iamconno,[],[],1538200406.0,0,3,False,9ju9a0,2,explainlikeimfive,ELI5: How do countries pay other countries?
2458,entropyNull,[],[],1538199876.0,0,11,False,9ju7pf,2,explainlikeimfive,ELI5: What exactly is the relation between heat and light?
2459,ruisleipa_3000,[],[],1538212643.0,0,6,False,9jv6qh,0,explainlikeimfive,"ELI5: Why does unhealthy food taste so good, and healthy food taste so bad?"
2460,Anti_42,[],[],1538210116.0,0,3,False,9jv055,0,explainlikeimfive,ELI5: Why there are still Kings and Queens in some countries and how effective they are in modern world?
2461,AncestralSpirit,[],[],1538210058.0,0,6,False,9jv007,1,explainlikeimfive,ELI5: Why do pawns in chess that cross the board get to choose something other than the Queen? Why would you choose something inferior that has less moves?
2462,Mrben13,[],[],1538166782.0,0,19,False,9jqk1r,10,explainlikeimfive,ELI5: Why some companies pay bi-weekly and some pay weekly? Is there a benefit of one over the other for the company?
2463,IComplimentVehicles,[],[],1538195872.0,0,8,False,9jtv46,2,explainlikeimfive,ELI5: Why do computers have a shutdown process instead of just cutting it's own power?
2464,ScottishGigolo,[],[],1538163457.0,0,14,False,9jq3cx,8,explainlikeimfive,ELI5: Why do stars expand as they age and what causes them suddenly contract as they go Nova?
2465,FlyingLemurs76,[],[],1538208324.0,0,42,False,9juvgt,1,explainlikeimfive,ELI5: The difference between atoms as waves vs atoms as particles
2466,ethancg_,[],[],1538206162.0,0,8,False,9jupu8,1,explainlikeimfive,ELI5: why is it harder to stop a projectile than it is to create one?
2467,X1x3x3x7,[],[],1538191596.0,0,9,False,9jtgiy,3,explainlikeimfive,ELI5: Why are there so many more types of apples than other fruits?
2468,Kaitah,[],[],1538204976.0,0,13,False,9jumgm,1,explainlikeimfive,"ELI5: Why can’t we surgically switch switch peoples brains around like we do hearts, kidney, etc?"
2469,Task876,[],[],1538183208.0,0,2,False,9jskdj,1,explainlikeimfive,ELI5: What is a state in thermodynamics?
2470,Ehrahbass,[],[],1538159275.0,0,9,False,9jphhj,10,explainlikeimfive,"ELI5: Why do we sometimes sneeze once and sometimes twice (and maybe rarely three times)? How does our body determine the amount of times we sneeze in one ""episode"" of sneezing?"
2471,IminPeru,[],[],1538176515.0,0,7,False,9jrtha,3,explainlikeimfive,ELI5: How does the process of patching/updating a software work?
2472,Mr_Cuddlesz,[],[],1538200343.0,0,1,False,9ju93q,1,explainlikeimfive,ELI5: Why do our bodies tend to fidget when we're concentrating?
2473,Sherman2020,[],[],1538158782.0,0,12,False,9jpexs,8,explainlikeimfive,ELI5: What is the fundamental difference between different types of cells in our body; ie muscle tissue vs organs vs bones
2474,Spoolx21,[],[],1538184416.0,0,3,False,9jsp1c,2,explainlikeimfive,ELI5:Why does a space objects speed change when it gets closer to a body?
2475,Watanuki-Kun207,[],[],1538180955.0,0,4,False,9jsbck,1,explainlikeimfive,ELI5: How do chemicals from smoking (cigarettes or marijuana) get from our lungs to our brain?
2476,jayzv26,[],[],1538193298.0,0,3,False,9jtmjn,1,explainlikeimfive,ELI5: Can you rely on Google Maps ETA when your are looking for Supply chain ETA Solution?
2477,MaelstromNyxus,[],[],1538158055.0,0,4,False,9jpb84,5,explainlikeimfive,ELI5: How exactly do toxins/bacteria from things like food poisoning affect the body? What are the processes that lead to being sick?
2478,DannyTheDragonSlayer,[],[],1538160905.0,0,10,False,9jppmk,4,explainlikeimfive,ELI5: What does Botulism need to grow? Why isn't it growing in all sorts of leftover foods and liquids?
2479,griffinmiller14,[],[],1538165390.0,0,1,False,9jqdea,1,explainlikeimfive,"ELI5: Stock options (puts, calls, etc.)"
2480,qwerty1q2w3e4r5t6y,[],[],1538172873.0,0,2,False,9jrdag,3,explainlikeimfive,ELI5: calculating the percentage of dissociation of a weak acid using Henderson-Hasselbalch
2481,forgettingpiglet,[],[],1538169483.0,0,5,False,9jqxb6,2,explainlikeimfive,ELI5: How can the spin of an electron be measured? Is this measurement 100% reliable?
2482,oXtC,[],[],1538165940.0,0,3,False,9jqg4y,2,explainlikeimfive,ELI5: Hot and cold sound
2483,t5_bluBLrv,['dalkride'],[14],1538147332.0,0,5,False,9jnrhi,6,explainlikeimfive,ELI5 how does Youtube pay its content creators?
2484,moon_fox_,[],[],1538141658.0,0,3,False,9jmzpl,7,explainlikeimfive,ELI5: Why does tapping the top of a bottle create an explosive foam beer reaction?
2485,seveortiz,[],[],1538162307.0,0,6,False,9jpwvt,2,explainlikeimfive,ELI5: Wind cramps
2486,domoappo9,[],[],1538175259.0,0,9,False,9jrnv8,1,explainlikeimfive,ELI5: Why does a railgun produce a muzzle flash and recoil?
2487,AggressiveMarsupial,"['kryzsec', 'illogictc']","[29, 11]",1538110050.0,0,14,False,9jk1hn,23,explainlikeimfive,"ELI5: How does ""barehanding"" or ""hothanding"" work for power lines"
2488,DrMantusToboggan,[],[],1538159676.0,0,6,False,9jpjig,2,explainlikeimfive,ELI5: How do we know how to whistle certain notes instinctively?
2489,Papiluff,"['teakwood54', 'FiveDozenWhales']","[11, 5]",1538145570.0,0,4,False,9jniqg,4,explainlikeimfive,"ELI5:What does it mean when someone has a ""low mental age""?"
2490,IamKidneyCastle,[],[],1538169876.0,0,14,False,9jqz78,0,explainlikeimfive,ELI5: Why do mirrors and reflections have zero input lag?
2491,jplank1983,[],[],1538154276.0,0,16,False,9jori1,2,explainlikeimfive,"ELI5: The problem with the recent ""proof"" of the Riemann Hypothesis"
2492,hot_doge_,['cdb03b'],[20],1538122155.0,0,8,False,9jl400,10,explainlikeimfive,ELI5: What purpose do silent letters in words serve?
2493,VennieQ,[],[],1538153029.0,0,9,False,9jokuv,2,explainlikeimfive,ELI5: What's the point in stealing a credit card? Can't they trace each purchase a thief makes with it?
2494,AyanAC_,[],[],1538139317.0,0,3,False,9jmp96,6,explainlikeimfive,ELI5: Reverse acquisitions
2495,GiddySwine,[],[],1538165998.0,0,5,False,9jqgf6,1,explainlikeimfive,ELI5: why do MLB outfielders throw overhand while infielders more often sidearm their throws even when they have time or are throwing around the horn?
2496,Remix73,[],[],1538165713.0,0,10,False,9jqez0,1,explainlikeimfive,"ELI5:Why do train wheels not slip on a smooth track, given that they have no grip like tyres do - especially going up a hill or in the wet!"
2497,Anything13579,['dumbphone77'],[4],1538137216.0,0,4,False,9jmgxp,4,explainlikeimfive,ELI5: Why are some tumors are cancer and some are not?
2498,,['alexgabriel_i'],[3],1538135820.0,0,7,False,9jmbhk,2,explainlikeimfive,ELI5: How do researches begin a study on a new disease?
2499,amandakatewi,['tgpineapple'],[9],1538105100.0,0,10,False,9jjifh,17,explainlikeimfive,ELI5: Why do humans and many animals have a dominant hand?
2500,Fuzzinstuff,['Loki-L'],[12],1538110067.0,0,9,False,9jk1k4,11,explainlikeimfive,ELI5: How do hippos move so quickly through water?
2501,anounmouse,['Alexaflohr'],[8],1538130072.0,0,4,False,9jlrwh,3,explainlikeimfive,"ELI5: If monkeypox mutates, would there really be a similar number of fatalities as the Spanish influenza?"
2502,CrazyEyezKillah,[],[],1538156105.0,0,3,False,9jp179,1,explainlikeimfive,ELI5: How does a company discover that they've been the victim of a computer security breach?
2503,TiBlode,[],[],1538155686.0,0,7,False,9joz0q,3,explainlikeimfive,ELI5: Why brain size doesn't equate to intelligence?
2504,Kingboomber,[],[],1538154798.0,0,9,False,9jouga,1,explainlikeimfive,ELI5: The Bends? Can someone explain in detail (simple detail) what it is?
2505,Lubo95,['ForumWarrior'],[5],1538114060.0,0,5,False,9jkez5,9,explainlikeimfive,"ELI5: Why does other people wake you up when they snore, but when you do it you don't wake yourself up."
2506,Traffodil,['ItsOliviaWilde'],[24],1538064501.0,0,13,False,9je6hz,94,explainlikeimfive,ELI5: Why do some sunsets fill the sky and others don’t?
2507,KappaMaus,['aenemenate'],[10],1538116703.0,0,5,False,9jknhl,7,explainlikeimfive,[ELI5] Would your vision/eyesight/eyes detoriate if you would wear a blindfold for a long time?
2508,curioustraveller1985,[],[],1538151357.0,0,3,False,9jocd1,1,explainlikeimfive,ELI5: Why does the US Fed buys US' Treasury bills?
2509,RusticBohemian,"['vgnEngineer', 'kouhoutek']","[1, 1]",1538151069.0,0,8,False,9joaus,0,explainlikeimfive,"ELI5: What element of a piece of music is being praised when someone says that it's the ""hardest drop in music history""?"
2510,Yousef_A,"['SaiphSDC', 'LurkmasterP']","[53, 38]",1538059630.0,0,39,False,9jdhk7,104,explainlikeimfive,"ELI5: In Newton’s cradle, when raising two balls, why doesn’t just one ball move from the opposite side with double the velocity of the 2 balls on the other side? Why do 2 balls move? Why can’t the collective momentum from both balls all be transferred to a single ball?"
2511,BeaverDelightTonight,['silverwolf874'],[6],1538136642.0,0,6,False,9jmeni,2,explainlikeimfive,ELI5: why do the first two or three pages of kids books all just say the title of the book?
2512,djcoinmoney,['quincium'],[14],1538109234.0,0,9,False,9jjyj1,8,explainlikeimfive,ELI5: What purpose do grains serve to wheat and rice plants?
2513,tmobilekid,"['False_Bee', 'wowitsdaniel', '407J-219']","[12, 10, 5]",1538114305.0,0,12,False,9jkfry,5,explainlikeimfive,ELI5: How is the universe expanding proof of the big bang?
2514,octopanda4,['Izaran'],[16],1538105562.0,0,28,False,9jjk9y,7,explainlikeimfive,ELI5: Why is the Pledge of Allegiance allowed in public schools if it includes the phrase “under God”?
2515,Rhinoaf,[],[],1538098159.0,0,3,False,9jipwa,9,explainlikeimfive,ELI5: why do large wet spots remain around small leaves on pavement?
2516,Brodio09,"['Argis13', 'FiveDozenWhales']","[10, 5]",1538144207.0,0,6,False,9jnc0v,1,explainlikeimfive,"ELI5: What about the 5, 7, 5 structure makes haikus “poetic?”"
2517,JimmyThrowaway1,[],[],1538143530.0,0,2,False,9jn8h8,0,explainlikeimfive,"ELI5: Hilbert Space. Do we live in Hilbert space? The spacetime we exist into can be called Hilbert space? If not, why?"
2518,Randle2318,[],[],1538117407.0,0,2,False,9jkpn4,3,explainlikeimfive,ELI5: what makes gallium a liquid but not aluminum or some element close to it?
2519,poopoocologne,"['TheFotty', 'JCAPER']","[2800, 2299]",1537971548.0,0,711,False,9j2wki,7188,explainlikeimfive,"ELI5: What is the difference between Country A printing more currency, and Country B giving Country A currency? I understand why printing more currency can lead to inflation, but am confused about why the second scenario does not also lead to inflation."
2520,Digby_M,['gtagi'],[11],1538082505.0,0,5,False,9jgqgt,15,explainlikeimfive,ELI5: The difference between speaking from the throat and speaking from the diaphragm.
2521,gaaerre,['stuthulhu'],[12],1538094029.0,0,10,False,9ji89v,8,explainlikeimfive,ELI5: Did prehistoric humans cut their nails?
2522,Zach_Attakk,['B797'],[2],1538134214.0,0,6,False,9jm5pb,1,explainlikeimfive,ELI5: What do the numbers on my contact lens mean?
