,author,comments_author_lst,comments_score_lst,created_utc,guilded,num_comments,pinned,r_id,score,subreddit,title
3552,jotaviox,['stoppage_time'],[12],1537808521.0,0,6,False,9ijpgv,14,explainlikeimfive,"ELI5: How does ""natural"" fear works (eg. fear of snakes, spiders, the dark, heights)? I understand it has to do with natural selection, but I don't get how the mechanism functions on the brain and how it passes forward from parents to children. Is that DNA related somehow?"
3553,HellBounddd,"['flashfyr3', 'cork_dork']","[11, 8]",1537820312.0,0,4,False,9ilg7z,5,explainlikeimfive,ELI5: What’s happening to wine when it aerates? Why does it make the wine seem a little easier to drink? Does aeration cause it to go down in percentage of alcohol? Can alcohol expire?
3554,Zockerland99,['mmmmmmBacon12345'],[28],1537797509.0,0,11,False,9ii4vu,22,explainlikeimfive,ELI5: What is registered RAM and what is the difference to ECC RAM and regular desktop RAM
3555,ThirdAppendix,['Concise_Pirate'],[6],1537841857.0,0,7,False,9io8cc,2,explainlikeimfive,ELI5: What is the difference between a C-Corp and an S-Corp?
3556,Theuserr,['Concise_Pirate'],[5],1537832348.0,0,15,False,9in2h7,2,explainlikeimfive,"ELI5: why is it bad for companys shares to ""go down""?"
3557,heywhatsuphaha,"['WitTwitLizBit888', 'Hairmetal411']","[14, 6]",1537808419.0,0,8,False,9ijow4,10,explainlikeimfive,ELI5: benefits of hot showers and cold showers - which is better & why?
3558,CannotRememberThis,['Concise_Pirate'],[7],1537826072.0,0,7,False,9im9ax,2,explainlikeimfive,ELI5: How fast does heat transfer between two objects? Does more heat cause it to transfer faster?
3559,Housefosale,['Concise_Pirate'],[3],1537852948.0,0,3,False,9ipfjf,0,explainlikeimfive,ELI5: Why do addresses have cnr of Smith Rd and cnr of John Rd. Why not just the number?
3560,flanmorrison,['princezukosfire'],[4],1537850292.0,0,3,False,9ip6bq,1,explainlikeimfive,ELI5: Why do windshield wipers make the window streaky for the first few strokes?
3561,thaharshtruth,['Eulers_ID'],[7],1537834312.0,0,7,False,9inb97,2,explainlikeimfive,ELI5: What’s the difference between vapor and smoke ?
3562,macaryl95,"['krystar78', 'tntonic42']","[7, 5]",1537820745.0,0,6,False,9ilie3,4,explainlikeimfive,"ELI5: If you collect something from the ground like, say a dead bug, and you store it, it seems to last forever. But if you leave it be, it decays rather quickly. What exactly would be the cause or causes of this?"
3563,TGotAReddit,['Concise_Pirate'],[3],1537825866.0,0,6,False,9im8aq,2,explainlikeimfive,"ELI5, why does it seem like we get more precipitation in non-summer months?"
3564,Der_letzte_Baron,"['stuthulhu', 'krystar78', 'Qwerty_Resident']","[8, 5, 4]",1537814556.0,0,10,False,9iklnr,5,explainlikeimfive,ELI5: Rocket trajectories
3565,Losername01,['mredding'],[15],1537807949.0,0,11,False,9ijm5b,7,explainlikeimfive,"ELI5 What is happening when my phone displays that it has full 4G signal, but it clearly doesn't because it can't load anything?"
3566,Sigdavtilmig,"['kouhoutek', 'stuthulhu', 'Miliean']","[16, 15, 10]",1537814376.0,0,17,False,9ikkpg,5,explainlikeimfive,ELI5 how come no other species on earth have reached intelligence close to humans?
3567,FerynaCZ,"['stumblepretty', 'mugenhunt', 'Qwerty_Resident']","[18, 13, 8]",1537808418.0,0,11,False,9ijovw,7,explainlikeimfive,ELI5: Why illegal recordings don't count as a full-value proof at court?
3568,girlholdingtherose,[],[],1537829736.0,0,7,False,9imqoz,0,explainlikeimfive,ELI5: Why can't we taste anything while our nose is plugged/ when we're sick?
3569,TheOriginalJunglist,[],[],1537829641.0,0,2,False,9imq91,2,explainlikeimfive,ELI5: How do we adopt new fears and irrational phobias?
3570,Slaytounge,['FiveDozenWhales'],[23],1537766220.0,0,10,False,9ifand,47,explainlikeimfive,"ELI5: If sound can't travel through the near vacuum of space, what happens to the energy that would have vibrated the air to make a sound? Also how do other wave forms travel in space if the atoms are spaced so far apart?"
3571,,[],[],1537840417.0,0,5,False,9io22j,1,explainlikeimfive,ELI5: why does dark skin appear to have a blue or purplish sheen in certain lighting?
3572,Gideon_Crumb,['Lithuim'],[6],1537812660.0,0,4,False,9ikbpj,3,explainlikeimfive,ELI5: How does hemoglobin decrease when you bleed?
3573,clarianneross,['MyNameIsRay'],[7],1537811990.0,0,2,False,9ik86c,2,explainlikeimfive,ELI5: How are maximum occupancies calculated for rooms and buildings?
3574,lanceparth,"['coolwool', 'thewisesloth', 'AmorinMorin']","[6, 5, 4]",1537837180.0,0,11,False,9innys,1,explainlikeimfive,"ELI5: If oil and other fossil fuels come from once living organisms that have been pressurized over millions of years and Saudi Arabia is basically a giant desert, why does SA have so much damn oil? Wouldn’t a place like the rain forest (much denser in both plants and animals) have more?"
3575,MiserableBean,[],[],1537836980.0,0,1,False,9inn3n,1,explainlikeimfive,ELI5: The curves in radiocarbon calibration graphics
3576,willobbum,"['lofunkybot', 'Target880']","[12, 8]",1537801120.0,0,14,False,9iimic,7,explainlikeimfive,ELI5: How come mammals other than humans don't get periods? Or do they?
3577,dozzer85,"['DecentChanceOfLousy', 'r3fl3kT0r']","[62, 24]",1537749874.0,0,30,False,9idjun,72,explainlikeimfive,ELI5: What happens to all the bleach and washing liquids and chemicals we use. Is any of it filtered out or degrades once it goes down the drain or are we simply polluting the seas?
3578,HappyOrwell,['KahBhume'],[5],1537819382.0,0,9,False,9ilbax,2,explainlikeimfive,ELI5: Opium's history in China & Britain
3579,diglar,"['TheSizik', 'UneekYoosername']","[7, 5]",1537810049.0,0,7,False,9ijxxb,2,explainlikeimfive,ELI5: Some batteries can't be recharged while others can
3580,theswm,"['jeremy-o', 'sloanj1400']","[20, 7]",1537784104.0,0,21,False,9igptb,11,explainlikeimfive,ELI5: How were countries formed ?
3581,Goofball-John-McGee,"['mugenhunt', 'blipsman', 'JudgeHoltman']","[12, 8, 5]",1537807406.0,0,13,False,9ijj8t,2,explainlikeimfive,ELI5: How do sales and discounts work? Would it not be harmful for the company to sell their products at lower prices?
3582,TurtleBoiCudge,"['datcoin', 'ImAGeekNotANerd']","[1706, 383]",1537671597.0,0,160,False,9i5d7h,3544,explainlikeimfive,ELI5: Why does your skin turn red when pressure is applied for long periods of time?
3583,delirium_3,"['Lithuim', 'mirak1784']","[5, 4]",1537799061.0,0,4,False,9iicdz,5,explainlikeimfive,ELI5: How come spiders of the same species that are in the same corner of a room with conjoined webs don’t trap and eat each other? Do they communicate to each other letting the other know?
3584,niknud,[],[],1537812153.0,0,1,False,9ik92n,2,explainlikeimfive,"ELI5: Understanding Simulacra and Simulation -- ""The simulacrum is never that which hides the truth - it is truth that hides the fact that there is none. The simulacrum is true."""
3585,adamtwosleeves,[],[],1537825463.0,0,1,False,9im6b6,0,explainlikeimfive,ELI5: Why are eggs so versatile for cooking?
3586,arup_r,[],[],1537811663.0,0,6,False,9ik6hm,2,explainlikeimfive,ELI5: What is *Bitmap Heap Scan* and *Bitmap Index Scan* ?
3587,fpsb0b306,['exotics'],[7],1537810348.0,0,7,False,9ijziw,2,explainlikeimfive,ELI5: How did so many other creatures survive the asteroid impact that completely killed all the dinosaurs?
3588,deephouse717,['Unique_username1'],[4],1537823132.0,0,3,False,9iluvy,0,explainlikeimfive,ELI5 smart HDR on the new iPhones and what makes it take great photos.
3589,KuhakuuyaL,[],[],1537809063.0,0,5,False,9ijsl8,2,explainlikeimfive,ELI5:how does a freezer freeze?
3590,IttaiAK,['daughterjudyk'],[6],1537822097.0,0,5,False,9ilpff,0,explainlikeimfive,ELI5: how can cooked meat be dry?
3591,rambleshancid,"['krystar78', 'AirborneRodent']","[8, 5]",1537821545.0,0,4,False,9ilmhq,1,explainlikeimfive,ELI5: Why is vinegar so special?
3592,Ulle82,[],[],1537806874.0,0,4,False,9ijgjt,2,explainlikeimfive,ELI5: Why is it you can lose a large part of your brain and sometimes live an almost normal life as if nothing is wrong? Do we not use the whole brain?
3593,BeatsByBard,[],[],1537816782.0,0,5,False,9ikxhu,0,explainlikeimfive,ELI5: What is the belt or band performers wear on stage?
3594,nkjays,['EasilyDistractedTim'],[6],1537766361.0,0,15,False,9ifb2v,13,explainlikeimfive,"ELI5: Why do things like bread and cheese go stale when exposed to air? There will always be air inside whatever you seal it with, so why does new air make things go stale?"
3595,explodingpens,['Phage0070'],[2],1537801266.0,0,5,False,9iinbc,2,explainlikeimfive,ELI5: What does it mean to pay for CO2 emission offsets?
3596,brojob_brojob,"['Darkchyylde', 'bangdazap']","[15, 5]",1537811828.0,0,10,False,9ik7c5,0,explainlikeimfive,"ELI5: How come that killing those that go against a leader's point of view (eg., Journalists in Russsia) is common in some countries, but is not utilized or effective in other powerful countries (eg., US, Canada, Australia, etc.)?"
3597,ahmoud76,,,1537797486.0,0,2,False,9ii4qu,1,explainlikeimfive,ELI5: Why does it feel good/satisfying to jab at your gums or apply pressure on them?
3598,BluLightShow,['Concise_Pirate'],[30],1537842338.0,0,12,False,9ioadf,0,explainlikeimfive,ELI5: Why does YouTube need an “algorithm” to recommend you videos? Can’t it just show content related to what you’ve clicked on?
3599,madeinnothing,['LondonPilot'],[24],1537783211.0,0,11,False,9igmyu,4,explainlikeimfive,"ELI5: Why is it called pencil ""lead"" when it is made out of carbon"
3600,markssharkpark,[],[],1538329191.0,0,108,False,9k89xr,883,explainlikeimfive,ELI5: what is 'the golden ratio' and what is its relevance to the way plants grow?
3601,doctorinfinite,[],[],1538320026.0,0,102,False,9k70qx,237,explainlikeimfive,ELI5: Why do American and British (for one) television look so different?
3602,Vexvertigo,[],[],1538295954.0,0,83,False,9k4q7r,290,explainlikeimfive,ELI5: How do computers turn a million yes and nos into a basic program?
3603,JimmyThrowaway1,[],[],1538328745.0,0,17,False,9k87ns,37,explainlikeimfive,ELI5: Why electrons do not interact/get affected with strong force?
3604,Ianobassman,[],[],1538330019.0,0,9,False,9k8e1s,20,explainlikeimfive,ELI5: Why do apples start to turn brown almost immediately after being cut while other fruits take longer to turn?
3605,PinealPunch,[],[],1538326790.0,0,14,False,9k7xk0,22,explainlikeimfive,ELI5: Why do metal playgrounds shock you if they are (literally) always grounded?
3606,Bobswarly88,[],[],1538326747.0,0,8,False,9k7xc5,8,explainlikeimfive,"ELI5: When listening to loud music, why is it that we feel and see the effects of low frequency notes and not high frequency notes?"
3607,KendrickLama1,['diekurzekatze'],[12505],1538193527.0,0,1322,False,9jtnaw,12240,explainlikeimfive,ELI5: Why is the Queen in chess the most effective piece?
3608,Neon-Predator,[],[],1538320888.0,0,6,False,9k74ne,7,explainlikeimfive,ELI5: Why are mold spores so ubiquitous to all environments? How do mold spores spread to the point where they are basically everywhere?
3609,wolverines96,[],[],1538338298.0,0,6,False,9k9k25,2,explainlikeimfive,ELI5: What are GMOs and why are they used?
3610,DarkAlman,,,1538333282.0,0,2,False,9k8uhp,3,explainlikeimfive,ELI5: The Iranian Islamic Revolution
3611,TheRedditGreenShow,[],[],1538331331.0,0,5,False,9k8koo,1,explainlikeimfive,"ELI5: How do ceiling fans collect dust, even if they’re always in motion?"
3612,siren_37,,,1538339209.0,0,0,False,9k9om8,1,explainlikeimfive,ELI5: why dont animals get sick eating flesh of other rotting animals when humans would generally get sick and throw up if we did the same?
3613,WaxuTutu,,,1538339204.0,0,0,False,9k9old,1,explainlikeimfive,"ELI5: Why does atomic radius ""reset"" when an element shell is filled?"
3614,1nationunderg0d,[],[],1538337791.0,0,2,False,9k9he9,1,explainlikeimfive,Eli5: Why is the earths core hot?
3615,RebaRocket,,,1538334038.0,0,2,False,9k8ye7,1,explainlikeimfive,ELI5: Why does music make me cry?
3616,AL_O0,[],[],1538334009.0,0,1,False,9k8y7j,0,explainlikeimfive,"ELI5: Why do hotel soap bars make your hands “stick"" when you wash them, even under the running water?"
3617,Galaxy_Bot,[],[],1538302342.0,0,3,False,9k59my,4,explainlikeimfive,ELI5: 'Liquefaction' of hard soil to quick sand as seen in the recent Indonesian earthquake in the island of Sulawesi
3618,monkeymafia24,[],[],1538261697.0,0,11,False,9k1bt1,34,explainlikeimfive,ELI5: Why does fake jewelery turn the skin around it green?
3619,WaterIsALiquid,[],[],1538316261.0,0,5,False,9k6klc,1,explainlikeimfive,ELI5: How do prosthetics work?
3620,hearmetoot,,,1538328865.0,0,1,False,9k88ap,0,explainlikeimfive,ELI5:Can somebody explain the youtube playbar?
3621,TheIcyPyro,[],[],1538321890.0,0,6,False,9k79cw,0,explainlikeimfive,ELI5: Why does Jupiter have so many moons in comparison with other planets in our solar system?
3622,oeynhausener,[],[],1538320962.0,0,5,False,9k7500,1,explainlikeimfive,ELI5: Giant Magnetoresistance and Tunnel Magnetoresistance
3623,Equanimity_Numbers,[],[],1538318959.0,0,1,False,9k6vuq,1,explainlikeimfive,ELI5:The psychology of the Halo Effect and Horn Effect?
3624,beytrod,[],[],1538305290.0,0,3,False,9k5iev,4,explainlikeimfive,ELI5: Why do fingernails grow quicker than toenails?
3625,Omstar,[],[],1538316435.0,0,12,False,9k6l9c,0,explainlikeimfive,ELI5: How do genetics actually work?
3626,Sharontopusia,[],[],1538328394.0,0,1,False,9k85uv,0,explainlikeimfive,ELI5: Explain sober drea (m)s while drunk
3627,Graylander54,[],[],1538280926.0,0,3,False,9k3d6w,4,explainlikeimfive,ELI5: How do Wire Transfer work?
3628,Randomtngs,[],[],1538280798.0,0,1,False,9k3cmf,2,explainlikeimfive,Eli5: how do contact lenses work?
3629,nomnombubbles,[],[],1538294175.0,0,11,False,9k4lo3,0,explainlikeimfive,ELI5: Why does drinking alcohol make you experience auditory and visionary hallucinations?
3630,whatthecraplol,[],[],1538306959.0,0,7,False,9k5ocu,1,explainlikeimfive,ELI5: How does an automatic transmission in a car work?
3631,5Oprano5,[],[],1538257731.0,0,3,False,9k0v1s,11,explainlikeimfive,Eli5: How do we know how prehistoric animals behaved?
3632,herKushu,,,1538283741.0,0,1,False,9k3owa,2,explainlikeimfive,ELI5: what's the difference between Three dimensional airflow and Two dimensional airflow for Subsonic Airflow.
3633,DanTheCan42,[],[],1538282083.0,0,12,False,9k3i0y,1,explainlikeimfive,ELIF: Why does the pitch of voices go up or down when you speed up or slow down a video?
3634,emok31,['mister_peeberz'],[18],1538247460.0,0,11,False,9jzkaw,19,explainlikeimfive,"ELI5: How do DNA or cells grow a body? If all DNA or cells are ""identical"" then how to they know to grow a lung or a brain at the right time?"
3635,spermwhalejail,[],[],1538274907.0,0,2,False,9k2qys,3,explainlikeimfive,ELI5: Why is nitrogen (rather than some other element) the atom of choice for the creation of a stable protein peptide?
3636,toth42,[],[],1538295709.0,0,2,False,9k4pmh,1,explainlikeimfive,ELI5 how Bunsen and co. discovered new metals through spectrochemical analysis
3637,nitermania,[],[],1538281842.0,0,8,False,9k3h36,2,explainlikeimfive,ELI5: How does Naloxone work once put into the body? How does it counteract the effects of an overdose?
3638,Undercraft_gaming,[],[],1538281479.0,0,6,False,9k3fmn,2,explainlikeimfive,ELI5: The significance of normal force in dynamics
3639,kammon2,[],[],1538281000.0,0,4,False,9k3dj3,4,explainlikeimfive,ELI5: How do the cyborg arms where you can control the hand movements with your brain work?
3640,growleroz,['restricteddata'],[64],1538235657.0,0,22,False,9jxvi9,19,explainlikeimfive,ELI5: How did scientists know that uranium could be used to make an atomic bomb?
3641,cursedbaklava,[],[],1538277598.0,0,10,False,9k30nm,3,explainlikeimfive,"ELI5: If D.I.D patients can have different allergies per alter, how does this work physically? Is it placebo?"
3642,KL_boy,[],[],1538289391.0,0,6,False,9k48z1,1,explainlikeimfive,ELI5: What makes a gene dominant and why? Why not just have a 50/50 chance of a gene being expressed?
3643,Derelict_Desmond,[],[],1538271885.0,0,15,False,9k2fmh,2,explainlikeimfive,ELI5: How does Iambic Pentameter work?
3644,WutsGoodMyDood,[],[],1538282836.0,0,6,False,9k3l5f,0,explainlikeimfive,"ELI5: What makes a CPU well, a CPU?"
3645,wildddin,['TheGinnnnnnger'],[5160],1538117211.0,0,205,False,9jkp11,8525,explainlikeimfive,ELI5: Why do (in most cases) our eyes need to be closed for us to be able to sleep? And what happens to people who can sleep with their eyes open?
3646,Chrisant000,"['False_Bee', 'Hoax13']","[90, 16]",1538195231.0,0,49,False,9jtt09,87,explainlikeimfive,ELI5: What is Alcohol poisoning?
3647,JPGAW,[],[],1538282460.0,0,4,False,9k3jiy,0,explainlikeimfive,"ELI5: Why does skin feel dry after showing, regardless of exposure to water?"
3648,themaxviwe,['OmegaWarrior686'],[9],1538242748.0,0,9,False,9jyxkf,4,explainlikeimfive,ELI5: Why quarks are not able to exist isolated? Why does they have to always be in other particles?
3649,communisttankengine,[],[],1538253056.0,0,5,False,9k09pr,4,explainlikeimfive,ELI5 how the simple concept of electron shells you learn in middle school relates to concepts about atomic orbitals
3650,communisttankengine,['communisttankengine'],[39],1538189872.0,0,24,False,9jta4g,60,explainlikeimfive,ELI5 Why do pickles have less calories than a fresh cucumber of the same size?
3651,imnotlegolas,['cosmoboy'],[3],1538228254.0,0,9,False,9jwrhn,7,explainlikeimfive,"ELI5: When exercising, why do muscles hurt not until the next day after sleep?"
3652,SenorDuck96,"['rld3x', 'iechosale']","[3, 3]",1538245912.0,0,5,False,9jzct2,2,explainlikeimfive,ELI5: How does a blister form and how do you get rid of one?
3653,NitrousAcid,"['tjsunday87', 'marypoppinsbrolly', 'lollo9770']","[11, 5, 5]",1538211715.0,0,7,False,9jv49a,8,explainlikeimfive,ELI5: Whats the difference between ethics and morals?
3654,WhatIsTeleport,"['police-ical', 'blipsman', 'cdb03b']","[13, 6, 5]",1538240468.0,0,11,False,9jylr1,2,explainlikeimfive,ELI5: Why is cake the go-to celebration food?
3655,MaddoxX_1996,"['Wormsblink', 'MillerCreek']","[2, 2]",1538229329.0,0,4,False,9jwxan,3,explainlikeimfive,ELI5: How do geologists record historic and pre-historic tsunamis?
3656,askingquestionsblog,['cnash'],[5],1538228639.0,0,2,False,9jwtln,3,explainlikeimfive,"ELI5: A ""paean,"" versus an ""encomium,"" versus a ""hagiography"""
3657,Techfault,[],[],1538227589.0,0,3,False,9jwo0r,3,explainlikeimfive,ELI5: Why is glucose in the blood filtered into the Bowman’s capsule if it just gets re-absorbed into the blood in the convoluted tubule?
3658,SqueamishDesign,"['Holy_City', 'falconzord']","[26, 9]",1538193900.0,0,47,False,9jtolz,15,explainlikeimfive,"ELI5: What is the difference between C, C#, C-- and C++ other than the fact that they are different languages?"
3659,GodotF2P,['lollo9770'],[7],1538210951.0,0,7,False,9jv27h,4,explainlikeimfive,ELI5: Why is a liquid not moving when a plane is flying a curve?
3660,Tekno9000,[],[],1538241729.0,0,1,False,9jysl5,0,explainlikeimfive,ELI5: What is the difference between S&OP and IBP?
3661,Deskbot,['Thrillho29'],[7],1538189017.0,0,3,False,9jt6v4,12,explainlikeimfive,ELI5: How does a stock broker borrow stocks for you to short-sell
3662,Classy_Amir,[],[],1538252546.0,0,10,False,9k07ev,0,explainlikeimfive,ELI5: How does a barrel work in a firearm?
3663,absolutely_cancer,['DaniRainbow'],[6],1538200887.0,0,2,False,9juann,9,explainlikeimfive,ELI5 Why does our ability to resist urges fade and we lose control when we just arrive at the bathroom
3664,lzldmb,['kinyutaka'],[5],1538230777.0,0,5,False,9jx5hj,0,explainlikeimfive,ELI5: How does allowing the left turn lane to go first and only one direction at a time at an intersection improve traffic flow?
3665,FlockingSheep,['CamKen'],[13],1538191574.0,0,2,False,9jtggd,7,explainlikeimfive,ELI5: Why is there an interference with bluetooth headsets whenever shredding documents?
3666,ducksandshawarma,"['Bigjoemonger', 'ViskerRatio']","[11, 6]",1538215618.0,0,7,False,9jvef2,1,explainlikeimfive,ELI5: What is a Memory Cache ? And how does it resemble and differs from RAM ?
3667,sgsfx,[],[],1538228485.0,0,9,False,9jwssw,1,explainlikeimfive,ELI5 cellular age
3668,CuriousCommittee,['B797'],[4],1538214736.0,0,3,False,9jvc70,2,explainlikeimfive,ELI5: What's the mechanism behind LCD screen burn-in? How often does it happen?
3669,dad_hacker_maq,"['kouhoutek', 'goatharper']","[5, 3]",1538214517.0,0,17,False,9jvbna,2,explainlikeimfive,"ELI5: if electric motors are basically spinning magnets on some level, where do they get all the magnets from?"
3670,cantwaittillcollege,['calste'],[7],1538188787.0,0,13,False,9jt5yz,7,explainlikeimfive,ELI5: Blackbodies & Blackbody Radiation
3671,WVAviator,[],[],1538212355.0,0,2,False,9jv60d,2,explainlikeimfive,ELI5: What's happening on some nights when you try to wipe the thick layer of moisture off your windshield but it reappears almost immediately?
3672,oz1cz,"['SamRothstein72', 'Holgrin']","[234, 37]",1538127699.0,0,123,False,9jlka0,149,explainlikeimfive,ELI5: How can you pull up an anchor?
3673,bicureyooz,"['Oishii88', 'Cantaimforshit']","[4, 3]",1538196738.0,0,10,False,9jtxy0,2,explainlikeimfive,ELI5: How does a US employer get affected when an employee files for unemployment through the state?
3674,AncestralSpirit,['kouhoutek'],[10],1538210058.0,0,7,False,9jv007,2,explainlikeimfive,ELI5: Why do pawns in chess that cross the board get to choose something other than the Queen? Why would you choose something inferior that has less moves?
3675,Baredare,"['Concise_Pirate', 'Glasnerven']","[26, 16]",1538170161.0,0,14,False,9jr0k5,15,explainlikeimfive,ELI5: Why not use single edged blades?
3676,danielle732,"['cdb03b', 'springsteentrack9']","[48, 13]",1538168795.0,0,17,False,9jqtzz,12,explainlikeimfive,ELI5: Why can’t we eat cows that die of natural causes or of old age?
3677,MohnJaddenPowers,['epiqu1n'],[5],1538167088.0,0,5,False,9jqllx,15,explainlikeimfive,"ELI5: If the female hemp plant contains THC, how do farmers make sure they don't grow it?"
3678,Ssauwrk,['1337gamer47'],[9],1538184812.0,0,6,False,9jsqkw,4,explainlikeimfive,ELI5: How does a game know what to load when you select a load to play?
3679,StoneEagleCopy,['BcTheCenterLeft'],[6],1538217478.0,0,6,False,9jvk6l,1,explainlikeimfive,"ELI5: Why when 2 liquids are put into a cup, they mix, but when 2 solids are put together, they stay separated. What 'barrier' stops it from mixing?"
3680,askingquestionsblog,['Drgeebee'],[2824],1538050031.0,0,428,False,9jcadl,8463,explainlikeimfive,"ELI5: How come working most muscle groups in the body leads them to be come ""built up"" and stronger, while one's eye muscles only seem to strain and weaken over time?"
3681,bluetack_man,"['zifnab90', 'MiloGoesToBJJ']","[6, 4]",1538215312.0,0,11,False,9jvdn1,0,explainlikeimfive,ELI5: Why are there always tomes of old dictionaries in old manor houses?
3682,DonnaPinciotti420,['dramawahoo'],[33],1538193557.0,0,25,False,9jtndv,2,explainlikeimfive,"ELI5: How do printers print white when the cartidges only hold black, yellow, cyan & magenta ink?"
3683,youdontrate315,['Phage0070'],[9],1538183452.0,0,12,False,9jsla0,3,explainlikeimfive,ELI5: Trans Atlantic calls in the early 1900s
3684,Iamconno,['cnash'],[6],1538200406.0,0,3,False,9ju9a0,2,explainlikeimfive,ELI5: How do countries pay other countries?
3685,entropyNull,[],[],1538199876.0,0,12,False,9ju7pf,2,explainlikeimfive,ELI5: What exactly is the relation between heat and light?
3686,ruisleipa_3000,['BeautylicousBabe'],[15],1538212643.0,0,8,False,9jv6qh,0,explainlikeimfive,"ELI5: Why does unhealthy food taste so good, and healthy food taste so bad?"
3687,Anti_42,"['Psyk60', 'Whyistheplatypus']","[3, 2]",1538210116.0,0,5,False,9jv055,0,explainlikeimfive,ELI5: Why there are still Kings and Queens in some countries and how effective they are in modern world?
3688,Mrben13,"['blipsman', 'BitsyBigBoyBoomeroo', 'minion531']","[9, 8, 5]",1538166782.0,0,20,False,9jqk1r,10,explainlikeimfive,ELI5: Why some companies pay bi-weekly and some pay weekly? Is there a benefit of one over the other for the company?
3689,ScottishGigolo,"['TheOnlyMego', 'stuthulhu']","[10, 4]",1538163457.0,0,14,False,9jq3cx,10,explainlikeimfive,ELI5: Why do stars expand as they age and what causes them suddenly contract as they go Nova?
3690,FlyingLemurs76,[],[],1538208324.0,0,43,False,9juvgt,1,explainlikeimfive,ELI5: The difference between atoms as waves vs atoms as particles
3691,ethancg_,['succaneers'],[4],1538206162.0,0,8,False,9jupu8,1,explainlikeimfive,ELI5: why is it harder to stop a projectile than it is to create one?
3692,X1x3x3x7,"['goatymcgoatfacesings', 'speakerchef']","[3, 2]",1538191596.0,0,10,False,9jtgiy,2,explainlikeimfive,ELI5: Why are there so many more types of apples than other fruits?
3693,Kaitah,"['internetboyfriend666', 'TheSoup05']","[14, 5]",1538204976.0,0,15,False,9jumgm,1,explainlikeimfive,"ELI5: Why can’t we surgically switch switch peoples brains around like we do hearts, kidney, etc?"
3694,Task876,['Surfin_Bro'],[2],1538183208.0,0,3,False,9jskdj,1,explainlikeimfive,ELI5: What is a state in thermodynamics?
3695,Ehrahbass,"['GrayPhilosophy', 'Nez_bit']","[5, 1]",1538159275.0,0,10,False,9jphhj,12,explainlikeimfive,"ELI5: Why do we sometimes sneeze once and sometimes twice (and maybe rarely three times)? How does our body determine the amount of times we sneeze in one ""episode"" of sneezing?"
3696,IminPeru,[],[],1538176515.0,0,7,False,9jrtha,3,explainlikeimfive,ELI5: How does the process of patching/updating a software work?
3697,Sherman2020,['pitroms'],[5],1538158782.0,0,14,False,9jpexs,8,explainlikeimfive,ELI5: What is the fundamental difference between different types of cells in our body; ie muscle tissue vs organs vs bones
3698,Spoolx21,['henstepl'],[3],1538184416.0,0,5,False,9jsp1c,2,explainlikeimfive,ELI5:Why does a space objects speed change when it gets closer to a body?
