,author,comments_author_lst,comments_score_lst,created_utc,guilded,num_comments,pinned,r_id,score,subreddit,title
1185,dozzer85,"['DecentChanceOfLousy', 'r3fl3kT0r']","[62, 24]",1537749874.0,0,30,False,9idjun,71,explainlikeimfive,ELI5: What happens to all the bleach and washing liquids and chemicals we use. Is any of it filtered out or degrades once it goes down the drain or are we simply polluting the seas?
1186,HappyOrwell,['KahBhume'],[6],1537819382.0,0,9,False,9ilbax,2,explainlikeimfive,ELI5: Opium's history in China & Britain
1187,diglar,"['TheSizik', 'UneekYoosername']","[7, 5]",1537810049.0,0,7,False,9ijxxb,4,explainlikeimfive,ELI5: Some batteries can't be recharged while others can
1188,theswm,"['jeremy-o', 'sloanj1400']","[20, 5]",1537784104.0,0,21,False,9igptb,10,explainlikeimfive,ELI5: How were countries formed ?
1189,Goofball-John-McGee,"['mugenhunt', 'blipsman']","[12, 8]",1537807406.0,0,13,False,9ijj8t,2,explainlikeimfive,ELI5: How do sales and discounts work? Would it not be harmful for the company to sell their products at lower prices?
1190,TurtleBoiCudge,"['datcoin', 'ImAGeekNotANerd']","[1704, 384]",1537671597.0,0,160,False,9i5d7h,3534,explainlikeimfive,ELI5: Why does your skin turn red when pressure is applied for long periods of time?
1191,delirium_3,"['Lithuim', 'mirak1784']","[6, 4]",1537799061.0,0,4,False,9iicdz,3,explainlikeimfive,ELI5: How come spiders of the same species that are in the same corner of a room with conjoined webs don’t trap and eat each other? Do they communicate to each other letting the other know?
1192,niknud,[],[],1537812153.0,0,1,False,9ik92n,2,explainlikeimfive,"ELI5: Understanding Simulacra and Simulation -- ""The simulacrum is never that which hides the truth - it is truth that hides the fact that there is none. The simulacrum is true."""
1193,adamtwosleeves,[],[],1537825463.0,0,1,False,9im6b6,2,explainlikeimfive,ELI5: Why are eggs so versatile for cooking?
1194,arup_r,[],[],1537811663.0,0,6,False,9ik6hm,2,explainlikeimfive,ELI5: What is *Bitmap Heap Scan* and *Bitmap Index Scan* ?
1195,fpsb0b306,['exotics'],[7],1537810348.0,0,7,False,9ijziw,2,explainlikeimfive,ELI5: How did so many other creatures survive the asteroid impact that completely killed all the dinosaurs?
1196,deephouse717,['Unique_username1'],[4],1537823132.0,0,3,False,9iluvy,0,explainlikeimfive,ELI5 smart HDR on the new iPhones and what makes it take great photos.
1197,KuhakuuyaL,[],[],1537809063.0,0,5,False,9ijsl8,2,explainlikeimfive,ELI5:how does a freezer freeze?
1198,IttaiAK,['daughterjudyk'],[6],1537822097.0,0,5,False,9ilpff,0,explainlikeimfive,ELI5: how can cooked meat be dry?
1199,rambleshancid,"['krystar78', 'AirborneRodent']","[9, 6]",1537821545.0,0,4,False,9ilmhq,1,explainlikeimfive,ELI5: Why is vinegar so special?
1200,markssharkpark,[],[],1538329191.0,0,490,False,9k89xr,7957,explainlikeimfive,ELI5: what is 'the golden ratio' and what is its relevance to the way plants grow?
1201,mrmangos02,[],[],1538389709.0,0,7,False,9kf5t2,20,explainlikeimfive,ELI5: why does 72 degrees in your house feel diiferent depending on outside temperature?
1202,doctorinfinite,[],[],1538320026.0,0,157,False,9k70qx,308,explainlikeimfive,ELI5: Why do American and British (for one) television look so different?
1203,pixelninja69,[],[],1538385642.0,0,3,False,9ket0g,10,explainlikeimfive,ELI5: doesnt moisturising after you wash your face just block your pores?
1204,Chokeeb,[],[],1538388457.0,0,3,False,9kf1ry,10,explainlikeimfive,ELI5: How does a single speaker produce multiple frequencies simultaneously to play music?
1205,leroysorro,[],[],1538389313.0,0,23,False,9kf4kj,7,explainlikeimfive,ELI5: The philosophy and teachings of Jordan Peterson.
1206,starlancer21,[],[],1538375707.0,0,9,False,9kdzkd,12,explainlikeimfive,Eli5: how does one way mirror/glass work?
1207,luxiofstars,[],[],1538382881.0,0,6,False,9kekxh,7,explainlikeimfive,ELI5: How do free apps make money?
1208,Lottso,[],[],1538372176.0,0,8,False,9kdnvo,11,explainlikeimfive,ELI5: what could a criminal ACTUALLY do if they had your social security number?
1209,1Banana2Oranges,[],[],1538384142.0,0,6,False,9keoem,4,explainlikeimfive,"ELI5: Why is there no B sharp and C flat, and E sharp or F flat In guitar?"
1210,Slim_Python,[],[],1538393798.0,0,1,False,9kfjtz,3,explainlikeimfive,ELI5: What is the difference between night sleep and naps with intervals?
1211,BlitzMainDontHurtMe,[],[],1538383618.0,0,3,False,9kemxd,5,explainlikeimfive,"ELI5: Some animals have more color receptors than us, what do they see, more colors, different shades, and why is that?"
1212,UsuallyJake,,,1538396360.0,0,0,False,9kftom,2,explainlikeimfive,ELI5: what is the difference between a compressed carbon dioxide tanks and a liquefied carbon dioxide tank?
1213,Kreagerrr,[],[],1538395601.0,0,6,False,9kfqn1,1,explainlikeimfive,ELI5: How exactly does the US school system works? How is it possible that students are leaving school with huge debts?
1214,Vexvertigo,['Zomunieo'],[206],1538295954.0,0,101,False,9k4q7r,323,explainlikeimfive,ELI5: How do computers turn a million yes and nos into a basic program?
1215,blkcollegemanutk,[],[],1538387008.0,0,11,False,9kex3f,2,explainlikeimfive,"ElI5. How are you able to descend 9-10m/s in an elevator, yet never feel that sinking or falling sensation?"
1216,Darayavaush,,,1538394602.0,0,0,False,9kfmq9,2,explainlikeimfive,"ELI5: Why do photons have no mass, considering almost all other elementary particles have it?"
1217,MysteryMisterMox,[],[],1538356268.0,0,4,False,9kbvd9,13,explainlikeimfive,ELI5: How does scar tissue work? And why does some wounds leave scars and others don't?
1218,reva_r,[],[],1538393696.0,0,3,False,9kfjgs,1,explainlikeimfive,ELI5: How do fish live in aquariums and bowls without getting bored to death?
1219,KeithCGlynn,[],[],1538385640.0,0,13,False,9ket0c,3,explainlikeimfive,ELI5: Why do planes need to dump fuel before emergency landing?
1220,WulffenKampf,[],[],1538379941.0,0,3,False,9kecn2,3,explainlikeimfive,"ELI5: What is the purpose of Wingtip Devices on jumbo jets, and what led to their creation?"
1221,Exciples,[],[],1538370737.0,0,5,False,9kdj0m,6,explainlikeimfive,ELI5: how does eyesight become blurry? And why does squinting fix this?
1222,IamMustache,[],[],1538370030.0,0,8,False,9kdge7,6,explainlikeimfive,"ELI5: People with perfect pitch, how exactly do you identify a note or key without any context? What processes do you go through to determine what a given note is?"
1223,ActiveOzone,[],[],1538355719.0,0,12,False,9kbsr4,13,explainlikeimfive,ELI5: How do scientist prove the existent of atoms when we cant even see them with our naked eyes?
1224,backerkv,[],[],1538372439.0,0,10,False,9kdoro,4,explainlikeimfive,ELI5: Why are there so many contrasting and varying definitions of race around the world? Is there no universally accepted race category?
1225,MarcusLithouver,[],[],1538390124.0,0,4,False,9kf744,2,explainlikeimfive,ELI5: Why would a triple envelopment work (or not work)?
1226,opkyei,[],[],1538389436.0,0,2,False,9kf4z6,2,explainlikeimfive,ELI5:How does TV White Space core network connect to the internet?
1227,PraisePancakes,[],[],1538359130.0,0,5,False,9kc8e3,9,explainlikeimfive,"ELI5: How do mathematicians and physicists come up with page long equations such as the ""Standard Model Equation""? Where do they start and how do they test these equations for accuracy?"
1228,JimmyThrowaway1,[],[],1538328745.0,0,17,False,9k87ns,41,explainlikeimfive,ELI5: Why electrons do not interact/get affected with strong force?
1229,eatdeadpeople,,,1538396830.0,0,0,False,9kfvhy,1,explainlikeimfive,ELI5: How do ants breath?
1230,PinealPunch,[],[],1538326790.0,0,23,False,9k7xk0,40,explainlikeimfive,ELI5: Why do metal playgrounds shock you if they are (literally) always grounded?
1231,mandudeguyman,,,1538393614.0,0,1,False,9kfj6a,0,explainlikeimfive,ELI5: Why are video streams slow at times and fast in others (with no change to the pc's internet speed)
1232,v78,[],[],1538371809.0,0,1,False,9kdmlm,3,explainlikeimfive,ELI5: What are the future implications of renaming The Republic of Macedonia?
1233,WVUGuy29,[],[],1538379676.0,0,13,False,9kebw4,1,explainlikeimfive,"ELI5: How do people on tv shows like Intervention not get arrested when they go buy their drugs? Does the network, like A&E, alert local LEOs to not arrest them? Is it bc of the cameras? How does this all go down?"
1234,Red2340,[],[],1538393139.0,0,2,False,9kfhg3,0,explainlikeimfive,"ELI5: Other than detecting changes in star brightness, how are astronomers able to tell so much detail about planets in other solar systems from so far away?"
1235,BiJa90,[],[],1538391364.0,0,3,False,9kfb6m,1,explainlikeimfive,"ELI5: Michael Phelps' 12,000 calorie diet."
1236,AbdulRatBad,[],[],1538387699.0,0,4,False,9kezc1,1,explainlikeimfive,ELI5: How is it that statistics bureaus report on information that is not reported ? eg. statistics for unreported crimes like unreported burglaries or even unreported sexual assaults.
1237,09ymmit07,[],[],1538387186.0,0,5,False,9kexq9,1,explainlikeimfive,ELI5: Why is the waste from nuclear fission not usable for nuclear fusion?
1238,extracrispy7,[],[],1538362398.0,0,2,False,9kcmq7,2,explainlikeimfive,ELI5: Why are gum sticky when they are dry but not when they are wet?
1239,instant_moksha,[],[],1538370225.0,0,10,False,9kdh5w,2,explainlikeimfive,ELI5 Why is the American constitution difficult to amend?
1240,joeyzanelli,[],[],1538383320.0,0,2,False,9kem5d,1,explainlikeimfive,ELI5: Do brains have a 'GPU' that maps our imagination?
1241,jackmerius27,[],[],1538379939.0,0,2,False,9kecmn,0,explainlikeimfive,ELI5: How do 3D movies work?
1242,em_te,[],[],1538378992.0,0,6,False,9ke9ul,0,explainlikeimfive,ELI5: why does soldering create a tiny spark that is worse for the eyes than the harm caused by huge floodlights even when both are far away?
1243,DoomCircus,[],[],1538376929.0,0,1,False,9ke3hm,1,explainlikeimfive,"ELI5: In car suspension, what do stabilizer links actually do?"
1244,ChristianJ84,[],[],1538341122.0,0,9,False,9k9y00,6,explainlikeimfive,ELI5 why a smartphone camera makes several flashes before taking the actual picture?
1245,manuelgcg,[],[],1538373308.0,0,3,False,9kdrra,1,explainlikeimfive,ELI5: What is reactive power? why is it important?
1246,Kornell2018,[],[],1538343413.0,0,2,False,9ka9c5,5,explainlikeimfive,ELI5: What is Modernism and other movements?
1247,just2browse2,[],[],1538370390.0,0,1,False,9kdhsg,1,explainlikeimfive,ELi5: Difference between redox reactions and precipitate reactions
1248,chapstan,[],[],1538356664.0,0,5,False,9kbx8w,2,explainlikeimfive,ELI5: How does putting duct tape on a mole or skin tag make it go away?
1249,WaterSnow7050,[],[],1538368180.0,0,4,False,9kd9sp,0,explainlikeimfive,"ELI5: Identical twins, just, how?"
1250,ForbidReality,[],[],1538354227.0,0,2,False,9kbm7m,2,explainlikeimfive,ELI5: Why can people be poisoned by proteins like botulinum when intestine absorbs only small chunks of amino acids?
1251,WaxuTutu,[],[],1538339204.0,0,8,False,9k9old,3,explainlikeimfive,"ELI5: Why does atomic radius ""reset"" when an element shell is filled?"
1252,KendrickLama1,['diekurzekatze'],[12513],1538193527.0,0,1322,False,9jtnaw,12247,explainlikeimfive,ELI5: Why is the Queen in chess the most effective piece?
1253,Neon-Predator,[],[],1538320888.0,0,6,False,9k74ne,7,explainlikeimfive,ELI5: Why are mold spores so ubiquitous to all environments? How do mold spores spread to the point where they are basically everywhere?
1254,Bobswarly88,[],[],1538326747.0,0,9,False,9k7xc5,3,explainlikeimfive,"ELI5: When listening to loud music, why is it that we feel and see the effects of low frequency notes and not high frequency notes?"
1255,w1tchb1tch,[],[],1538354055.0,0,2,False,9kblgi,1,explainlikeimfive,ELI5: How do things like pools and bathrooms in luxury bomb shelters work?
1256,Don_Hoomer,[],[],1538346150.0,0,3,False,9kam3t,1,explainlikeimfive,ELI5: The four seasons
1257,MmmVomit,[],[],1538345758.0,0,5,False,9kakbg,1,explainlikeimfive,ELI5 why electrolysis of water results in hydrogen at one electrode and oxygen at the other
1258,Galaxy_Bot,['KubrickIsMyCopilot'],[2],1538302342.0,0,4,False,9k59my,5,explainlikeimfive,ELI5: 'Liquefaction' of hard soil to quick sand as seen in the recent Indonesian earthquake in the island of Sulawesi
1259,beytrod,['cowboykillerreds'],[4],1538305290.0,0,4,False,9k5iev,6,explainlikeimfive,ELI5: Why do fingernails grow quicker than toenails?
1260,monkeymafia24,"['CapnJackH', 'BonnieBottom', 'PrincessShelbyy']","[29, 29, 28]",1538261697.0,0,11,False,9k1bt1,44,explainlikeimfive,ELI5: Why does fake jewelery turn the skin around it green?
1261,Omstar,[],[],1538316435.0,0,12,False,9k6l9c,3,explainlikeimfive,ELI5: How do genetics actually work?
1262,TheIcyPyro,[],[],1538321890.0,0,9,False,9k79cw,0,explainlikeimfive,ELI5: Why does Jupiter have so many moons in comparison with other planets in our solar system?
1263,oeynhausener,[],[],1538320962.0,0,6,False,9k7500,1,explainlikeimfive,ELI5: Giant Magnetoresistance and Tunnel Magnetoresistance
1264,WaterIsALiquid,[],[],1538316261.0,0,5,False,9k6klc,1,explainlikeimfive,ELI5: How do prosthetics work?
1265,Graylander54,['spaceboypurp'],[3],1538280926.0,0,3,False,9k3d6w,6,explainlikeimfive,ELI5: How do Wire Transfer work?
1266,herKushu,,,1538283741.0,0,1,False,9k3owa,5,explainlikeimfive,ELI5: what's the difference between Three dimensional airflow and Two dimensional airflow for Subsonic Airflow.
1267,DanTheCan42,['Unable_Request'],[13],1538282083.0,0,12,False,9k3i0y,2,explainlikeimfive,ELIF: Why does the pitch of voices go up or down when you speed up or slow down a video?
1268,5Oprano5,"['Helvete-73', '2Siders']","[13, 7]",1538257731.0,0,3,False,9k0v1s,15,explainlikeimfive,Eli5: How do we know how prehistoric animals behaved?
1269,whatthecraplol,[],[],1538306959.0,0,8,False,9k5ocu,0,explainlikeimfive,ELI5: How does an automatic transmission in a car work?
1270,emok31,['mister_peeberz'],[19],1538247460.0,0,12,False,9jzkaw,18,explainlikeimfive,"ELI5: How do DNA or cells grow a body? If all DNA or cells are ""identical"" then how to they know to grow a lung or a brain at the right time?"
1271,Derelict_Desmond,"['Portarossa', 'Cidopuck']","[15, 6]",1538271885.0,0,15,False,9k2fmh,4,explainlikeimfive,ELI5: How does Iambic Pentameter work?
1272,KL_boy,['Schnutzel'],[5],1538289391.0,0,6,False,9k48z1,1,explainlikeimfive,ELI5: What makes a gene dominant and why? Why not just have a 50/50 chance of a gene being expressed?
1273,spermwhalejail,['kiwicascudo'],[2],1538274907.0,0,2,False,9k2qys,5,explainlikeimfive,ELI5: Why is nitrogen (rather than some other element) the atom of choice for the creation of a stable protein peptide?
1274,growleroz,['restricteddata'],[72],1538235657.0,0,24,False,9jxvi9,23,explainlikeimfive,ELI5: How did scientists know that uranium could be used to make an atomic bomb?
1275,toth42,[],[],1538295709.0,0,2,False,9k4pmh,1,explainlikeimfive,ELI5 how Bunsen and co. discovered new metals through spectrochemical analysis
1276,nitermania,['TehWildMan_'],[6],1538281842.0,0,10,False,9k3h36,2,explainlikeimfive,ELI5: How does Naloxone work once put into the body? How does it counteract the effects of an overdose?
1277,Undercraft_gaming,"['Target880', 'km89']","[2, 2]",1538281479.0,0,6,False,9k3fmn,2,explainlikeimfive,ELI5: The significance of normal force in dynamics
1278,kammon2,[],[],1538281000.0,0,3,False,9k3dj3,2,explainlikeimfive,ELI5: How do the cyborg arms where you can control the hand movements with your brain work?
1279,nomnombubbles,"['Ninjaraiii', 'OpthalmicObsessions']","[40, 13]",1538294175.0,0,11,False,9k4lo3,0,explainlikeimfive,ELI5: Why does drinking alcohol make you experience auditory and visionary hallucinations?
1280,cursedbaklava,['Concise_Pirate'],[2],1538277598.0,0,11,False,9k30nm,2,explainlikeimfive,"ELI5: If D.I.D patients can have different allergies per alter, how does this work physically? Is it placebo?"
1281,WutsGoodMyDood,['illogictc'],[6],1538282836.0,0,7,False,9k3l5f,2,explainlikeimfive,"ELI5: What makes a CPU well, a CPU?"
1282,wildddin,['TheGinnnnnnger'],[5164],1538117211.0,0,204,False,9jkp11,8537,explainlikeimfive,ELI5: Why do (in most cases) our eyes need to be closed for us to be able to sleep? And what happens to people who can sleep with their eyes open?
1283,Chrisant000,['False_Bee'],[88],1538195231.0,0,49,False,9jtt09,83,explainlikeimfive,ELI5: What is Alcohol poisoning?
1284,JPGAW,['shibamyheart'],[5],1538282460.0,0,4,False,9k3jiy,0,explainlikeimfive,"ELI5: Why does skin feel dry after showing, regardless of exposure to water?"
1285,themaxviwe,['OmegaWarrior686'],[8],1538242748.0,0,9,False,9jyxkf,7,explainlikeimfive,ELI5: Why quarks are not able to exist isolated? Why does they have to always be in other particles?
1286,communisttankengine,"['helpimapenguin', 'WRSaunders']","[6, 3]",1538253056.0,0,5,False,9k09pr,2,explainlikeimfive,ELI5 how the simple concept of electron shells you learn in middle school relates to concepts about atomic orbitals
1287,communisttankengine,['communisttankengine'],[38],1538189872.0,0,24,False,9jta4g,61,explainlikeimfive,ELI5 Why do pickles have less calories than a fresh cucumber of the same size?
1288,imnotlegolas,['cosmoboy'],[3],1538228254.0,0,9,False,9jwrhn,7,explainlikeimfive,"ELI5: When exercising, why do muscles hurt not until the next day after sleep?"
1289,SenorDuck96,"['rld3x', 'iechosale']","[3, 3]",1538245912.0,0,5,False,9jzct2,2,explainlikeimfive,ELI5: How does a blister form and how do you get rid of one?
1290,NitrousAcid,"['tjsunday87', 'marypoppinsbrolly', 'kouhoutek']","[11, 10, 6]",1538211715.0,0,7,False,9jv49a,7,explainlikeimfive,ELI5: Whats the difference between ethics and morals?
1291,WhatIsTeleport,"['police-ical', 'blipsman', 'cdb03b']","[14, 5, 4]",1538240468.0,0,11,False,9jylr1,2,explainlikeimfive,ELI5: Why is cake the go-to celebration food?
1292,MaddoxX_1996,"['Wormsblink', 'MillerCreek']","[2, 2]",1538229329.0,0,4,False,9jwxan,3,explainlikeimfive,ELI5: How do geologists record historic and pre-historic tsunamis?
1293,askingquestionsblog,['cnash'],[5],1538228639.0,0,2,False,9jwtln,5,explainlikeimfive,"ELI5: A ""paean,"" versus an ""encomium,"" versus a ""hagiography"""
1294,Techfault,[],[],1538227589.0,0,3,False,9jwo0r,3,explainlikeimfive,ELI5: Why is glucose in the blood filtered into the Bowman’s capsule if it just gets re-absorbed into the blood in the convoluted tubule?
1295,SqueamishDesign,"['Holy_City', 'falconzord']","[26, 7]",1538193900.0,0,48,False,9jtolz,17,explainlikeimfive,"ELI5: What is the difference between C, C#, C-- and C++ other than the fact that they are different languages?"
1296,GodotF2P,['lollo9770'],[7],1538210951.0,0,7,False,9jv27h,4,explainlikeimfive,ELI5: Why is a liquid not moving when a plane is flying a curve?
1297,Tekno9000,[],[],1538241729.0,0,1,False,9jysl5,0,explainlikeimfive,ELI5: What is the difference between S&OP and IBP?
1298,Deskbot,['Thrillho29'],[6],1538189017.0,0,3,False,9jt6v4,11,explainlikeimfive,ELI5: How does a stock broker borrow stocks for you to short-sell
1299,Classy_Amir,['Straight-faced_solo'],[6],1538252546.0,0,11,False,9k07ev,0,explainlikeimfive,ELI5: How does a barrel work in a firearm?
1300,absolutely_cancer,['DaniRainbow'],[7],1538200887.0,0,2,False,9juann,8,explainlikeimfive,ELI5 Why does our ability to resist urges fade and we lose control when we just arrive at the bathroom
1301,lzldmb,['kinyutaka'],[5],1538230777.0,0,5,False,9jx5hj,2,explainlikeimfive,ELI5: How does allowing the left turn lane to go first and only one direction at a time at an intersection improve traffic flow?
1302,FlockingSheep,['CamKen'],[14],1538191574.0,0,2,False,9jtggd,6,explainlikeimfive,ELI5: Why is there an interference with bluetooth headsets whenever shredding documents?
1303,ducksandshawarma,"['Bigjoemonger', 'ViskerRatio']","[11, 7]",1538215618.0,0,7,False,9jvef2,3,explainlikeimfive,ELI5: What is a Memory Cache ? And how does it resemble and differs from RAM ?
1304,sgsfx,[],[],1538228485.0,0,9,False,9jwssw,1,explainlikeimfive,ELI5 cellular age
1305,CuriousCommittee,['B797'],[5],1538214736.0,0,3,False,9jvc70,2,explainlikeimfive,ELI5: What's the mechanism behind LCD screen burn-in? How often does it happen?
1306,dad_hacker_maq,"['kouhoutek', 'goatharper']","[5, 4]",1538214517.0,0,17,False,9jvbna,2,explainlikeimfive,"ELI5: if electric motors are basically spinning magnets on some level, where do they get all the magnets from?"
1307,cantwaittillcollege,['calste'],[7],1538188787.0,0,13,False,9jt5yz,7,explainlikeimfive,ELI5: Blackbodies & Blackbody Radiation
1308,WVAviator,[],[],1538212355.0,0,2,False,9jv60d,2,explainlikeimfive,ELI5: What's happening on some nights when you try to wipe the thick layer of moisture off your windshield but it reappears almost immediately?
1309,oz1cz,['SamRothstein72'],[235],1538127699.0,0,124,False,9jlka0,148,explainlikeimfive,ELI5: How can you pull up an anchor?
1310,bicureyooz,"['Cantaimforshit', 'Oishii88']","[3, 3]",1538196738.0,0,10,False,9jtxy0,4,explainlikeimfive,ELI5: How does a US employer get affected when an employee files for unemployment through the state?
1311,Anti_42,"['Psyk60', 'Whyistheplatypus']","[3, 2]",1538210116.0,0,5,False,9jv055,2,explainlikeimfive,ELI5: Why there are still Kings and Queens in some countries and how effective they are in modern world?
1312,AncestralSpirit,['kouhoutek'],[11],1538210058.0,0,7,False,9jv007,2,explainlikeimfive,ELI5: Why do pawns in chess that cross the board get to choose something other than the Queen? Why would you choose something inferior that has less moves?
1313,Baredare,"['Concise_Pirate', 'Glasnerven']","[28, 16]",1538170161.0,0,14,False,9jr0k5,13,explainlikeimfive,ELI5: Why not use single edged blades?
1314,danielle732,"['cdb03b', 'springsteentrack9']","[49, 13]",1538168795.0,0,17,False,9jqtzz,13,explainlikeimfive,ELI5: Why can’t we eat cows that die of natural causes or of old age?
1315,MohnJaddenPowers,['epiqu1n'],[6],1538167088.0,0,5,False,9jqllx,14,explainlikeimfive,"ELI5: If the female hemp plant contains THC, how do farmers make sure they don't grow it?"
1316,Ssauwrk,['1337gamer47'],[10],1538184812.0,0,6,False,9jsqkw,6,explainlikeimfive,ELI5: How does a game know what to load when you select a load to play?
1317,StoneEagleCopy,['BcTheCenterLeft'],[6],1538217478.0,0,7,False,9jvk6l,1,explainlikeimfive,"ELI5: Why when 2 liquids are put into a cup, they mix, but when 2 solids are put together, they stay separated. What 'barrier' stops it from mixing?"
1318,askingquestionsblog,['Drgeebee'],[2824],1538050031.0,0,428,False,9jcadl,8470,explainlikeimfive,"ELI5: How come working most muscle groups in the body leads them to be come ""built up"" and stronger, while one's eye muscles only seem to strain and weaken over time?"
1319,bluetack_man,['zifnab90'],[8],1538215312.0,0,11,False,9jvdn1,0,explainlikeimfive,ELI5: Why are there always tomes of old dictionaries in old manor houses?
1320,youdontrate315,['Phage0070'],[10],1538183452.0,0,12,False,9jsla0,7,explainlikeimfive,ELI5: Trans Atlantic calls in the early 1900s
1321,Iamconno,['cnash'],[8],1538200406.0,0,3,False,9ju9a0,2,explainlikeimfive,ELI5: How do countries pay other countries?
1322,entropyNull,[],[],1538199876.0,0,12,False,9ju7pf,2,explainlikeimfive,ELI5: What exactly is the relation between heat and light?
1323,X1x3x3x7,"['goatymcgoatfacesings', 'speakerchef']","[3, 2]",1538191596.0,0,10,False,9jtgiy,4,explainlikeimfive,ELI5: Why are there so many more types of apples than other fruits?
1324,ruisleipa_3000,['BeautylicousBabe'],[14],1538212643.0,0,8,False,9jv6qh,0,explainlikeimfive,"ELI5: Why does unhealthy food taste so good, and healthy food taste so bad?"
1325,Mrben13,"['BitsyBigBoyBoomeroo', 'blipsman', 'geuben']","[8, 8, 5]",1538166782.0,0,20,False,9jqk1r,9,explainlikeimfive,ELI5: Why some companies pay bi-weekly and some pay weekly? Is there a benefit of one over the other for the company?
1326,ScottishGigolo,['TheOnlyMego'],[11],1538163457.0,0,14,False,9jq3cx,9,explainlikeimfive,ELI5: Why do stars expand as they age and what causes them suddenly contract as they go Nova?
1327,FlyingLemurs76,[],[],1538208324.0,0,43,False,9juvgt,1,explainlikeimfive,ELI5: The difference between atoms as waves vs atoms as particles
1328,IminPeru,[],[],1538176515.0,0,7,False,9jrtha,5,explainlikeimfive,ELI5: How does the process of patching/updating a software work?
1329,DonnaPinciotti420,['dramawahoo'],[35],1538193557.0,0,25,False,9jtndv,2,explainlikeimfive,"ELI5: How do printers print white when the cartidges only hold black, yellow, cyan & magenta ink?"
1330,ethancg_,['succaneers'],[3],1538206162.0,0,8,False,9jupu8,1,explainlikeimfive,ELI5: why is it harder to stop a projectile than it is to create one?
1331,Kaitah,"['internetboyfriend666', 'TheSoup05']","[14, 6]",1538204976.0,0,15,False,9jumgm,1,explainlikeimfive,"ELI5: Why can’t we surgically switch switch peoples brains around like we do hearts, kidney, etc?"
1332,Task876,"['Surfin_Bro', 'denishype']","[2, 2]",1538183208.0,0,3,False,9jskdj,4,explainlikeimfive,ELI5: What is a state in thermodynamics?
1333,Ehrahbass,"['GrayPhilosophy', 'Nez_bit']","[7, 1]",1538159275.0,0,10,False,9jphhj,9,explainlikeimfive,"ELI5: Why do we sometimes sneeze once and sometimes twice (and maybe rarely three times)? How does our body determine the amount of times we sneeze in one ""episode"" of sneezing?"
1334,Watanuki-Kun207,[],[],1538180955.0,0,4,False,9jsbck,4,explainlikeimfive,ELI5: How do chemicals from smoking (cigarettes or marijuana) get from our lungs to our brain?
1335,Sherman2020,['pitroms'],[4],1538158782.0,0,14,False,9jpexs,9,explainlikeimfive,ELI5: What is the fundamental difference between different types of cells in our body; ie muscle tissue vs organs vs bones
1336,Spoolx21,['henstepl'],[3],1538184416.0,0,5,False,9jsp1c,2,explainlikeimfive,ELI5:Why does a space objects speed change when it gets closer to a body?
