,author,comments_author_lst,comments_score_lst,created_utc,guilded,num_comments,pinned,r_id,score,subreddit,title
1227,Questioningmyconsnt,[],[],1538402714.0,0,1,False,9kglxx,1,TwoXChromosomes,I'm wondering if I can give consent if I've been drinking. Girls have been telling me otherwise.
1228,sailortwift237,['bluediamond'],[6],1538350684.0,0,5,False,9kb6ih,14,TwoXChromosomes,Why I Didn’t Report
1229,Da_Kahuna,,,1538364793.0,0,0,False,9kcwa1,5,TwoXChromosomes,Discovery paves way for improved ovarian cancer care
1230,klg301,"['weirdmedgirl', 'm00py', 'merlinh2o', 'Christi1203', 'heisdeadjim_au']","[2, 1, 1, 1, 1]",1538368161.0,0,20,False,9kd9q7,7,TwoXChromosomes,Forgiving my rapist
1231,justdonthappy,[],[],1538397328.0,0,5,False,9kfxi8,1,TwoXChromosomes,I hate my job
1232,throw1761501,[],[],1538382558.0,0,2,False,9kejzc,2,TwoXChromosomes,Why I Didn't Report
1233,Obihoe_,,,1538382184.0,0,0,False,9keizl,4,TwoXChromosomes,Positive message for All
1234,Postmanpat1990,[],[],1538394070.0,0,7,False,9kfks1,1,TwoXChromosomes,Posting for some advice
1235,agilebeast1,"['Mooshiiee', 'tonydiethelm']","[5, 3]",1538344858.0,0,6,False,9kag2k,10,TwoXChromosomes,Please help me help my friend
1236,EmotionalSupportBin,,,1538390228.0,0,0,False,9kf7gy,0,TwoXChromosomes,Finally worked out what prompts my ex to text me out of the blue and I feel irrationally violated
1237,willselfthrowawayin,[],[],1538368534.0,0,1,False,9kdb3z,3,TwoXChromosomes,I spoke out about my assault and was called unstable and a liar (venting).
1238,ThreeLeggedPugg,,,1538376343.0,0,0,False,9ke1m2,2,TwoXChromosomes,How to live with feeling guilty for something that is not your fault.
1239,hermaddness,"['psychonautSlave', 'Durakus']","[4, 3]",1538368001.0,0,15,False,9kd94c,2,TwoXChromosomes,Not quite a stalker
1240,rddikulus,['rddikulus'],[2],1538367153.0,0,2,False,9kd5u5,4,TwoXChromosomes,7 Things to Remember If Dr. Christine Blasey Ford and Judge Kavanaugh's Hearing is Difficult for You
1241,BeadyEyed123,,,1538387168.0,0,0,False,9kexnp,1,TwoXChromosomes,Katie Couric: The news needs more diversity at the top
1242,Xxraebae,[],[],1538372325.0,0,1,False,9kdod7,1,TwoXChromosomes,I wish I never reported
1243,vicbritelite,,,1538372068.0,0,0,False,9kdnin,2,TwoXChromosomes,LUTERA TO VIENVA
1244,lil_ginge,"['0m3gaMan5513', 'mrbigah', 'Albyshit']","[2956, 1596, 1530]",1538221796.0,1,642,False,9jvzdt,6893,TwoXChromosomes,“Don’t do that to me”
1245,browniecheesecake,"['IndyPoker979', 'WatchMeCatchMe', 'miss-syzygy']","[26, 8, 7]",1538317502.0,0,23,False,9k6plx,29,TwoXChromosomes,Drink spiking
1246,eeeboo,"['wugachaka', 'inlovedelicious']","[45, 40]",1538272108.0,0,19,False,9k2gfg,277,TwoXChromosomes,Sexual assault apology?
1247,NimegaGunner,"['wackyvorlon', 'SpiffySpifferson']","[8, 6]",1538381769.0,0,11,False,9kehtt,0,TwoXChromosomes,Still scared
1248,Abwawa12,"['TheBlancoOne', 'a-little-sleepy']","[7, 6]",1538380533.0,0,7,False,9kee92,1,TwoXChromosomes,What draws the line between abuse and playing fighting?
1249,scrizzzgirl,[],[],1538364487.0,0,5,False,9kcv3r,2,TwoXChromosomes,Extremely painful periods no insurance
1250,CSQUITO,,,1538390624.0,0,0,False,9kf8sf,0,TwoXChromosomes,"The reality is, no one thinks their friend is a predator before it happens. If you had already seen warning signs you probably would have distanced yourself."
1251,leo_99,"['debbiecupcakesshit', 'wander-to-wonder']","[5, 4]",1538354144.0,0,3,False,9kbluz,4,TwoXChromosomes,Should happiness and love always go hand in hand?
1252,Fyourchickenstrips7,['gadgetcool5'],[5],1538347800.0,0,4,False,9kati4,6,TwoXChromosomes,I was just physically harassed for the first time
1253,FoxyRoxyBoo,[],[],1538374214.0,0,1,False,9kduvr,0,TwoXChromosomes,Experiences with Plan B or EllaOne emergency contraceptives?
1254,faraoa,"['ElyriaRose', 'kittenpantzen']","[16, 9]",1538352657.0,0,11,False,9kbezc,5,TwoXChromosomes,I am not sure if I am in an abusive relationship.
1255,Eteel,"['ladragoness', 'CyanAlpaca', 'steboy']","[178, 60, 50]",1538256446.0,0,88,False,9k0pf1,398,TwoXChromosomes,"Woman goes public with an allegation that Cristiano Ronaldo raped her. In earliest version of questionnaire, Ronaldo admits Mayorga said no and stop, but he continued because, he said, she made herself available and never screamed. He said he's not like the others, so he apologised afterward."
1256,blueeyedbeauty123,"['MadExplorer', 'shannon_agins', 'schmelk1000']","[9, 5, 4]",1538359247.0,0,8,False,9kc8ya,2,TwoXChromosomes,What clothing items never go out of style
1257,debtblag,"['wwarnout', 'AshEliseB']","[1222, 366]",1538224963.0,0,894,False,9jwbmj,2082,TwoXChromosomes,Everyone got to be angry at the hearing except Christine Blasey Ford
1258,throwaway12344628,['Mentalfloss1'],[5],1538358621.0,0,5,False,9kc65w,2,TwoXChromosomes,Itchy?
1259,SabrinaR_P,['DConstructed'],[6],1538358144.0,0,2,False,9kc43o,1,TwoXChromosomes,Don't know where else to post this. Might be triggering
1260,Throwitladeedah,"['adrianaonly', 'Halexander_Amilton']","[3, 2]",1538355114.0,0,9,False,9kbq0w,4,TwoXChromosomes,"I think I may have experienced abuse in my marriage...but not sure. (Long, trigger warning)"
1261,iamkenni,"['kittenpantzen', 'nkdeck07', 'Throwaway2017b']","[13, 6, 5]",1538354480.0,0,11,False,9kbn9y,1,TwoXChromosomes,Multiple birth control methods
1262,whatagirlygirl,,,1538313762.0,0,0,False,9k6bc4,15,TwoXChromosomes,My Daughter has been fighting to change how kids enter foster care (Just A Dad Proud of his Daughter)
1263,DoggosAreAllYouNeed,"['Stormvixenix', 'JolieFraise']","[9, 8]",1538295424.0,0,35,False,9k4ouq,34,TwoXChromosomes,My surgical abortion experience
1264,sadatay,,,1538364981.0,0,0,False,9kcx3c,2,TwoXChromosomes,How Samantha Bee and Cecile Richards Overcome Self-Doubt
1265,bananananicanocu,['j0339'],[2],1538363009.0,0,3,False,9kcp8n,1,TwoXChromosomes,"When I flex my pelvic floor muscles, my lower back pops."
1266,DConstructed,['PSayre'],[3],1538361333.0,0,5,False,9kcie6,1,TwoXChromosomes,"Probiotics, etc Help me protect my vagina"
1267,Chawped,,,1538360707.0,0,0,False,9kcfl7,0,TwoXChromosomes,Know your worth
1268,Hashtag2Blessed,['JadeAngelov'],[1],1538359431.0,0,2,False,9kc9up,1,TwoXChromosomes,I think I might need mental health services
1269,Ohheyboo2,,,1538359156.0,0,0,False,9kc8id,1,TwoXChromosomes,Period has become much more painful recently.
1270,_lofigoodness,['sbmotoracer'],[3],1538357997.0,0,5,False,9kc3fr,1,TwoXChromosomes,"My roommate lives in the same small city that her attacker lives in. She’s seen his car parked outside of places (restaurants, grocery stores) she needed to go and is overwhelmed by anxiety and has to remove herself. Any advice for her?"
1271,Mz-MM,"['chelsea_theking', '2doggos1pantsuit']","[11, 8]",1538308097.0,0,25,False,9k5seh,11,TwoXChromosomes,Making female friends is hard for me as a woman.
1272,JudgeMudflap,,,1538369660.0,0,0,False,9kdf25,0,TwoXChromosomes,How Domestic Violence Cases Are Proven and Won | Explained by Lawyers
1273,horizntalartist,"['StormySprite', 'mattemer', 'wugachaka', 'Mirawenya']","[38, 9, 8, 7]",1538260704.0,0,17,False,9k17w0,124,TwoXChromosomes,"""I'm so sorry you're bleeding! Are you okay??"""
1274,Baileysfriend12,['MrsMitchBitch'],[5],1538331768.0,0,3,False,9k8mxs,2,TwoXChromosomes,Friend forgot they had HPV?
1275,MrsCharles88,['marfatardo'],[20],1538268818.0,0,6,False,9k23ue,76,TwoXChromosomes,The police use my abuser as a case study in how to get away with it
1276,throwaway279527,[],[],1538351311.0,0,3,False,9kb98b,0,TwoXChromosomes,Baby Fever
1277,Obvitata2018,"['SleepUntilTomorrow', 'Myceliemz24', 'wildthingsthings', 'Mooshiiee']","[15, 5, 3, 2]",1538345908.0,0,19,False,9kal12,0,TwoXChromosomes,I think my boyfriend raped me and I don't know what to do.
1278,CrowdSurfingGuy,['Dara_Lecht'],[4],1538345630.0,0,7,False,9kajqs,3,TwoXChromosomes,Ovary pain when I get aroused after inserting IUD
1279,ednastvincent,"['Ishuzu', 'on_island_time', 'heidismiles']","[10, 5, 5]",1538288453.0,0,4,False,9k4688,18,TwoXChromosomes,Remember Dixie Chick's Not Ready to Make Nice?
1280,jonathanhoag1942,[],[],1538276003.0,0,1,False,9k2ux5,37,TwoXChromosomes,Jennifer...
1281,DirtyAngelToes,['Dara_Lecht'],[3],1538344150.0,0,4,False,9kacqj,0,TwoXChromosomes,Painful cramping over a week before period hits...am I the only one or is this normal?
1282,040211092616,"['DConstructed', 'blitzedginger', 'wobblebase']","[7, 6, 4]",1538343802.0,0,11,False,9kab67,0,TwoXChromosomes,My friend did a complete 180 personality-wise. I’m really worried.
1283,2beagles,['username1685'],[3],1538329711.0,0,2,False,9k8ciw,1,TwoXChromosomes,How do I support a survivor this week?
1284,GodInThisChilis,"['PristineUndies', 'Frankyfrankyfranky', 'HiBrucke6', 'Chiinori', 'GodInThisChilis']","[33, 29, 29, 27, 26]",1538277877.0,0,307,False,9k31mq,29,TwoXChromosomes,Reddit loves Kavanaugh
1285,newluna,['AshEliseB'],[8],1538277095.0,0,3,False,9k2yve,28,TwoXChromosomes,The power of no
1286,Wtfreeze,"['aopanda', 'Shadows23']","[3, 3]",1538338190.0,0,6,False,9k9jhe,1,TwoXChromosomes,We scheduled a time to talk and he didn't pick up
1287,Sulfamide,['throwaway4thehorde'],[18],1538263200.0,0,4,False,9k1hya,51,TwoXChromosomes,"The comments section in the article about Pelosi calling Kavanaugh ""hysterical"" is so refreshing."
1288,amymonzon,"['dogmanzzx', 'FuturePigeon', 'fightya4it', 'semithroway']","[36, 26, 17, 15]",1538243778.0,0,49,False,9jz2f8,110,TwoXChromosomes,I worked at a nightclub as a GoGo dancer...
1289,LegitimatelyTrash,['Souperpie84'],[2],1538347863.0,0,9,False,9katrz,0,TwoXChromosomes,Can braces help bad facial asymmetry?
1290,throwawaylonelys,"['8livesdown', 'pez_dispenser', 'christianlaf69']","[5, 2, 2]",1538320631.0,0,7,False,9k73jn,4,TwoXChromosomes,Can only orgasm under specific circumstances
1291,MyTeaJustWentCold,"['theRealDerekWalker', 'Dejohns2']","[8, 3]",1538333203.0,0,14,False,9k8u31,0,TwoXChromosomes,Kellyanne Conway: I was sexually assaulted
1292,diamondslight,"['Whatifim80lol', 'opticalshadow', '2doggos1pantsuit']","[25, 7, 7]",1538288131.0,0,30,False,9k458r,10,TwoXChromosomes,i’m not my boyfriend’s “type”
1293,littletoad109,['HikeTheSky'],[2],1538332142.0,0,5,False,9k8opl,1,TwoXChromosomes,My fiancé broke my heart today
1294,babe__ruthless,"['jimmyjackbob', 'Blindlord', 'tr36lak', 'joppike']","[4, 4, 4, 3]",1538344177.0,0,20,False,9kacw8,0,TwoXChromosomes,Was I raped?
1295,sparkkofcolor,[],[],1538330156.0,0,4,False,9k8er9,1,TwoXChromosomes,What to expect as a bridesmaid
1296,SplendidTit,['SplendidTit'],[13],1538260472.0,0,21,False,9k16zh,34,TwoXChromosomes,"Woman goes public with rape accusation against Cristiano Ronaldo. He admits ""she said ‘no’, and ‘don’t do that’ several times. Afterwards I apologised."""
1297,lecremepuff,"['FeralBottleofMtDew', 'Chocolate_fudge04', 'Hi-thirsty-im-dad']","[5, 4, 3]",1538238375.0,0,6,False,9jyaf1,103,TwoXChromosomes,Just a nice story to escape the current news
1298,krystlerm,['satijade'],[51],1538252343.0,0,37,False,9k06i7,38,TwoXChromosomes,I almost had my appendix burst because a male ER doctor thought my pain was psychosomatic. When will women be taken seriously when they complain about pain?
1299,catastrophichysteria,"['wellsfargosucksass', 'Mirawenya', 'ohliin', 'catcooker', 'never_be_boring']","[15, 9, 7, 7, 7]",1538253747.0,0,27,False,9k0cym,35,TwoXChromosomes,Not to self: just because I wasnt raped does not mean I was not sexually assaulted.
1300,verywittywilde,"['verywittywilde', 'verywittywilde', 'Calvinball1986']","[50, 25, 20]",1538226937.0,0,50,False,9jwk7f,145,TwoXChromosomes,My abuser using the court to contact me
1301,priviegedwhitegirl,[],[],1538350319.0,0,1,False,9kb4wj,0,TwoXChromosomes,"I need advice on how to ""adult"" on my own"
1302,novagirl0972,"['Chiinori', 'tonydiethelm']","[8, 4]",1538280281.0,0,5,False,9k3ad1,10,TwoXChromosomes,I feel bad that I’m avoiding all the sexual assault posts and will never share my story.
1303,shushuah,,,1538334910.0,0,0,False,9k92ye,0,TwoXChromosomes,I feel helpless right now knowing someone is using my identity and I’m paying the consequences for it
1304,veryfrustratedfreshy,['Alwaysbeenaunicorn'],[4],1538288913.0,0,32,False,9k47m1,5,TwoXChromosomes,how to masturbate when you have a billion roommates?
1305,Varamyr_Axelord,"['Ninja_attack', 'eatcornNt0ke']","[15, 15]",1538351694.0,0,17,False,9kbavq,0,TwoXChromosomes,California becomes first state to mandate female board members
1306,airlocili,['ErikaaSky3'],[2],1538340217.0,0,5,False,9k9tm3,0,TwoXChromosomes,Staring
1307,Mindiina,['MrsMcBasketball'],[10],1538273686.0,0,5,False,9k2mfo,11,TwoXChromosomes,"I got into a car accident while a guy I really like was in town. He's gone home now, and I'm lonely and left to pick up the pieces."
1308,ashbertollini,['milkyturtle'],[18],1538261658.0,0,16,False,9k1bo3,15,TwoXChromosomes,So theres this young lady I work with
1309,afloofah,"['AskMrBinks', 'outinspace95']","[10, 5]",1538273494.0,0,11,False,9k2lqa,8,TwoXChromosomes,I think my dad felt me up while he was drunk tonight
1310,s7ven8n9ne,"['laundryanddishes', 'pettytite', 'highlandcatter', 'Cyprinus_L']","[4, 3, 3, 3]",1538314341.0,0,6,False,9k6dih,1,TwoXChromosomes,Looking for advice/similar stories about decreased sex life after moving in together/getting married
1311,MosquitoRevenge,,,1538313658.0,0,0,False,9k6axu,0,TwoXChromosomes,Study by Swedish university finds pregnant women take up phthalates through plastic floors at home. Many different phthalates have been deemed dangerous to human health by the EU.
1312,Wendy-the-gogo-girl,['workquestions12'],[3],1538277629.0,0,3,False,9k30r6,5,TwoXChromosomes,"I ran into an old ""fling"" today [Trigger Warning]"
1313,Lady_Schmoobleydong,['MizDiana'],[7],1538324911.0,0,4,False,9k7o67,0,TwoXChromosomes,My badass Nonna and her choice that kind of bums me out.
1314,bluebird_heart,"['Pahka1947', 'newdawn-newday']","[5, 2]",1538243954.0,0,25,False,9jz386,31,TwoXChromosomes,Kavanaugh’s accusers in particular wouldn’t have been comfortable coming forward about what happened to them in the early 1980s. The way our culture thought about rape at the time was fundamentally different than it is now.
1315,shes_not_there,"['JustkiddingIsuck', 'Zjinu']","[4797, 3084]",1538149532.0,1,2060,False,9jo2wq,18635,TwoXChromosomes,"“When men imagine a female uprising, they imagine a world in which women rule men as men have ruled women.” -Sally Kempton"
1316,horsebackrider,,,1538243606.0,0,0,False,9jz1kl,28,TwoXChromosomes,I need to say thank you
1317,TheInfamousBlack,"['zyiliana', 'Trilobyte141', 'hisownshot', 'Dejohns2']","[17, 15, 15, 15]",1538238160.0,0,23,False,9jy99i,32,TwoXChromosomes,I'm so tired of this response.
1318,missmoonana,[],[],1538306286.0,0,7,False,9k5lzn,0,TwoXChromosomes,For those who still can't tell their story...
1319,hurryhomeprincess,['pixiejblue'],[3],1538304111.0,0,7,False,9k5e9r,1,TwoXChromosomes,"I should be on my period now, but I am not."
1320,icefourthirtythree,"['toddybody', 'Berisha11', 'TrappedInATardis', 'sleeplessqueen']","[31, 7, 6, 5]",1538229300.0,0,32,False,9jwx57,49,TwoXChromosomes,Her Name Is Kathryn: The Woman Who Accuses Ronaldo of Rape
1321,ALowlyLavaLamp,['8livesdown'],[2],1538347572.0,0,3,False,9kasil,0,TwoXChromosomes,Why Brett Kavanaugh's Tears Mean Nothing To Me [TW]
1322,texlorax,[],[],1538315385.0,0,2,False,9k6h7n,0,TwoXChromosomes,Fury is a Political Weapon and Women Need to Wield It
1323,lula2488,['ilovetoeatmeat'],[7],1538238861.0,0,11,False,9jyd30,24,TwoXChromosomes,This Instagram Shames Men for Being Absolute Monsters on Dating Apps
1324,theblackspaniel,"['Leakybubble', 'lyra_silver', 'princessjabba', 'Nemick']","[9, 8, 6, 6]",1538266850.0,0,20,False,9k1w62,6,TwoXChromosomes,"Sex, boundaries and work - need some perspective"
1325,zxcsd,['American_marxist'],[3],1538248847.0,0,2,False,9jzqsc,10,TwoXChromosomes,Former ‘Miss Baghdad’ Shot Dead as She Drove Through Iraqi Capital in Latest of Series of Attacks on Women
1326,sadbutnotsurprised,['intransigentpangolin'],[2],1538253477.0,0,6,False,9k0bpl,7,TwoXChromosomes,"I ""just"" cried. [Support] [Trigger Warning]"
1327,whysys,[],[],1538293729.0,0,9,False,9k4khb,0,TwoXChromosomes,"Thank god for average speed cameras, advice needed"
1328,Thrwaway5476,[],[],1538307109.0,0,3,False,9k5owu,0,TwoXChromosomes,How do you make sure people who hurt you pay and how to stop unhealthy relationship patterns?
1329,macfearsum,['macfearsum'],[5],1538247926.0,0,3,False,9jzml1,10,TwoXChromosomes,My #MeToo #WhyIDidn'tReport stories
1330,aech93,[],[],1538326815.0,0,6,False,9k7xoj,0,TwoXChromosomes,"No sir, “third base” does not apply to shoes."
1331,lambun,"['MajorFulcrum', 'Larchbox']","[3, 2]",1538219728.0,0,13,False,9jvs2s,37,TwoXChromosomes,A forgotten soldier on a forgotten front: the only British woman to fight on WW1’s front line
1332,awkwardbabyseal,,,1538249070.0,0,0,False,9jzrrw,6,TwoXChromosomes,A memory brought on by this week's news.
1333,lilisuperstar,"['BEWARE_SARZALLAK', 'Mirawenya', 'CurlsMoreAlice', 'a-little-sleepy', 'KatTheOptimen']","[11, 9, 3, 3, 3]",1538336362.0,0,11,False,9k9a76,0,TwoXChromosomes,Told off the guy who left me to push his luggage through!
1334,missbehaviorbiology,,,1538243521.0,0,0,False,9jz15v,11,TwoXChromosomes,There are more victims and survivors of sexual assault and sexual harassment than there are perpetrators afraid of their histories haunting them... and we all have a VOTE.
1335,jimmyjackbob,,,1538319929.0,0,0,False,9k709r,0,TwoXChromosomes,A case study in self body image confidence.
1336,Dejohns2,['HariMichaelson'],[2],1538242252.0,0,20,False,9jyv8d,11,TwoXChromosomes,"If You Are About to Make a Comment Like, ""Why didn't you report, tho?"" DON'T!"
1337,SureLilac,"['Startraveller42', 'duco4242', 'FluffyOceanPrincess']","[6, 5, 5]",1538270963.0,0,8,False,9k2c4d,2,TwoXChromosomes,I need help choosing between two jobs- retail or restaurant. Any advice at this point would be appreciated.
1338,weathercrow,"['Schattentochter', 'Dejohns2']","[9, 4]",1538238154.0,0,7,False,9jy987,12,TwoXChromosomes,I didn't report it and he did it to another girl. I'll never forgive myself.
1339,Herder_of_cats,[],[],1538247564.0,0,2,False,9jzks2,5,TwoXChromosomes,#whyididntreport Can't deal with posting this on social media
1340,Whey-Men,,,1538268877.0,0,0,False,9k243e,1,TwoXChromosomes,On Tensions and Opportunities: Building Partnerships Between Government and Sex Worker-Led Organizations in Kenya in the Fight Against HIV/AIDS
1341,robinson5,,,1538295533.0,0,0,False,9k4p4l,0,TwoXChromosomes,Cops’ treatment of rape victims
1342,saphirra1209,['nithwyr'],[15],1538237995.0,0,15,False,9jy8di,7,TwoXChromosomes,To the Women Who Saw Me Crying at the Frat Party
1343,birdinthebush74,[],[],1538210467.0,0,2,False,9jv11b,37,TwoXChromosomes,"Texas Anti-Abortion Family Planning Group Promised to Serve 70,000 Women. It Served 3,300."
1344,,['horford_is_overrated'],[2],1538293677.0,0,3,False,9k4kci,0,TwoXChromosomes,Dear me...
1345,ps00093,['arabis'],[9],1538251083.0,0,21,False,9k00tm,3,TwoXChromosomes,I'm not sure if I'm being selfish or losing one of my friends to his girlfriend.
1346,Yung_kawaii,"['fastal_12147', 'Bloomsnlooms']","[3, 2]",1538275778.0,0,13,False,9k2u5d,1,TwoXChromosomes,How do I provide help to my alcoholic father in an other state?
1347,BeadyEyed123,['double_chunk'],[1],1538184437.0,0,6,False,9jsp4d,99,TwoXChromosomes,"Since the Kavanaugh hearing, calls to King County sexual-assault hotline have tripled"
1348,TheKrs1,"['mrs_AW', 'Dejohns2']","[6, 4]",1538238785.0,0,11,False,9jycn4,6,TwoXChromosomes,How difficult is it for American Women to get birth control?
1349,99sorrynotsorry,"['DirectingWar', 'guithrough123']","[215, 119]",1538142584.0,0,324,False,9jn3uu,831,TwoXChromosomes,"Many men claim women are too emotional and unstable to conduct business or to govern, and many of those same men claim they can't (and shouldn't be expected to) control themselves if a woman doesn't fully clothe her shoulders."
1350,flyersfan314,"['joppike', 'YouWillAlwaysBeMale', 'orangeLILpumpkin']","[1, 1, -3]",1538259521.0,0,26,False,9k12y4,2,TwoXChromosomes,"Does the saying ""believe her"" mean believing that a specific person is guilty? I am not trying to troll. I want to learn more about what people mean when they say this. I have understood it as believe and support her emotionally and socially."
1351,but_hes_nice,"['moesickle', 'NaturalZebra', 'MaximumSignature']","[21, 12, 10]",1538186683.0,0,16,False,9jsxrs,82,TwoXChromosomes,"Since I'm not strong enough to post it on Facebook, #whyididntreport"
1352,Silverseren,[],[],1538271880.0,0,2,False,9k2fm4,0,TwoXChromosomes,"Amid Kavanaugh controversy, Trump administration plans to relax sexual assault rules on campus"
1353,marji80,,,1538270787.0,0,0,False,9k2bex,2,TwoXChromosomes,Make My Sexual Assault Count
1354,SteelTalons310,[],[],1538284270.0,0,2,False,9k3r83,0,TwoXChromosomes,This subreddit is getting me depressed about the truth of the world
1355,acronyx,"['pnwfarming', 'NorthernWhiteRhino']","[96, 49]",1538160330.0,0,137,False,9jpmq5,255,TwoXChromosomes,To the women who cornered Senator Flake
1356,PMmeForAFatGirlfrind,"['2doggos1pantsuit', 'logicallyauburn']","[3, 2]",1538268164.0,0,18,False,9k219r,0,TwoXChromosomes,I wanted to get long lasting birth control (the IUD) before my insurance is taken away
1357,relevantlife,[],[],1538235679.0,0,2,False,9jxvml,7,TwoXChromosomes,"Lindsey Graham disregards violence toward women, and his State is a women's murder capital. Graham’s tone deafness to rape victims is nothing new. He has consistently voted against the Violence against Women Act."
1358,Pisano87,"['Larry-Man', 'OMGSpaghettiisawesom', 'hatgineer']","[1427, 1247, 869]",1538098944.0,0,579,False,9jit5y,10430,TwoXChromosomes,"I'm a male who was raped several times by two older boys between the ages of 11-14, I wanted to report it so bad but never did. I understand why many of you didn't."
1359,Master_Tinyface,['aqquilus'],[3],1538244224.0,0,8,False,9jz4is,3,TwoXChromosomes,How do I find a support group for women who are victims of sexual assault and rape?
1360,ScamallDorcha,,,1538279203.0,0,0,False,9k36dm,0,TwoXChromosomes,"This org travels, creating street theater for social change, using curiosity to spread the expression, ""Helping Women Brings Good Things."""
1361,sherylcrowfan,"['eatsleeppetdogs', 'banana_lloyd']","[3, 3]",1538265426.0,0,25,False,9k1qjz,1,TwoXChromosomes,Itchy red bumps and huge ingrown hairs on bikini line and mound that never ever stop
1362,robloxmolester,[],[],1538250460.0,0,1,False,9jzy24,2,TwoXChromosomes,Woman and the weak and Trust
1363,Carouselcolours,[],[],1538263611.0,0,2,False,9k1jjm,0,TwoXChromosomes,Why is my period six days late?
1364,NotMyShade,"['happilyemployed', 'NiueyueDuankuKoujiao']","[3, 2]",1538241316.0,0,20,False,9jyqdk,4,TwoXChromosomes,Where do my responsibilities as a feminist end and my rights as a victim begin?
1365,HelpMePlease0002,"['Chiinori', 'JadeAngelov', 'CasualHSV']","[16, 9, 5]",1538248749.0,0,15,False,9jzqbt,2,TwoXChromosomes,"Lost virginity, got herpes, want to kill myself."
1366,poppycatt,"['LeanOnGreen', 'Moonfflakes', '__gasoline']","[4, 3, 3]",1538262172.0,0,6,False,9k1dqy,1,TwoXChromosomes,I'm having a terrible breakup and don't know where else to turn.
1367,spikey_dino,"['lyra_silver', '7ayKid', 'Larchbox', 'Spilledwinenevermind']","[5, 5, 4, 3]",1538261320.0,0,15,False,9k1ad4,0,TwoXChromosomes,My boyfriend just broke up with me for being sad before my period starts
1368,yourbasicgeek,,,1538238804.0,0,0,False,9jycqb,3,TwoXChromosomes,The 'Father of American Neurology' Prescribed Women Months of Motionless Milk-Drinking
1369,Ayrane,[],[],1538180031.0,0,1,False,9js7o1,55,TwoXChromosomes,Federal judge rules a Kentucky law on abortion is unconstitutional
1370,teadessert,['tzghvb'],[10],1538201740.0,0,9,False,9jud5e,20,TwoXChromosomes,Just wanted to share...story about a would-be-rapist
1371,CostumingMom,['Amipel'],[4],1538258970.0,0,2,False,9k10l9,1,TwoXChromosomes,Sex vs Friendship
1372,thebottomofawhale,['Reverserer'],[4],1538226837.0,0,13,False,9jwjtp,3,TwoXChromosomes,Having the worst period and finding it hard for anyone to understand how sick that makes me.
1373,HistoricalLunch,,,1538257250.0,0,0,False,9k0sxo,0,TwoXChromosomes,Vagina feeling tight/swollen after IUD insertion... seeking advice!
1374,iheartaidan,['a-little-sleepy'],[3],1538269697.0,0,7,False,9k27b6,0,TwoXChromosomes,What would you do if you conceived a child from a one night stand? Then find out about it 5 years later?
1375,Chocolate_fudge04,"['Dejohns2', 'kevnmartin']","[10, 6]",1538242232.0,0,27,False,9jyv4x,1,TwoXChromosomes,My dad doesn't get it
1376,webstuf,['eugkra33'],[8],1538241865.0,0,14,False,9jytdh,1,TwoXChromosomes,Christine Blasey Ford's friend clarifies statement about alleged assault by Brett Kavanaugh: 'I believe her'
1377,roselia4812,"['sourpussmcgee', 'Dejohns2', 'LifeLikeAndPoseable', 'eugkra33']","[6, 5, 3, 3]",1538255023.0,0,24,False,9k0irj,0,TwoXChromosomes,I'm scared
1378,shiskebob,['Trilobyte141'],[53],1538162600.0,0,10,False,9jpyjt,111,TwoXChromosomes,Christine Blasey Fords lawyer resigned from law firm to represent her.
1379,Koharushjsjs,[],[],1538241283.0,0,5,False,9jyq7l,2,TwoXChromosomes,My story
1380,1998hoho,"['IndyPoker979', 'AshEliseB', 'JoshuaACNewman', 'kallisti_gold', 'champagne_insecurity']","[13, 10, 8, 5, 5]",1538276123.0,0,12,False,9k2vbu,0,TwoXChromosomes,Is this guy being creepy or just romantic
1381,timTimotha,['fanjastic7'],[11],1538253960.0,0,9,False,9k0dyb,2,TwoXChromosomes,Is it me or does this article make it seem like its Ok to murder your husband if he is a dick and cheats on you?
1382,snielson825,,,1538240345.0,0,0,False,9jyl2l,2,TwoXChromosomes,Dear #Metoo- Confession from an anonymous friend. Your silent sisters. *trigger warning abuse*
