,author,comments_author_lst,comments_score_lst,created_utc,guilded,num_comments,pinned,r_id,score,subreddit,title
2446,iheartaidan,,,1538269697.0,0,0,False,9k27b6,1,TwoXChromosomes,What would you do if you conceived a child from a one night stand? Then find out about it 5 years later?
2447,Chocolate_fudge04,['Dejohns2'],[8],1538242232.0,0,12,False,9jyv4x,6,TwoXChromosomes,My dad doesn't get it
2448,webstuf,"['webstuf', 'eugkra33']","[2, 1]",1538241865.0,0,3,False,9jytdh,2,TwoXChromosomes,Christine Blasey Ford's friend clarifies statement about alleged assault by Brett Kavanaugh: 'I believe her'
2449,PMmeForAFatGirlfrind,[],[],1538268164.0,0,12,False,9k219r,1,TwoXChromosomes,I wanted to get long lasting birth control (the IUD) before my insurance is taken away
2450,acronyx,"['pnwfarming', 'NorthernWhiteRhino']","[99, 44]",1538160330.0,0,136,False,9jpmq5,249,TwoXChromosomes,To the women who cornered Senator Flake
2451,timTimotha,['fanjastic7'],[4],1538253960.0,0,6,False,9k0dyb,4,TwoXChromosomes,Is it me or does this article make it seem like its Ok to murder your husband if he is a dick and cheats on you?
2452,relevantlife,['8livesdown'],[4],1538235679.0,0,2,False,9jxvml,3,TwoXChromosomes,"Lindsey Graham disregards violence toward women, and his State is a women's murder capital. Graham’s tone deafness to rape victims is nothing new. He has consistently voted against the Violence against Women Act."
2453,blerrycat,,,1538266904.0,0,0,False,9k1wdg,0,TwoXChromosomes,Female Villains In Films And Television
2454,theblackspaniel,[],[],1538266850.0,0,6,False,9k1w62,1,TwoXChromosomes,"Sex, boundaries and work - need some perspective"
2455,Pisano87,"['Larry-Man', 'OMGSpaghettiisawesom', 'hatgineer']","[1428, 1237, 861]",1538098944.0,0,585,False,9jit5y,10419,TwoXChromosomes,"I'm a male who was raped several times by two older boys between the ages of 11-14, I wanted to report it so bad but never did. I understand why many of you didn't."
2456,TheKrs1,['mrs_AW'],[8],1538238785.0,0,9,False,9jycn4,5,TwoXChromosomes,How difficult is it for American Women to get birth control?
2457,Master_Tinyface,['aqquilus'],[3],1538244224.0,0,8,False,9jz4is,3,TwoXChromosomes,How do I find a support group for women who are victims of sexual assault and rape?
2458,sherylcrowfan,"['eatsleeppetdogs', 'banana_lloyd']","[3, 3]",1538265426.0,0,23,False,9k1qjz,0,TwoXChromosomes,Itchy red bumps and huge ingrown hairs on bikini line and mound that never ever stop
2459,robloxmolester,[],[],1538250460.0,0,1,False,9jzy24,2,TwoXChromosomes,Woman and the weak and Trust
2460,Carouselcolours,[],[],1538263611.0,0,2,False,9k1jjm,0,TwoXChromosomes,Why is my period six days late?
2461,poppycatt,['LeanOnGreen'],[3],1538262172.0,0,5,False,9k1dqy,1,TwoXChromosomes,I'm having a terrible breakup and don't know where else to turn.
2462,burtzev,[],[],1538259800.0,0,1,False,9k144w,0,TwoXChromosomes,Ten Items Corroborate Dr. Blasey Ford’s Allegation Kavanaugh Tried to Rape Her
2463,flyersfan314,['orangeLILpumpkin'],[1],1538259521.0,0,10,False,9k12y4,1,TwoXChromosomes,"Does the saying ""believe her"" mean believing that a specific person is guilty? I am not trying to troll. I want to learn more about what people mean when they say this. I have understood it as believe and support her emotionally and socially."
2464,Ayrane,[],[],1538180031.0,0,1,False,9js7o1,57,TwoXChromosomes,Federal judge rules a Kentucky law on abortion is unconstitutional
2465,CostumingMom,[],[],1538258970.0,0,1,False,9k10l9,1,TwoXChromosomes,Sex vs Friendship
2466,teadessert,['tzghvb'],[11],1538201740.0,0,9,False,9jud5e,17,TwoXChromosomes,Just wanted to share...story about a would-be-rapist
2467,graymgaym,[],[],1538270059.0,0,1,False,9k28ma,0,TwoXChromosomes,So I'm doing something superficial in 'Google Sheets'...
2468,Kore624,"['TheFamousDoodleberry', 'wobblebase', 'Mirawenya']","[9, 7, 5]",1538256257.0,0,26,False,9k0ol7,1,TwoXChromosomes,Can we just clear up some things about washing your genitals? (RANT)
2469,roselia4812,"['zyiliana', 'sourpussmcgee', 'Dejohns2', 'LifeLikeAndPoseable', 'sourpussmcgee']","[4, 3, 3, 3, 2]",1538255023.0,0,18,False,9k0irj,0,TwoXChromosomes,I'm scared
2470,Koharushjsjs,[],[],1538241283.0,0,5,False,9jyq7l,2,TwoXChromosomes,My story
2471,shiskebob,['Trilobyte141'],[53],1538162600.0,0,10,False,9jpyjt,112,TwoXChromosomes,Christine Blasey Fords lawyer resigned from law firm to represent her.
2472,thebottomofawhale,[],[],1538226837.0,0,10,False,9jwjtp,6,TwoXChromosomes,Having the worst period and finding it hard for anyone to understand how sick that makes me.
2473,yourbasicgeek,,,1538238804.0,0,0,False,9jycqb,2,TwoXChromosomes,The 'Father of American Neurology' Prescribed Women Months of Motionless Milk-Drinking
2474,powerpixie01,,,1538250668.0,0,0,False,9jzz0l,0,TwoXChromosomes,x-post from r/MeToo - Creating a Publication Platform for ALL #MeToo Survivors and Stories - Would Love Input/Feedback
2475,Insert2Quarters,"['MadBodhi', 'TI4_Nekro']","[15, 4]",1538174167.0,0,20,False,9jrj4x,52,TwoXChromosomes,A Dose of Victim Blaming From My Mother
2476,bubbleheadbob2000,"['pwei19', 'LilJourney']","[8, 7]",1538222324.0,0,28,False,9jw18g,4,TwoXChromosomes,Telling my daughter (14) that she is smart and beautiful.
2477,hanayos-riceball,"['lethanos', 'philox00']","[4, 3]",1538246737.0,0,6,False,9jzgt5,1,TwoXChromosomes,Someone found my wallet
2478,Analyidiot,['Forwardlization'],[4],1538244687.0,0,3,False,9jz6tl,1,TwoXChromosomes,I feel like I could have done better.
2479,jlmontello,"['BijouPyramidette', 'SaysWhateverforKarma']","[18, 4]",1538158956.0,0,19,False,9jpfw3,76,TwoXChromosomes,Why Women Don't Come Out: I did and Lost My Job
2480,ashesofdecay,"['DConstructed', 'axlotl_rose']","[19, 9]",1538173673.0,0,8,False,9jrgz6,29,TwoXChromosomes,I shared why I didn't report story - my mom told me that I shouldn't have because I didn't think of how it would affect her.
2481,NotMyShade,"['happilyemployed', 'NiueyueDuankuKoujiao']","[2, 2]",1538241316.0,0,17,False,9jyqdk,0,TwoXChromosomes,Where do my responsibilities as a feminist end and my rights as a victim begin?
2482,Tattooedprofessional,"['ElleFuego', 'Olibolii', 'CreatrixAnima', 'doconeal18']","[63, 34, 30, 28]",1538130987.0,0,31,False,9jluu5,284,TwoXChromosomes,This is for you.
2483,PM70,"['grumpymuppett', 'DocBenwayOperates78']","[4002, 3553]",1538075755.0,2,1188,False,9jfsl7,15924,TwoXChromosomes,I was raped by my husband 46F support
2484,Muncamunca,['Schattentochter'],[3],1538187459.0,0,4,False,9jt0ru,14,TwoXChromosomes,"Do not go and tell a sexual assault, abuse, or harassment victim to ""laugh"" at their situation"
2485,pedantic_cheesewheel,"['Flyer770', 'Covered_1n_Bees', 'gionnelles', 'zengal108']","[1048, 426, 400, 303]",1538080174.0,0,254,False,9jgeui,4087,TwoXChromosomes,My Wife Works at a Rape Crisis Nonprofit and They Are Getting FLOODED with Survivor Calls
2486,MrsMikeHunt,[],[],1538238414.0,0,2,False,9jyang,0,TwoXChromosomes,Miscarriage or period?
2487,EndlessEnds,"['Oudeis16', 'LethalDevoti0n']","[418, 94]",1538093279.0,1,600,False,9ji4ug,1781,TwoXChromosomes,"My thoughts, as a retired prosecutor, on he Brett Kavanaugh Senate Hearing"
2488,r101606,['Wytch78'],[3],1538238173.0,0,9,False,9jy9c3,0,TwoXChromosomes,Popping Bartholin gland cyst at home?
2489,cold_hearted_,"['09Charger', 'TheSearch4Knowledge', 'username1685']","[3, 2, 2]",1538237050.0,0,16,False,9jy38e,1,TwoXChromosomes,How can I be more affectionate?
2490,inpainneedhelp,"['MamboNo101503256', '3NightOwls', '3NightOwls']","[7, 6, 5]",1538236818.0,0,13,False,9jy1vy,0,TwoXChromosomes,"Need UTI help, cant go to doctor or do any kind of phone or webcam interview"
2491,m9felix,"['milkyturtle', 'clavisinsession']","[6, 4]",1538234161.0,0,23,False,9jxnmm,3,TwoXChromosomes,"In you opinion, is it rude for your partner’s ex to casually bring up their past? If so why do you think they keep mentioning it?"
2492,tsunamini,"['pennagirl', 'Bluelilly582', 'jlmontello', 'KitsuneGeisha']","[32, 11, 9, 4]",1538147204.0,0,18,False,9jnqus,85,TwoXChromosomes,SO frustrated with the number of people discounting survivors stories because they didn’t report it when it happened
2493,notathrowawayfolks,['Mockturtle22'],[2],1538232522.0,0,8,False,9jxez8,0,TwoXChromosomes,I need advice for my anxiety issues
2494,t-me-sis,"['FluffyOceanPrincess', 'winterIsLeaving', 'littlej2010']","[5, 4, 4]",1538188111.0,0,7,False,9jt387,8,TwoXChromosomes,Where is a good place to get cheap underwear?
2495,,[],[],1538230867.0,0,2,False,9jx605,0,TwoXChromosomes,I don't have a #WhyIDidn'tReport Story
2496,Neon-Socks,[],[],1538159748.0,0,2,False,9jpjuw,41,TwoXChromosomes,"I was abandoned by my school. Now, I am abandoned by my country."
2497,HayeBail,['Warga5m'],[2],1538214822.0,0,14,False,9jvcec,1,TwoXChromosomes,Workplace Hazards. I feel sick.
2498,throwawayyy_321,"['Smiff0806', 'pupcakeonthelamb']","[3, 2]",1538228289.0,0,4,False,9jwroi,0,TwoXChromosomes,Took Plan B and still nervous
2499,throwawayBkuzreasons,"['moesickle', 'pupcakeonthelamb', 'Ashlityr']","[15, 10, 9]",1538189410.0,0,12,False,9jt8cm,6,TwoXChromosomes,Is it really an issue if a woman changes her last name after getting married?
2500,Gaia_the_bun,"['annqueue', 'ladybawlz29']","[10, 5]",1538177825.0,0,5,False,9jryr1,11,TwoXChromosomes,An old man mastrubated to me in a park
2501,Pinkfatrat,['Titrifle'],[7],1538188060.0,0,6,False,9jt31g,7,TwoXChromosomes,Principal tells girls shorts are making male staff ‘uncomfortable’ | Newcastle Herald
2502,Dmarek02,['Jamesth'],[18],1538145693.0,0,8,False,9jnjau,60,TwoXChromosomes,He Cried After He Punched Me in The Face
2503,Tralfamadorian_,"['hurtsdonut_', 'legaladvicequest', 'Dregenfox', 'lily31']","[24, 20, 19, 14]",1538161369.0,0,44,False,9jps0h,27,TwoXChromosomes,What the GOP made perfectly clear to all American women today.
2504,adiposehysteria,[],[],1538237353.0,0,5,False,9jy4vv,0,TwoXChromosomes,Without Us The World Stops
2505,warmtortilla,"['PutinsRustedPistol', 'bigbrother420', 'ms-una']","[3, 3, 2]",1538250101.0,0,21,False,9jzwer,0,TwoXChromosomes,Had drunken sex with sober boyfriend and I'm having mixed feelings about it. Need an outsiders opinion.
2506,penelope_pig,['rjsays42'],[5],1538157472.0,0,6,False,9jp86x,26,TwoXChromosomes,I got my tubes tied
2507,Whey-Men,,,1538219754.0,0,0,False,9jvs5y,0,TwoXChromosomes,"HIV prevalence among Kampala, Uganda female sex workers is high. Kampala female sex workers are in need of intensified and targeted HIV prevention and control effort"
2508,rjsays42,[],[],1538196715.0,0,4,False,9jtxva,2,TwoXChromosomes,I Didn't Report... Because I Didn't Want to Break My Mother's Heart...
2509,hello0o0o0o0o0,[],[],1538238777.0,0,1,False,9jyclk,0,TwoXChromosomes,Feeling anxious/triggered after following the Kavanaugh hearing
2510,needsmoremayo,"['MsGinger23', 'ActionFiguresinc']","[3, 1]",1538189729.0,0,4,False,9jt9l8,5,TwoXChromosomes,I saved a life today.
2511,yah_bitch,"['thrwycltr', 'MsAlyssa', 'kyvonneb03']","[50, 43, 23]",1538109923.0,0,39,False,9jk109,234,TwoXChromosomes,"For everyone who asks ""why are they coming forward now"""
2512,,['grumpymuppett'],[9],1538166230.0,0,24,False,9jqhj4,13,TwoXChromosomes,"TIL over 120 US ride share drivers have been committed of sexual assault. This statistic excludes unreported incidents. As a former female ride-share driver, here’s how to stay safe:"
2513,Scarl3tt3,"['Sandmint', 'Inactivated']","[3, 3]",1538167529.0,0,17,False,9jqnsc,11,TwoXChromosomes,I took charge of my reproductive health! [NSFW]
2514,ElegantCyclist,,,1538229224.0,0,0,False,9jwwqy,0,TwoXChromosomes,'Untrue' Explores the Female Libido
2515,arolldis-bluntman,,,1538235807.0,0,0,False,9jxwc0,0,TwoXChromosomes,"Your favorite Bechdel Test-passing scenes in memoirs, novels, short stories"
2516,teehee1113,[],[],1538227462.0,0,2,False,9jwnc0,0,TwoXChromosomes,Decidual or breakthrough bleeding please calm my worries.
2517,Aaneiltex,"['Robalo21', 'DConstructed']","[267, 205]",1538090689.0,0,237,False,9jhtpd,531,TwoXChromosomes,My problems with the Brett Kavanaugh hearing and the excuse that friends “know he is a good person and would never do something like that.”
2518,neph4,,,1538178218.0,0,0,False,9js0eg,5,TwoXChromosomes,MILCK - NPR Music Tiny Desk Concert
2519,relevantlife,"['champagne_insecurity', 'OrganicPurchase921', 'elinordash']","[3, 3, 2]",1538149225.0,0,10,False,9jo18h,27,TwoXChromosomes,"Joe Manchin (WV) - 202-224-3954, Joe Donnelly (IN) -(202) 224-4814, Lisa Murkowski (AK) -(202)-224-6665, Susan Collins (ME) - (202)224-2523. We are 2 simple votes away from putting an alleged sexual abuser who will reverse Roe on the Court. Call now. Be polite, but form. #VoteNoOnKavanaugh"
2520,ImaConsumerWhore,[],[],1538198997.0,0,6,False,9ju4zj,4,TwoXChromosomes,Let's talk: miscarriage
2521,,['DConstructed'],[8],1538156210.0,0,4,False,9jp1qw,14,TwoXChromosomes,Why I didn't report.
2522,Quicily,[],[],1538237195.0,0,8,False,9jy41t,0,TwoXChromosomes,"""The lava of our anger is going to cover the earth and bury you."""
2523,Squatch_man,"['lezitup', 'aopanda']","[1, 1]",1538231198.0,0,3,False,9jx7ue,0,TwoXChromosomes,Does anyone have tips on supporting a long distance GF who suffers from anxiety?
2524,orangeLILpumpkin,['shorty_doowop'],[1],1538157286.0,0,7,False,9jp7ap,13,TwoXChromosomes,The senate judiciary committee just voted to recommend to the full Senate confirmation of Brett Kavanaugh to the United States Supreme Court by a vote of 11-10
2525,sunflowerliz,[],[],1538163368.0,0,2,False,9jq2tf,8,TwoXChromosomes,I never told anyone either
2526,actuallyasuperhero,"['ToodleDeeandDum', 'buzzz001']","[8, 5]",1538150798.0,0,10,False,9jo9i1,19,TwoXChromosomes,To those who never reported
2527,Peevesie,['SatanMaster'],[2405],1538037818.0,1,226,False,9jb4tc,15084,TwoXChromosomes,"'Husband Is Not The Master Of Wife', India's SC Strikes Down 158 Year Old Adultery Law Under Section 497 IPC"
2528,painted_crab,[],[],1538143123.0,0,1,False,9jn6ga,26,TwoXChromosomes,Everybody’s different
2529,ThisIsKellen,"['luvsaves', 'DoMyBallsLookNormal', 'Iprobablyneedssris']","[8, 5, 5]",1538238053.0,0,36,False,9jy8ow,0,TwoXChromosomes,I get guilted into sex by my GF.
2530,Silverseren,,,1538179113.0,0,0,False,9js3zk,5,TwoXChromosomes,The Origin of Gender (PBS Origin of Everything)
2531,mellyhead13,['AkiTendo'],[3],1538169775.0,0,5,False,9jqypg,6,TwoXChromosomes,My why...
2532,sint0xicateme,"['MarionWormer', 'HikeTheSky', 'Bognin']","[32, 18, 13]",1538111364.0,0,66,False,9jk674,117,TwoXChromosomes,"""It is a remarkable fact of American life that many men are now defending sexual assault. The group that has spent years laughing at the very idea of anything like “rape culture” are suddenly not just admitting that it exists, but that it's an unstoppable cocktail of culture and biology."""
2533,razorchalice,[],[],1538203959.0,0,1,False,9jujhy,0,TwoXChromosomes,Had to take Plan B. Nervous.
2534,Macenroe85,['Garbanzo3rdEye'],[2],1538190402.0,0,10,False,9jtc4j,1,TwoXChromosomes,My wife and I moved to a new city/country and we need help finding a nearby support network
2535,Kurralynn,"['sour-wench', 'misterhak']","[24, 9]",1538109102.0,0,11,False,9jjy1o,126,TwoXChromosomes,Here’s my story of #whyIdidntreport
2536,pushyouaround,"['morningspacesuit', 'MadBodhi', 'chemkitty123', '2doggos1pantsuit']","[5, 4, 4, 3]",1538201494.0,0,16,False,9jucfn,1,TwoXChromosomes,"A normal date turns into a nightmare, or how a normal man has two faces"
2537,throw_auobrv,[],[],1538152801.0,0,6,False,9jojq4,11,TwoXChromosomes,"I'm one of the ""lucky ones"", I've never been raped."
2538,leftover_picinni,"['aliceindankland', 'ninyabruja', 'Dppstorytel']","[54, 28, 20]",1538115915.0,0,17,False,9jkl2y,78,TwoXChromosomes,"With everything going on, I have to say this somewhere. I’m a 20 y.o. Male and a month ago I was raped by my therapist"
2539,bicureyooz,,,1538200205.0,0,0,False,9ju8pm,1,TwoXChromosomes,‘5 Browns’ Siblings Speak Out About Father’s Sexual Abuse
2540,MDL1994,['beetbaby'],[1],1538168222.0,0,3,False,9jqr4e,5,TwoXChromosomes,How Mirena gave me my life back
2541,notathrowawayfolks,,,1538198201.0,0,0,False,9ju2kj,0,TwoXChromosomes,Anxiety Support
2542,lemondrops222,['Feyle'],[4],1538210038.0,0,11,False,9juzye,0,TwoXChromosomes,A guy I used to be friends with raped someone
2543,FeDuPFeMe,['Sandi_T'],[10],1538142611.0,0,13,False,9jn3yq,14,TwoXChromosomes,I never came forward. I was to young to protect myself and the justice system failed me. Now the justice system is failing another woman and it feels personal.
2544,grneyez922,"['Violet__Delights__', 'gobsmacked247', 'TheEndIsSquared']","[14, 9, 5]",1538106801.0,0,20,False,9jjp61,93,TwoXChromosomes,#MeToo began and I was still too scared. #whyididntreport finally gave me the courage
2545,metoo5555,[],[],1538226499.0,0,2,False,9jwiek,0,TwoXChromosomes,I've barely told anyone the full story #metoo Trigger warning
2546,kjordan21,,,1538215077.0,0,0,False,9jvd0b,0,TwoXChromosomes,Political rant
2547,kris0203,"['daughterjudyk', 'Shelbie007']","[2, 2]",1538193178.0,0,4,False,9jtm5b,1,TwoXChromosomes,Mirena side effects?
2548,Bee0312,"['Meatcat1', 'Geekygirl420', 'joygasmic']","[3, 3, 3]",1538149735.0,0,4,False,9jo40i,9,TwoXChromosomes,I feel anxious. I'm having trouble breathing. I have no one to talk to.
2549,amy-kath-leen,[],[],1538189982.0,0,1,False,9jtaio,0,TwoXChromosomes,I think I overtreated with finding out my boyfriend messaged another girl when we first started seeing each other
2550,TheRealBallchynz,,,1538175012.0,0,0,False,9jrmuv,2,TwoXChromosomes,New Zealand Prime Minister Jacinda Ardern and former Prime Minister Helen Clark talk gender equality
2551,Visandthat,"['deedee25252', 'tomcruiseincocktail2', 'AMaskedAvenger', 'McDuchess']","[16, 15, 13, 7]",1538088138.0,1,21,False,9jhhv5,158,TwoXChromosomes,"I was 3-13, 14, and 19...."
2552,fibonnacci27,,,1538218499.0,0,0,False,9jvno2,0,TwoXChromosomes,Former CIA Officer Will Teach You How to Spot a Lie l Digiday
2553,Silverseren,,,1538159947.0,0,0,False,9jpkv4,3,TwoXChromosomes,E-mails Show That Republican Senate Staff Stymied Deborah Ramirez’s Effort to Give Testimony
2554,bowlofcherries16,"['housecatuphigh', 'ithoughtilostyou', 'sezit']","[76, 37, 30]",1538077047.0,0,76,False,9jfz7z,273,TwoXChromosomes,PSA: Today is a tough day for survivors of sexual assault.
2555,blueeyedbeauty123,['Wariowins1212'],[3],1538186355.0,0,4,False,9jswg4,0,TwoXChromosomes,Best eyeshadow palette for a natural look?
2556,BasonHenry,"['i-fink-u-freeky', 'ALowlyLavaLamp', 'pumpkinspicepiggy']","[6, 3, 3]",1538147722.0,0,5,False,9jntl6,6,TwoXChromosomes,Creep Frequency?
2557,mysinglelife,"['Streamjumper', 'worldofcloud', 'ChimoEngr', 'BannedFrom2X', 'pianopower2590']","[8, 7, 5, 5, 5]",1538150591.0,0,18,False,9jo8e8,5,TwoXChromosomes,Have sex against your will in a relationship is called help each other out by a tinder date.
2558,manicmeowshroom,['altschwitz'],[2],1538185513.0,0,9,False,9jst85,0,TwoXChromosomes,Smelly underboob? Clean it up with orbitz!
2559,JustAni96,"['plsmrwarrior', 'morningspacesuit']","[9, 8]",1538198523.0,0,5,False,9ju3li,0,TwoXChromosomes,I fell in love with a catfish I don’t know what to do
2560,CatShat23,,,1538184906.0,0,0,False,9jsqy4,1,TwoXChromosomes,I don't like this #metoo movement. [Trigger Warning: Sexual Assault/Graphic imagery)
2561,Pikahime,"['Anabelle_McAllister', 'kallisti_gold']","[2, 2]",1538183296.0,0,22,False,9jskoz,0,TwoXChromosomes,Questions about abortion.
2562,ironically-spiders,[],[],1538203870.0,0,3,False,9juj8x,0,TwoXChromosomes,My #whyIdidntreport
2563,999lonely,['RandyDandyAndy'],[4],1538182318.0,0,3,False,9jsgss,1,TwoXChromosomes,Nobody cares about eating disorders anymore
2564,fitfemale4life,[],[],1538182222.0,0,3,False,9jsgfd,1,TwoXChromosomes,I did not report. I was failed by the people I trusted.
2565,drewiepoodle,,,1538182050.0,0,1,False,9jsfrg,0,TwoXChromosomes,"Far worse than a scenario in which one person is lying, and the other telling the truth, is the scenario in which both are telling the truth."
2566,concerneduncle89,['shoemaker777'],[6],1538193259.0,0,2,False,9jtmev,0,TwoXChromosomes,My niece just told my sister-in-law she was molested.
2567,GrumpyFinn,['Meteorboy'],[5],1538140676.0,0,5,False,9jmvct,6,TwoXChromosomes,I feel alone and ignored.
2568,Prysorra2,,,1538178685.0,0,0,False,9js2ah,1,TwoXChromosomes,TED Talk: Rape Kits processed and justice delivered!!
2569,shizzleforizzle,[],[],1538150686.0,0,6,False,9jo8v1,5,TwoXChromosomes,20% of SCOTUS shouldn’t be allowed within 1000 feet of schools.
2570,WowUsernameMuchKarma,"['wugachaka', 'cookmamerie', 'penatr8']","[116, 54, 36]",1538053315.0,1,73,False,9jco1a,567,TwoXChromosomes,My mom just gave me such a great idea (#whyIdidntreport)
2571,_notthehippopotamus,[],[],1538162907.0,0,1,False,9jq09b,4,TwoXChromosomes,She Says-Investigative podcast that follows the winding road of a sexual assault survivor through the long and difficult search for justice
2572,c92dlb,['plumlipstick'],[2],1538176163.0,0,8,False,9jrrzc,1,TwoXChromosomes,Seasoned menstrual cup user with new problems.
2573,La_Femme_Nokia,[],[],1538154459.0,0,2,False,9josmh,2,TwoXChromosomes,I never bothered because I was ashamed I was convinced that I let myself get raped.
2574,ExpensiveMention,[],[],1538175866.0,0,4,False,9jrqn4,0,TwoXChromosomes,A rant i posted on Facebook to my fellow artists in the art community. About being tired of the hate and discrimination in the art community. Do you guys agree?
2575,Sidjoneya,"['ehhdoesntmatter', 'KaijuKi', 'WaywardAnus', 'Ozymander']","[3, 2, 1, 1]",1538128512.0,0,15,False,9jlmsj,12,TwoXChromosomes,Can self defence help end violence against women? Some think it puts women at further risk because the attacker will perceive it as a threat to his masculinity.
2576,Velvetrose-2,[],[],1538143767.0,0,1,False,9jn9pt,6,TwoXChromosomes,"The rape culture of the 1980s, explained by Sixteen Candles"
2577,sofyflo,"['jemmeow', 'violet453', 'Agony_Mouse', 'wellsfargosucksass', 'LiarBitchface', 'SatanMaster']","[23, 11, 8, 6, 6, 6]",1538081057.0,0,16,False,9jgj7z,119,TwoXChromosomes,To the Lady with Hairy Legs
2578,kt-bug17,['EnbyAmbi'],[3],1538173987.0,0,23,False,9jrid4,0,TwoXChromosomes,Got a comment about my red hair today...
2579,timmg,"['Mrbiigstuff', 'asp2_downhill']","[4, 4]",1538173954.0,0,9,False,9jri81,1,TwoXChromosomes,"Women control the United States: since 1964, more women have voted than men. In 2016 15% more women than men voted."
2580,thecrayonmastermind,[],[],1538152276.0,0,2,False,9joh1c,2,TwoXChromosomes,I think my ex is the reason I have PTSD and I really need to talk about it
2581,bbcnews,,,1538146173.0,0,0,False,9jnlp2,4,TwoXChromosomes,"India's Supreme Court has revoked a ban on women entering the Sabarimala temple, considered to be one of the holiest for Hindus. The ban had prevented women of ""menstruating age"" from entering"
2582,socializedslut,['jrh1524'],[3],1538141313.0,0,5,False,9jmy78,5,TwoXChromosomes,How girls are socialized in regards to sex
2583,stasiya762,[],[],1538172209.0,0,3,False,9jraby,2,TwoXChromosomes,Hope for the workplace
2584,MesopotamianRex,[],[],1538150519.0,0,3,False,9jo81a,3,TwoXChromosomes,I would like to share my story.
2585,ninebubblewaters,['sweettea_sweetie1'],[2],1538171721.0,0,9,False,9jr80b,0,TwoXChromosomes,Has anyone ever had cramping/spotting around 4 or 5 days after period?
2586,schsm,[],[],1538088245.0,0,3,False,9jhicq,70,TwoXChromosomes,"Denouncing 'Misogynistic Bullying' and 'Failed Leadership,' 50+ Groups Call on Grassley to Resign Immediately as Judiciary Committee Chair"
2587,yathrowmeawayplsthnx,,,1538184340.0,0,0,False,9jsopc,0,TwoXChromosomes,I've never told anyone this story before.
2588,Throwyourtoothbrush,,,1538156732.0,0,1,False,9jp4gh,2,TwoXChromosomes,#WhyIdidn'treport
2589,MrbidAkrasian,"['a-little-sleepy', 'aopanda']","[3, 2]",1538170237.0,0,11,False,9jr0x3,1,TwoXChromosomes,"19 yr old Indian Mechanical engineering student. ""If you can't deal with this, how will you deal with your husband?"""
2590,Hainkpe,[],[],1538147505.0,0,3,False,9jnsf0,1,TwoXChromosomes,She should’ve told! She did. No one believed her until...
2591,logical-leia,[],[],1538113457.0,0,1,False,9jkd3e,17,TwoXChromosomes,For the First Time in my Life I feel like My Body is Mine
2592,dwyerswansong,['Novaember1'],[12],1538147047.0,0,44,False,9jnq3h,3,TwoXChromosomes,Reconciling belief in the accuser and wrongful conviction in America?
2593,thewoodenabacus,"['lamamaloca', 'TheSlamAnderson', 'shitholejedi']","[82, 41, 33]",1538071473.0,0,67,False,9jf6fu,138,TwoXChromosomes,How many rich people when robbed are then questioned: “Were you drinking? Why did you have valuables in a place where people knew they existed? Had you been drinking when this person robbed you?” I wonder if it wouldn’t be better for Kavanaugh to have robbed Ms. Ford.
2594,dontstartlethebears,,,1538167438.0,0,0,False,9jqnbw,1,TwoXChromosomes,Madame Defarge knitted the names of the guilty
2595,throwawaytoday9q,"['BishonenPrincess', 'Pr2r', 'faeriekitteh']","[5, 4, 4]",1538151921.0,0,18,False,9jof5t,2,TwoXChromosomes,Do I have to have short hair when I get old?
2596,Ijkvectors,"['HariMichaelson', 'FireAlarm911']","[3, 3]",1538186539.0,0,4,False,9jsx6d,0,TwoXChromosomes,Do you #BelieveHer?
2597,kryptos19,"['lifeisasongyouknow', 'fitxx333', 'IndependentBowler']","[5, 3, 3]",1538112945.0,0,13,False,9jkbgj,14,TwoXChromosomes,Am I the only one who doesn't like the term survivors?
2598,StayHappy_DontWorry,['revamp11'],[3],1538141369.0,0,5,False,9jmyex,2,TwoXChromosomes,"After seeing some of the posts from this subreddit on /r/all, i wanted to post my story. Male, 21 and while it isn't as bad as some of the stories i read, i never really got treated well for it and wanted to share my story to a group that might understand (LONG POST)"
