,author,comments_author_lst,comments_score_lst,created_utc,guilded,num_comments,pinned,r_id,score,subreddit,title
0,Qu1nlan,"['MermaidPumpkinButt', 'Snoochems', 'StubbedMyLittlePenis']","[129, 56, 54]",1497988792.0,0,175,False,6igks7,419,TwoXChromosomes,/r/TwoXChromosomes is looking for new moderators
1,EmptyArmsBereavement,"['heatheranne', 'topgopher']","[66, 42]",1532616354.0,0,69,False,922vk2,1070,TwoXChromosomes,"I'm Carol, and after losing my first daughter to a cord accident during labor in 2003 I went on to found Empty Arms Bereavement Support, a community based non-profit that helps other families who have experienced the loss of a baby. AMA!"
2,lil_ginge,"['Albyshit', '0m3gaMan5513']","[805, 737]",1538221796.0,0,339,False,9jvzdt,2950,TwoXChromosomes,“Don’t do that to me”
3,debtblag,"['wwarnout', 'AshEliseB', 'Reverserer']","[529, 152, 106]",1538224963.0,0,438,False,9jwbmj,766,TwoXChromosomes,Everyone got to be angry at the hearing except Christine Blasey Ford
4,verywittywilde,"['verywittywilde', 'verywittywilde', 'Calvinball1986']","[20, 15, 8]",1538226937.0,0,36,False,9jwk7f,80,TwoXChromosomes,My abuser using the court to contact me
5,shes_not_there,"['JustkiddingIsuck', 'Zjinu']","[4764, 3054]",1538149532.0,1,2057,False,9jo2wq,18538,TwoXChromosomes,"“When men imagine a female uprising, they imagine a world in which women rule men as men have ruled women.” -Sally Kempton"
6,icefourthirtythree,"['toddybody', 'Berisha11', 'TrappedInATardis', 'sleeplessqueen', 'aokusman']","[14, 1, 1, 1, 1]",1538229300.0,0,15,False,9jwx57,30,TwoXChromosomes,Her Name Is Kathryn: The Woman Who Accuses Ronaldo of Rape
7,lecremepuff,[],[],1538238375.0,0,1,False,9jyaf1,13,TwoXChromosomes,Just a nice story to escape the current news
8,lambun,['MajorFulcrum'],[0],1538219728.0,0,10,False,9jvs2s,22,TwoXChromosomes,A forgotten soldier on a forgotten front: the only British woman to fight on WW1’s front line
9,BeadyEyed123,['Mouseprintss'],[2],1538184437.0,0,5,False,9jsp4d,97,TwoXChromosomes,"Since the Kavanaugh hearing, calls to King County sexual-assault hotline have tripled"
10,99sorrynotsorry,"['DirectingWar', 'guithrough123']","[201, 117]",1538142584.0,0,287,False,9jn3uu,817,TwoXChromosomes,"Many men claim women are too emotional and unstable to conduct business or to govern, and many of those same men claim they can't (and shouldn't be expected to) control themselves if a woman doesn't fully clothe her shoulders."
11,TheInfamousBlack,[],[],1538238160.0,0,7,False,9jy99i,6,TwoXChromosomes,I'm so tired of this response.
12,birdinthebush74,[],[],1538210467.0,0,1,False,9jv11b,23,TwoXChromosomes,"Texas Anti-Abortion Family Planning Group Promised to Serve 70,000 Women. It Served 3,300."
13,but_hes_nice,"['moesickle', 'NaturalZebra', 'battleborn5', 'Charlie_2020']","[21, 9, 9, 9]",1538186683.0,0,10,False,9jsxrs,70,TwoXChromosomes,"Since I'm not strong enough to post it on Facebook, #whyididntreport"
14,saphirra1209,[],[],1538237995.0,0,5,False,9jy8di,3,TwoXChromosomes,To the Women Who Saw Me Crying at the Frat Party
15,Ageisanumber,[],[],1538236378.0,0,2,False,9jxzgf,6,TwoXChromosomes,Yesterday I posted a few photos of myself on reddit. I did it to celebrate my coming 50th birthday and enjoyed some parts. What I learned surprised me
16,acronyx,"['pnwfarming', 'NorthernWhiteRhino']","[96, 42]",1538160330.0,0,134,False,9jpmq5,237,TwoXChromosomes,To the women who cornered Senator Flake
17,Pisano87,"['Larry-Man', 'OMGSpaghettiisawesom', 'hatgineer']","[1427, 1235, 858]",1538098944.0,0,584,False,9jit5y,10410,TwoXChromosomes,"I'm a male who was raped several times by two older boys between the ages of 11-14, I wanted to report it so bad but never did. I understand why many of you didn't."
18,lula2488,,,1538238861.0,0,0,False,9jyd30,1,TwoXChromosomes,This Instagram Shames Men for Being Absolute Monsters on Dating Apps
19,TheKrs1,[],[],1538238785.0,0,7,False,9jycn4,4,TwoXChromosomes,How difficult is it for American Women to get birth control?
20,amymonzon,,,1538243778.0,0,0,False,9jz2f8,3,TwoXChromosomes,I worked at a nightclub as a GoGo dancer...
21,weathercrow,[],[],1538238154.0,0,4,False,9jy987,3,TwoXChromosomes,I didn't report it and he did it to another girl. I'll never forgive myself.
22,horsebackrider,,,1538243606.0,0,0,False,9jz1kl,3,TwoXChromosomes,I need to say thank you
23,Dejohns2,,,1538242252.0,0,0,False,9jyv8d,0,TwoXChromosomes,"If You Are About to Make a Comment Like, ""Why didn't you report, tho?"" DON'T!"
24,webstuf,[],[],1538241865.0,0,1,False,9jytdh,2,TwoXChromosomes,Christine Blasey Ford's friend clarifies statement about alleged assault by Brett Kavanaugh: 'I believe her'
25,Ayrane,[],[],1538180031.0,0,1,False,9js7o1,53,TwoXChromosomes,Federal judge rules a Kentucky law on abortion is unconstitutional
26,Koharushjsjs,[],[],1538241283.0,0,2,False,9jyq7l,1,TwoXChromosomes,My story
27,shiskebob,['Trilobyte141'],[50],1538162600.0,0,9,False,9jpyjt,110,TwoXChromosomes,Christine Blasey Fords lawyer resigned from law firm to represent her.
28,bubbleheadbob2000,"['pwei19', 'LilJourney']","[7, 3]",1538222324.0,0,27,False,9jw18g,5,TwoXChromosomes,Telling my daughter (14) that she is smart and beautiful.
29,yourbasicgeek,,,1538238804.0,0,0,False,9jycqb,1,TwoXChromosomes,The 'Father of American Neurology' Prescribed Women Months of Motionless Milk-Drinking
30,teadessert,['tzghvb'],[8],1538201740.0,0,8,False,9jud5e,13,TwoXChromosomes,Just wanted to share...story about a would-be-rapist
31,r101606,[],[],1538238173.0,0,6,False,9jy9c3,1,TwoXChromosomes,Popping Bartholin gland cyst at home?
32,cold_hearted_,[],[],1538237050.0,0,4,False,9jy38e,1,TwoXChromosomes,How can I be more affectionate?
33,relevantlife,[],[],1538235679.0,0,1,False,9jxvml,1,TwoXChromosomes,"Lindsey Graham disregards violence toward women, and his State is a women's murder capital. Graham’s tone deafness to rape victims is nothing new. He has consistently voted against the Violence against Women Act."
34,Insert2Quarters,"['MadBodhi', 'TI4_Nekro']","[12, 4]",1538174167.0,0,20,False,9jrj4x,46,TwoXChromosomes,A Dose of Victim Blaming From My Mother
35,m9felix,"['milkyturtle', 'clavisinsession']","[6, 4]",1538234161.0,0,21,False,9jxnmm,1,TwoXChromosomes,"In you opinion, is it rude for your partner’s ex to casually bring up their past? If so why do you think they keep mentioning it?"
36,Master_Tinyface,,,1538244224.0,0,0,False,9jz4is,1,TwoXChromosomes,How do I find a support group for women who are victims of sexual assault and rape?
37,bluebird_heart,,,1538243954.0,0,0,False,9jz386,0,TwoXChromosomes,Kavanaugh’s accusers in particular wouldn’t have been comfortable coming forward about what happened to them in the early 1980s. The way our culture thought about rape at the time was fundamentally different than it is now.
38,jlmontello,"['BijouPyramidette', 'SaysWhateverforKarma', 'wellsfargosucksass']","[14, 5, 3]",1538158956.0,0,19,False,9jpfw3,75,TwoXChromosomes,Why Women Don't Come Out: I did and Lost My Job
39,missbehaviorbiology,,,1538243521.0,0,0,False,9jz15v,0,TwoXChromosomes,There are more victims and survivors of sexual assault and sexual harassment than there are perpetrators afraid of their histories haunting them... and we all have a VOTE.
40,Chocolate_fudge04,[],[],1538242232.0,0,1,False,9jyv4x,0,TwoXChromosomes,My dad doesn't get it
41,ashesofdecay,"['DConstructed', 'axlotl_rose']","[21, 7]",1538173673.0,0,8,False,9jrgz6,34,TwoXChromosomes,I shared why I didn't report story - my mom told me that I shouldn't have because I didn't think of how it would affect her.
42,NotMyShade,[],[],1538241316.0,0,2,False,9jyqdk,0,TwoXChromosomes,Where do my responsibilities as a feminist end and my rights as a victim begin?
43,Tattooedprofessional,"['ElleFuego', 'Olibolii', 'CreatrixAnima', 'doconeal18']","[58, 31, 30, 27]",1538130987.0,0,32,False,9jluu5,279,TwoXChromosomes,This is for you.
44,PM70,"['grumpymuppett', 'DocBenwayOperates78']","[3997, 3553]",1538075755.0,2,1191,False,9jfsl7,15914,TwoXChromosomes,I was raped by my husband 46F support
45,thebottomofawhale,"['SozzledStarling', 'Apocalypstik']","[3, 3]",1538226837.0,0,8,False,9jwjtp,1,TwoXChromosomes,Having the worst period and finding it hard for anyone to understand how sick that makes me.
46,Muncamunca,[],[],1538187459.0,0,1,False,9jt0ru,14,TwoXChromosomes,"Do not go and tell a sexual assault, abuse, or harassment victim to ""laugh"" at their situation"
47,pedantic_cheesewheel,"['Flyer770', 'Covered_1n_Bees', 'gionnelles', 'zengal108']","[1041, 418, 400, 304]",1538080174.0,0,254,False,9jgeui,4077,TwoXChromosomes,My Wife Works at a Rape Crisis Nonprofit and They Are Getting FLOODED with Survivor Calls
48,hello0o0o0o0o0,[],[],1538238777.0,0,1,False,9jyclk,0,TwoXChromosomes,Feeling anxious/triggered after following the Kavanaugh hearing
49,MrsMikeHunt,[],[],1538238414.0,0,2,False,9jyang,0,TwoXChromosomes,Miscarriage or period?
50,EndlessEnds,"['Oudeis16', 'LethalDevoti0n']","[418, 94]",1538093279.0,1,599,False,9ji4ug,1781,TwoXChromosomes,"My thoughts, as a retired prosecutor, on he Brett Kavanaugh Senate Hearing"
51,tossmeoutaccount,[],[],1538238190.0,0,2,False,9jy9fm,0,TwoXChromosomes,Help?
52,adiposehysteria,[],[],1538237353.0,0,4,False,9jy4vv,0,TwoXChromosomes,Without Us The World Stops
53,inpainneedhelp,['MamboNo101503256'],[6],1538236818.0,0,10,False,9jy1vy,0,TwoXChromosomes,"Need UTI help, cant go to doctor or do any kind of phone or webcam interview"
54,tsunamini,"['pennagirl', 'Bluelilly582', 'jlmontello', 'KitsuneGeisha']","[29, 10, 9, 4]",1538147204.0,0,17,False,9jnqus,80,TwoXChromosomes,SO frustrated with the number of people discounting survivors stories because they didn’t report it when it happened
55,notathrowawayfolks,[],[],1538232522.0,0,6,False,9jxez8,0,TwoXChromosomes,I need advice for my anxiety issues
56,t-me-sis,"['FluffyOceanPrincess', 'winterIsLeaving', 'littlej2010']","[4, 4, 4]",1538188111.0,0,7,False,9jt387,11,TwoXChromosomes,Where is a good place to get cheap underwear?
57,,[],[],1538230867.0,0,2,False,9jx605,2,TwoXChromosomes,I don't have a #WhyIDidn'tReport Story
58,togivethemallmydays,['RamenRomano'],[3],1538229834.0,0,13,False,9jx03u,0,TwoXChromosomes,Do you think my housemate likes me back?
59,Neon-Socks,[],[],1538159748.0,0,2,False,9jpjuw,34,TwoXChromosomes,"I was abandoned by my school. Now, I am abandoned by my country."
60,ElegantCyclist,,,1538229224.0,0,0,False,9jwwqy,0,TwoXChromosomes,'Untrue' Explores the Female Libido
61,throwawayyy_321,"['Smiff0806', 'pupcakeonthelamb']","[3, 2]",1538228289.0,0,4,False,9jwroi,0,TwoXChromosomes,Took Plan B and still nervous
62,Tralfamadorian_,"['hurtsdonut_', 'legaladvicequest', 'Dregenfox', 'lily31']","[22, 18, 16, 11]",1538161369.0,0,43,False,9jps0h,30,TwoXChromosomes,What the GOP made perfectly clear to all American women today.
63,teehee1113,[],[],1538227462.0,0,2,False,9jwnc0,0,TwoXChromosomes,Decidual or breakthrough bleeding please calm my worries.
64,throwawayBkuzreasons,"['moesickle', 'pupcakeonthelamb', 'Ashlityr', 'Skullclutter']","[11, 11, 7, 5]",1538189410.0,0,12,False,9jt8cm,5,TwoXChromosomes,Is it really an issue if a woman changes her last name after getting married?
65,Dmarek02,"['Jamesth', 'rayge-kwit']","[18, 15]",1538145693.0,0,8,False,9jnjau,59,TwoXChromosomes,He Cried After He Punched Me in The Face
66,Gaia_the_bun,"['annqueue', 'ladybawlz29']","[9, 8]",1538177825.0,0,5,False,9jryr1,12,TwoXChromosomes,An old man mastrubated to me in a park
67,Quicily,[],[],1538237195.0,0,4,False,9jy41t,0,TwoXChromosomes,"""The lava of our anger is going to cover the earth and bury you."""
68,arolldis-bluntman,,,1538235807.0,0,0,False,9jxwc0,0,TwoXChromosomes,"Your favorite Bechdel Test-passing scenes in memoirs, novels, short stories"
69,needsmoremayo,"['MsGinger23', 'ActionFiguresinc']","[3, 1]",1538189729.0,0,4,False,9jt9l8,3,TwoXChromosomes,I saved a life today.
70,penelope_pig,['rjsays42'],[4],1538157472.0,0,6,False,9jp86x,26,TwoXChromosomes,I got my tubes tied
71,Whey-Men,,,1538219754.0,0,0,False,9jvs5y,0,TwoXChromosomes,"HIV prevalence among Kampala, Uganda female sex workers is high. Kampala female sex workers are in need of intensified and targeted HIV prevention and control effort"
72,Pinkfatrat,['Titrifle'],[4],1538188060.0,0,4,False,9jt31g,6,TwoXChromosomes,Principal tells girls shorts are making male staff ‘uncomfortable’ | Newcastle Herald
73,pregnant-fool,['UnblinkingLycopene'],[8],1538218486.0,0,13,False,9jvnmg,1,TwoXChromosomes,In hospital with extreme pain. Doctors are telling me it's baby blues?!
74,Squatch_man,"['lezitup', 'aopanda']","[1, 1]",1538231198.0,0,3,False,9jx7ue,0,TwoXChromosomes,Does anyone have tips on supporting a long distance GF who suffers from anxiety?
75,yah_bitch,"['thrwycltr', 'MsAlyssa', 'kyvonneb03']","[51, 38, 25]",1538109923.0,0,39,False,9jk109,231,TwoXChromosomes,"For everyone who asks ""why are they coming forward now"""
76,,['grumpymuppett'],[8],1538166230.0,0,24,False,9jqhj4,13,TwoXChromosomes,"TIL over 120 US ride share drivers have been committed of sexual assault. This statistic excludes unreported incidents. As a former female ride-share driver, here’s how to stay safe:"
77,Scarl3tt3,"['Sandmint', 'Inactivated']","[3, 3]",1538167529.0,0,17,False,9jqnsc,14,TwoXChromosomes,I took charge of my reproductive health! [NSFW]
78,pushyouaround,"['morningspacesuit', 'chemkitty123', 'MadBodhi', '2doggos1pantsuit', 'PM70']","[6, 2, 2, 2, 1]",1538201494.0,0,16,False,9jucfn,2,TwoXChromosomes,"A normal date turns into a nightmare, or how a normal man has two faces"
79,HayeBail,['Warga5m'],[1],1538214822.0,0,14,False,9jvcec,1,TwoXChromosomes,Workplace Hazards. I feel sick.
80,Aaneiltex,"['Robalo21', 'DConstructed']","[267, 208]",1538090689.0,0,236,False,9jhtpd,533,TwoXChromosomes,My problems with the Brett Kavanaugh hearing and the excuse that friends “know he is a good person and would never do something like that.”
81,ImaConsumerWhore,[],[],1538198997.0,0,6,False,9ju4zj,4,TwoXChromosomes,Let's talk: miscarriage
82,relevantlife,"['elinordash', 'OrganicPurchase921', 'champagne_insecurity']","[5, 5, 5]",1538149225.0,0,9,False,9jo18h,27,TwoXChromosomes,"Joe Manchin (WV) - 202-224-3954, Joe Donnelly (IN) -(202) 224-4814, Lisa Murkowski (AK) -(202)-224-6665, Susan Collins (ME) - (202)224-2523. We are 2 simple votes away from putting an alleged sexual abuser who will reverse Roe on the Court. Call now. Be polite, but form. #VoteNoOnKavanaugh"
83,Macenroe85,['Garbanzo3rdEye'],[2],1538190402.0,0,10,False,9jtc4j,4,TwoXChromosomes,My wife and I moved to a new city/country and we need help finding a nearby support network
84,ThisIsKellen,[],[],1538238053.0,0,24,False,9jy8ow,0,TwoXChromosomes,I get guilted into sex by my GF.
85,lemondrops222,['Feyle'],[3],1538210038.0,0,6,False,9juzye,0,TwoXChromosomes,A guy I used to be friends with raped someone
86,neph4,,,1538178218.0,0,0,False,9js0eg,7,TwoXChromosomes,MILCK - NPR Music Tiny Desk Concert
87,,['DConstructed'],[8],1538156210.0,0,4,False,9jp1qw,15,TwoXChromosomes,Why I didn't report.
88,sunflowerliz,[],[],1538163368.0,0,2,False,9jq2tf,8,TwoXChromosomes,I never told anyone either
89,actuallyasuperhero,"['ToodleDeeandDum', 'buzzz001']","[6, 4]",1538150798.0,0,10,False,9jo9i1,20,TwoXChromosomes,To those who never reported
90,Peevesie,['SatanMaster'],[2399],1538037818.0,1,226,False,9jb4tc,15077,TwoXChromosomes,"'Husband Is Not The Master Of Wife', India's SC Strikes Down 158 Year Old Adultery Law Under Section 497 IPC"
91,orangeLILpumpkin,['shorty_doowop'],[0],1538157286.0,0,7,False,9jp7ap,15,TwoXChromosomes,The senate judiciary committee just voted to recommend to the full Senate confirmation of Brett Kavanaugh to the United States Supreme Court by a vote of 11-10
92,painted_crab,[],[],1538143123.0,0,1,False,9jn6ga,27,TwoXChromosomes,Everybody’s different
93,kris0203,"['daughterjudyk', 'Shelbie007']","[2, 2]",1538193178.0,0,4,False,9jtm5b,2,TwoXChromosomes,Mirena side effects?
94,Silverseren,,,1538179113.0,0,0,False,9js3zk,4,TwoXChromosomes,The Origin of Gender (PBS Origin of Everything)
95,mellyhead13,['AkiTendo'],[3],1538169775.0,0,5,False,9jqypg,5,TwoXChromosomes,My why...
96,sint0xicateme,"['MarionWormer', 'HikeTheSky', 'Bognin']","[30, 15, 13]",1538111364.0,0,66,False,9jk674,117,TwoXChromosomes,"""It is a remarkable fact of American life that many men are now defending sexual assault. The group that has spent years laughing at the very idea of anything like “rape culture” are suddenly not just admitting that it exists, but that it's an unstoppable cocktail of culture and biology."""
97,razorchalice,[],[],1538203959.0,0,1,False,9jujhy,1,TwoXChromosomes,Had to take Plan B. Nervous.
98,Kurralynn,"['sour-wench', 'misterhak']","[24, 9]",1538109102.0,0,12,False,9jjy1o,129,TwoXChromosomes,Here’s my story of #whyIdidntreport
99,leftover_picinni,"['aliceindankland', 'ninyabruja', 'Dppstorytel']","[52, 28, 19]",1538115915.0,0,17,False,9jkl2y,74,TwoXChromosomes,"With everything going on, I have to say this somewhere. I’m a 20 y.o. Male and a month ago I was raped by my therapist"
100,bicureyooz,,,1538200205.0,0,0,False,9ju8pm,1,TwoXChromosomes,‘5 Browns’ Siblings Speak Out About Father’s Sexual Abuse
101,MDL1994,['beetbaby'],[1],1538168222.0,0,3,False,9jqr4e,4,TwoXChromosomes,How Mirena gave me my life back
102,throw_auobrv,[],[],1538152801.0,0,6,False,9jojq4,11,TwoXChromosomes,"I'm one of the ""lucky ones"", I've never been raped."
103,metoo5555,[],[],1538226499.0,0,2,False,9jwiek,0,TwoXChromosomes,I've barely told anyone the full story #metoo Trigger warning
104,JustAni96,"['plsmrwarrior', 'morningspacesuit']","[7, 6]",1538198523.0,0,5,False,9ju3li,0,TwoXChromosomes,I fell in love with a catfish I don’t know what to do
105,notathrowawayfolks,,,1538198201.0,0,0,False,9ju2kj,1,TwoXChromosomes,Anxiety Support
106,rjsays42,[],[],1538196715.0,0,2,False,9jtxva,2,TwoXChromosomes,I Didn't Report... Because I Didn't Want to Break My Mother's Heart...
107,999lonely,['RandyDandyAndy'],[5],1538182318.0,0,3,False,9jsgss,3,TwoXChromosomes,Nobody cares about eating disorders anymore
108,FeDuPFeMe,['Sandi_T'],[8],1538142611.0,0,13,False,9jn3yq,15,TwoXChromosomes,I never came forward. I was to young to protect myself and the justice system failed me. Now the justice system is failing another woman and it feels personal.
109,grneyez922,"['Violet__Delights__', 'gobsmacked247', 'TheEndIsSquared']","[14, 10, 6]",1538106801.0,0,20,False,9jjp61,93,TwoXChromosomes,#MeToo began and I was still too scared. #whyididntreport finally gave me the courage
110,concerneduncle89,['shoemaker777'],[6],1538193259.0,0,2,False,9jtmev,0,TwoXChromosomes,My niece just told my sister-in-law she was molested.
111,Bee0312,[],[],1538149735.0,0,3,False,9jo40i,10,TwoXChromosomes,I feel anxious. I'm having trouble breathing. I have no one to talk to.
112,fibonnacci27,,,1538218499.0,0,0,False,9jvno2,0,TwoXChromosomes,Former CIA Officer Will Teach You How to Spot a Lie l Digiday
113,lostinnocent,"['BlueLilacMoon', 'horror_unfolds', 'pancakepoodle']","[2, 1, 1]",1538191142.0,0,5,False,9jteuv,2,TwoXChromosomes,I feel so lost and triggered by these hearings. I just need to tell my story.
114,ironically-spiders,[],[],1538203870.0,0,3,False,9juj8x,0,TwoXChromosomes,My #whyIdidntreport
115,amy-kath-leen,[],[],1538189982.0,0,1,False,9jtaio,1,TwoXChromosomes,I think I overtreated with finding out my boyfriend messaged another girl when we first started seeing each other
116,TheRealBallchynz,,,1538175012.0,0,0,False,9jrmuv,4,TwoXChromosomes,New Zealand Prime Minister Jacinda Ardern and former Prime Minister Helen Clark talk gender equality
117,kjordan21,,,1538215077.0,0,0,False,9jvd0b,0,TwoXChromosomes,Political rant
118,N7riseSSJ,,,1538187642.0,0,0,False,9jt1hf,0,TwoXChromosomes,I was sexually assaulted my Freshman year of College
119,Visandthat,"['tomcruiseincocktail2', 'deedee25252', 'AMaskedAvenger']","[16, 14, 10]",1538088138.0,1,21,False,9jhhv5,160,TwoXChromosomes,"I was 3-13, 14, and 19...."
120,Silverseren,,,1538159947.0,0,0,False,9jpkv4,4,TwoXChromosomes,E-mails Show That Republican Senate Staff Stymied Deborah Ramirez’s Effort to Give Testimony
121,bowlofcherries16,"['housecatuphigh', 'ithoughtilostyou', 'sezit']","[77, 36, 35]",1538077047.0,0,76,False,9jfz7z,274,TwoXChromosomes,PSA: Today is a tough day for survivors of sexual assault.
122,blueeyedbeauty123,['Wariowins1212'],[3],1538186355.0,0,4,False,9jswg4,0,TwoXChromosomes,Best eyeshadow palette for a natural look?
123,BasonHenry,"['i-fink-u-freeky', 'ALowlyLavaLamp']","[6, 5]",1538147722.0,0,5,False,9jntl6,5,TwoXChromosomes,Creep Frequency?
124,mysinglelife,"['worldofcloud', 'Streamjumper', 'BannedFrom2X', 'pianopower2590', 'ChimoEngr']","[10, 8, 5, 5, 4]",1538150591.0,0,19,False,9jo8e8,4,TwoXChromosomes,Have sex against your will in a relationship is called help each other out by a tinder date.
125,manicmeowshroom,['altschwitz'],[2],1538185513.0,0,9,False,9jst85,0,TwoXChromosomes,Smelly underboob? Clean it up with orbitz!
126,CatShat23,,,1538184906.0,0,0,False,9jsqy4,0,TwoXChromosomes,I don't like this #metoo movement. [Trigger Warning: Sexual Assault/Graphic imagery)
127,Pikahime,"['Anabelle_McAllister', 'kallisti_gold']","[2, 2]",1538183296.0,0,22,False,9jskoz,0,TwoXChromosomes,Questions about abortion.
128,fitfemale4life,[],[],1538182222.0,0,3,False,9jsgfd,0,TwoXChromosomes,I did not report. I was failed by the people I trusted.
129,drewiepoodle,,,1538182050.0,0,1,False,9jsfrg,0,TwoXChromosomes,"Far worse than a scenario in which one person is lying, and the other telling the truth, is the scenario in which both are telling the truth."
130,GrumpyFinn,"['Meteorboy', 'PearlTheGeckoGirl']","[4, 3]",1538140676.0,0,5,False,9jmvct,8,TwoXChromosomes,I feel alone and ignored.
131,Prysorra2,,,1538178685.0,0,0,False,9js2ah,1,TwoXChromosomes,TED Talk: Rape Kits processed and justice delivered!!
132,shizzleforizzle,[],[],1538150686.0,0,6,False,9jo8v1,3,TwoXChromosomes,20% of SCOTUS shouldn’t be allowed within 1000 feet of schools.
133,WowUsernameMuchKarma,"['wugachaka', 'cookmamerie', 'penatr8']","[115, 58, 38]",1538053315.0,1,73,False,9jco1a,562,TwoXChromosomes,My mom just gave me such a great idea (#whyIdidntreport)
134,_notthehippopotamus,[],[],1538162907.0,0,1,False,9jq09b,3,TwoXChromosomes,She Says-Investigative podcast that follows the winding road of a sexual assault survivor through the long and difficult search for justice
135,c92dlb,['plumlipstick'],[2],1538176163.0,0,8,False,9jrrzc,1,TwoXChromosomes,Seasoned menstrual cup user with new problems.
136,La_Femme_Nokia,[],[],1538154459.0,0,2,False,9josmh,3,TwoXChromosomes,I never bothered because I was ashamed I was convinced that I let myself get raped.
137,Sidjoneya,"['ehhdoesntmatter', 'KaijuKi', 'WaywardAnus', 'Ozymander']","[4, 2, 1, 1]",1538128512.0,0,15,False,9jlmsj,10,TwoXChromosomes,Can self defence help end violence against women? Some think it puts women at further risk because the attacker will perceive it as a threat to his masculinity.
138,Velvetrose-2,[],[],1538143767.0,0,1,False,9jn9pt,4,TwoXChromosomes,"The rape culture of the 1980s, explained by Sixteen Candles"
139,sofyflo,"['jemmeow', 'violet453', 'Agony_Mouse']","[24, 11, 9]",1538081057.0,0,16,False,9jgj7z,120,TwoXChromosomes,To the Lady with Hairy Legs
140,kt-bug17,['EnbyAmbi'],[3],1538173987.0,0,23,False,9jrid4,1,TwoXChromosomes,Got a comment about my red hair today...
141,timmg,['Mrbiigstuff'],[8],1538173954.0,0,9,False,9jri81,2,TwoXChromosomes,"Women control the United States: since 1964, more women have voted than men. In 2016 15% more women than men voted."
142,thecrayonmastermind,[],[],1538152276.0,0,2,False,9joh1c,4,TwoXChromosomes,I think my ex is the reason I have PTSD and I really need to talk about it
143,bbcnews,,,1538146173.0,0,0,False,9jnlp2,3,TwoXChromosomes,"India's Supreme Court has revoked a ban on women entering the Sabarimala temple, considered to be one of the holiest for Hindus. The ban had prevented women of ""menstruating age"" from entering"
144,socializedslut,['jrh1524'],[3],1538141313.0,0,5,False,9jmy78,6,TwoXChromosomes,How girls are socialized in regards to sex
145,stasiya762,[],[],1538172209.0,0,3,False,9jraby,0,TwoXChromosomes,Hope for the workplace
146,MesopotamianRex,[],[],1538150519.0,0,3,False,9jo81a,3,TwoXChromosomes,I would like to share my story.
147,ninebubblewaters,['sweettea_sweetie1'],[2],1538171721.0,0,9,False,9jr80b,0,TwoXChromosomes,Has anyone ever had cramping/spotting around 4 or 5 days after period?
148,schsm,[],[],1538088245.0,0,3,False,9jhicq,72,TwoXChromosomes,"Denouncing 'Misogynistic Bullying' and 'Failed Leadership,' 50+ Groups Call on Grassley to Resign Immediately as Judiciary Committee Chair"
149,yathrowmeawayplsthnx,,,1538184340.0,0,0,False,9jsopc,0,TwoXChromosomes,I've never told anyone this story before.
150,Throwyourtoothbrush,,,1538156732.0,0,1,False,9jp4gh,1,TwoXChromosomes,#WhyIdidn'treport
151,MrbidAkrasian,"['aopanda', 'a-little-sleepy']","[2, 1]",1538170237.0,0,11,False,9jr0x3,0,TwoXChromosomes,"19 yr old Indian Mechanical engineering student. ""If you can't deal with this, how will you deal with your husband?"""
152,Hainkpe,[],[],1538147505.0,0,3,False,9jnsf0,3,TwoXChromosomes,She should’ve told! She did. No one believed her until...
153,logical-leia,[],[],1538113457.0,0,1,False,9jkd3e,16,TwoXChromosomes,For the First Time in my Life I feel like My Body is Mine
154,thewoodenabacus,"['lamamaloca', 'TheSlamAnderson', 'shitholejedi']","[80, 42, 33]",1538071473.0,0,67,False,9jf6fu,135,TwoXChromosomes,How many rich people when robbed are then questioned: “Were you drinking? Why did you have valuables in a place where people knew they existed? Had you been drinking when this person robbed you?” I wonder if it wouldn’t be better for Kavanaugh to have robbed Ms. Ford.
155,dontstartlethebears,,,1538167438.0,0,0,False,9jqnbw,0,TwoXChromosomes,Madame Defarge knitted the names of the guilty
