,author,comments_author_lst,comments_score_lst,created_utc,guilded,num_comments,pinned,r_id,score,subreddit,title
3509,LefthandedLunatic,,,1538091974.0,0,0,False,9jhzdi,9,TwoXChromosomes,Fox News fires contributor for calling Kavanaugh accusers 'lying skanks'
3510,travolta_cage,,,1538150335.0,0,0,False,9jo73c,0,TwoXChromosomes,Top 5 Women in Blockchain.
3511,jbrock76,"['Artteachernc', 'outinspace95']","[3, 3]",1538150314.0,0,9,False,9jo70g,0,TwoXChromosomes,The 1980s are finally coming to an ugly fruition!
3512,Blondeslug,['Slabardo'],[18],1538136659.0,0,13,False,9jmepu,2,TwoXChromosomes,I was just assaulted and I don’t know who to tell
3513,PlayfulPotato,,,1538171348.0,0,1,False,9jr69p,0,TwoXChromosomes,Women in Tech Celebrities
3514,metoohesdead,"['dankbot2024', 'treemanswife', 'MadMulti']","[9, 7, 5]",1538068083.0,0,14,False,9jeowe,33,TwoXChromosomes,My abuser died. I don't know how to feel.
3515,Onbehalfofanother,,,1538148438.0,0,0,False,9jnx4v,0,TwoXChromosomes,Asking on behalf of my best friend -coping in a toxic work environment since yesterday.
3516,sezit,['ehhdoesntmatter'],[19],1538078213.0,0,38,False,9jg51u,17,TwoXChromosomes,"You know what is really needed? Admittance and apologies from assaulters of what they have actually done. Denial of what they have done, gaslighting their victims is so harmful."
3517,AMaskedAvenger,"['MrSparklepantz', 'ksweaters']","[15, 9]",1538093396.0,0,5,False,9ji5d7,7,TwoXChromosomes,Let's take today to gild survivors of rape and sexual assault who tell their stories
3518,Immediate_Pineapple,[],[],1538155034.0,0,2,False,9jovo7,0,TwoXChromosomes,I took news coverage of a sexual abuse trial from 18 years ago and updated it with research. The teenage girl had been portrayed unfairly.
3519,flowerzzz1,['orangeLILpumpkin'],[10],1538101385.0,0,5,False,9jj3dg,7,TwoXChromosomes,What are women going to do?
3520,twoxxchrom,"['yfunk3', 'tzghvb']","[7, 6]",1538110088.0,0,9,False,9jk1ly,1,TwoXChromosomes,I alienate my female friends when I'm assertive around guys. Help?
3521,Jernn,['tesla9'],[8],1538068438.0,0,2,False,9jeqr5,23,TwoXChromosomes,76 yr. old woman calls C-SPAN during Kav. hearing break and tells her story. Heartbreaking
3522,Throwaway9272018,[],[],1538099201.0,0,4,False,9jiub2,5,TwoXChromosomes,"I (21M) was in an abusive relationship and raped in my first year of college, causing me to drop out."
3523,GWS2004,"['lalalooloo2', 'orangeLILpumpkin']","[11, 4]",1538143086.0,0,22,False,9jn690,0,TwoXChromosomes,Women who are registered Independents. Does this weeks events change the party you support?
3524,nacho_fries,"['DimeInPieces', 'minimal15t']","[14, 7]",1538064988.0,0,13,False,9je8z8,27,TwoXChromosomes,"I want to stay informed, but watching the news is so hard lately."
3525,octoboss,,,1538126782.0,0,0,False,9jlhkx,2,TwoXChromosomes,Busy Philipps shares that she was raped at 14 - 'Today is the day we are silent no more.'
3526,texlorax,['buckethealien'],[1275],1537963209.0,0,1230,False,9j1uge,5644,TwoXChromosomes,"Amid Effort to Ram Kavanaugh Through Senate, House GOP Refusing to Reauthorize Violence Against Women Act"
3527,190HELVETIA,[],[],1538103098.0,0,5,False,9jjae4,3,TwoXChromosomes,Finally admitted to myself that I was in an abusive relationship
3528,Mattson,"['DConstructed', 'Makememak']","[13, 7]",1538072689.0,0,7,False,9jfctq,12,TwoXChromosomes,My 62 year old mom told me of how she was raped at 17 and never told anyone... not even her parents... I do not know how to respond to this.
3529,someblueberry,"['MagicalHamster', 'aopanda', 'JadeAngelov', 'DConstructed']","[13, 13, 11, 6]",1538058632.0,0,19,False,9jdcuk,28,TwoXChromosomes,"Here's a lighthearted xx thought: The old saying goes that ""the way to a man's heart is through his stomach"" but there is no easier way for me to agree to a casual date than a man asking ""you hungry?"""
3530,Electronic_Animal,['Throwyourtoothbrush'],[4],1538082845.0,0,4,False,9jgs8e,9,TwoXChromosomes,Having a hard time processing something that happened to me 10 years ago.
3531,schsm,[],[],1538150093.0,0,15,False,9jo5vn,0,TwoXChromosomes,Tearful women confronts Senator Flake on elevator
3532,pandaperogies,"['Cat-no-Dog', 'literally_tho_tbh', 'MrFrode']","[14, 5, 4]",1538044632.0,0,24,False,9jbqb6,59,TwoXChromosomes,Power to Dr. Christine Blasey Ford Today
3533,jeanpaulfartre,"['orangeLILpumpkin', 'ItsMeJayson']","[8, 6]",1538149154.0,0,7,False,9jo0vr,0,TwoXChromosomes,Kavanaugh and Ford might both be telling the truth. And that says something profoundly troubling about our world.
3534,Cadet-Bone-Spurs,[],[],1538073823.0,0,1,False,9jfim0,11,TwoXChromosomes,Female candidates are calling out sexism more aggressively on the campaign trail
3535,svetlana45,,,1538107077.0,0,0,False,9jjq70,1,TwoXChromosomes,Just need to let it out
3536,Questionsfor2X,"['somebodys_mom', 'rockstar-monkey']","[14, 4]",1538106561.0,0,11,False,9jjo9f,2,TwoXChromosomes,Question: Was it rape?
3537,thefatcatlikesnaps,"['42ReasonsWhy', 'extaz93', 'misterhak', 'RabbleBlahandSuch', 'AcheBae']","[5, 2, 1, 1, 1]",1538119049.0,0,10,False,9jkux7,0,TwoXChromosomes,My rapists are still my best friends
3538,Whey-Men,,,1538104892.0,0,0,False,9jjhk3,2,TwoXChromosomes,Measuring vulnerability among female sex workers in India using a multidimensional framework
3539,Chinnychin_,,,1538118351.0,0,0,False,9jksp7,0,TwoXChromosomes,I stayed with him far too long... I’m trying to pick up the pieces now I suppose.
3540,PM_ME_UR_FOREARMz,[],[],1538080280.0,0,1,False,9jgfdk,8,TwoXChromosomes,I was watching the Kavanaugh hearing...
3541,kittenpantzen,"['Trilobyte141', 'Pr2r', 'avacadoroo', 'berned-out']","[13, 12, 3, 2]",1538058200.0,0,25,False,9jdaro,23,TwoXChromosomes,Tennessee high school AD put on leave after saying girls 'pretty much ruin everything'
3542,iloveallthebacon,[],[],1538103520.0,0,2,False,9jjc3d,4,TwoXChromosomes,Are there any sexual assault subreddits?
3543,scoobydoo226,[],[],1538116741.0,0,1,False,9jknlm,2,TwoXChromosomes,Reading old high school essays..
3544,k-so-what,[],[],1538129999.0,0,3,False,9jlroi,0,TwoXChromosomes,Xpost from (law and order) r/SVU...
3545,brassattack,"['Sunflower_Hunny', 'DConstructed', 'onlylovematters']","[2, 2, 2]",1538102700.0,0,16,False,9jj8qf,1,TwoXChromosomes,Should I talk to my mom?
3546,anamarija96,[],[],1538113032.0,0,6,False,9jkbpx,0,TwoXChromosomes,Period stupidly late
3547,fuuuunke,,,1538112878.0,0,0,False,9jkb8u,2,TwoXChromosomes,"After the Kavanaugh Allegations, Republicans Offer a Shocking Defense: Sexual Assault Isn’t a Big Deal"
3548,sadatay,,,1538155163.0,0,0,False,9jowb9,0,TwoXChromosomes,HOW DARE YOU DO THIS TO BRETT KAVANAUGH? (sarcasm)
3549,bigbellyflygirl,[],[],1538097554.0,0,3,False,9jind9,3,TwoXChromosomes,To Those Who Doubt Sexual Assault Victims Who Wait To Report Abuse
3550,anotherspicytaco,[],[],1538110897.0,0,3,False,9jk4hp,0,TwoXChromosomes,I've never told anyone about the time I was sexually assaulted. It's all I can think about right now.
3551,Red9357,,,1538110864.0,0,0,False,9jk4cq,1,TwoXChromosomes,Hi reddit I’ve been having some mental and emotional problems need advice
3552,Norwegian__Blue,['Norwegian__Blue'],[11],1538070146.0,0,15,False,9jezig,10,TwoXChromosomes,#whyididntreport
3553,_SexyWiddleBaby_,['rhysdahl'],[4],1538123809.0,0,2,False,9jl8pw,0,TwoXChromosomes,"Can I, personally, do anything to help in the Kavanaugh hearings? Is it okay, as a survivor, to remove myself from it as much as possible? (Triggering)"
3554,Enenra930,,,1538078672.0,0,0,False,9jg77l,3,TwoXChromosomes,"With today’s hearings top of mind, sharing one woman’s powerful story and thoughts"
3555,Barbie66,,,1538109992.0,0,0,False,9jk1a2,1,TwoXChromosomes,[Support] “Please Don’t Make This a Rape Thing”
3556,anonthrowaway2241,[],[],1538074743.0,0,3,False,9jfnb1,4,TwoXChromosomes,I wasn't listened to either
3557,salajomo,['DConstructed'],[5],1538087622.0,0,7,False,9jhfk4,3,TwoXChromosomes,Two weeks ago a friend of mine was raped. She has ask me for space so she can heal.
3558,Anonymous5678945,"['Trilobyte141', 'BeliefsoverTruth']","[141, 47]",1537991610.0,0,54,False,9j5wrk,408,TwoXChromosomes,"After more than two decades, I know the names of her rapists and the rage is overwhelming."
3559,rosykitty,[],[],1538122044.0,0,1,False,9jl3pc,0,TwoXChromosomes,My cousin is in an emotionally abusive relationship.
3560,toadnigiri,"['Coomb', 'champagne_insecurity', 'somebodys_mom']","[8, 8, 7]",1538094241.0,0,13,False,9ji95t,1,TwoXChromosomes,"What does ""Renate Alumnus"" mean and why is it offensive?"
3561,xj371,,,1538107766.0,0,0,False,9jjt0t,1,TwoXChromosomes,Disability and Domestic Violence and Abuse: Don't forget about us
3562,river_tree_nut,[],[],1538107543.0,0,1,False,9jjs5z,3,TwoXChromosomes,Amazon's producers flubbed tonight's rollout of the first game in a season-long series of all-female NFL commentary.
3563,BracingMyselfForIt,['veriin'],[8],1538085229.0,0,3,False,9jh4a2,4,TwoXChromosomes,Bad psych session
3564,gypsykush,"['caariss', '8livesdown', 'gypsykush']","[21, 9, 9]",1538047954.0,0,14,False,9jc2bb,19,TwoXChromosomes,"Tennessee public school administrator tells boys to ""blame the girls"""
3565,sexy_toaster,[],[],1538106388.0,0,4,False,9jjnko,1,TwoXChromosomes,I feel so alone and like I can't make friends and I don't know what's wrong with me.
3566,SAPit,[],[],1538119727.0,0,1,False,9jkx03,0,TwoXChromosomes,"Devotion Cannot Be Subjected To Gender Discrimination, Indian SC Allows Women Entry In Sabarimala Temple By 4:1 Majority; Lone Woman In The Bench Dissents"
3567,olive20597,['Mouseprintss'],[3],1538105224.0,0,5,False,9jjiwh,0,TwoXChromosomes,It’s becoming difficult for me to be there for my friend in this situation. I don’t know what to do anymore
3568,everythingsuuuuckss,"['sangetencre', 'bluebunny20', 'champagne_insecurity']","[44, 14, 14]",1538083743.0,0,30,False,9jgwuj,4,TwoXChromosomes,"I am pregnant, my boyfriend doesn't want me to get an abortion and it's caused many arguments. Who is right? What the chances of this being resolved?"
3569,ZenMaw,"['dani8espo', 'Mirawenya', 'AmyHunty35', '58_weasels']","[33, 23, 20, 14]",1538033230.0,0,57,False,9jarlq,39,TwoXChromosomes,"Teacher told girl to ""hold in"" her period when she asked to go to the bathroom"
3570,illytaria,,,1538103939.0,0,0,False,9jjdrc,0,TwoXChromosomes,Past trauma causea new trauma
3571,Larry-Man,,,1538103814.0,0,0,False,9jjd9d,0,TwoXChromosomes,The Things You Took From Me
3572,thecherrynow,['milkyturtle'],[2],1538102772.0,0,7,False,9jj924,0,TwoXChromosomes,Does anyone have any advice about donating eggs?
3573,sophiajoplin,"['bocaj96', 'nisutapasion']","[6, 3]",1538133867.0,0,6,False,9jm4j5,0,TwoXChromosomes,I just learned that Iceland is the only country in the world where unequal pay is illegal and employers are punished via huge fines if they don't comply with the law.
3574,Pregnancyscare1203,['burrito_finger'],[2],1538100994.0,0,2,False,9jj1qc,0,TwoXChromosomes,Ordering online pregnancy tests
3575,feelthetequila,"['ForBetterForNurse', '47South']","[4, 1]",1538086789.0,0,17,False,9jhbpa,2,TwoXChromosomes,I struggle with hormonal birth control and need a more reliable method than condoms and pulling out. Looking for advice and suggestions!
3576,tinykittymama,['MarginallyCorrect'],[4],1538068812.0,0,17,False,9jesp7,3,TwoXChromosomes,I tried to be the causal girl. It didn't work.
3577,kym_kym,[],[],1538098296.0,0,1,False,9jiqhs,2,TwoXChromosomes,I can’t remember
3578,BlueEyedDinosaur,['lily-loves-you'],[4],1538127091.0,0,6,False,9jlii2,0,TwoXChromosomes,Would I tell my own daughter to report her sexual assault? Probably not. Here’s why.
3579,socialanxietylol,['bikeidaho'],[0],1538095549.0,0,3,False,9jiesn,0,TwoXChromosomes,"""Women can't have positions of power because they are too emotional"""
3580,i-wanna-see-it-all,[],[],1538057433.0,0,1,False,9jd74x,8,TwoXChromosomes,A thank you post to moms
3581,dani_gogh,"['pettytite', 'kiwioveralls', 'avacadoroo']","[4, 3, 3]",1538094499.0,0,17,False,9jia85,1,TwoXChromosomes,pregnancy scare (pt 2)
3582,relevantlife,,,1538061839.0,0,0,False,9jdspo,5,TwoXChromosomes,"MormonLeaks releases another Kirton McConkie doc detailing sex abuse coverups. A 4 y/o was molested in a church bathroom, the church failed to act when a 7 y/o girl was molested by a man church leaders knew to be a predator, & the church offered 50k to a man who was abused by missionaries."
3583,anon085312469,[],[],1538065412.0,0,1,False,9jeb2q,7,TwoXChromosomes,“Why did she wait so long to come forward?”
3584,episton22,,,1538092189.0,0,0,False,9ji0bw,0,TwoXChromosomes,Listening to Dr Ford brought it all back.
3585,elwhite121388,[],[],1538092125.0,0,2,False,9ji01r,0,TwoXChromosomes,Abusive Ex Now Dating a Tech CEO who is also head of a women's rights non-profit
3586,grilledcheesethrwawy,,,1538105541.0,0,0,False,9jjk6s,0,TwoXChromosomes,Listening to Dr. Ford's testimony brought back memories of an experience my friend shared with me.
3587,Heresmystory1,[],[],1538103551.0,0,1,False,9jjc7c,0,TwoXChromosomes,"Want to share my ""me too"" story to people who will listen and have maybe been through similar things."
3588,conlangbot,"['AsABlackMan', 'hmk_gq']","[35, 20]",1538012063.0,0,24,False,9j8li0,49,TwoXChromosomes,I am tired of rising above
3589,nylonfiberpizza,[],[],1538108666.0,0,2,False,9jjwhd,0,TwoXChromosomes,Kids/Adoption/Birth
3590,OldCarWorshipper,['timoni'],[4],1538113455.0,0,3,False,9jkd31,0,TwoXChromosomes,Hypothetical question- extreme vigilante justice
3591,0lelznjp,[],[],1538099484.0,0,1,False,9jivjf,0,TwoXChromosomes,infidelity after assault? how normal is it
3592,elainebeneshair,"['champagne_insecurity', 'Nosworc82', 'LeanOnGreen']","[10, 1, 1]",1538106397.0,0,11,False,9jjnlu,0,TwoXChromosomes,I raped my boyfriend
3593,LefthandedLunatic,"['TooShiftyForYou', 'primitiveradio', 'immortalfirelover']","[149, 63, 55]",1537973764.0,0,340,False,9j37od,277,TwoXChromosomes,"Avenatti identifies Kavanaugh accuser as Washington resident Julie Swetnick, claims Supreme Court pick and pal tried to spike girls' drinks"
3594,paxweasley,"['cestkevvie', 'ktv13']","[3, 3]",1538067792.0,0,3,False,9jen91,3,TwoXChromosomes,Today seems like a good day to listen to this song
3595,calgaryflamer,[],[],1538093125.0,0,1,False,9ji487,0,TwoXChromosomes,There’s One Very Obvious Reason Teen Girls Don’t Report Sexual Misconduct
3596,sint0xicateme,,,1538111027.0,0,0,False,9jk50j,0,TwoXChromosomes,Brett Kavanaugh and the Cruelty of Male Bonding: When being one of the guys comes at a woman’s expense.
3597,mrdooter,['Bureku808'],[2],1538092328.0,0,2,False,9ji0wz,0,TwoXChromosomes,Dealing with yelling/male anger
3598,champagne_insecurity,[],[],1538099582.0,0,14,False,9jivwv,0,TwoXChromosomes,7 Things to Remember If Dr. Christine Blasey Ford and Judge Kavanaugh's Hearing Is Difficult for You
3599,sahlty_lemon,,,1538076209.0,0,0,False,9jfuyg,0,TwoXChromosomes,“blame the girls... they pretty much ruin everything.”
3600,Qu1nlan,"['MermaidPumpkinButt', 'Snoochems', 'StubbedMyLittlePenis']","[133, 57, 52]",1497988792.0,0,175,False,6igks7,413,TwoXChromosomes,/r/TwoXChromosomes is looking for new moderators
3601,EmptyArmsBereavement,"['heatheranne', 'topgopher']","[69, 41]",1532616354.0,0,68,False,922vk2,1074,TwoXChromosomes,"I'm Carol, and after losing my first daughter to a cord accident during labor in 2003 I went on to found Empty Arms Bereavement Support, a community based non-profit that helps other families who have experienced the loss of a baby. AMA!"
3602,RiskyDriver,"['pahobee', 'BellaVestido', 'Gottagetanediton']","[1797, 1163, 659]",1538247673.0,0,534,False,9jzlam,18056,TwoXChromosomes,"Story of a woman who came forward when she was raped. After being threatened with homelessness, she recanted and was arrested for a false rape accusation. Years later they caught a serial rapists with her picture. This is why women don't come forward (long read but well worth it)"
3603,torlanda,[],[],1538310704.0,0,2,False,9k60mu,116,TwoXChromosomes,To the woman in London who stood up for me while I was alone having a beer
3604,lil_ginge,"['0m3gaMan5513', 'mrbigah', 'Albyshit']","[2911, 1571, 1523]",1538221796.0,0,641,False,9jvzdt,6837,TwoXChromosomes,“Don’t do that to me”
3605,eeeboo,"['inlovedelicious', 'wugachaka']","[25, 21]",1538272108.0,0,4,False,9k2gfg,199,TwoXChromosomes,Sexual assault apology?
3606,debtblag,"['wwarnout', 'AshEliseB']","[1202, 359]",1538224963.0,0,869,False,9jwbmj,2057,TwoXChromosomes,Everyone got to be angry at the hearing except Christine Blasey Ford
3607,Eteel,"['ladragoness', 'CyanAlpaca', 'steboy']","[138, 42, 40]",1538256446.0,0,49,False,9k0pf1,337,TwoXChromosomes,"Woman goes public with an allegation that Cristiano Ronaldo raped her. In earliest version of questionnaire, Ronaldo admits Mayorga said no and stop, but he continued because, he said, she made herself available and never screamed. He said he's not like the others, so he apologised afterward."
3608,DoggosAreAllYouNeed,['JolieFraise'],[3],1538295424.0,0,12,False,9k4ouq,20,TwoXChromosomes,My surgical abortion experience
3609,horizntalartist,['StormySprite'],[27],1538260704.0,0,13,False,9k17w0,91,TwoXChromosomes,"""I'm so sorry you're bleeding! Are you okay??"""
3610,MrsCharles88,['marfatardo'],[14],1538268818.0,0,4,False,9k23ue,49,TwoXChromosomes,The police use my abuser as a case study in how to get away with it
3611,GodInThisChilis,"['Chiinori', 'GodInThisChilis', 'HiBrucke6', 'Frankyfrankyfranky']","[19, 19, 16, 12]",1538277877.0,0,168,False,9k31mq,24,TwoXChromosomes,Reddit loves Kavanaugh
3612,ednastvincent,['Ishuzu'],[4],1538288453.0,0,2,False,9k4688,10,TwoXChromosomes,Remember Dixie Chick's Not Ready to Make Nice?
3613,texlorax,,,1538315385.0,0,0,False,9k6h7n,2,TwoXChromosomes,Fury is a Political Weapon and Women Need to Wield It
3614,newluna,['AshEliseB'],[6],1538277095.0,0,2,False,9k2yve,21,TwoXChromosomes,The power of no
3615,amymonzon,"['dogmanzzx', 'FuturePigeon', 'semithroway', 'fightya4it']","[26, 19, 15, 13]",1538243778.0,0,43,False,9jz2f8,104,TwoXChromosomes,I worked at a nightclub as a GoGo dancer...
3616,NatlyNat,[],[],1538306243.0,0,1,False,9k5lup,4,TwoXChromosomes,A family friend touched me in a inappropriate way when i was younger
3617,Sulfamide,['throwaway4thehorde'],[11],1538263200.0,0,4,False,9k1hya,38,TwoXChromosomes,"The comments section in the article about Pelosi calling Kavanaugh ""hysterical"" is so refreshing."
3618,diamondslight,"['Whatifim80lol', 'aopanda', '2doggos1pantsuit']","[14, 7, 5]",1538288131.0,0,12,False,9k458r,9,TwoXChromosomes,i’m not my boyfriend’s “type”
3619,jonathanhoag1942,[],[],1538276003.0,0,1,False,9k2ux5,18,TwoXChromosomes,Jennifer...
3620,lecremepuff,"['FeralBottleofMtDew', 'Chocolate_fudge04']","[5, 4]",1538238375.0,0,6,False,9jyaf1,98,TwoXChromosomes,Just a nice story to escape the current news
3621,SplendidTit,['SplendidTit'],[12],1538260472.0,0,9,False,9k16zh,27,TwoXChromosomes,"Woman goes public with rape accusation against Cristiano Ronaldo. He admits ""she said ‘no’, and ‘don’t do that’ several times. Afterwards I apologised."""
3622,whatagirlygirl,,,1538313762.0,0,0,False,9k6bc4,1,TwoXChromosomes,My Daughter has been fighting to change how kids enter foster care (Just A Dad Proud of his Daughter)
3623,verywittywilde,"['verywittywilde', 'verywittywilde', 'Calvinball1986']","[46, 26, 21]",1538226937.0,0,49,False,9jwk7f,145,TwoXChromosomes,My abuser using the court to contact me
3624,catastrophichysteria,"['wellsfargosucksass', 'Mirawenya', 'ohliin', 'catcooker']","[9, 9, 8, 6]",1538253747.0,0,24,False,9k0cym,34,TwoXChromosomes,Not to self: just because I wasnt raped does not mean I was not sexually assaulted.
3625,krystlerm,"['satijade', 'Emptyplates']","[41, 11]",1538252343.0,0,30,False,9k06i7,32,TwoXChromosomes,I almost had my appendix burst because a male ER doctor thought my pain was psychosomatic. When will women be taken seriously when they complain about pain?
3626,Mz-MM,[],[],1538308097.0,0,7,False,9k5seh,2,TwoXChromosomes,Making female friends is hard for me as a woman.
3627,HayeBail,,,1538305034.0,0,0,False,9k5hhj,2,TwoXChromosomes,Update: Workplace Hazards. I feel sick
3628,novagirl0972,['Chiinori'],[5],1538280281.0,0,4,False,9k3ad1,8,TwoXChromosomes,I feel bad that I’m avoiding all the sexual assault posts and will never share my story.
3629,ashbertollini,['milkyturtle'],[17],1538261658.0,0,15,False,9k1bo3,19,TwoXChromosomes,So theres this young lady I work with
3630,hurryhomeprincess,[],[],1538304111.0,0,3,False,9k5e9r,1,TwoXChromosomes,"I should be on my period now, but I am not."
3631,s7ven8n9ne,[],[],1538314341.0,0,3,False,9k6dih,1,TwoXChromosomes,Looking for advice/similar stories about decreased sex life after moving in together/getting married
3632,Mindiina,['MrsMcBasketball'],[5],1538273686.0,0,2,False,9k2mfo,7,TwoXChromosomes,"I got into a car accident while a guy I really like was in town. He's gone home now, and I'm lonely and left to pick up the pieces."
3633,MosquitoRevenge,,,1538313658.0,0,0,False,9k6axu,1,TwoXChromosomes,Study by Swedish university finds pregnant women take up phthalates through plastic floors at home. Many different phthalates have been deemed dangerous to human health by the EU.
3634,veryfrustratedfreshy,['Alwaysbeenaunicorn'],[6],1538288913.0,0,30,False,9k47m1,4,TwoXChromosomes,how to masturbate when you have a billion roommates?
3635,shes_not_there,"['JustkiddingIsuck', 'Zjinu']","[4789, 3076]",1538149532.0,1,2072,False,9jo2wq,18616,TwoXChromosomes,"“When men imagine a female uprising, they imagine a world in which women rule men as men have ruled women.” -Sally Kempton"
3636,Wendy-the-gogo-girl,['pink_plaid'],[2],1538277629.0,0,2,False,9k30r6,7,TwoXChromosomes,"I ran into an old ""fling"" today [Trigger Warning]"
3637,afloofah,['AskMrBinks'],[9],1538273494.0,0,7,False,9k2lqa,6,TwoXChromosomes,I think my dad felt me up while he was drunk tonight
3638,whysys,[],[],1538293729.0,0,5,False,9k4khb,2,TwoXChromosomes,"Thank god for average speed cameras, advice needed"
3639,bluebird_heart,"['Pahka1947', 'newdawn-newday']","[5, 3]",1538243954.0,0,21,False,9jz386,24,TwoXChromosomes,Kavanaugh’s accusers in particular wouldn’t have been comfortable coming forward about what happened to them in the early 1980s. The way our culture thought about rape at the time was fundamentally different than it is now.
3640,missmoonana,[],[],1538306286.0,0,2,False,9k5lzn,1,TwoXChromosomes,For those who still can't tell their story...
3641,horsebackrider,,,1538243606.0,0,0,False,9jz1kl,22,TwoXChromosomes,I need to say thank you
3642,TheInfamousBlack,"['hisownshot', 'zyiliana', 'Trilobyte141', 'Dejohns2', 'Schattentochter']","[18, 13, 12, 12, 10]",1538238160.0,0,21,False,9jy99i,30,TwoXChromosomes,I'm so tired of this response.
3643,icefourthirtythree,"['toddybody', 'sleeplessqueen', 'Berisha11']","[29, 7, 6]",1538229300.0,0,24,False,9jwx57,42,TwoXChromosomes,Her Name Is Kathryn: The Woman Who Accuses Ronaldo of Rape
3644,lula2488,"['ilovetoeatmeat', 'Trilobyte141']","[4, 1]",1538238861.0,0,5,False,9jyd30,26,TwoXChromosomes,This Instagram Shames Men for Being Absolute Monsters on Dating Apps
3645,SureLilac,"['Startraveller42', 'FluffyOceanPrincess']","[6, 5]",1538270963.0,0,5,False,9k2c4d,5,TwoXChromosomes,I need help choosing between two jobs- retail or restaurant. Any advice at this point would be appreciated.
3646,sadbutnotsurprised,['rugby_shirt'],[4],1538253477.0,0,5,False,9k0bpl,10,TwoXChromosomes,"I ""just"" cried. [Support] [Trigger Warning]"
3647,theblackspaniel,"['lyra_silver', 'Leakybubble']","[9, 8]",1538266850.0,0,17,False,9k1w62,4,TwoXChromosomes,"Sex, boundaries and work - need some perspective"
3648,zxcsd,['American_marxist'],[3],1538248847.0,0,2,False,9jzqsc,11,TwoXChromosomes,Former ‘Miss Baghdad’ Shot Dead as She Drove Through Iraqi Capital in Latest of Series of Attacks on Women
3649,Starbursthatecrime,['horford_is_overrated'],[2],1538293677.0,0,3,False,9k4kci,0,TwoXChromosomes,Dear me...
3650,macfearsum,['macfearsum'],[5],1538247926.0,0,3,False,9jzml1,9,TwoXChromosomes,My #MeToo #WhyIDidn'tReport stories
3651,lambun,"['MajorFulcrum', 'Larchbox']","[3, 2]",1538219728.0,0,13,False,9jvs2s,36,TwoXChromosomes,A forgotten soldier on a forgotten front: the only British woman to fight on WW1’s front line
3652,Ashie_Knees,"['sezit', 'Keighlon']","[12, 5]",1538288459.0,0,16,False,9k4693,0,TwoXChromosomes,If you feel like you deserve someone would you let them walk away? Even if they let you walk away?
3653,awkwardbabyseal,,,1538249070.0,0,0,False,9jzrrw,6,TwoXChromosomes,A memory brought on by this week's news.
3654,Dejohns2,[],[],1538242252.0,0,16,False,9jyv8d,10,TwoXChromosomes,"If You Are About to Make a Comment Like, ""Why didn't you report, tho?"" DON'T!"
3655,missbehaviorbiology,,,1538243521.0,0,0,False,9jz15v,8,TwoXChromosomes,There are more victims and survivors of sexual assault and sexual harassment than there are perpetrators afraid of their histories haunting them... and we all have a VOTE.
3656,alexiaw,['dirtypaws2020'],[6],1538252597.0,0,2,False,9k07nt,6,TwoXChromosomes,Did anyone catch him say
3657,weathercrow,"['Schattentochter', 'Dejohns2']","[8, 4]",1538238154.0,0,6,False,9jy987,12,TwoXChromosomes,I didn't report it and he did it to another girl. I'll never forgive myself.
3658,Herder_of_cats,[],[],1538247564.0,0,1,False,9jzks2,8,TwoXChromosomes,#whyididntreport Can't deal with posting this on social media
3659,ps00093,['arabis'],[10],1538251083.0,0,14,False,9k00tm,4,TwoXChromosomes,I'm not sure if I'm being selfish or losing one of my friends to his girlfriend.
3660,Whey-Men,,,1538268877.0,0,0,False,9k243e,2,TwoXChromosomes,On Tensions and Opportunities: Building Partnerships Between Government and Sex Worker-Led Organizations in Kenya in the Fight Against HIV/AIDS
3661,saphirra1209,['nithwyr'],[13],1538237995.0,0,15,False,9jy8di,8,TwoXChromosomes,To the Women Who Saw Me Crying at the Frat Party
